Name: “Table 1 of 1 on page 23 of 166”,Name: “Table 1 of 1 on page 23 of 166”,Name: “Table 1 of 1 on page 23 of 166”,Name: “Table 1 of 1 on page 23 of 166”,Name: “Table 1 of 1 on page 23 of 166”,Name: “Table 1 of 1 on page 23 of 166”,Name: “Table 1 of 1 on page 23 of 166”,Name: “Table 1 of 1 on page 23 of 166”,Name: “Table 1 of 1 on page 23 of 166”,Name: “Table 1 of 1 on page 23 of 166”,Name: “Table 1 of 1 on page 23 of 166”,Name: “Table 1 of 1 on page 23 of 166”,Name: “Table 1 of 1 on page 23 of 166”,Name: “Table 1 of 1 on page 23 of 166”,Name: “Table 1 of 1 on page 23 of 166”,Name: “Table 1 of 1 on page 23 of 166”,Name: “Table 1 of 1 on page 23 of 166”,Name: “Table 1 of 1 on page 23 of 166”,Name: “Table 1 of 1 on page 23 of 166”,Name: “Table 1 of 1 on page 23 of 166”
Table: 23,Table: 23,Table: 23,Table: 23,Table: 23,Table: 23,Table: 23,Table: 23,Table: 23,Table: 23,Table: 23,Table: 23,Table: 23,Table: 23,Table: 23,Table: 23,Table: 23,Table: 23,Table: 23,Table: 23
,,,,,,,,,,,,,,,,,,,
,,,County Administrator's Budget Message,County Administrator's Budget Message,County Administrator's Budget Message,County Administrator's Budget Message,County Administrator's Budget Message,County Administrator's Budget Message,County Administrator's Budget Message,County Administrator's Budget Message,County Administrator's Budget Message,County Administrator's Budget Message,County Administrator's Budget Message,County Administrator's Budget Message,,,,,
Improve the Lives of Citizens and Foster a Sense of Community,Improve the Lives of Citizens and Foster a Sense of Community,Improve the Lives of Citizens and Foster a Sense of Community,Improve the Lives of Citizens and Foster a Sense of Community,Improve the Lives of Citizens and Foster a Sense of Community,Improve the Lives of Citizens and Foster a Sense of Community,Improve the Lives of Citizens and Foster a Sense of Community,Improve the Lives of Citizens and Foster a Sense of Community,Improve the Lives of Citizens and Foster a Sense of Community,Improve the Lives of Citizens and Foster a Sense of Community,Improve the Lives of Citizens and Foster a Sense of Community,Improve the Lives of Citizens and Foster a Sense of Community,Improve the Lives of Citizens and Foster a Sense of Community,,,,,,,
Investing in public education continues to be a major priority in this budget.,Investing in public education continues to be a major priority in this budget.,Investing in public education continues to be a major priority in this budget.,Investing in public education continues to be a major priority in this budget.,Investing in public education continues to be a major priority in this budget.,Investing in public education continues to be a major priority in this budget.,Investing in public education continues to be a major priority in this budget.,Investing in public education continues to be a major priority in this budget.,Investing in public education continues to be a major priority in this budget.,Investing in public education continues to be a major priority in this budget.,Investing in public education continues to be a major priority in this budget.,Investing in public education continues to be a major priority in this budget.,Investing in public education continues to be a major priority in this budget.,Investing in public education continues to be a major priority in this budget.,Investing in public education continues to be a major priority in this budget.,Investing in public education continues to be a major priority in this budget.,Despite a $3.4,Despite a $3.4,Despite a $3.4,Despite a $3.4
"million decline in local revenues since November 2008, the County’s contribution to the","million decline in local revenues since November 2008, the County’s contribution to the","million decline in local revenues since November 2008, the County’s contribution to the","million decline in local revenues since November 2008, the County’s contribution to the","million decline in local revenues since November 2008, the County’s contribution to the","million decline in local revenues since November 2008, the County’s contribution to the","million decline in local revenues since November 2008, the County’s contribution to the","million decline in local revenues since November 2008, the County’s contribution to the","million decline in local revenues since November 2008, the County’s contribution to the","million decline in local revenues since November 2008, the County’s contribution to the","million decline in local revenues since November 2008, the County’s contribution to the","million decline in local revenues since November 2008, the County’s contribution to the","million decline in local revenues since November 2008, the County’s contribution to the","million decline in local revenues since November 2008, the County’s contribution to the","million decline in local revenues since November 2008, the County’s contribution to the","million decline in local revenues since November 2008, the County’s contribution to the","million decline in local revenues since November 2008, the County’s contribution to the","million decline in local revenues since November 2008, the County’s contribution to the","million decline in local revenues since November 2008, the County’s contribution to the","million decline in local revenues since November 2008, the County’s contribution to the"
operating budget of the Williamsburg-James City County (WJCC) Schools drops a modest,operating budget of the Williamsburg-James City County (WJCC) Schools drops a modest,operating budget of the Williamsburg-James City County (WJCC) Schools drops a modest,operating budget of the Williamsburg-James City County (WJCC) Schools drops a modest,operating budget of the Williamsburg-James City County (WJCC) Schools drops a modest,operating budget of the Williamsburg-James City County (WJCC) Schools drops a modest,operating budget of the Williamsburg-James City County (WJCC) Schools drops a modest,operating budget of the Williamsburg-James City County (WJCC) Schools drops a modest,operating budget of the Williamsburg-James City County (WJCC) Schools drops a modest,operating budget of the Williamsburg-James City County (WJCC) Schools drops a modest,operating budget of the Williamsburg-James City County (WJCC) Schools drops a modest,operating budget of the Williamsburg-James City County (WJCC) Schools drops a modest,operating budget of the Williamsburg-James City County (WJCC) Schools drops a modest,operating budget of the Williamsburg-James City County (WJCC) Schools drops a modest,operating budget of the Williamsburg-James City County (WJCC) Schools drops a modest,operating budget of the Williamsburg-James City County (WJCC) Schools drops a modest,operating budget of the Williamsburg-James City County (WJCC) Schools drops a modest,operating budget of the Williamsburg-James City County (WJCC) Schools drops a modest,operating budget of the Williamsburg-James City County (WJCC) Schools drops a modest,operating budget of the Williamsburg-James City County (WJCC) Schools drops a modest
"$300,000 or 0.4 percent.","$300,000 or 0.4 percent.","$300,000 or 0.4 percent.","$300,000 or 0.4 percent.","$300,000 or 0.4 percent.","Investments in the Capital Budget for schools continue, funding is","Investments in the Capital Budget for schools continue, funding is","Investments in the Capital Budget for schools continue, funding is","Investments in the Capital Budget for schools continue, funding is","Investments in the Capital Budget for schools continue, funding is","Investments in the Capital Budget for schools continue, funding is","Investments in the Capital Budget for schools continue, funding is","Investments in the Capital Budget for schools continue, funding is","Investments in the Capital Budget for schools continue, funding is","Investments in the Capital Budget for schools continue, funding is","Investments in the Capital Budget for schools continue, funding is","Investments in the Capital Budget for schools continue, funding is","Investments in the Capital Budget for schools continue, funding is","Investments in the Capital Budget for schools continue, funding is","Investments in the Capital Budget for schools continue, funding is"
proposed for a significant portion of the project costs included in the WJCC capital request.,proposed for a significant portion of the project costs included in the WJCC capital request.,proposed for a significant portion of the project costs included in the WJCC capital request.,proposed for a significant portion of the project costs included in the WJCC capital request.,proposed for a significant portion of the project costs included in the WJCC capital request.,proposed for a significant portion of the project costs included in the WJCC capital request.,proposed for a significant portion of the project costs included in the WJCC capital request.,proposed for a significant portion of the project costs included in the WJCC capital request.,proposed for a significant portion of the project costs included in the WJCC capital request.,proposed for a significant portion of the project costs included in the WJCC capital request.,proposed for a significant portion of the project costs included in the WJCC capital request.,proposed for a significant portion of the project costs included in the WJCC capital request.,proposed for a significant portion of the project costs included in the WJCC capital request.,proposed for a significant portion of the project costs included in the WJCC capital request.,proposed for a significant portion of the project costs included in the WJCC capital request.,proposed for a significant portion of the project costs included in the WJCC capital request.,proposed for a significant portion of the project costs included in the WJCC capital request.,proposed for a significant portion of the project costs included in the WJCC capital request.,proposed for a significant portion of the project costs included in the WJCC capital request.,proposed for a significant portion of the project costs included in the WJCC capital request.
$3,million,is,also,dedicated,dedicated,as,a,“set,aside”,in,the,Debt,Service,Service,Fund,to,fund,the,net
operating cost increases of a new elementary school and a new middle school opening in,operating cost increases of a new elementary school and a new middle school opening in,operating cost increases of a new elementary school and a new middle school opening in,operating cost increases of a new elementary school and a new middle school opening in,operating cost increases of a new elementary school and a new middle school opening in,operating cost increases of a new elementary school and a new middle school opening in,operating cost increases of a new elementary school and a new middle school opening in,operating cost increases of a new elementary school and a new middle school opening in,operating cost increases of a new elementary school and a new middle school opening in,operating cost increases of a new elementary school and a new middle school opening in,operating cost increases of a new elementary school and a new middle school opening in,operating cost increases of a new elementary school and a new middle school opening in,operating cost increases of a new elementary school and a new middle school opening in,operating cost increases of a new elementary school and a new middle school opening in,operating cost increases of a new elementary school and a new middle school opening in,operating cost increases of a new elementary school and a new middle school opening in,operating cost increases of a new elementary school and a new middle school opening in,operating cost increases of a new elementary school and a new middle school opening in,operating cost increases of a new elementary school and a new middle school opening in,operating cost increases of a new elementary school and a new middle school opening in
August of 2010.,August of 2010.,August of 2010.,,,,,,,,,,,,,,,,,
The,FY,2010,budget,also,,makes,,public,public,safety,a priority with continuing,a priority with continuing,a priority with continuing,a priority with continuing,a priority with continuing,investments,investments,investments,in
"facilities, equipment and staffing.","facilities, equipment and staffing.","facilities, equipment and staffing.","facilities, equipment and staffing.","facilities, equipment and staffing.","facilities, equipment and staffing.","facilities, equipment and staffing.",FY 2010 County revenues are not sufficient to fund all the,FY 2010 County revenues are not sufficient to fund all the,FY 2010 County revenues are not sufficient to fund all the,FY 2010 County revenues are not sufficient to fund all the,FY 2010 County revenues are not sufficient to fund all the,FY 2010 County revenues are not sufficient to fund all the,FY 2010 County revenues are not sufficient to fund all the,FY 2010 County revenues are not sufficient to fund all the,FY 2010 County revenues are not sufficient to fund all the,FY 2010 County revenues are not sufficient to fund all the,FY 2010 County revenues are not sufficient to fund all the,FY 2010 County revenues are not sufficient to fund all the,FY 2010 County revenues are not sufficient to fund all the
staff additions included in the FY 2010 fiscal plan recommended by Municipal and Financial,staff additions included in the FY 2010 fiscal plan recommended by Municipal and Financial,staff additions included in the FY 2010 fiscal plan recommended by Municipal and Financial,staff additions included in the FY 2010 fiscal plan recommended by Municipal and Financial,staff additions included in the FY 2010 fiscal plan recommended by Municipal and Financial,staff additions included in the FY 2010 fiscal plan recommended by Municipal and Financial,staff additions included in the FY 2010 fiscal plan recommended by Municipal and Financial,staff additions included in the FY 2010 fiscal plan recommended by Municipal and Financial,staff additions included in the FY 2010 fiscal plan recommended by Municipal and Financial,staff additions included in the FY 2010 fiscal plan recommended by Municipal and Financial,staff additions included in the FY 2010 fiscal plan recommended by Municipal and Financial,staff additions included in the FY 2010 fiscal plan recommended by Municipal and Financial,staff additions included in the FY 2010 fiscal plan recommended by Municipal and Financial,staff additions included in the FY 2010 fiscal plan recommended by Municipal and Financial,staff additions included in the FY 2010 fiscal plan recommended by Municipal and Financial,staff additions included in the FY 2010 fiscal plan recommended by Municipal and Financial,staff additions included in the FY 2010 fiscal plan recommended by Municipal and Financial,staff additions included in the FY 2010 fiscal plan recommended by Municipal and Financial,staff additions included in the FY 2010 fiscal plan recommended by Municipal and Financial,staff additions included in the FY 2010 fiscal plan recommended by Municipal and Financial
"Services Group (MFSG) to Police, Fire, and Emergency Communications but every effort is","Services Group (MFSG) to Police, Fire, and Emergency Communications but every effort is","Services Group (MFSG) to Police, Fire, and Emergency Communications but every effort is","Services Group (MFSG) to Police, Fire, and Emergency Communications but every effort is","Services Group (MFSG) to Police, Fire, and Emergency Communications but every effort is","Services Group (MFSG) to Police, Fire, and Emergency Communications but every effort is","Services Group (MFSG) to Police, Fire, and Emergency Communications but every effort is","Services Group (MFSG) to Police, Fire, and Emergency Communications but every effort is","Services Group (MFSG) to Police, Fire, and Emergency Communications but every effort is","Services Group (MFSG) to Police, Fire, and Emergency Communications but every effort is","Services Group (MFSG) to Police, Fire, and Emergency Communications but every effort is","Services Group (MFSG) to Police, Fire, and Emergency Communications but every effort is","Services Group (MFSG) to Police, Fire, and Emergency Communications but every effort is","Services Group (MFSG) to Police, Fire, and Emergency Communications but every effort is","Services Group (MFSG) to Police, Fire, and Emergency Communications but every effort is","Services Group (MFSG) to Police, Fire, and Emergency Communications but every effort is","Services Group (MFSG) to Police, Fire, and Emergency Communications but every effort is","Services Group (MFSG) to Police, Fire, and Emergency Communications but every effort is","Services Group (MFSG) to Police, Fire, and Emergency Communications but every effort is","Services Group (MFSG) to Police, Fire, and Emergency Communications but every effort is"
being made to find alternative funding.,being made to find alternative funding.,being made to find alternative funding.,being made to find alternative funding.,being made to find alternative funding.,being made to find alternative funding.,being made to find alternative funding.,being made to find alternative funding.,being made to find alternative funding.,"The Federal COPS program, as an example, may","The Federal COPS program, as an example, may","The Federal COPS program, as an example, may","The Federal COPS program, as an example, may","The Federal COPS program, as an example, may","The Federal COPS program, as an example, may","The Federal COPS program, as an example, may","The Federal COPS program, as an example, may","The Federal COPS program, as an example, may","The Federal COPS program, as an example, may","The Federal COPS program, as an example, may"
offer the County the ability to add up to six new police officers some time in FY 2010.,offer the County the ability to add up to six new police officers some time in FY 2010.,offer the County the ability to add up to six new police officers some time in FY 2010.,offer the County the ability to add up to six new police officers some time in FY 2010.,offer the County the ability to add up to six new police officers some time in FY 2010.,offer the County the ability to add up to six new police officers some time in FY 2010.,offer the County the ability to add up to six new police officers some time in FY 2010.,offer the County the ability to add up to six new police officers some time in FY 2010.,offer the County the ability to add up to six new police officers some time in FY 2010.,offer the County the ability to add up to six new police officers some time in FY 2010.,offer the County the ability to add up to six new police officers some time in FY 2010.,offer the County the ability to add up to six new police officers some time in FY 2010.,offer the County the ability to add up to six new police officers some time in FY 2010.,offer the County the ability to add up to six new police officers some time in FY 2010.,offer the County the ability to add up to six new police officers some time in FY 2010.,offer the County the ability to add up to six new police officers some time in FY 2010.,offer the County the ability to add up to six new police officers some time in FY 2010.,offer the County the ability to add up to six new police officers some time in FY 2010.,Over,Over
$1 billion in Federal funds has been set aside for this program and I am hopeful that the,$1 billion in Federal funds has been set aside for this program and I am hopeful that the,$1 billion in Federal funds has been set aside for this program and I am hopeful that the,$1 billion in Federal funds has been set aside for this program and I am hopeful that the,$1 billion in Federal funds has been set aside for this program and I am hopeful that the,$1 billion in Federal funds has been set aside for this program and I am hopeful that the,$1 billion in Federal funds has been set aside for this program and I am hopeful that the,$1 billion in Federal funds has been set aside for this program and I am hopeful that the,$1 billion in Federal funds has been set aside for this program and I am hopeful that the,$1 billion in Federal funds has been set aside for this program and I am hopeful that the,$1 billion in Federal funds has been set aside for this program and I am hopeful that the,$1 billion in Federal funds has been set aside for this program and I am hopeful that the,$1 billion in Federal funds has been set aside for this program and I am hopeful that the,$1 billion in Federal funds has been set aside for this program and I am hopeful that the,$1 billion in Federal funds has been set aside for this program and I am hopeful that the,$1 billion in Federal funds has been set aside for this program and I am hopeful that the,$1 billion in Federal funds has been set aside for this program and I am hopeful that the,$1 billion in Federal funds has been set aside for this program and I am hopeful that the,$1 billion in Federal funds has been set aside for this program and I am hopeful that the,$1 billion in Federal funds has been set aside for this program and I am hopeful that the
James City County application will be received favorably.,James City County application will be received favorably.,James City County application will be received favorably.,James City County application will be received favorably.,James City County application will be received favorably.,James City County application will be received favorably.,James City County application will be received favorably.,James City County application will be received favorably.,James City County application will be received favorably.,James City County application will be received favorably.,James City County application will be received favorably.,James City County application will be received favorably.,James City County application will be received favorably.,,,,,,,
I am unable to recommend the addition of the four new positions originally planned in Fire,I am unable to recommend the addition of the four new positions originally planned in Fire,I am unable to recommend the addition of the four new positions originally planned in Fire,I am unable to recommend the addition of the four new positions originally planned in Fire,I am unable to recommend the addition of the four new positions originally planned in Fire,I am unable to recommend the addition of the four new positions originally planned in Fire,I am unable to recommend the addition of the four new positions originally planned in Fire,I am unable to recommend the addition of the four new positions originally planned in Fire,I am unable to recommend the addition of the four new positions originally planned in Fire,I am unable to recommend the addition of the four new positions originally planned in Fire,I am unable to recommend the addition of the four new positions originally planned in Fire,I am unable to recommend the addition of the four new positions originally planned in Fire,I am unable to recommend the addition of the four new positions originally planned in Fire,I am unable to recommend the addition of the four new positions originally planned in Fire,I am unable to recommend the addition of the four new positions originally planned in Fire,I am unable to recommend the addition of the four new positions originally planned in Fire,I am unable to recommend the addition of the four new positions originally planned in Fire,I am unable to recommend the addition of the four new positions originally planned in Fire,I am unable to recommend the addition of the four new positions originally planned in Fire,I am unable to recommend the addition of the four new positions originally planned in Fire
and,Emergency,Emergency,Communications,Communications,Communications,Communications,,in,FY,2010.,Workload,Workload,is,not,growing,as,quickly,quickly,as
