"originally thought, a fact attributed to declines in visitation (hotels, motels, and timeshares)","originally thought, a fact attributed to declines in visitation (hotels, motels, and timeshares)","originally thought, a fact attributed to declines in visitation (hotels, motels, and timeshares)","originally thought, a fact attributed to declines in visitation (hotels, motels, and timeshares)","originally thought, a fact attributed to declines in visitation (hotels, motels, and timeshares)","originally thought, a fact attributed to declines in visitation (hotels, motels, and timeshares)","originally thought, a fact attributed to declines in visitation (hotels, motels, and timeshares)","originally thought, a fact attributed to declines in visitation (hotels, motels, and timeshares)","originally thought, a fact attributed to declines in visitation (hotels, motels, and timeshares)","originally thought, a fact attributed to declines in visitation (hotels, motels, and timeshares)","originally thought, a fact attributed to declines in visitation (hotels, motels, and timeshares)","originally thought, a fact attributed to declines in visitation (hotels, motels, and timeshares)","originally thought, a fact attributed to declines in visitation (hotels, motels, and timeshares)","originally thought, a fact attributed to declines in visitation (hotels, motels, and timeshares)","originally thought, a fact attributed to declines in visitation (hotels, motels, and timeshares)","originally thought, a fact attributed to declines in visitation (hotels, motels, and timeshares)","originally thought, a fact attributed to declines in visitation (hotels, motels, and timeshares)","originally thought, a fact attributed to declines in visitation (hotels, motels, and timeshares)","originally thought, a fact attributed to declines in visitation (hotels, motels, and timeshares)","originally thought, a fact attributed to declines in visitation (hotels, motels, and timeshares)"
"and reduced vehicle traffic volume, particularly on the interstate.","and reduced vehicle traffic volume, particularly on the interstate.","and reduced vehicle traffic volume, particularly on the interstate.","and reduced vehicle traffic volume, particularly on the interstate.","and reduced vehicle traffic volume, particularly on the interstate.","and reduced vehicle traffic volume, particularly on the interstate.","and reduced vehicle traffic volume, particularly on the interstate.","and reduced vehicle traffic volume, particularly on the interstate.","and reduced vehicle traffic volume, particularly on the interstate.","and reduced vehicle traffic volume, particularly on the interstate.","and reduced vehicle traffic volume, particularly on the interstate.","and reduced vehicle traffic volume, particularly on the interstate.","and reduced vehicle traffic volume, particularly on the interstate.","and reduced vehicle traffic volume, particularly on the interstate.",,,,,,
In,these,challenging,challenging,economic,economic,conditions,conditions,conditions,conditions,this,budget,"attempts,","attempts,",as,much,as,"possible,","possible,",to
maintain current funding for “safety net” services.,maintain current funding for “safety net” services.,maintain current funding for “safety net” services.,maintain current funding for “safety net” services.,maintain current funding for “safety net” services.,maintain current funding for “safety net” services.,maintain current funding for “safety net” services.,maintain current funding for “safety net” services.,maintain current funding for “safety net” services.,maintain current funding for “safety net” services.,maintain current funding for “safety net” services.,"These include social services, public","These include social services, public","These include social services, public","These include social services, public","These include social services, public","These include social services, public","These include social services, public","These include social services, public","These include social services, public"
"health and mental health services, and initiatives focusing on the needs of an increasing","health and mental health services, and initiatives focusing on the needs of an increasing","health and mental health services, and initiatives focusing on the needs of an increasing","health and mental health services, and initiatives focusing on the needs of an increasing","health and mental health services, and initiatives focusing on the needs of an increasing","health and mental health services, and initiatives focusing on the needs of an increasing","health and mental health services, and initiatives focusing on the needs of an increasing","health and mental health services, and initiatives focusing on the needs of an increasing","health and mental health services, and initiatives focusing on the needs of an increasing","health and mental health services, and initiatives focusing on the needs of an increasing","health and mental health services, and initiatives focusing on the needs of an increasing","health and mental health services, and initiatives focusing on the needs of an increasing","health and mental health services, and initiatives focusing on the needs of an increasing","health and mental health services, and initiatives focusing on the needs of an increasing","health and mental health services, and initiatives focusing on the needs of an increasing","health and mental health services, and initiatives focusing on the needs of an increasing","health and mental health services, and initiatives focusing on the needs of an increasing","health and mental health services, and initiatives focusing on the needs of an increasing","health and mental health services, and initiatives focusing on the needs of an increasing","health and mental health services, and initiatives focusing on the needs of an increasing"
number of homeless individuals and families in the community.,number of homeless individuals and families in the community.,number of homeless individuals and families in the community.,number of homeless individuals and families in the community.,number of homeless individuals and families in the community.,number of homeless individuals and families in the community.,number of homeless individuals and families in the community.,number of homeless individuals and families in the community.,number of homeless individuals and families in the community.,number of homeless individuals and families in the community.,number of homeless individuals and families in the community.,number of homeless individuals and families in the community.,number of homeless individuals and families in the community.,number of homeless individuals and families in the community.,The safety net also includes,The safety net also includes,The safety net also includes,The safety net also includes,The safety net also includes,The safety net also includes
a,number,of,nonprofit,nonprofit,agencies,agencies,,that,perform,perform,important,important,functions,functions,in,our,"community,","community,","community,"
depending to a great degree on the work of volunteers.,depending to a great degree on the work of volunteers.,depending to a great degree on the work of volunteers.,depending to a great degree on the work of volunteers.,depending to a great degree on the work of volunteers.,depending to a great degree on the work of volunteers.,depending to a great degree on the work of volunteers.,depending to a great degree on the work of volunteers.,depending to a great degree on the work of volunteers.,depending to a great degree on the work of volunteers.,depending to a great degree on the work of volunteers.,depending to a great degree on the work of volunteers.,"These services have been increasing,","These services have been increasing,","These services have been increasing,","These services have been increasing,","These services have been increasing,","These services have been increasing,","These services have been increasing,","These services have been increasing,"
food,stamp,"clients,","clients,",as,an,"example,","example,","example,",have,increased,increased,34,percent,from,February,February,2008,2008,to
February 2009.,February 2009.,February 2009.,Other benefits programs have seen similar surges from families in need of,Other benefits programs have seen similar surges from families in need of,Other benefits programs have seen similar surges from families in need of,Other benefits programs have seen similar surges from families in need of,Other benefits programs have seen similar surges from families in need of,Other benefits programs have seen similar surges from families in need of,Other benefits programs have seen similar surges from families in need of,Other benefits programs have seen similar surges from families in need of,Other benefits programs have seen similar surges from families in need of,Other benefits programs have seen similar surges from families in need of,Other benefits programs have seen similar surges from families in need of,Other benefits programs have seen similar surges from families in need of,Other benefits programs have seen similar surges from families in need of,Other benefits programs have seen similar surges from families in need of,Other benefits programs have seen similar surges from families in need of,Other benefits programs have seen similar surges from families in need of,Other benefits programs have seen similar surges from families in need of
services.,services.,,,,,,,,,,,,,,,,,,
"Plan Responsibly for the Needs of a Growing, Diverse Community","Plan Responsibly for the Needs of a Growing, Diverse Community","Plan Responsibly for the Needs of a Growing, Diverse Community","Plan Responsibly for the Needs of a Growing, Diverse Community","Plan Responsibly for the Needs of a Growing, Diverse Community","Plan Responsibly for the Needs of a Growing, Diverse Community","Plan Responsibly for the Needs of a Growing, Diverse Community","Plan Responsibly for the Needs of a Growing, Diverse Community","Plan Responsibly for the Needs of a Growing, Diverse Community","Plan Responsibly for the Needs of a Growing, Diverse Community","Plan Responsibly for the Needs of a Growing, Diverse Community","Plan Responsibly for the Needs of a Growing, Diverse Community","Plan Responsibly for the Needs of a Growing, Diverse Community","Plan Responsibly for the Needs of a Growing, Diverse Community",,,,,,
Planning efforts continue as revisions are being presented and discussed as part of 2009,Planning efforts continue as revisions are being presented and discussed as part of 2009,Planning efforts continue as revisions are being presented and discussed as part of 2009,Planning efforts continue as revisions are being presented and discussed as part of 2009,Planning efforts continue as revisions are being presented and discussed as part of 2009,Planning efforts continue as revisions are being presented and discussed as part of 2009,Planning efforts continue as revisions are being presented and discussed as part of 2009,Planning efforts continue as revisions are being presented and discussed as part of 2009,Planning efforts continue as revisions are being presented and discussed as part of 2009,Planning efforts continue as revisions are being presented and discussed as part of 2009,Planning efforts continue as revisions are being presented and discussed as part of 2009,Planning efforts continue as revisions are being presented and discussed as part of 2009,Planning efforts continue as revisions are being presented and discussed as part of 2009,Planning efforts continue as revisions are being presented and discussed as part of 2009,Planning efforts continue as revisions are being presented and discussed as part of 2009,Planning efforts continue as revisions are being presented and discussed as part of 2009,Planning efforts continue as revisions are being presented and discussed as part of 2009,Planning efforts continue as revisions are being presented and discussed as part of 2009,Planning efforts continue as revisions are being presented and discussed as part of 2009,Planning efforts continue as revisions are being presented and discussed as part of 2009
review,of,the,County’s,County’s,,Comprehensive,Comprehensive,Comprehensive,Comprehensive,Plan.,Funding,Funding,is,budgeted,budgeted,to,allow,allow,the
"implementation of several of the major anticipated revisions, including changes to current","implementation of several of the major anticipated revisions, including changes to current","implementation of several of the major anticipated revisions, including changes to current","implementation of several of the major anticipated revisions, including changes to current","implementation of several of the major anticipated revisions, including changes to current","implementation of several of the major anticipated revisions, including changes to current","implementation of several of the major anticipated revisions, including changes to current","implementation of several of the major anticipated revisions, including changes to current","implementation of several of the major anticipated revisions, including changes to current","implementation of several of the major anticipated revisions, including changes to current","implementation of several of the major anticipated revisions, including changes to current","implementation of several of the major anticipated revisions, including changes to current","implementation of several of the major anticipated revisions, including changes to current","implementation of several of the major anticipated revisions, including changes to current","implementation of several of the major anticipated revisions, including changes to current","implementation of several of the major anticipated revisions, including changes to current","implementation of several of the major anticipated revisions, including changes to current","implementation of several of the major anticipated revisions, including changes to current","implementation of several of the major anticipated revisions, including changes to current","implementation of several of the major anticipated revisions, including changes to current"
"County ordinances, policies and regulations, and special studies to set the framework for key","County ordinances, policies and regulations, and special studies to set the framework for key","County ordinances, policies and regulations, and special studies to set the framework for key","County ordinances, policies and regulations, and special studies to set the framework for key","County ordinances, policies and regulations, and special studies to set the framework for key","County ordinances, policies and regulations, and special studies to set the framework for key","County ordinances, policies and regulations, and special studies to set the framework for key","County ordinances, policies and regulations, and special studies to set the framework for key","County ordinances, policies and regulations, and special studies to set the framework for key","County ordinances, policies and regulations, and special studies to set the framework for key","County ordinances, policies and regulations, and special studies to set the framework for key","County ordinances, policies and regulations, and special studies to set the framework for key","County ordinances, policies and regulations, and special studies to set the framework for key","County ordinances, policies and regulations, and special studies to set the framework for key","County ordinances, policies and regulations, and special studies to set the framework for key","County ordinances, policies and regulations, and special studies to set the framework for key","County ordinances, policies and regulations, and special studies to set the framework for key","County ordinances, policies and regulations, and special studies to set the framework for key","County ordinances, policies and regulations, and special studies to set the framework for key","County ordinances, policies and regulations, and special studies to set the framework for key"
strategic initiatives.,strategic initiatives.,strategic initiatives.,strategic initiatives.,,,,,,,,,,,,,,,,
Drafts of a new Parks and Recreation Master Plan are now being reviewed as is “Shaping,Drafts of a new Parks and Recreation Master Plan are now being reviewed as is “Shaping,Drafts of a new Parks and Recreation Master Plan are now being reviewed as is “Shaping,Drafts of a new Parks and Recreation Master Plan are now being reviewed as is “Shaping,Drafts of a new Parks and Recreation Master Plan are now being reviewed as is “Shaping,Drafts of a new Parks and Recreation Master Plan are now being reviewed as is “Shaping,Drafts of a new Parks and Recreation Master Plan are now being reviewed as is “Shaping,Drafts of a new Parks and Recreation Master Plan are now being reviewed as is “Shaping,Drafts of a new Parks and Recreation Master Plan are now being reviewed as is “Shaping,Drafts of a new Parks and Recreation Master Plan are now being reviewed as is “Shaping,Drafts of a new Parks and Recreation Master Plan are now being reviewed as is “Shaping,Drafts of a new Parks and Recreation Master Plan are now being reviewed as is “Shaping,Drafts of a new Parks and Recreation Master Plan are now being reviewed as is “Shaping,Drafts of a new Parks and Recreation Master Plan are now being reviewed as is “Shaping,Drafts of a new Parks and Recreation Master Plan are now being reviewed as is “Shaping,Drafts of a new Parks and Recreation Master Plan are now being reviewed as is “Shaping,Drafts of a new Parks and Recreation Master Plan are now being reviewed as is “Shaping,Drafts of a new Parks and Recreation Master Plan are now being reviewed as is “Shaping,Drafts of a new Parks and Recreation Master Plan are now being reviewed as is “Shaping,Drafts of a new Parks and Recreation Master Plan are now being reviewed as is “Shaping
"Our Shores,” a series of proposals that focus on potential improvements to three County-","Our Shores,” a series of proposals that focus on potential improvements to three County-","Our Shores,” a series of proposals that focus on potential improvements to three County-","Our Shores,” a series of proposals that focus on potential improvements to three County-","Our Shores,” a series of proposals that focus on potential improvements to three County-","Our Shores,” a series of proposals that focus on potential improvements to three County-","Our Shores,” a series of proposals that focus on potential improvements to three County-","Our Shores,” a series of proposals that focus on potential improvements to three County-","Our Shores,” a series of proposals that focus on potential improvements to three County-","Our Shores,” a series of proposals that focus on potential improvements to three County-","Our Shores,” a series of proposals that focus on potential improvements to three County-","Our Shores,” a series of proposals that focus on potential improvements to three County-","Our Shores,” a series of proposals that focus on potential improvements to three County-","Our Shores,” a series of proposals that focus on potential improvements to three County-","Our Shores,” a series of proposals that focus on potential improvements to three County-","Our Shores,” a series of proposals that focus on potential improvements to three County-","Our Shores,” a series of proposals that focus on potential improvements to three County-","Our Shores,” a series of proposals that focus on potential improvements to three County-","Our Shores,” a series of proposals that focus on potential improvements to three County-","Our Shores,” a series of proposals that focus on potential improvements to three County-"
"owned properties (Jamestown Beach Campground, Chickahominy Riverfront Park, and the","owned properties (Jamestown Beach Campground, Chickahominy Riverfront Park, and the","owned properties (Jamestown Beach Campground, Chickahominy Riverfront Park, and the","owned properties (Jamestown Beach Campground, Chickahominy Riverfront Park, and the","owned properties (Jamestown Beach Campground, Chickahominy Riverfront Park, and the","owned properties (Jamestown Beach Campground, Chickahominy Riverfront Park, and the","owned properties (Jamestown Beach Campground, Chickahominy Riverfront Park, and the","owned properties (Jamestown Beach Campground, Chickahominy Riverfront Park, and the","owned properties (Jamestown Beach Campground, Chickahominy Riverfront Park, and the","owned properties (Jamestown Beach Campground, Chickahominy Riverfront Park, and the","owned properties (Jamestown Beach Campground, Chickahominy Riverfront Park, and the","owned properties (Jamestown Beach Campground, Chickahominy Riverfront Park, and the","owned properties (Jamestown Beach Campground, Chickahominy Riverfront Park, and the","owned properties (Jamestown Beach Campground, Chickahominy Riverfront Park, and the","owned properties (Jamestown Beach Campground, Chickahominy Riverfront Park, and the","owned properties (Jamestown Beach Campground, Chickahominy Riverfront Park, and the","owned properties (Jamestown Beach Campground, Chickahominy Riverfront Park, and the","owned properties (Jamestown Beach Campground, Chickahominy Riverfront Park, and the","owned properties (Jamestown Beach Campground, Chickahominy Riverfront Park, and the","owned properties (Jamestown Beach Campground, Chickahominy Riverfront Park, and the"
,,,,,,,,,Page A-5,Page A-5,,,,,,,,,
