Name: “Table 1 of 1 on page 16 of 62”,Name: “Table 1 of 1 on page 16 of 62”,Name: “Table 1 of 1 on page 16 of 62”,Name: “Table 1 of 1 on page 16 of 62”,Name: “Table 1 of 1 on page 16 of 62”,Name: “Table 1 of 1 on page 16 of 62”,Name: “Table 1 of 1 on page 16 of 62”,Name: “Table 1 of 1 on page 16 of 62”,Name: “Table 1 of 1 on page 16 of 62”,Name: “Table 1 of 1 on page 16 of 62”,Name: “Table 1 of 1 on page 16 of 62”,Name: “Table 1 of 1 on page 16 of 62”,Name: “Table 1 of 1 on page 16 of 62”,Name: “Table 1 of 1 on page 16 of 62”,Name: “Table 1 of 1 on page 16 of 62”,Name: “Table 1 of 1 on page 16 of 62”,Name: “Table 1 of 1 on page 16 of 62”
Table: 16,Table: 16,Table: 16,Table: 16,Table: 16,Table: 16,Table: 16,Table: 16,Table: 16,Table: 16,Table: 16,Table: 16,Table: 16,Table: 16,Table: 16,Table: 16,Table: 16
,,,,,,,,,,,,,,,,
FUND STRUCTURE,FUND STRUCTURE,FUND STRUCTURE,FUND STRUCTURE,FUND STRUCTURE,,,,,,,,,,,,
The city uses fund accounting to ensure and demonstrate compliance with finance-related legal and regulatory,The city uses fund accounting to ensure and demonstrate compliance with finance-related legal and regulatory,The city uses fund accounting to ensure and demonstrate compliance with finance-related legal and regulatory,The city uses fund accounting to ensure and demonstrate compliance with finance-related legal and regulatory,The city uses fund accounting to ensure and demonstrate compliance with finance-related legal and regulatory,The city uses fund accounting to ensure and demonstrate compliance with finance-related legal and regulatory,The city uses fund accounting to ensure and demonstrate compliance with finance-related legal and regulatory,The city uses fund accounting to ensure and demonstrate compliance with finance-related legal and regulatory,The city uses fund accounting to ensure and demonstrate compliance with finance-related legal and regulatory,The city uses fund accounting to ensure and demonstrate compliance with finance-related legal and regulatory,The city uses fund accounting to ensure and demonstrate compliance with finance-related legal and regulatory,The city uses fund accounting to ensure and demonstrate compliance with finance-related legal and regulatory,The city uses fund accounting to ensure and demonstrate compliance with finance-related legal and regulatory,The city uses fund accounting to ensure and demonstrate compliance with finance-related legal and regulatory,The city uses fund accounting to ensure and demonstrate compliance with finance-related legal and regulatory,The city uses fund accounting to ensure and demonstrate compliance with finance-related legal and regulatory,The city uses fund accounting to ensure and demonstrate compliance with finance-related legal and regulatory
requirements.,requirements.,A fund is a grouping of related accounts used to maintain control over resources that have been,A fund is a grouping of related accounts used to maintain control over resources that have been,A fund is a grouping of related accounts used to maintain control over resources that have been,A fund is a grouping of related accounts used to maintain control over resources that have been,A fund is a grouping of related accounts used to maintain control over resources that have been,A fund is a grouping of related accounts used to maintain control over resources that have been,A fund is a grouping of related accounts used to maintain control over resources that have been,A fund is a grouping of related accounts used to maintain control over resources that have been,A fund is a grouping of related accounts used to maintain control over resources that have been,A fund is a grouping of related accounts used to maintain control over resources that have been,A fund is a grouping of related accounts used to maintain control over resources that have been,A fund is a grouping of related accounts used to maintain control over resources that have been,A fund is a grouping of related accounts used to maintain control over resources that have been,A fund is a grouping of related accounts used to maintain control over resources that have been,A fund is a grouping of related accounts used to maintain control over resources that have been
segregated for specific activities or objectives.,segregated for specific activities or objectives.,segregated for specific activities or objectives.,segregated for specific activities or objectives.,segregated for specific activities or objectives.,segregated for specific activities or objectives.,The city’s funds can be divided into four categories: governmental,The city’s funds can be divided into four categories: governmental,The city’s funds can be divided into four categories: governmental,The city’s funds can be divided into four categories: governmental,The city’s funds can be divided into four categories: governmental,The city’s funds can be divided into four categories: governmental,The city’s funds can be divided into four categories: governmental,The city’s funds can be divided into four categories: governmental,The city’s funds can be divided into four categories: governmental,The city’s funds can be divided into four categories: governmental,The city’s funds can be divided into four categories: governmental
"funds, proprietary funds, component unit funds and fiduciary funds.","funds, proprietary funds, component unit funds and fiduciary funds.","funds, proprietary funds, component unit funds and fiduciary funds.","funds, proprietary funds, component unit funds and fiduciary funds.","funds, proprietary funds, component unit funds and fiduciary funds.","funds, proprietary funds, component unit funds and fiduciary funds.","funds, proprietary funds, component unit funds and fiduciary funds.","funds, proprietary funds, component unit funds and fiduciary funds.","funds, proprietary funds, component unit funds and fiduciary funds.","funds, proprietary funds, component unit funds and fiduciary funds.","funds, proprietary funds, component unit funds and fiduciary funds.",,,,,,
G OVERNMENTAL FUNDS,G OVERNMENTAL FUNDS,G OVERNMENTAL FUNDS,G OVERNMENTAL FUNDS,G OVERNMENTAL FUNDS,,,,,,,,,,,,
"Governmental funds consist of the General Fund, Special Revenue Funds, Capital Project Fund, Debt Service Funds","Governmental funds consist of the General Fund, Special Revenue Funds, Capital Project Fund, Debt Service Funds","Governmental funds consist of the General Fund, Special Revenue Funds, Capital Project Fund, Debt Service Funds","Governmental funds consist of the General Fund, Special Revenue Funds, Capital Project Fund, Debt Service Funds","Governmental funds consist of the General Fund, Special Revenue Funds, Capital Project Fund, Debt Service Funds","Governmental funds consist of the General Fund, Special Revenue Funds, Capital Project Fund, Debt Service Funds","Governmental funds consist of the General Fund, Special Revenue Funds, Capital Project Fund, Debt Service Funds","Governmental funds consist of the General Fund, Special Revenue Funds, Capital Project Fund, Debt Service Funds","Governmental funds consist of the General Fund, Special Revenue Funds, Capital Project Fund, Debt Service Funds","Governmental funds consist of the General Fund, Special Revenue Funds, Capital Project Fund, Debt Service Funds","Governmental funds consist of the General Fund, Special Revenue Funds, Capital Project Fund, Debt Service Funds","Governmental funds consist of the General Fund, Special Revenue Funds, Capital Project Fund, Debt Service Funds","Governmental funds consist of the General Fund, Special Revenue Funds, Capital Project Fund, Debt Service Funds","Governmental funds consist of the General Fund, Special Revenue Funds, Capital Project Fund, Debt Service Funds","Governmental funds consist of the General Fund, Special Revenue Funds, Capital Project Fund, Debt Service Funds","Governmental funds consist of the General Fund, Special Revenue Funds, Capital Project Fund, Debt Service Funds","Governmental funds consist of the General Fund, Special Revenue Funds, Capital Project Fund, Debt Service Funds"
and Permanent Fund (see following section).,and Permanent Fund (see following section).,and Permanent Fund (see following section).,and Permanent Fund (see following section).,and Permanent Fund (see following section).,and Permanent Fund (see following section).,Most governmental functions of the city are financed through these,Most governmental functions of the city are financed through these,Most governmental functions of the city are financed through these,Most governmental functions of the city are financed through these,Most governmental functions of the city are financed through these,Most governmental functions of the city are financed through these,Most governmental functions of the city are financed through these,Most governmental functions of the city are financed through these,Most governmental functions of the city are financed through these,Most governmental functions of the city are financed through these,Most governmental functions of the city are financed through these
funds.,Governmental funds normally are supported by taxes and intergovernmental revenues.,Governmental funds normally are supported by taxes and intergovernmental revenues.,Governmental funds normally are supported by taxes and intergovernmental revenues.,Governmental funds normally are supported by taxes and intergovernmental revenues.,Governmental funds normally are supported by taxes and intergovernmental revenues.,Governmental funds normally are supported by taxes and intergovernmental revenues.,Governmental funds normally are supported by taxes and intergovernmental revenues.,Governmental funds normally are supported by taxes and intergovernmental revenues.,Governmental funds normally are supported by taxes and intergovernmental revenues.,Governmental funds normally are supported by taxes and intergovernmental revenues.,Governmental funds normally are supported by taxes and intergovernmental revenues.,Governmental funds normally are supported by taxes and intergovernmental revenues.,Governmental funds normally are supported by taxes and intergovernmental revenues.,Governmental funds normally are supported by taxes and intergovernmental revenues.,The modified,The modified
accrual basis of accounting is used for the budgets of all governmental funds.,accrual basis of accounting is used for the budgets of all governmental funds.,accrual basis of accounting is used for the budgets of all governmental funds.,accrual basis of accounting is used for the budgets of all governmental funds.,accrual basis of accounting is used for the budgets of all governmental funds.,accrual basis of accounting is used for the budgets of all governmental funds.,accrual basis of accounting is used for the budgets of all governmental funds.,accrual basis of accounting is used for the budgets of all governmental funds.,accrual basis of accounting is used for the budgets of all governmental funds.,accrual basis of accounting is used for the budgets of all governmental funds.,accrual basis of accounting is used for the budgets of all governmental funds.,accrual basis of accounting is used for the budgets of all governmental funds.,,,,,
General Fund,General Fund,,,,,,,,,,,,,,,
"The general operating fund of the city accounts for all financial transactions of the general government, except","The general operating fund of the city accounts for all financial transactions of the general government, except","The general operating fund of the city accounts for all financial transactions of the general government, except","The general operating fund of the city accounts for all financial transactions of the general government, except","The general operating fund of the city accounts for all financial transactions of the general government, except","The general operating fund of the city accounts for all financial transactions of the general government, except","The general operating fund of the city accounts for all financial transactions of the general government, except","The general operating fund of the city accounts for all financial transactions of the general government, except","The general operating fund of the city accounts for all financial transactions of the general government, except","The general operating fund of the city accounts for all financial transactions of the general government, except","The general operating fund of the city accounts for all financial transactions of the general government, except","The general operating fund of the city accounts for all financial transactions of the general government, except","The general operating fund of the city accounts for all financial transactions of the general government, except","The general operating fund of the city accounts for all financial transactions of the general government, except","The general operating fund of the city accounts for all financial transactions of the general government, except","The general operating fund of the city accounts for all financial transactions of the general government, except","The general operating fund of the city accounts for all financial transactions of the general government, except"
those required or preferred to be accounted for in another fund.,those required or preferred to be accounted for in another fund.,those required or preferred to be accounted for in another fund.,those required or preferred to be accounted for in another fund.,those required or preferred to be accounted for in another fund.,those required or preferred to be accounted for in another fund.,those required or preferred to be accounted for in another fund.,those required or preferred to be accounted for in another fund.,those required or preferred to be accounted for in another fund.,those required or preferred to be accounted for in another fund.,those required or preferred to be accounted for in another fund.,The General Fund accounts for the normal,The General Fund accounts for the normal,The General Fund accounts for the normal,The General Fund accounts for the normal,The General Fund accounts for the normal,The General Fund accounts for the normal
"recurring activities of the city, such as police, public works, general government, etc. These activities are funded by","recurring activities of the city, such as police, public works, general government, etc. These activities are funded by","recurring activities of the city, such as police, public works, general government, etc. These activities are funded by","recurring activities of the city, such as police, public works, general government, etc. These activities are funded by","recurring activities of the city, such as police, public works, general government, etc. These activities are funded by","recurring activities of the city, such as police, public works, general government, etc. These activities are funded by","recurring activities of the city, such as police, public works, general government, etc. These activities are funded by","recurring activities of the city, such as police, public works, general government, etc. These activities are funded by","recurring activities of the city, such as police, public works, general government, etc. These activities are funded by","recurring activities of the city, such as police, public works, general government, etc. These activities are funded by","recurring activities of the city, such as police, public works, general government, etc. These activities are funded by","recurring activities of the city, such as police, public works, general government, etc. These activities are funded by","recurring activities of the city, such as police, public works, general government, etc. These activities are funded by","recurring activities of the city, such as police, public works, general government, etc. These activities are funded by","recurring activities of the city, such as police, public works, general government, etc. These activities are funded by","recurring activities of the city, such as police, public works, general government, etc. These activities are funded by","recurring activities of the city, such as police, public works, general government, etc. These activities are funded by"
"such revenue sources as general property taxes, other local taxes, licenses and permits, fines and forfeitures, use of","such revenue sources as general property taxes, other local taxes, licenses and permits, fines and forfeitures, use of","such revenue sources as general property taxes, other local taxes, licenses and permits, fines and forfeitures, use of","such revenue sources as general property taxes, other local taxes, licenses and permits, fines and forfeitures, use of","such revenue sources as general property taxes, other local taxes, licenses and permits, fines and forfeitures, use of","such revenue sources as general property taxes, other local taxes, licenses and permits, fines and forfeitures, use of","such revenue sources as general property taxes, other local taxes, licenses and permits, fines and forfeitures, use of","such revenue sources as general property taxes, other local taxes, licenses and permits, fines and forfeitures, use of","such revenue sources as general property taxes, other local taxes, licenses and permits, fines and forfeitures, use of","such revenue sources as general property taxes, other local taxes, licenses and permits, fines and forfeitures, use of","such revenue sources as general property taxes, other local taxes, licenses and permits, fines and forfeitures, use of","such revenue sources as general property taxes, other local taxes, licenses and permits, fines and forfeitures, use of","such revenue sources as general property taxes, other local taxes, licenses and permits, fines and forfeitures, use of","such revenue sources as general property taxes, other local taxes, licenses and permits, fines and forfeitures, use of","such revenue sources as general property taxes, other local taxes, licenses and permits, fines and forfeitures, use of","such revenue sources as general property taxes, other local taxes, licenses and permits, fines and forfeitures, use of","such revenue sources as general property taxes, other local taxes, licenses and permits, fines and forfeitures, use of"
money,and,"property,",charges,for,"services,",recovered,recovered,recovered,costs,and,non-categorical,non-categorical,"aid,",shared,expenses,and
categorical aid from the Commonwealth and Federal Government.,categorical aid from the Commonwealth and Federal Government.,categorical aid from the Commonwealth and Federal Government.,categorical aid from the Commonwealth and Federal Government.,categorical aid from the Commonwealth and Federal Government.,categorical aid from the Commonwealth and Federal Government.,categorical aid from the Commonwealth and Federal Government.,categorical aid from the Commonwealth and Federal Government.,categorical aid from the Commonwealth and Federal Government.,categorical aid from the Commonwealth and Federal Government.,categorical aid from the Commonwealth and Federal Government.,,,,,,
Special Revenue Funds,Special Revenue Funds,Special Revenue Funds,,,,,,,,,,,,,,
The Special Revenue Funds account for the proceeds of specific revenue resources that are restricted or committed,The Special Revenue Funds account for the proceeds of specific revenue resources that are restricted or committed,The Special Revenue Funds account for the proceeds of specific revenue resources that are restricted or committed,The Special Revenue Funds account for the proceeds of specific revenue resources that are restricted or committed,The Special Revenue Funds account for the proceeds of specific revenue resources that are restricted or committed,The Special Revenue Funds account for the proceeds of specific revenue resources that are restricted or committed,The Special Revenue Funds account for the proceeds of specific revenue resources that are restricted or committed,The Special Revenue Funds account for the proceeds of specific revenue resources that are restricted or committed,The Special Revenue Funds account for the proceeds of specific revenue resources that are restricted or committed,The Special Revenue Funds account for the proceeds of specific revenue resources that are restricted or committed,The Special Revenue Funds account for the proceeds of specific revenue resources that are restricted or committed,The Special Revenue Funds account for the proceeds of specific revenue resources that are restricted or committed,The Special Revenue Funds account for the proceeds of specific revenue resources that are restricted or committed,The Special Revenue Funds account for the proceeds of specific revenue resources that are restricted or committed,The Special Revenue Funds account for the proceeds of specific revenue resources that are restricted or committed,The Special Revenue Funds account for the proceeds of specific revenue resources that are restricted or committed,The Special Revenue Funds account for the proceeds of specific revenue resources that are restricted or committed
to expenditure for specific purposes (other than expendable trusts or major capital projects) and require separate,to expenditure for specific purposes (other than expendable trusts or major capital projects) and require separate,to expenditure for specific purposes (other than expendable trusts or major capital projects) and require separate,to expenditure for specific purposes (other than expendable trusts or major capital projects) and require separate,to expenditure for specific purposes (other than expendable trusts or major capital projects) and require separate,to expenditure for specific purposes (other than expendable trusts or major capital projects) and require separate,to expenditure for specific purposes (other than expendable trusts or major capital projects) and require separate,to expenditure for specific purposes (other than expendable trusts or major capital projects) and require separate,to expenditure for specific purposes (other than expendable trusts or major capital projects) and require separate,to expenditure for specific purposes (other than expendable trusts or major capital projects) and require separate,to expenditure for specific purposes (other than expendable trusts or major capital projects) and require separate,to expenditure for specific purposes (other than expendable trusts or major capital projects) and require separate,to expenditure for specific purposes (other than expendable trusts or major capital projects) and require separate,to expenditure for specific purposes (other than expendable trusts or major capital projects) and require separate,to expenditure for specific purposes (other than expendable trusts or major capital projects) and require separate,to expenditure for specific purposes (other than expendable trusts or major capital projects) and require separate,to expenditure for specific purposes (other than expendable trusts or major capital projects) and require separate
"accounting because of legal or regulatory provisions, or administrative action.","accounting because of legal or regulatory provisions, or administrative action.","accounting because of legal or regulatory provisions, or administrative action.","accounting because of legal or regulatory provisions, or administrative action.","accounting because of legal or regulatory provisions, or administrative action.","accounting because of legal or regulatory provisions, or administrative action.","accounting because of legal or regulatory provisions, or administrative action.","accounting because of legal or regulatory provisions, or administrative action.","accounting because of legal or regulatory provisions, or administrative action.","accounting because of legal or regulatory provisions, or administrative action.","accounting because of legal or regulatory provisions, or administrative action.","accounting because of legal or regulatory provisions, or administrative action.","accounting because of legal or regulatory provisions, or administrative action.",,,,
Capital Project Fund,Capital Project Fund,Capital Project Fund,,,,,,,,,,,,,,
