Name: “Table 1 of 1 on page 64 of 212”,Name: “Table 1 of 1 on page 64 of 212”,Name: “Table 1 of 1 on page 64 of 212”,Name: “Table 1 of 1 on page 64 of 212”,Name: “Table 1 of 1 on page 64 of 212”,Name: “Table 1 of 1 on page 64 of 212”,Name: “Table 1 of 1 on page 64 of 212”,Name: “Table 1 of 1 on page 64 of 212”,Name: “Table 1 of 1 on page 64 of 212”,Name: “Table 1 of 1 on page 64 of 212”,Name: “Table 1 of 1 on page 64 of 212”,Name: “Table 1 of 1 on page 64 of 212”,Name: “Table 1 of 1 on page 64 of 212”,Name: “Table 1 of 1 on page 64 of 212”
Table: 64,Table: 64,Table: 64,Table: 64,Table: 64,Table: 64,Table: 64,Table: 64,Table: 64,Table: 64,Table: 64,Table: 64,Table: 64,Table: 64
,,,,,,,,,,,,,
S HERIFF AND J AIL,S HERIFF AND J AIL,S HERIFF AND J AIL,S HERIFF AND J AIL,S HERIFF AND J AIL,,,,,,,,,
MISSION S TATEMENT,MISSION S TATEMENT,MISSION S TATEMENT,MISSION S TATEMENT,,,,,,,,,,
The Norfolk Sheriff's Office serves the residents of Norfolk by providing for the incarceration of adult and,The Norfolk Sheriff's Office serves the residents of Norfolk by providing for the incarceration of adult and,The Norfolk Sheriff's Office serves the residents of Norfolk by providing for the incarceration of adult and,The Norfolk Sheriff's Office serves the residents of Norfolk by providing for the incarceration of adult and,The Norfolk Sheriff's Office serves the residents of Norfolk by providing for the incarceration of adult and,The Norfolk Sheriff's Office serves the residents of Norfolk by providing for the incarceration of adult and,The Norfolk Sheriff's Office serves the residents of Norfolk by providing for the incarceration of adult and,The Norfolk Sheriff's Office serves the residents of Norfolk by providing for the incarceration of adult and,The Norfolk Sheriff's Office serves the residents of Norfolk by providing for the incarceration of adult and,The Norfolk Sheriff's Office serves the residents of Norfolk by providing for the incarceration of adult and,The Norfolk Sheriff's Office serves the residents of Norfolk by providing for the incarceration of adult and,The Norfolk Sheriff's Office serves the residents of Norfolk by providing for the incarceration of adult and,The Norfolk Sheriff's Office serves the residents of Norfolk by providing for the incarceration of adult and,The Norfolk Sheriff's Office serves the residents of Norfolk by providing for the incarceration of adult and
certified juvenile offenders in methods that protect public safety; maintaining institutional safety in a cost-,certified juvenile offenders in methods that protect public safety; maintaining institutional safety in a cost-,certified juvenile offenders in methods that protect public safety; maintaining institutional safety in a cost-,certified juvenile offenders in methods that protect public safety; maintaining institutional safety in a cost-,certified juvenile offenders in methods that protect public safety; maintaining institutional safety in a cost-,certified juvenile offenders in methods that protect public safety; maintaining institutional safety in a cost-,certified juvenile offenders in methods that protect public safety; maintaining institutional safety in a cost-,certified juvenile offenders in methods that protect public safety; maintaining institutional safety in a cost-,certified juvenile offenders in methods that protect public safety; maintaining institutional safety in a cost-,certified juvenile offenders in methods that protect public safety; maintaining institutional safety in a cost-,certified juvenile offenders in methods that protect public safety; maintaining institutional safety in a cost-,certified juvenile offenders in methods that protect public safety; maintaining institutional safety in a cost-,certified juvenile offenders in methods that protect public safety; maintaining institutional safety in a cost-,certified juvenile offenders in methods that protect public safety; maintaining institutional safety in a cost-
effective manner that meets statutory and constitutional standards; providing services and programs for,effective manner that meets statutory and constitutional standards; providing services and programs for,effective manner that meets statutory and constitutional standards; providing services and programs for,effective manner that meets statutory and constitutional standards; providing services and programs for,effective manner that meets statutory and constitutional standards; providing services and programs for,effective manner that meets statutory and constitutional standards; providing services and programs for,effective manner that meets statutory and constitutional standards; providing services and programs for,effective manner that meets statutory and constitutional standards; providing services and programs for,effective manner that meets statutory and constitutional standards; providing services and programs for,effective manner that meets statutory and constitutional standards; providing services and programs for,effective manner that meets statutory and constitutional standards; providing services and programs for,effective manner that meets statutory and constitutional standards; providing services and programs for,effective manner that meets statutory and constitutional standards; providing services and programs for,effective manner that meets statutory and constitutional standards; providing services and programs for
inmates seeking assistance with the intent to reduce recidivism; providing a safe and secure environment,inmates seeking assistance with the intent to reduce recidivism; providing a safe and secure environment,inmates seeking assistance with the intent to reduce recidivism; providing a safe and secure environment,inmates seeking assistance with the intent to reduce recidivism; providing a safe and secure environment,inmates seeking assistance with the intent to reduce recidivism; providing a safe and secure environment,inmates seeking assistance with the intent to reduce recidivism; providing a safe and secure environment,inmates seeking assistance with the intent to reduce recidivism; providing a safe and secure environment,inmates seeking assistance with the intent to reduce recidivism; providing a safe and secure environment,inmates seeking assistance with the intent to reduce recidivism; providing a safe and secure environment,inmates seeking assistance with the intent to reduce recidivism; providing a safe and secure environment,inmates seeking assistance with the intent to reduce recidivism; providing a safe and secure environment,inmates seeking assistance with the intent to reduce recidivism; providing a safe and secure environment,inmates seeking assistance with the intent to reduce recidivism; providing a safe and secure environment,inmates seeking assistance with the intent to reduce recidivism; providing a safe and secure environment
"for the Juvenile Courts, Circuit Courts and the District Courts of the City of Norfolk; ensuring that order and","for the Juvenile Courts, Circuit Courts and the District Courts of the City of Norfolk; ensuring that order and","for the Juvenile Courts, Circuit Courts and the District Courts of the City of Norfolk; ensuring that order and","for the Juvenile Courts, Circuit Courts and the District Courts of the City of Norfolk; ensuring that order and","for the Juvenile Courts, Circuit Courts and the District Courts of the City of Norfolk; ensuring that order and","for the Juvenile Courts, Circuit Courts and the District Courts of the City of Norfolk; ensuring that order and","for the Juvenile Courts, Circuit Courts and the District Courts of the City of Norfolk; ensuring that order and","for the Juvenile Courts, Circuit Courts and the District Courts of the City of Norfolk; ensuring that order and","for the Juvenile Courts, Circuit Courts and the District Courts of the City of Norfolk; ensuring that order and","for the Juvenile Courts, Circuit Courts and the District Courts of the City of Norfolk; ensuring that order and","for the Juvenile Courts, Circuit Courts and the District Courts of the City of Norfolk; ensuring that order and","for the Juvenile Courts, Circuit Courts and the District Courts of the City of Norfolk; ensuring that order and","for the Juvenile Courts, Circuit Courts and the District Courts of the City of Norfolk; ensuring that order and","for the Juvenile Courts, Circuit Courts and the District Courts of the City of Norfolk; ensuring that order and"
decorum are maintained during all court proceedings; and providing for the timely service of all process,decorum are maintained during all court proceedings; and providing for the timely service of all process,decorum are maintained during all court proceedings; and providing for the timely service of all process,decorum are maintained during all court proceedings; and providing for the timely service of all process,decorum are maintained during all court proceedings; and providing for the timely service of all process,decorum are maintained during all court proceedings; and providing for the timely service of all process,decorum are maintained during all court proceedings; and providing for the timely service of all process,decorum are maintained during all court proceedings; and providing for the timely service of all process,decorum are maintained during all court proceedings; and providing for the timely service of all process,decorum are maintained during all court proceedings; and providing for the timely service of all process,decorum are maintained during all court proceedings; and providing for the timely service of all process,decorum are maintained during all court proceedings; and providing for the timely service of all process,decorum are maintained during all court proceedings; and providing for the timely service of all process,decorum are maintained during all court proceedings; and providing for the timely service of all process
and criminal warrants received by the Norfolk Sheriff's office.,and criminal warrants received by the Norfolk Sheriff's office.,and criminal warrants received by the Norfolk Sheriff's office.,and criminal warrants received by the Norfolk Sheriff's office.,and criminal warrants received by the Norfolk Sheriff's office.,and criminal warrants received by the Norfolk Sheriff's office.,and criminal warrants received by the Norfolk Sheriff's office.,,,,,,,
D EPARTMENT OVERVIEW,D EPARTMENT OVERVIEW,D EPARTMENT OVERVIEW,D EPARTMENT OVERVIEW,D EPARTMENT OVERVIEW,,,,,,,,,
The Norfolk Sheriff's office is required by the State Constitution to operate in three capacities: maintain a,The Norfolk Sheriff's office is required by the State Constitution to operate in three capacities: maintain a,The Norfolk Sheriff's office is required by the State Constitution to operate in three capacities: maintain a,The Norfolk Sheriff's office is required by the State Constitution to operate in three capacities: maintain a,The Norfolk Sheriff's office is required by the State Constitution to operate in three capacities: maintain a,The Norfolk Sheriff's office is required by the State Constitution to operate in three capacities: maintain a,The Norfolk Sheriff's office is required by the State Constitution to operate in three capacities: maintain a,The Norfolk Sheriff's office is required by the State Constitution to operate in three capacities: maintain a,The Norfolk Sheriff's office is required by the State Constitution to operate in three capacities: maintain a,The Norfolk Sheriff's office is required by the State Constitution to operate in three capacities: maintain a,The Norfolk Sheriff's office is required by the State Constitution to operate in three capacities: maintain a,The Norfolk Sheriff's office is required by the State Constitution to operate in three capacities: maintain a,The Norfolk Sheriff's office is required by the State Constitution to operate in three capacities: maintain a,The Norfolk Sheriff's office is required by the State Constitution to operate in three capacities: maintain a
"safe and secure jail facility; ensure public safety in the Norfolk court system; and, execute various types of","safe and secure jail facility; ensure public safety in the Norfolk court system; and, execute various types of","safe and secure jail facility; ensure public safety in the Norfolk court system; and, execute various types of","safe and secure jail facility; ensure public safety in the Norfolk court system; and, execute various types of","safe and secure jail facility; ensure public safety in the Norfolk court system; and, execute various types of","safe and secure jail facility; ensure public safety in the Norfolk court system; and, execute various types of","safe and secure jail facility; ensure public safety in the Norfolk court system; and, execute various types of","safe and secure jail facility; ensure public safety in the Norfolk court system; and, execute various types of","safe and secure jail facility; ensure public safety in the Norfolk court system; and, execute various types of","safe and secure jail facility; ensure public safety in the Norfolk court system; and, execute various types of","safe and secure jail facility; ensure public safety in the Norfolk court system; and, execute various types of","safe and secure jail facility; ensure public safety in the Norfolk court system; and, execute various types of","safe and secure jail facility; ensure public safety in the Norfolk court system; and, execute various types of","safe and secure jail facility; ensure public safety in the Norfolk court system; and, execute various types of"
"civil processes. In addition, the Norfolk Sheriff's office provides services and programs to incarcerated","civil processes. In addition, the Norfolk Sheriff's office provides services and programs to incarcerated","civil processes. In addition, the Norfolk Sheriff's office provides services and programs to incarcerated","civil processes. In addition, the Norfolk Sheriff's office provides services and programs to incarcerated","civil processes. In addition, the Norfolk Sheriff's office provides services and programs to incarcerated","civil processes. In addition, the Norfolk Sheriff's office provides services and programs to incarcerated","civil processes. In addition, the Norfolk Sheriff's office provides services and programs to incarcerated","civil processes. In addition, the Norfolk Sheriff's office provides services and programs to incarcerated","civil processes. In addition, the Norfolk Sheriff's office provides services and programs to incarcerated","civil processes. In addition, the Norfolk Sheriff's office provides services and programs to incarcerated","civil processes. In addition, the Norfolk Sheriff's office provides services and programs to incarcerated","civil processes. In addition, the Norfolk Sheriff's office provides services and programs to incarcerated","civil processes. In addition, the Norfolk Sheriff's office provides services and programs to incarcerated","civil processes. In addition, the Norfolk Sheriff's office provides services and programs to incarcerated"
offenders with the intention to reduce recidivism. The Norfolk Sheriff's office also provides City residents,offenders with the intention to reduce recidivism. The Norfolk Sheriff's office also provides City residents,offenders with the intention to reduce recidivism. The Norfolk Sheriff's office also provides City residents,offenders with the intention to reduce recidivism. The Norfolk Sheriff's office also provides City residents,offenders with the intention to reduce recidivism. The Norfolk Sheriff's office also provides City residents,offenders with the intention to reduce recidivism. The Norfolk Sheriff's office also provides City residents,offenders with the intention to reduce recidivism. The Norfolk Sheriff's office also provides City residents,offenders with the intention to reduce recidivism. The Norfolk Sheriff's office also provides City residents,offenders with the intention to reduce recidivism. The Norfolk Sheriff's office also provides City residents,offenders with the intention to reduce recidivism. The Norfolk Sheriff's office also provides City residents,offenders with the intention to reduce recidivism. The Norfolk Sheriff's office also provides City residents,offenders with the intention to reduce recidivism. The Norfolk Sheriff's office also provides City residents,offenders with the intention to reduce recidivism. The Norfolk Sheriff's office also provides City residents,offenders with the intention to reduce recidivism. The Norfolk Sheriff's office also provides City residents
with community and crime prevention programs.,with community and crime prevention programs.,with community and crime prevention programs.,with community and crime prevention programs.,with community and crime prevention programs.,with community and crime prevention programs.,,,,,,,,
Civil Process and Court Security: The purpose of service of civil process is to provide a timely notice to a,Civil Process and Court Security: The purpose of service of civil process is to provide a timely notice to a,Civil Process and Court Security: The purpose of service of civil process is to provide a timely notice to a,Civil Process and Court Security: The purpose of service of civil process is to provide a timely notice to a,Civil Process and Court Security: The purpose of service of civil process is to provide a timely notice to a,Civil Process and Court Security: The purpose of service of civil process is to provide a timely notice to a,Civil Process and Court Security: The purpose of service of civil process is to provide a timely notice to a,Civil Process and Court Security: The purpose of service of civil process is to provide a timely notice to a,Civil Process and Court Security: The purpose of service of civil process is to provide a timely notice to a,Civil Process and Court Security: The purpose of service of civil process is to provide a timely notice to a,Civil Process and Court Security: The purpose of service of civil process is to provide a timely notice to a,Civil Process and Court Security: The purpose of service of civil process is to provide a timely notice to a,Civil Process and Court Security: The purpose of service of civil process is to provide a timely notice to a,Civil Process and Court Security: The purpose of service of civil process is to provide a timely notice to a
"person or legal entity of pending legal action in which they somehow may be involved, including civil","person or legal entity of pending legal action in which they somehow may be involved, including civil","person or legal entity of pending legal action in which they somehow may be involved, including civil","person or legal entity of pending legal action in which they somehow may be involved, including civil","person or legal entity of pending legal action in which they somehow may be involved, including civil","person or legal entity of pending legal action in which they somehow may be involved, including civil","person or legal entity of pending legal action in which they somehow may be involved, including civil","person or legal entity of pending legal action in which they somehow may be involved, including civil","person or legal entity of pending legal action in which they somehow may be involved, including civil","person or legal entity of pending legal action in which they somehow may be involved, including civil","person or legal entity of pending legal action in which they somehow may be involved, including civil","person or legal entity of pending legal action in which they somehow may be involved, including civil","person or legal entity of pending legal action in which they somehow may be involved, including civil","person or legal entity of pending legal action in which they somehow may be involved, including civil"
"subpoenas and warrants, writs, and eviction notices.","subpoenas and warrants, writs, and eviction notices.","subpoenas and warrants, writs, and eviction notices.","subpoenas and warrants, writs, and eviction notices.","subpoenas and warrants, writs, and eviction notices.","subpoenas and warrants, writs, and eviction notices.","subpoenas and warrants, writs, and eviction notices.",,,,,,,
Community Corrections: The Inmate Work Force and Work Release Programs provide an opportunity for,Community Corrections: The Inmate Work Force and Work Release Programs provide an opportunity for,Community Corrections: The Inmate Work Force and Work Release Programs provide an opportunity for,Community Corrections: The Inmate Work Force and Work Release Programs provide an opportunity for,Community Corrections: The Inmate Work Force and Work Release Programs provide an opportunity for,Community Corrections: The Inmate Work Force and Work Release Programs provide an opportunity for,Community Corrections: The Inmate Work Force and Work Release Programs provide an opportunity for,Community Corrections: The Inmate Work Force and Work Release Programs provide an opportunity for,Community Corrections: The Inmate Work Force and Work Release Programs provide an opportunity for,Community Corrections: The Inmate Work Force and Work Release Programs provide an opportunity for,Community Corrections: The Inmate Work Force and Work Release Programs provide an opportunity for,Community Corrections: The Inmate Work Force and Work Release Programs provide an opportunity for,Community Corrections: The Inmate Work Force and Work Release Programs provide an opportunity for,Community Corrections: The Inmate Work Force and Work Release Programs provide an opportunity for
"qualified inmates to receive credit for fines and court costs, receive job training, earn early release credit,","qualified inmates to receive credit for fines and court costs, receive job training, earn early release credit,","qualified inmates to receive credit for fines and court costs, receive job training, earn early release credit,","qualified inmates to receive credit for fines and court costs, receive job training, earn early release credit,","qualified inmates to receive credit for fines and court costs, receive job training, earn early release credit,","qualified inmates to receive credit for fines and court costs, receive job training, earn early release credit,","qualified inmates to receive credit for fines and court costs, receive job training, earn early release credit,","qualified inmates to receive credit for fines and court costs, receive job training, earn early release credit,","qualified inmates to receive credit for fines and court costs, receive job training, earn early release credit,","qualified inmates to receive credit for fines and court costs, receive job training, earn early release credit,","qualified inmates to receive credit for fines and court costs, receive job training, earn early release credit,","qualified inmates to receive credit for fines and court costs, receive job training, earn early release credit,","qualified inmates to receive credit for fines and court costs, receive job training, earn early release credit,","qualified inmates to receive credit for fines and court costs, receive job training, earn early release credit,"
secure paid employment and be considered for home electronic monitoring.,secure paid employment and be considered for home electronic monitoring.,secure paid employment and be considered for home electronic monitoring.,secure paid employment and be considered for home electronic monitoring.,secure paid employment and be considered for home electronic monitoring.,secure paid employment and be considered for home electronic monitoring.,secure paid employment and be considered for home electronic monitoring.,secure paid employment and be considered for home electronic monitoring.,secure paid employment and be considered for home electronic monitoring.,secure paid employment and be considered for home electronic monitoring.,These programs also help,These programs also help,These programs also help,These programs also help
reduce jail overcrowding and introduce a work ethic to young inmates.,reduce jail overcrowding and introduce a work ethic to young inmates.,reduce jail overcrowding and introduce a work ethic to young inmates.,reduce jail overcrowding and introduce a work ethic to young inmates.,reduce jail overcrowding and introduce a work ethic to young inmates.,reduce jail overcrowding and introduce a work ethic to young inmates.,reduce jail overcrowding and introduce a work ethic to young inmates.,reduce jail overcrowding and introduce a work ethic to young inmates.,reduce jail overcrowding and introduce a work ethic to young inmates.,The Weekender Work program,The Weekender Work program,The Weekender Work program,The Weekender Work program,The Weekender Work program
allows,inmates,to,provide,community,service,during,weekend,days,as,an,alternative,to,serving
"consecutive days in jail, allowing them to maintain gainful employment.","consecutive days in jail, allowing them to maintain gainful employment.","consecutive days in jail, allowing them to maintain gainful employment.","consecutive days in jail, allowing them to maintain gainful employment.","consecutive days in jail, allowing them to maintain gainful employment.","consecutive days in jail, allowing them to maintain gainful employment.","consecutive days in jail, allowing them to maintain gainful employment.","consecutive days in jail, allowing them to maintain gainful employment.","consecutive days in jail, allowing them to maintain gainful employment.",,,,,
