Name: “Table 1 of 1 on page 114 of 171”,Name: “Table 1 of 1 on page 114 of 171”,Name: “Table 1 of 1 on page 114 of 171”,Name: “Table 1 of 1 on page 114 of 171”,Name: “Table 1 of 1 on page 114 of 171”,Name: “Table 1 of 1 on page 114 of 171”,Name: “Table 1 of 1 on page 114 of 171”,Name: “Table 1 of 1 on page 114 of 171”,Name: “Table 1 of 1 on page 114 of 171”,Name: “Table 1 of 1 on page 114 of 171”,Name: “Table 1 of 1 on page 114 of 171”,Name: “Table 1 of 1 on page 114 of 171”,Name: “Table 1 of 1 on page 114 of 171”,Name: “Table 1 of 1 on page 114 of 171”
Table: 114,Table: 114,Table: 114,Table: 114,Table: 114,Table: 114,Table: 114,Table: 114,Table: 114,Table: 114,Table: 114,Table: 114,Table: 114,Table: 114
,,,,,,,,,,,,,
,,,,,,,,,,,,,
,,,,Capital Improvement Program FY2014,Capital Improvement Program FY2014,Capital Improvement Program FY2014,Capital Improvement Program FY2014,Capital Improvement Program FY2014,Capital Improvement Program FY2014,– FY2018,– FY2018,,
STRATEGIC PLAN.,STRATEGIC PLAN.,STRATEGIC PLAN.,STRATEGIC PLAN.,Each year County departments and agencies review and revise the Strategic Plan,Each year County departments and agencies review and revise the Strategic Plan,Each year County departments and agencies review and revise the Strategic Plan,Each year County departments and agencies review and revise the Strategic Plan,Each year County departments and agencies review and revise the Strategic Plan,Each year County departments and agencies review and revise the Strategic Plan,Each year County departments and agencies review and revise the Strategic Plan,Each year County departments and agencies review and revise the Strategic Plan,Each year County departments and agencies review and revise the Strategic Plan,Each year County departments and agencies review and revise the Strategic Plan
"that inspire their annual goals, objectives, and work program initiatives for the coming year.","that inspire their annual goals, objectives, and work program initiatives for the coming year.","that inspire their annual goals, objectives, and work program initiatives for the coming year.","that inspire their annual goals, objectives, and work program initiatives for the coming year.","that inspire their annual goals, objectives, and work program initiatives for the coming year.","that inspire their annual goals, objectives, and work program initiatives for the coming year.","that inspire their annual goals, objectives, and work program initiatives for the coming year.","that inspire their annual goals, objectives, and work program initiatives for the coming year.","that inspire their annual goals, objectives, and work program initiatives for the coming year.","that inspire their annual goals, objectives, and work program initiatives for the coming year.","that inspire their annual goals, objectives, and work program initiatives for the coming year.","that inspire their annual goals, objectives, and work program initiatives for the coming year.",Most of the,Most of the
"budget impacts of an adopted Strategic Plan are in the Operating Budget, but a few items may end up in","budget impacts of an adopted Strategic Plan are in the Operating Budget, but a few items may end up in","budget impacts of an adopted Strategic Plan are in the Operating Budget, but a few items may end up in","budget impacts of an adopted Strategic Plan are in the Operating Budget, but a few items may end up in","budget impacts of an adopted Strategic Plan are in the Operating Budget, but a few items may end up in","budget impacts of an adopted Strategic Plan are in the Operating Budget, but a few items may end up in","budget impacts of an adopted Strategic Plan are in the Operating Budget, but a few items may end up in","budget impacts of an adopted Strategic Plan are in the Operating Budget, but a few items may end up in","budget impacts of an adopted Strategic Plan are in the Operating Budget, but a few items may end up in","budget impacts of an adopted Strategic Plan are in the Operating Budget, but a few items may end up in","budget impacts of an adopted Strategic Plan are in the Operating Budget, but a few items may end up in","budget impacts of an adopted Strategic Plan are in the Operating Budget, but a few items may end up in","budget impacts of an adopted Strategic Plan are in the Operating Budget, but a few items may end up in","budget impacts of an adopted Strategic Plan are in the Operating Budget, but a few items may end up in"
the CIP.,,,,,,,,,,,,,
PROJECT COSTS.,PROJECT COSTS.,PROJECT COSTS.,PROJECT COSTS.,The projected costs of each capital project are sometimes the result of detailed,The projected costs of each capital project are sometimes the result of detailed,The projected costs of each capital project are sometimes the result of detailed,The projected costs of each capital project are sometimes the result of detailed,The projected costs of each capital project are sometimes the result of detailed,The projected costs of each capital project are sometimes the result of detailed,The projected costs of each capital project are sometimes the result of detailed,The projected costs of each capital project are sometimes the result of detailed,The projected costs of each capital project are sometimes the result of detailed,The projected costs of each capital project are sometimes the result of detailed
engineering studies and sometimes simply educated guesses. The project costs to be funded in the CIP,engineering studies and sometimes simply educated guesses. The project costs to be funded in the CIP,engineering studies and sometimes simply educated guesses. The project costs to be funded in the CIP,engineering studies and sometimes simply educated guesses. The project costs to be funded in the CIP,engineering studies and sometimes simply educated guesses. The project costs to be funded in the CIP,engineering studies and sometimes simply educated guesses. The project costs to be funded in the CIP,engineering studies and sometimes simply educated guesses. The project costs to be funded in the CIP,engineering studies and sometimes simply educated guesses. The project costs to be funded in the CIP,engineering studies and sometimes simply educated guesses. The project costs to be funded in the CIP,engineering studies and sometimes simply educated guesses. The project costs to be funded in the CIP,engineering studies and sometimes simply educated guesses. The project costs to be funded in the CIP,engineering studies and sometimes simply educated guesses. The project costs to be funded in the CIP,engineering studies and sometimes simply educated guesses. The project costs to be funded in the CIP,engineering studies and sometimes simply educated guesses. The project costs to be funded in the CIP
"should include all costs relating to design, acquisition, construction, project management, equipment,","should include all costs relating to design, acquisition, construction, project management, equipment,","should include all costs relating to design, acquisition, construction, project management, equipment,","should include all costs relating to design, acquisition, construction, project management, equipment,","should include all costs relating to design, acquisition, construction, project management, equipment,","should include all costs relating to design, acquisition, construction, project management, equipment,","should include all costs relating to design, acquisition, construction, project management, equipment,","should include all costs relating to design, acquisition, construction, project management, equipment,","should include all costs relating to design, acquisition, construction, project management, equipment,","should include all costs relating to design, acquisition, construction, project management, equipment,","should include all costs relating to design, acquisition, construction, project management, equipment,","should include all costs relating to design, acquisition, construction, project management, equipment,","should include all costs relating to design, acquisition, construction, project management, equipment,","should include all costs relating to design, acquisition, construction, project management, equipment,"
"legal expenses, mitigation of damages, title costs and other land related costs, etc., when such information","legal expenses, mitigation of damages, title costs and other land related costs, etc., when such information","legal expenses, mitigation of damages, title costs and other land related costs, etc., when such information","legal expenses, mitigation of damages, title costs and other land related costs, etc., when such information","legal expenses, mitigation of damages, title costs and other land related costs, etc., when such information","legal expenses, mitigation of damages, title costs and other land related costs, etc., when such information","legal expenses, mitigation of damages, title costs and other land related costs, etc., when such information","legal expenses, mitigation of damages, title costs and other land related costs, etc., when such information","legal expenses, mitigation of damages, title costs and other land related costs, etc., when such information","legal expenses, mitigation of damages, title costs and other land related costs, etc., when such information","legal expenses, mitigation of damages, title costs and other land related costs, etc., when such information","legal expenses, mitigation of damages, title costs and other land related costs, etc., when such information","legal expenses, mitigation of damages, title costs and other land related costs, etc., when such information","legal expenses, mitigation of damages, title costs and other land related costs, etc., when such information"
is available. Each year the CIP may be adjusted as the complete project costs become more firmly known.,is available. Each year the CIP may be adjusted as the complete project costs become more firmly known.,is available. Each year the CIP may be adjusted as the complete project costs become more firmly known.,is available. Each year the CIP may be adjusted as the complete project costs become more firmly known.,is available. Each year the CIP may be adjusted as the complete project costs become more firmly known.,is available. Each year the CIP may be adjusted as the complete project costs become more firmly known.,is available. Each year the CIP may be adjusted as the complete project costs become more firmly known.,is available. Each year the CIP may be adjusted as the complete project costs become more firmly known.,is available. Each year the CIP may be adjusted as the complete project costs become more firmly known.,is available. Each year the CIP may be adjusted as the complete project costs become more firmly known.,is available. Each year the CIP may be adjusted as the complete project costs become more firmly known.,is available. Each year the CIP may be adjusted as the complete project costs become more firmly known.,is available. Each year the CIP may be adjusted as the complete project costs become more firmly known.,is available. Each year the CIP may be adjusted as the complete project costs become more firmly known.
FUNDING DECISIONS.,FUNDING DECISIONS.,FUNDING DECISIONS.,FUNDING DECISIONS.,FUNDING DECISIONS.,Funding recommendations by staff to the Board are made based on a variety,Funding recommendations by staff to the Board are made based on a variety,Funding recommendations by staff to the Board are made based on a variety,Funding recommendations by staff to the Board are made based on a variety,Funding recommendations by staff to the Board are made based on a variety,Funding recommendations by staff to the Board are made based on a variety,Funding recommendations by staff to the Board are made based on a variety,Funding recommendations by staff to the Board are made based on a variety,Funding recommendations by staff to the Board are made based on a variety
of information.,of information.,"The total amount of money available, the level of developer contributions or other private","The total amount of money available, the level of developer contributions or other private","The total amount of money available, the level of developer contributions or other private","The total amount of money available, the level of developer contributions or other private","The total amount of money available, the level of developer contributions or other private","The total amount of money available, the level of developer contributions or other private","The total amount of money available, the level of developer contributions or other private","The total amount of money available, the level of developer contributions or other private","The total amount of money available, the level of developer contributions or other private","The total amount of money available, the level of developer contributions or other private","The total amount of money available, the level of developer contributions or other private","The total amount of money available, the level of developer contributions or other private"
"funding sources, the availability of grants or Federal and State funds, and the availability of previously","funding sources, the availability of grants or Federal and State funds, and the availability of previously","funding sources, the availability of grants or Federal and State funds, and the availability of previously","funding sources, the availability of grants or Federal and State funds, and the availability of previously","funding sources, the availability of grants or Federal and State funds, and the availability of previously","funding sources, the availability of grants or Federal and State funds, and the availability of previously","funding sources, the availability of grants or Federal and State funds, and the availability of previously","funding sources, the availability of grants or Federal and State funds, and the availability of previously","funding sources, the availability of grants or Federal and State funds, and the availability of previously","funding sources, the availability of grants or Federal and State funds, and the availability of previously","funding sources, the availability of grants or Federal and State funds, and the availability of previously","funding sources, the availability of grants or Federal and State funds, and the availability of previously","funding sources, the availability of grants or Federal and State funds, and the availability of previously","funding sources, the availability of grants or Federal and State funds, and the availability of previously"
appropriated and unobligated funds are all factors that are considered in recommending a funding level.,appropriated and unobligated funds are all factors that are considered in recommending a funding level.,appropriated and unobligated funds are all factors that are considered in recommending a funding level.,appropriated and unobligated funds are all factors that are considered in recommending a funding level.,appropriated and unobligated funds are all factors that are considered in recommending a funding level.,appropriated and unobligated funds are all factors that are considered in recommending a funding level.,appropriated and unobligated funds are all factors that are considered in recommending a funding level.,appropriated and unobligated funds are all factors that are considered in recommending a funding level.,appropriated and unobligated funds are all factors that are considered in recommending a funding level.,appropriated and unobligated funds are all factors that are considered in recommending a funding level.,appropriated and unobligated funds are all factors that are considered in recommending a funding level.,appropriated and unobligated funds are all factors that are considered in recommending a funding level.,appropriated and unobligated funds are all factors that are considered in recommending a funding level.,appropriated and unobligated funds are all factors that are considered in recommending a funding level.
"Consistency with either the Strategic Management and Comprehensive Plans, as well as the Planning","Consistency with either the Strategic Management and Comprehensive Plans, as well as the Planning","Consistency with either the Strategic Management and Comprehensive Plans, as well as the Planning","Consistency with either the Strategic Management and Comprehensive Plans, as well as the Planning","Consistency with either the Strategic Management and Comprehensive Plans, as well as the Planning","Consistency with either the Strategic Management and Comprehensive Plans, as well as the Planning","Consistency with either the Strategic Management and Comprehensive Plans, as well as the Planning","Consistency with either the Strategic Management and Comprehensive Plans, as well as the Planning","Consistency with either the Strategic Management and Comprehensive Plans, as well as the Planning","Consistency with either the Strategic Management and Comprehensive Plans, as well as the Planning","Consistency with either the Strategic Management and Comprehensive Plans, as well as the Planning","Consistency with either the Strategic Management and Comprehensive Plans, as well as the Planning","Consistency with either the Strategic Management and Comprehensive Plans, as well as the Planning","Consistency with either the Strategic Management and Comprehensive Plans, as well as the Planning"
"Commission's priorities, are also considered in the funding recommendation.","Commission's priorities, are also considered in the funding recommendation.","Commission's priorities, are also considered in the funding recommendation.","Commission's priorities, are also considered in the funding recommendation.","Commission's priorities, are also considered in the funding recommendation.","Commission's priorities, are also considered in the funding recommendation.","Commission's priorities, are also considered in the funding recommendation.","Commission's priorities, are also considered in the funding recommendation.","Commission's priorities, are also considered in the funding recommendation.","Commission's priorities, are also considered in the funding recommendation.","Commission's priorities, are also considered in the funding recommendation.",,,
DEBT FINANCING.,DEBT FINANCING.,DEBT FINANCING.,DEBT FINANCING.,Debt financing is an option that the Board of Supervisors may also consider as a,Debt financing is an option that the Board of Supervisors may also consider as a,Debt financing is an option that the Board of Supervisors may also consider as a,Debt financing is an option that the Board of Supervisors may also consider as a,Debt financing is an option that the Board of Supervisors may also consider as a,Debt financing is an option that the Board of Supervisors may also consider as a,Debt financing is an option that the Board of Supervisors may also consider as a,Debt financing is an option that the Board of Supervisors may also consider as a,Debt financing is an option that the Board of Supervisors may also consider as a,Debt financing is an option that the Board of Supervisors may also consider as a
financing option.,financing option.,,There are essentially only two options for debt financing.,There are essentially only two options for debt financing.,There are essentially only two options for debt financing.,There are essentially only two options for debt financing.,There are essentially only two options for debt financing.,There are essentially only two options for debt financing.,There are essentially only two options for debt financing.,There are essentially only two options for debt financing.,The first is some form of,The first is some form of,The first is some form of
"owner financing or lease purchase, an installment sale, or any other financing instrument that must be","owner financing or lease purchase, an installment sale, or any other financing instrument that must be","owner financing or lease purchase, an installment sale, or any other financing instrument that must be","owner financing or lease purchase, an installment sale, or any other financing instrument that must be","owner financing or lease purchase, an installment sale, or any other financing instrument that must be","owner financing or lease purchase, an installment sale, or any other financing instrument that must be","owner financing or lease purchase, an installment sale, or any other financing instrument that must be","owner financing or lease purchase, an installment sale, or any other financing instrument that must be","owner financing or lease purchase, an installment sale, or any other financing instrument that must be","owner financing or lease purchase, an installment sale, or any other financing instrument that must be","owner financing or lease purchase, an installment sale, or any other financing instrument that must be","owner financing or lease purchase, an installment sale, or any other financing instrument that must be","owner financing or lease purchase, an installment sale, or any other financing instrument that must be","owner financing or lease purchase, an installment sale, or any other financing instrument that must be"
reviewed and funds appropriated each year.,reviewed and funds appropriated each year.,reviewed and funds appropriated each year.,reviewed and funds appropriated each year.,reviewed and funds appropriated each year.,reviewed and funds appropriated each year.,reviewed and funds appropriated each year.,The second type of debt financing is known as general,The second type of debt financing is known as general,The second type of debt financing is known as general,The second type of debt financing is known as general,The second type of debt financing is known as general,The second type of debt financing is known as general,The second type of debt financing is known as general
"obligation financing, where future Boards of Supervisors are required to set the tax rates at a level to pay","obligation financing, where future Boards of Supervisors are required to set the tax rates at a level to pay","obligation financing, where future Boards of Supervisors are required to set the tax rates at a level to pay","obligation financing, where future Boards of Supervisors are required to set the tax rates at a level to pay","obligation financing, where future Boards of Supervisors are required to set the tax rates at a level to pay","obligation financing, where future Boards of Supervisors are required to set the tax rates at a level to pay","obligation financing, where future Boards of Supervisors are required to set the tax rates at a level to pay","obligation financing, where future Boards of Supervisors are required to set the tax rates at a level to pay","obligation financing, where future Boards of Supervisors are required to set the tax rates at a level to pay","obligation financing, where future Boards of Supervisors are required to set the tax rates at a level to pay","obligation financing, where future Boards of Supervisors are required to set the tax rates at a level to pay","obligation financing, where future Boards of Supervisors are required to set the tax rates at a level to pay","obligation financing, where future Boards of Supervisors are required to set the tax rates at a level to pay","obligation financing, where future Boards of Supervisors are required to set the tax rates at a level to pay"
off the debt.,off the debt.,"Except for specific exceptions, such as schools, general obligation debt can only be issued","Except for specific exceptions, such as schools, general obligation debt can only be issued","Except for specific exceptions, such as schools, general obligation debt can only be issued","Except for specific exceptions, such as schools, general obligation debt can only be issued","Except for specific exceptions, such as schools, general obligation debt can only be issued","Except for specific exceptions, such as schools, general obligation debt can only be issued","Except for specific exceptions, such as schools, general obligation debt can only be issued","Except for specific exceptions, such as schools, general obligation debt can only be issued","Except for specific exceptions, such as schools, general obligation debt can only be issued","Except for specific exceptions, such as schools, general obligation debt can only be issued","Except for specific exceptions, such as schools, general obligation debt can only be issued","Except for specific exceptions, such as schools, general obligation debt can only be issued"
after a successful voter referendum authorizes the borrowing.,after a successful voter referendum authorizes the borrowing.,after a successful voter referendum authorizes the borrowing.,after a successful voter referendum authorizes the borrowing.,after a successful voter referendum authorizes the borrowing.,after a successful voter referendum authorizes the borrowing.,after a successful voter referendum authorizes the borrowing.,after a successful voter referendum authorizes the borrowing.,after a successful voter referendum authorizes the borrowing.,after a successful voter referendum authorizes the borrowing.,Debt financing payments are then paid,Debt financing payments are then paid,Debt financing payments are then paid,Debt financing payments are then paid
