mostly from General Fund contributions.,mostly from General Fund contributions.,mostly from General Fund contributions.,mostly from General Fund contributions.,mostly from General Fund contributions.,mostly from General Fund contributions.,mostly from General Fund contributions.,Past trends have been to “stair step” increasing contributions,Past trends have been to “stair step” increasing contributions,Past trends have been to “stair step” increasing contributions,Past trends have been to “stair step” increasing contributions,Past trends have been to “stair step” increasing contributions,Past trends have been to “stair step” increasing contributions,Past trends have been to “stair step” increasing contributions
from the operating budget.,from the operating budget.,from the operating budget.,from the operating budget.,from the operating budget.,The change from annual reassessments to reassessments every other year puts,The change from annual reassessments to reassessments every other year puts,The change from annual reassessments to reassessments every other year puts,The change from annual reassessments to reassessments every other year puts,The change from annual reassessments to reassessments every other year puts,The change from annual reassessments to reassessments every other year puts,The change from annual reassessments to reassessments every other year puts,The change from annual reassessments to reassessments every other year puts,The change from annual reassessments to reassessments every other year puts
most of the funding pressure on the first year of the two-year budget process.,most of the funding pressure on the first year of the two-year budget process.,most of the funding pressure on the first year of the two-year budget process.,most of the funding pressure on the first year of the two-year budget process.,most of the funding pressure on the first year of the two-year budget process.,most of the funding pressure on the first year of the two-year budget process.,most of the funding pressure on the first year of the two-year budget process.,most of the funding pressure on the first year of the two-year budget process.,most of the funding pressure on the first year of the two-year budget process.,most of the funding pressure on the first year of the two-year budget process.,most of the funding pressure on the first year of the two-year budget process.,For a further discussion of,For a further discussion of,For a further discussion of
"debt financing, please see page F-11.","debt financing, please see page F-11.","debt financing, please see page F-11.","debt financing, please see page F-11.","debt financing, please see page F-11.","debt financing, please see page F-11.","debt financing, please see page F-11.",,,,,,,
SEPARATE,SEPARATE,CAPITAL,CAPITAL,CAPITAL,IMPROVEMENT,IMPROVEMENT,IMPROVEMENT,PROGRAMS.,PROGRAMS.,Some,agencies,and/or,regional
organizations adopt their own Capital Improvement Programs.,organizations adopt their own Capital Improvement Programs.,organizations adopt their own Capital Improvement Programs.,organizations adopt their own Capital Improvement Programs.,organizations adopt their own Capital Improvement Programs.,organizations adopt their own Capital Improvement Programs.,organizations adopt their own Capital Improvement Programs.,organizations adopt their own Capital Improvement Programs.,organizations adopt their own Capital Improvement Programs.,organizations adopt their own Capital Improvement Programs.,These include the Virginia Peninsula,These include the Virginia Peninsula,These include the Virginia Peninsula,These include the Virginia Peninsula
"Regional Jail, the Middle Peninsula Juvenile Detention Commission, the Community Action Agency, the","Regional Jail, the Middle Peninsula Juvenile Detention Commission, the Community Action Agency, the","Regional Jail, the Middle Peninsula Juvenile Detention Commission, the Community Action Agency, the","Regional Jail, the Middle Peninsula Juvenile Detention Commission, the Community Action Agency, the","Regional Jail, the Middle Peninsula Juvenile Detention Commission, the Community Action Agency, the","Regional Jail, the Middle Peninsula Juvenile Detention Commission, the Community Action Agency, the","Regional Jail, the Middle Peninsula Juvenile Detention Commission, the Community Action Agency, the","Regional Jail, the Middle Peninsula Juvenile Detention Commission, the Community Action Agency, the","Regional Jail, the Middle Peninsula Juvenile Detention Commission, the Community Action Agency, the","Regional Jail, the Middle Peninsula Juvenile Detention Commission, the Community Action Agency, the","Regional Jail, the Middle Peninsula Juvenile Detention Commission, the Community Action Agency, the","Regional Jail, the Middle Peninsula Juvenile Detention Commission, the Community Action Agency, the","Regional Jail, the Middle Peninsula Juvenile Detention Commission, the Community Action Agency, the","Regional Jail, the Middle Peninsula Juvenile Detention Commission, the Community Action Agency, the"
"Group Home Commission, and the James City Service Authority.","Group Home Commission, and the James City Service Authority.","Group Home Commission, and the James City Service Authority.","Group Home Commission, and the James City Service Authority.","Group Home Commission, and the James City Service Authority.","Group Home Commission, and the James City Service Authority.","Group Home Commission, and the James City Service Authority.","Group Home Commission, and the James City Service Authority.","Group Home Commission, and the James City Service Authority.","Group Home Commission, and the James City Service Authority.",The County's CIP includes items for,The County's CIP includes items for,The County's CIP includes items for,The County's CIP includes items for
regional,"groups, such as the Williamsburg Regional Library or the Williamsburg-James City County","groups, such as the Williamsburg Regional Library or the Williamsburg-James City County","groups, such as the Williamsburg Regional Library or the Williamsburg-James City County","groups, such as the Williamsburg Regional Library or the Williamsburg-James City County","groups, such as the Williamsburg Regional Library or the Williamsburg-James City County","groups, such as the Williamsburg Regional Library or the Williamsburg-James City County","groups, such as the Williamsburg Regional Library or the Williamsburg-James City County","groups, such as the Williamsburg Regional Library or the Williamsburg-James City County","groups, such as the Williamsburg Regional Library or the Williamsburg-James City County","groups, such as the Williamsburg Regional Library or the Williamsburg-James City County","groups, such as the Williamsburg Regional Library or the Williamsburg-James City County","groups, such as the Williamsburg Regional Library or the Williamsburg-James City County","groups, such as the Williamsburg Regional Library or the Williamsburg-James City County"
"Public Schools, where the County is the major funding source.","Public Schools, where the County is the major funding source.","Public Schools, where the County is the major funding source.","Public Schools, where the County is the major funding source.","Public Schools, where the County is the major funding source.","Public Schools, where the County is the major funding source.","Public Schools, where the County is the major funding source.","Public Schools, where the County is the major funding source.","Public Schools, where the County is the major funding source.","Public Schools, where the County is the major funding source.",,,,
SUMMARY.,SUMMARY.,The Capital Improvement Program represents the mutual efforts of County departments,The Capital Improvement Program represents the mutual efforts of County departments,The Capital Improvement Program represents the mutual efforts of County departments,The Capital Improvement Program represents the mutual efforts of County departments,The Capital Improvement Program represents the mutual efforts of County departments,The Capital Improvement Program represents the mutual efforts of County departments,The Capital Improvement Program represents the mutual efforts of County departments,The Capital Improvement Program represents the mutual efforts of County departments,The Capital Improvement Program represents the mutual efforts of County departments,The Capital Improvement Program represents the mutual efforts of County departments,The Capital Improvement Program represents the mutual efforts of County departments,The Capital Improvement Program represents the mutual efforts of County departments
"and agencies to meet the infrastructure needs of County residents, businesses, and visitors.","and agencies to meet the infrastructure needs of County residents, businesses, and visitors.","and agencies to meet the infrastructure needs of County residents, businesses, and visitors.","and agencies to meet the infrastructure needs of County residents, businesses, and visitors.","and agencies to meet the infrastructure needs of County residents, businesses, and visitors.","and agencies to meet the infrastructure needs of County residents, businesses, and visitors.","and agencies to meet the infrastructure needs of County residents, businesses, and visitors.","and agencies to meet the infrastructure needs of County residents, businesses, and visitors.","and agencies to meet the infrastructure needs of County residents, businesses, and visitors.","and agencies to meet the infrastructure needs of County residents, businesses, and visitors.","and agencies to meet the infrastructure needs of County residents, businesses, and visitors.","and agencies to meet the infrastructure needs of County residents, businesses, and visitors.",It usually,It usually
cannot fully fund all the Capital Budget requests and the projects are closely scrutinized and prioritized to,cannot fully fund all the Capital Budget requests and the projects are closely scrutinized and prioritized to,cannot fully fund all the Capital Budget requests and the projects are closely scrutinized and prioritized to,cannot fully fund all the Capital Budget requests and the projects are closely scrutinized and prioritized to,cannot fully fund all the Capital Budget requests and the projects are closely scrutinized and prioritized to,cannot fully fund all the Capital Budget requests and the projects are closely scrutinized and prioritized to,cannot fully fund all the Capital Budget requests and the projects are closely scrutinized and prioritized to,cannot fully fund all the Capital Budget requests and the projects are closely scrutinized and prioritized to,cannot fully fund all the Capital Budget requests and the projects are closely scrutinized and prioritized to,cannot fully fund all the Capital Budget requests and the projects are closely scrutinized and prioritized to,cannot fully fund all the Capital Budget requests and the projects are closely scrutinized and prioritized to,cannot fully fund all the Capital Budget requests and the projects are closely scrutinized and prioritized to,cannot fully fund all the Capital Budget requests and the projects are closely scrutinized and prioritized to,cannot fully fund all the Capital Budget requests and the projects are closely scrutinized and prioritized to
provide for the maximum benefit.,provide for the maximum benefit.,provide for the maximum benefit.,provide for the maximum benefit.,provide for the maximum benefit.,provide for the maximum benefit.,"Citizen input, the County's adopted Comprehensive and Strategic","Citizen input, the County's adopted Comprehensive and Strategic","Citizen input, the County's adopted Comprehensive and Strategic","Citizen input, the County's adopted Comprehensive and Strategic","Citizen input, the County's adopted Comprehensive and Strategic","Citizen input, the County's adopted Comprehensive and Strategic","Citizen input, the County's adopted Comprehensive and Strategic","Citizen input, the County's adopted Comprehensive and Strategic"
"Management Plans, the recommendations of the County's Planning Commission, and the total funding","Management Plans, the recommendations of the County's Planning Commission, and the total funding","Management Plans, the recommendations of the County's Planning Commission, and the total funding","Management Plans, the recommendations of the County's Planning Commission, and the total funding","Management Plans, the recommendations of the County's Planning Commission, and the total funding","Management Plans, the recommendations of the County's Planning Commission, and the total funding","Management Plans, the recommendations of the County's Planning Commission, and the total funding","Management Plans, the recommendations of the County's Planning Commission, and the total funding","Management Plans, the recommendations of the County's Planning Commission, and the total funding","Management Plans, the recommendations of the County's Planning Commission, and the total funding","Management Plans, the recommendations of the County's Planning Commission, and the total funding","Management Plans, the recommendations of the County's Planning Commission, and the total funding","Management Plans, the recommendations of the County's Planning Commission, and the total funding","Management Plans, the recommendations of the County's Planning Commission, and the total funding"
available,all,play,a,role,in,allocating,limited,resources.,The,FY2014-FY2018,Capital,Improvement,Improvement
Program is very lean compared to previous years as capital investments compete with ongoing operations,Program is very lean compared to previous years as capital investments compete with ongoing operations,Program is very lean compared to previous years as capital investments compete with ongoing operations,Program is very lean compared to previous years as capital investments compete with ongoing operations,Program is very lean compared to previous years as capital investments compete with ongoing operations,Program is very lean compared to previous years as capital investments compete with ongoing operations,Program is very lean compared to previous years as capital investments compete with ongoing operations,Program is very lean compared to previous years as capital investments compete with ongoing operations,Program is very lean compared to previous years as capital investments compete with ongoing operations,Program is very lean compared to previous years as capital investments compete with ongoing operations,Program is very lean compared to previous years as capital investments compete with ongoing operations,Program is very lean compared to previous years as capital investments compete with ongoing operations,Program is very lean compared to previous years as capital investments compete with ongoing operations,Program is very lean compared to previous years as capital investments compete with ongoing operations
for adequate funding.,for adequate funding.,for adequate funding.,for adequate funding.,,,,,,,,,,
,,,,,,,,Page D-2,,,,,
