Gloucester County by providing quality public utility service at reasonable costs while meeting and/or,Gloucester County by providing quality public utility service at reasonable costs while meeting and/or,Gloucester County by providing quality public utility service at reasonable costs while meeting and/or,Gloucester County by providing quality public utility service at reasonable costs while meeting and/or,Gloucester County by providing quality public utility service at reasonable costs while meeting and/or,Gloucester County by providing quality public utility service at reasonable costs while meeting and/or,Gloucester County by providing quality public utility service at reasonable costs while meeting and/or,Gloucester County by providing quality public utility service at reasonable costs while meeting and/or,Gloucester County by providing quality public utility service at reasonable costs while meeting and/or,Gloucester County by providing quality public utility service at reasonable costs while meeting and/or,Gloucester County by providing quality public utility service at reasonable costs while meeting and/or,Gloucester County by providing quality public utility service at reasonable costs while meeting and/or,Gloucester County by providing quality public utility service at reasonable costs while meeting and/or,Gloucester County by providing quality public utility service at reasonable costs while meeting and/or
"exceeding all federal, state, and local regulations with regard to water quality.","exceeding all federal, state, and local regulations with regard to water quality.","exceeding all federal, state, and local regulations with regard to water quality.","exceeding all federal, state, and local regulations with regard to water quality.","exceeding all federal, state, and local regulations with regard to water quality.","exceeding all federal, state, and local regulations with regard to water quality.","exceeding all federal, state, and local regulations with regard to water quality.","exceeding all federal, state, and local regulations with regard to water quality.","exceeding all federal, state, and local regulations with regard to water quality.","exceeding all federal, state, and local regulations with regard to water quality.","exceeding all federal, state, and local regulations with regard to water quality.",The department,The department,The department
"operates a water treatment plant, 17 sewer pump stations, and a maintenance yard to provide potable","operates a water treatment plant, 17 sewer pump stations, and a maintenance yard to provide potable","operates a water treatment plant, 17 sewer pump stations, and a maintenance yard to provide potable","operates a water treatment plant, 17 sewer pump stations, and a maintenance yard to provide potable","operates a water treatment plant, 17 sewer pump stations, and a maintenance yard to provide potable","operates a water treatment plant, 17 sewer pump stations, and a maintenance yard to provide potable","operates a water treatment plant, 17 sewer pump stations, and a maintenance yard to provide potable","operates a water treatment plant, 17 sewer pump stations, and a maintenance yard to provide potable","operates a water treatment plant, 17 sewer pump stations, and a maintenance yard to provide potable","operates a water treatment plant, 17 sewer pump stations, and a maintenance yard to provide potable","operates a water treatment plant, 17 sewer pump stations, and a maintenance yard to provide potable","operates a water treatment plant, 17 sewer pump stations, and a maintenance yard to provide potable","operates a water treatment plant, 17 sewer pump stations, and a maintenance yard to provide potable","operates a water treatment plant, 17 sewer pump stations, and a maintenance yard to provide potable"
water and sewer service.,water and sewer service.,water and sewer service.,"The water treatment plant handles about 1.3 million gallons of water daily,","The water treatment plant handles about 1.3 million gallons of water daily,","The water treatment plant handles about 1.3 million gallons of water daily,","The water treatment plant handles about 1.3 million gallons of water daily,","The water treatment plant handles about 1.3 million gallons of water daily,","The water treatment plant handles about 1.3 million gallons of water daily,","The water treatment plant handles about 1.3 million gallons of water daily,","The water treatment plant handles about 1.3 million gallons of water daily,","The water treatment plant handles about 1.3 million gallons of water daily,","The water treatment plant handles about 1.3 million gallons of water daily,","The water treatment plant handles about 1.3 million gallons of water daily,"
drawing from both the Beaverdam reservoir and deep wells.,drawing from both the Beaverdam reservoir and deep wells.,drawing from both the Beaverdam reservoir and deep wells.,drawing from both the Beaverdam reservoir and deep wells.,drawing from both the Beaverdam reservoir and deep wells.,drawing from both the Beaverdam reservoir and deep wells.,drawing from both the Beaverdam reservoir and deep wells.,,The department provides a public health,The department provides a public health,The department provides a public health,The department provides a public health,The department provides a public health,The department provides a public health
function in that the collection and off-site treatment of sewage reduces the nitrogen entering the waters,function in that the collection and off-site treatment of sewage reduces the nitrogen entering the waters,function in that the collection and off-site treatment of sewage reduces the nitrogen entering the waters,function in that the collection and off-site treatment of sewage reduces the nitrogen entering the waters,function in that the collection and off-site treatment of sewage reduces the nitrogen entering the waters,function in that the collection and off-site treatment of sewage reduces the nitrogen entering the waters,function in that the collection and off-site treatment of sewage reduces the nitrogen entering the waters,function in that the collection and off-site treatment of sewage reduces the nitrogen entering the waters,function in that the collection and off-site treatment of sewage reduces the nitrogen entering the waters,function in that the collection and off-site treatment of sewage reduces the nitrogen entering the waters,function in that the collection and off-site treatment of sewage reduces the nitrogen entering the waters,function in that the collection and off-site treatment of sewage reduces the nitrogen entering the waters,function in that the collection and off-site treatment of sewage reduces the nitrogen entering the waters,function in that the collection and off-site treatment of sewage reduces the nitrogen entering the waters
of the Chesapeake Bay and reduces the exposure to potentially hazardous conditions posed by failing,of the Chesapeake Bay and reduces the exposure to potentially hazardous conditions posed by failing,of the Chesapeake Bay and reduces the exposure to potentially hazardous conditions posed by failing,of the Chesapeake Bay and reduces the exposure to potentially hazardous conditions posed by failing,of the Chesapeake Bay and reduces the exposure to potentially hazardous conditions posed by failing,of the Chesapeake Bay and reduces the exposure to potentially hazardous conditions posed by failing,of the Chesapeake Bay and reduces the exposure to potentially hazardous conditions posed by failing,of the Chesapeake Bay and reduces the exposure to potentially hazardous conditions posed by failing,of the Chesapeake Bay and reduces the exposure to potentially hazardous conditions posed by failing,of the Chesapeake Bay and reduces the exposure to potentially hazardous conditions posed by failing,of the Chesapeake Bay and reduces the exposure to potentially hazardous conditions posed by failing,of the Chesapeake Bay and reduces the exposure to potentially hazardous conditions posed by failing,of the Chesapeake Bay and reduces the exposure to potentially hazardous conditions posed by failing,of the Chesapeake Bay and reduces the exposure to potentially hazardous conditions posed by failing
septic fields.,septic fields.,,,,,,,,,,,,
The County’s investment in the raw water supply has been an impetus for economic development over,The County’s investment in the raw water supply has been an impetus for economic development over,The County’s investment in the raw water supply has been an impetus for economic development over,The County’s investment in the raw water supply has been an impetus for economic development over,The County’s investment in the raw water supply has been an impetus for economic development over,The County’s investment in the raw water supply has been an impetus for economic development over,The County’s investment in the raw water supply has been an impetus for economic development over,The County’s investment in the raw water supply has been an impetus for economic development over,The County’s investment in the raw water supply has been an impetus for economic development over,The County’s investment in the raw water supply has been an impetus for economic development over,The County’s investment in the raw water supply has been an impetus for economic development over,The County’s investment in the raw water supply has been an impetus for economic development over,The County’s investment in the raw water supply has been an impetus for economic development over,The County’s investment in the raw water supply has been an impetus for economic development over
"the past two decades, and has had an ancillary benefit of community recreation. At the end of June 30,","the past two decades, and has had an ancillary benefit of community recreation. At the end of June 30,","the past two decades, and has had an ancillary benefit of community recreation. At the end of June 30,","the past two decades, and has had an ancillary benefit of community recreation. At the end of June 30,","the past two decades, and has had an ancillary benefit of community recreation. At the end of June 30,","the past two decades, and has had an ancillary benefit of community recreation. At the end of June 30,","the past two decades, and has had an ancillary benefit of community recreation. At the end of June 30,","the past two decades, and has had an ancillary benefit of community recreation. At the end of June 30,","the past two decades, and has had an ancillary benefit of community recreation. At the end of June 30,","the past two decades, and has had an ancillary benefit of community recreation. At the end of June 30,","the past two decades, and has had an ancillary benefit of community recreation. At the end of June 30,","the past two decades, and has had an ancillary benefit of community recreation. At the end of June 30,","the past two decades, and has had an ancillary benefit of community recreation. At the end of June 30,","the past two decades, and has had an ancillary benefit of community recreation. At the end of June 30,"
"2012, the department provided water service to approximately 4,565 accounts and sewer service to","2012, the department provided water service to approximately 4,565 accounts and sewer service to","2012, the department provided water service to approximately 4,565 accounts and sewer service to","2012, the department provided water service to approximately 4,565 accounts and sewer service to","2012, the department provided water service to approximately 4,565 accounts and sewer service to","2012, the department provided water service to approximately 4,565 accounts and sewer service to","2012, the department provided water service to approximately 4,565 accounts and sewer service to","2012, the department provided water service to approximately 4,565 accounts and sewer service to","2012, the department provided water service to approximately 4,565 accounts and sewer service to","2012, the department provided water service to approximately 4,565 accounts and sewer service to","2012, the department provided water service to approximately 4,565 accounts and sewer service to","2012, the department provided water service to approximately 4,565 accounts and sewer service to","2012, the department provided water service to approximately 4,565 accounts and sewer service to","2012, the department provided water service to approximately 4,565 accounts and sewer service to"
"approximately 1,285 accounts.","approximately 1,285 accounts.","approximately 1,285 accounts.","approximately 1,285 accounts.","approximately 1,285 accounts.",,,,,,,,,
"The budget for the Utility Fund is $7,431,358, which represents an increase of 11.4% or $761,680 over","The budget for the Utility Fund is $7,431,358, which represents an increase of 11.4% or $761,680 over","The budget for the Utility Fund is $7,431,358, which represents an increase of 11.4% or $761,680 over","The budget for the Utility Fund is $7,431,358, which represents an increase of 11.4% or $761,680 over","The budget for the Utility Fund is $7,431,358, which represents an increase of 11.4% or $761,680 over","The budget for the Utility Fund is $7,431,358, which represents an increase of 11.4% or $761,680 over","The budget for the Utility Fund is $7,431,358, which represents an increase of 11.4% or $761,680 over","The budget for the Utility Fund is $7,431,358, which represents an increase of 11.4% or $761,680 over","The budget for the Utility Fund is $7,431,358, which represents an increase of 11.4% or $761,680 over","The budget for the Utility Fund is $7,431,358, which represents an increase of 11.4% or $761,680 over","The budget for the Utility Fund is $7,431,358, which represents an increase of 11.4% or $761,680 over","The budget for the Utility Fund is $7,431,358, which represents an increase of 11.4% or $761,680 over","The budget for the Utility Fund is $7,431,358, which represents an increase of 11.4% or $761,680 over","The budget for the Utility Fund is $7,431,358, which represents an increase of 11.4% or $761,680 over"
the current adopted budget.,the current adopted budget.,the current adopted budget.,"A large driver in this increase is the presentation of $1,990,000 in bond","A large driver in this increase is the presentation of $1,990,000 in bond","A large driver in this increase is the presentation of $1,990,000 in bond","A large driver in this increase is the presentation of $1,990,000 in bond","A large driver in this increase is the presentation of $1,990,000 in bond","A large driver in this increase is the presentation of $1,990,000 in bond","A large driver in this increase is the presentation of $1,990,000 in bond","A large driver in this increase is the presentation of $1,990,000 in bond","A large driver in this increase is the presentation of $1,990,000 in bond","A large driver in this increase is the presentation of $1,990,000 in bond","A large driver in this increase is the presentation of $1,990,000 in bond"
"proceeds, which will be explained in greater detail below.","proceeds, which will be explained in greater detail below.","proceeds, which will be explained in greater detail below.","proceeds, which will be explained in greater detail below.","proceeds, which will be explained in greater detail below.","proceeds, which will be explained in greater detail below.","proceeds, which will be explained in greater detail below.",,,,,,,
,,,,,,8,,,,,,,
