services and/or producing and delivering goods in connection with a fund’s principal ongoing operations.,services and/or producing and delivering goods in connection with a fund’s principal ongoing operations.,services and/or producing and delivering goods in connection with a fund’s principal ongoing operations.,services and/or producing and delivering goods in connection with a fund’s principal ongoing operations.,services and/or producing and delivering goods in connection with a fund’s principal ongoing operations.,services and/or producing and delivering goods in connection with a fund’s principal ongoing operations.,services and/or producing and delivering goods in connection with a fund’s principal ongoing operations.,services and/or producing and delivering goods in connection with a fund’s principal ongoing operations.,services and/or producing and delivering goods in connection with a fund’s principal ongoing operations.,services and/or producing and delivering goods in connection with a fund’s principal ongoing operations.,services and/or producing and delivering goods in connection with a fund’s principal ongoing operations.,services and/or producing and delivering goods in connection with a fund’s principal ongoing operations.,services and/or producing and delivering goods in connection with a fund’s principal ongoing operations.,
"Ordinance: A formal legislative enactment by the City Council, which has the full force and effect of law within the","Ordinance: A formal legislative enactment by the City Council, which has the full force and effect of law within the","Ordinance: A formal legislative enactment by the City Council, which has the full force and effect of law within the","Ordinance: A formal legislative enactment by the City Council, which has the full force and effect of law within the","Ordinance: A formal legislative enactment by the City Council, which has the full force and effect of law within the","Ordinance: A formal legislative enactment by the City Council, which has the full force and effect of law within the","Ordinance: A formal legislative enactment by the City Council, which has the full force and effect of law within the","Ordinance: A formal legislative enactment by the City Council, which has the full force and effect of law within the","Ordinance: A formal legislative enactment by the City Council, which has the full force and effect of law within the","Ordinance: A formal legislative enactment by the City Council, which has the full force and effect of law within the","Ordinance: A formal legislative enactment by the City Council, which has the full force and effect of law within the","Ordinance: A formal legislative enactment by the City Council, which has the full force and effect of law within the","Ordinance: A formal legislative enactment by the City Council, which has the full force and effect of law within the","Ordinance: A formal legislative enactment by the City Council, which has the full force and effect of law within the"
boundaries of the city.,boundaries of the city.,,,,,,,,,,,,
"Outcome Measure: the results of an activity, plan, process, or program and their comparison with the intended or","Outcome Measure: the results of an activity, plan, process, or program and their comparison with the intended or","Outcome Measure: the results of an activity, plan, process, or program and their comparison with the intended or","Outcome Measure: the results of an activity, plan, process, or program and their comparison with the intended or","Outcome Measure: the results of an activity, plan, process, or program and their comparison with the intended or","Outcome Measure: the results of an activity, plan, process, or program and their comparison with the intended or","Outcome Measure: the results of an activity, plan, process, or program and their comparison with the intended or","Outcome Measure: the results of an activity, plan, process, or program and their comparison with the intended or","Outcome Measure: the results of an activity, plan, process, or program and their comparison with the intended or","Outcome Measure: the results of an activity, plan, process, or program and their comparison with the intended or","Outcome Measure: the results of an activity, plan, process, or program and their comparison with the intended or","Outcome Measure: the results of an activity, plan, process, or program and their comparison with the intended or","Outcome Measure: the results of an activity, plan, process, or program and their comparison with the intended or","Outcome Measure: the results of an activity, plan, process, or program and their comparison with the intended or"
projected results.,projected results.,,,,,,,,,,,,
Parking Facilities Fund: A fund used to account for the operations of the city-owned parking facilities.,Parking Facilities Fund: A fund used to account for the operations of the city-owned parking facilities.,Parking Facilities Fund: A fund used to account for the operations of the city-owned parking facilities.,Parking Facilities Fund: A fund used to account for the operations of the city-owned parking facilities.,Parking Facilities Fund: A fund used to account for the operations of the city-owned parking facilities.,Parking Facilities Fund: A fund used to account for the operations of the city-owned parking facilities.,Parking Facilities Fund: A fund used to account for the operations of the city-owned parking facilities.,Parking Facilities Fund: A fund used to account for the operations of the city-owned parking facilities.,Parking Facilities Fund: A fund used to account for the operations of the city-owned parking facilities.,Parking Facilities Fund: A fund used to account for the operations of the city-owned parking facilities.,Parking Facilities Fund: A fund used to account for the operations of the city-owned parking facilities.,Parking Facilities Fund: A fund used to account for the operations of the city-owned parking facilities.,,
Part-Time Position (Permanent): A position regularly scheduled for no more than 30 hours per week.,Part-Time Position (Permanent): A position regularly scheduled for no more than 30 hours per week.,Part-Time Position (Permanent): A position regularly scheduled for no more than 30 hours per week.,Part-Time Position (Permanent): A position regularly scheduled for no more than 30 hours per week.,Part-Time Position (Permanent): A position regularly scheduled for no more than 30 hours per week.,Part-Time Position (Permanent): A position regularly scheduled for no more than 30 hours per week.,Part-Time Position (Permanent): A position regularly scheduled for no more than 30 hours per week.,Part-Time Position (Permanent): A position regularly scheduled for no more than 30 hours per week.,Part-Time Position (Permanent): A position regularly scheduled for no more than 30 hours per week.,Part-Time Position (Permanent): A position regularly scheduled for no more than 30 hours per week.,Part-Time Position (Permanent): A position regularly scheduled for no more than 30 hours per week.,Part-Time Position (Permanent): A position regularly scheduled for no more than 30 hours per week.,,
Personal Property Tax:,Personal Property Tax:,Taxes assessed each year by the Commissioner of Revenue's (COR) Office for all tangible,Taxes assessed each year by the Commissioner of Revenue's (COR) Office for all tangible,Taxes assessed each year by the Commissioner of Revenue's (COR) Office for all tangible,Taxes assessed each year by the Commissioner of Revenue's (COR) Office for all tangible,Taxes assessed each year by the Commissioner of Revenue's (COR) Office for all tangible,Taxes assessed each year by the Commissioner of Revenue's (COR) Office for all tangible,Taxes assessed each year by the Commissioner of Revenue's (COR) Office for all tangible,Taxes assessed each year by the Commissioner of Revenue's (COR) Office for all tangible,Taxes assessed each year by the Commissioner of Revenue's (COR) Office for all tangible,Taxes assessed each year by the Commissioner of Revenue's (COR) Office for all tangible,Taxes assessed each year by the Commissioner of Revenue's (COR) Office for all tangible,Taxes assessed each year by the Commissioner of Revenue's (COR) Office for all tangible
personal property located within the City of Norfolk.,personal property located within the City of Norfolk.,personal property located within the City of Norfolk.,personal property located within the City of Norfolk.,personal property located within the City of Norfolk.,personal property located within the City of Norfolk.,,,,,,,,
538,Glossary,,,,,,,,,,,,
