,,,,FINANCIAL POLICIES,FINANCIAL POLICIES,FINANCIAL POLICIES,FINANCIAL POLICIES,,,
The City shall comply with all on-going disclosure requirements and shall file such,The City shall comply with all on-going disclosure requirements and shall file such,The City shall comply with all on-going disclosure requirements and shall file such,The City shall comply with all on-going disclosure requirements and shall file such,The City shall comply with all on-going disclosure requirements and shall file such,The City shall comply with all on-going disclosure requirements and shall file such,The City shall comply with all on-going disclosure requirements and shall file such,The City shall comply with all on-going disclosure requirements and shall file such,The City shall comply with all on-going disclosure requirements and shall file such,The City shall comply with all on-going disclosure requirements and shall file such,The City shall comply with all on-going disclosure requirements and shall file such,The City shall comply with all on-going disclosure requirements and shall file such,The City shall comply with all on-going disclosure requirements and shall file such,The City shall comply with all on-going disclosure requirements and shall file such
documents in a timely manner.,documents in a timely manner.,documents in a timely manner.,documents in a timely manner.,documents in a timely manner.,documents in a timely manner.,,,,,,,,
The City shall monitor earnings on bond proceeds and rebate excess earnings as required,The City shall monitor earnings on bond proceeds and rebate excess earnings as required,The City shall monitor earnings on bond proceeds and rebate excess earnings as required,The City shall monitor earnings on bond proceeds and rebate excess earnings as required,The City shall monitor earnings on bond proceeds and rebate excess earnings as required,The City shall monitor earnings on bond proceeds and rebate excess earnings as required,The City shall monitor earnings on bond proceeds and rebate excess earnings as required,The City shall monitor earnings on bond proceeds and rebate excess earnings as required,The City shall monitor earnings on bond proceeds and rebate excess earnings as required,The City shall monitor earnings on bond proceeds and rebate excess earnings as required,The City shall monitor earnings on bond proceeds and rebate excess earnings as required,The City shall monitor earnings on bond proceeds and rebate excess earnings as required,The City shall monitor earnings on bond proceeds and rebate excess earnings as required,The City shall monitor earnings on bond proceeds and rebate excess earnings as required
to the U.S. Treasury to avoid the loss of tax-exempt status.,to the U.S. Treasury to avoid the loss of tax-exempt status.,to the U.S. Treasury to avoid the loss of tax-exempt status.,to the U.S. Treasury to avoid the loss of tax-exempt status.,to the U.S. Treasury to avoid the loss of tax-exempt status.,to the U.S. Treasury to avoid the loss of tax-exempt status.,to the U.S. Treasury to avoid the loss of tax-exempt status.,to the U.S. Treasury to avoid the loss of tax-exempt status.,to the U.S. Treasury to avoid the loss of tax-exempt status.,,,,,
The City will enforce filing notices of completion on all projects within five years of their,The City will enforce filing notices of completion on all projects within five years of their,The City will enforce filing notices of completion on all projects within five years of their,The City will enforce filing notices of completion on all projects within five years of their,The City will enforce filing notices of completion on all projects within five years of their,The City will enforce filing notices of completion on all projects within five years of their,The City will enforce filing notices of completion on all projects within five years of their,The City will enforce filing notices of completion on all projects within five years of their,The City will enforce filing notices of completion on all projects within five years of their,The City will enforce filing notices of completion on all projects within five years of their,The City will enforce filing notices of completion on all projects within five years of their,The City will enforce filing notices of completion on all projects within five years of their,The City will enforce filing notices of completion on all projects within five years of their,The City will enforce filing notices of completion on all projects within five years of their
financing.,financing.,,,,,,,,,,,,
The,City,shall,,continually,review,outstanding,outstanding,obligations,and,aggressively,aggressively,aggressively,initiate
refinancings when economically feasible and advantageous.,refinancings when economically feasible and advantageous.,refinancings when economically feasible and advantageous.,refinancings when economically feasible and advantageous.,refinancings when economically feasible and advantageous.,refinancings when economically feasible and advantageous.,refinancings when economically feasible and advantageous.,refinancings when economically feasible and advantageous.,refinancings when economically feasible and advantageous.,,,,,
The Chief Financial Officer will periodically report unspent capital project funds to the,The Chief Financial Officer will periodically report unspent capital project funds to the,The Chief Financial Officer will periodically report unspent capital project funds to the,The Chief Financial Officer will periodically report unspent capital project funds to the,The Chief Financial Officer will periodically report unspent capital project funds to the,The Chief Financial Officer will periodically report unspent capital project funds to the,The Chief Financial Officer will periodically report unspent capital project funds to the,The Chief Financial Officer will periodically report unspent capital project funds to the,The Chief Financial Officer will periodically report unspent capital project funds to the,The Chief Financial Officer will periodically report unspent capital project funds to the,The Chief Financial Officer will periodically report unspent capital project funds to the,The Chief Financial Officer will periodically report unspent capital project funds to the,The Chief Financial Officer will periodically report unspent capital project funds to the,The Chief Financial Officer will periodically report unspent capital project funds to the
City Manager and City Council not less than annually.,City Manager and City Council not less than annually.,City Manager and City Council not less than annually.,City Manager and City Council not less than annually.,City Manager and City Council not less than annually.,City Manager and City Council not less than annually.,City Manager and City Council not less than annually.,City Manager and City Council not less than annually.,,,,,,
Debt Administration,Debt Administration,Debt Administration,Debt Administration,,,,,,,,,,
The City shall comply with the Internal Revenue Code Section 148 — Arbitrage,The City shall comply with the Internal Revenue Code Section 148 — Arbitrage,The City shall comply with the Internal Revenue Code Section 148 — Arbitrage,The City shall comply with the Internal Revenue Code Section 148 — Arbitrage,The City shall comply with the Internal Revenue Code Section 148 — Arbitrage,The City shall comply with the Internal Revenue Code Section 148 — Arbitrage,The City shall comply with the Internal Revenue Code Section 148 — Arbitrage,The City shall comply with the Internal Revenue Code Section 148 — Arbitrage,The City shall comply with the Internal Revenue Code Section 148 — Arbitrage,The City shall comply with the Internal Revenue Code Section 148 — Arbitrage,The City shall comply with the Internal Revenue Code Section 148 — Arbitrage,The City shall comply with the Internal Revenue Code Section 148 — Arbitrage,The City shall comply with the Internal Revenue Code Section 148 — Arbitrage,The City shall comply with the Internal Revenue Code Section 148 — Arbitrage
Regulations for all tax-exempt debt issued. An annual estimate of arbitrage liabilities,Regulations for all tax-exempt debt issued. An annual estimate of arbitrage liabilities,Regulations for all tax-exempt debt issued. An annual estimate of arbitrage liabilities,Regulations for all tax-exempt debt issued. An annual estimate of arbitrage liabilities,Regulations for all tax-exempt debt issued. An annual estimate of arbitrage liabilities,Regulations for all tax-exempt debt issued. An annual estimate of arbitrage liabilities,Regulations for all tax-exempt debt issued. An annual estimate of arbitrage liabilities,Regulations for all tax-exempt debt issued. An annual estimate of arbitrage liabilities,Regulations for all tax-exempt debt issued. An annual estimate of arbitrage liabilities,Regulations for all tax-exempt debt issued. An annual estimate of arbitrage liabilities,Regulations for all tax-exempt debt issued. An annual estimate of arbitrage liabilities,Regulations for all tax-exempt debt issued. An annual estimate of arbitrage liabilities,Regulations for all tax-exempt debt issued. An annual estimate of arbitrage liabilities,Regulations for all tax-exempt debt issued. An annual estimate of arbitrage liabilities
shall be obtained by the City and recorded on the financial statements.,shall be obtained by the City and recorded on the financial statements.,shall be obtained by the City and recorded on the financial statements.,shall be obtained by the City and recorded on the financial statements.,shall be obtained by the City and recorded on the financial statements.,shall be obtained by the City and recorded on the financial statements.,shall be obtained by the City and recorded on the financial statements.,shall be obtained by the City and recorded on the financial statements.,shall be obtained by the City and recorded on the financial statements.,shall be obtained by the City and recorded on the financial statements.,shall be obtained by the City and recorded on the financial statements.,,,
A good faith deposit of 2.0% of the par amount of the bond sale shall be presented by,A good faith deposit of 2.0% of the par amount of the bond sale shall be presented by,A good faith deposit of 2.0% of the par amount of the bond sale shall be presented by,A good faith deposit of 2.0% of the par amount of the bond sale shall be presented by,A good faith deposit of 2.0% of the par amount of the bond sale shall be presented by,A good faith deposit of 2.0% of the par amount of the bond sale shall be presented by,A good faith deposit of 2.0% of the par amount of the bond sale shall be presented by,A good faith deposit of 2.0% of the par amount of the bond sale shall be presented by,A good faith deposit of 2.0% of the par amount of the bond sale shall be presented by,A good faith deposit of 2.0% of the par amount of the bond sale shall be presented by,A good faith deposit of 2.0% of the par amount of the bond sale shall be presented by,A good faith deposit of 2.0% of the par amount of the bond sale shall be presented by,A good faith deposit of 2.0% of the par amount of the bond sale shall be presented by,A good faith deposit of 2.0% of the par amount of the bond sale shall be presented by
the underwriter in the form of a check or surety acceptable to the City and Bond,the underwriter in the form of a check or surety acceptable to the City and Bond,the underwriter in the form of a check or surety acceptable to the City and Bond,the underwriter in the form of a check or surety acceptable to the City and Bond,the underwriter in the form of a check or surety acceptable to the City and Bond,the underwriter in the form of a check or surety acceptable to the City and Bond,the underwriter in the form of a check or surety acceptable to the City and Bond,the underwriter in the form of a check or surety acceptable to the City and Bond,the underwriter in the form of a check or surety acceptable to the City and Bond,the underwriter in the form of a check or surety acceptable to the City and Bond,the underwriter in the form of a check or surety acceptable to the City and Bond,the underwriter in the form of a check or surety acceptable to the City and Bond,the underwriter in the form of a check or surety acceptable to the City and Bond,the underwriter in the form of a check or surety acceptable to the City and Bond
Counsel prior to the approval of the bonds by the Mayor and City Council.,Counsel prior to the approval of the bonds by the Mayor and City Council.,Counsel prior to the approval of the bonds by the Mayor and City Council.,Counsel prior to the approval of the bonds by the Mayor and City Council.,Counsel prior to the approval of the bonds by the Mayor and City Council.,Counsel prior to the approval of the bonds by the Mayor and City Council.,Counsel prior to the approval of the bonds by the Mayor and City Council.,Counsel prior to the approval of the bonds by the Mayor and City Council.,Counsel prior to the approval of the bonds by the Mayor and City Council.,Counsel prior to the approval of the bonds by the Mayor and City Council.,Counsel prior to the approval of the bonds by the Mayor and City Council.,Counsel prior to the approval of the bonds by the Mayor and City Council.,Counsel prior to the approval of the bonds by the Mayor and City Council.,
,,,,,,,26,,,,,,
The City shall use a competitive bidding process in the sale of debt unless the use of a,The City shall use a competitive bidding process in the sale of debt unless the use of a,The City shall use a competitive bidding process in the sale of debt unless the use of a,The City shall use a competitive bidding process in the sale of debt unless the use of a,The City shall use a competitive bidding process in the sale of debt unless the use of a,The City shall use a competitive bidding process in the sale of debt unless the use of a,The City shall use a competitive bidding process in the sale of debt unless the use of a,The City shall use a competitive bidding process in the sale of debt unless the use of a,The City shall use a competitive bidding process in the sale of debt unless the use of a,The City shall use a competitive bidding process in the sale of debt unless the use of a,The City shall use a competitive bidding process in the sale of debt unless the use of a,The City shall use a competitive bidding process in the sale of debt unless the use of a
"negotiated process is warranted due to market timing requirements (refunding), or a","negotiated process is warranted due to market timing requirements (refunding), or a","negotiated process is warranted due to market timing requirements (refunding), or a","negotiated process is warranted due to market timing requirements (refunding), or a","negotiated process is warranted due to market timing requirements (refunding), or a","negotiated process is warranted due to market timing requirements (refunding), or a","negotiated process is warranted due to market timing requirements (refunding), or a","negotiated process is warranted due to market timing requirements (refunding), or a","negotiated process is warranted due to market timing requirements (refunding), or a","negotiated process is warranted due to market timing requirements (refunding), or a","negotiated process is warranted due to market timing requirements (refunding), or a","negotiated process is warranted due to market timing requirements (refunding), or a"
unique pledge or debt structure. The City will award competitively issued debt on a true,unique pledge or debt structure. The City will award competitively issued debt on a true,unique pledge or debt structure. The City will award competitively issued debt on a true,unique pledge or debt structure. The City will award competitively issued debt on a true,unique pledge or debt structure. The City will award competitively issued debt on a true,unique pledge or debt structure. The City will award competitively issued debt on a true,unique pledge or debt structure. The City will award competitively issued debt on a true,unique pledge or debt structure. The City will award competitively issued debt on a true,unique pledge or debt structure. The City will award competitively issued debt on a true,unique pledge or debt structure. The City will award competitively issued debt on a true,unique pledge or debt structure. The City will award competitively issued debt on a true,unique pledge or debt structure. The City will award competitively issued debt on a true
interest cost (TIC) basis.,interest cost (TIC) basis.,interest cost (TIC) basis.,interest cost (TIC) basis.,,,,,,,,
The City welcomes ideas and proposals from investment bankers and will seek to give,The City welcomes ideas and proposals from investment bankers and will seek to give,The City welcomes ideas and proposals from investment bankers and will seek to give,The City welcomes ideas and proposals from investment bankers and will seek to give,The City welcomes ideas and proposals from investment bankers and will seek to give,The City welcomes ideas and proposals from investment bankers and will seek to give,The City welcomes ideas and proposals from investment bankers and will seek to give,The City welcomes ideas and proposals from investment bankers and will seek to give,The City welcomes ideas and proposals from investment bankers and will seek to give,The City welcomes ideas and proposals from investment bankers and will seek to give,The City welcomes ideas and proposals from investment bankers and will seek to give,The City welcomes ideas and proposals from investment bankers and will seek to give
first consideration to those firms that submit unique and innovative ideas that benefit,first consideration to those firms that submit unique and innovative ideas that benefit,first consideration to those firms that submit unique and innovative ideas that benefit,first consideration to those firms that submit unique and innovative ideas that benefit,first consideration to those firms that submit unique and innovative ideas that benefit,first consideration to those firms that submit unique and innovative ideas that benefit,first consideration to those firms that submit unique and innovative ideas that benefit,first consideration to those firms that submit unique and innovative ideas that benefit,first consideration to those firms that submit unique and innovative ideas that benefit,first consideration to those firms that submit unique and innovative ideas that benefit,first consideration to those firms that submit unique and innovative ideas that benefit,first consideration to those firms that submit unique and innovative ideas that benefit
the City. Unsolicited proposals should be submitted to the City’s Chief Financial,the City. Unsolicited proposals should be submitted to the City’s Chief Financial,the City. Unsolicited proposals should be submitted to the City’s Chief Financial,the City. Unsolicited proposals should be submitted to the City’s Chief Financial,the City. Unsolicited proposals should be submitted to the City’s Chief Financial,the City. Unsolicited proposals should be submitted to the City’s Chief Financial,the City. Unsolicited proposals should be submitted to the City’s Chief Financial,the City. Unsolicited proposals should be submitted to the City’s Chief Financial,the City. Unsolicited proposals should be submitted to the City’s Chief Financial,the City. Unsolicited proposals should be submitted to the City’s Chief Financial,the City. Unsolicited proposals should be submitted to the City’s Chief Financial,the City. Unsolicited proposals should be submitted to the City’s Chief Financial
Officer.,,,,,,,,,,,
The selection of an underwriter or group of underwriters for a negotiated sale shall be,The selection of an underwriter or group of underwriters for a negotiated sale shall be,The selection of an underwriter or group of underwriters for a negotiated sale shall be,The selection of an underwriter or group of underwriters for a negotiated sale shall be,The selection of an underwriter or group of underwriters for a negotiated sale shall be,The selection of an underwriter or group of underwriters for a negotiated sale shall be,The selection of an underwriter or group of underwriters for a negotiated sale shall be,The selection of an underwriter or group of underwriters for a negotiated sale shall be,The selection of an underwriter or group of underwriters for a negotiated sale shall be,The selection of an underwriter or group of underwriters for a negotiated sale shall be,The selection of an underwriter or group of underwriters for a negotiated sale shall be,The selection of an underwriter or group of underwriters for a negotiated sale shall be
based on the following factors:,based on the following factors:,based on the following factors:,based on the following factors:,based on the following factors:,,,,,,,
•,Participation in the City’s competitive sales;,Participation in the City’s competitive sales;,Participation in the City’s competitive sales;,Participation in the City’s competitive sales;,Participation in the City’s competitive sales;,Participation in the City’s competitive sales;,Participation in the City’s competitive sales;,,,,
•,Submission of unique or creative proposals;,Submission of unique or creative proposals;,Submission of unique or creative proposals;,Submission of unique or creative proposals;,Submission of unique or creative proposals;,Submission of unique or creative proposals;,Submission of unique or creative proposals;,,,,
•,Qualifications of firm;,Qualifications of firm;,Qualifications of firm;,Qualifications of firm;,Qualifications of firm;,,,,,,
•,Size and geographic distribution of their sales staff.,Size and geographic distribution of their sales staff.,Size and geographic distribution of their sales staff.,Size and geographic distribution of their sales staff.,Size and geographic distribution of their sales staff.,Size and geographic distribution of their sales staff.,Size and geographic distribution of their sales staff.,,,,
All professional service providers selected in connection with the City’s debt issuance,All professional service providers selected in connection with the City’s debt issuance,All professional service providers selected in connection with the City’s debt issuance,All professional service providers selected in connection with the City’s debt issuance,All professional service providers selected in connection with the City’s debt issuance,All professional service providers selected in connection with the City’s debt issuance,All professional service providers selected in connection with the City’s debt issuance,All professional service providers selected in connection with the City’s debt issuance,All professional service providers selected in connection with the City’s debt issuance,All professional service providers selected in connection with the City’s debt issuance,All professional service providers selected in connection with the City’s debt issuance,All professional service providers selected in connection with the City’s debt issuance
and management program shall be chosen through a competitive process such as,and management program shall be chosen through a competitive process such as,and management program shall be chosen through a competitive process such as,and management program shall be chosen through a competitive process such as,and management program shall be chosen through a competitive process such as,and management program shall be chosen through a competitive process such as,and management program shall be chosen through a competitive process such as,and management program shall be chosen through a competitive process such as,and management program shall be chosen through a competitive process such as,and management program shall be chosen through a competitive process such as,and management program shall be chosen through a competitive process such as,and management program shall be chosen through a competitive process such as
request for proposals (RFP’s) on an as needed basis.,request for proposals (RFP’s) on an as needed basis.,request for proposals (RFP’s) on an as needed basis.,request for proposals (RFP’s) on an as needed basis.,request for proposals (RFP’s) on an as needed basis.,request for proposals (RFP’s) on an as needed basis.,request for proposals (RFP’s) on an as needed basis.,request for proposals (RFP’s) on an as needed basis.,,,,
The use of reimbursement resolutions shall be encouraged as a cash management tool,The use of reimbursement resolutions shall be encouraged as a cash management tool,The use of reimbursement resolutions shall be encouraged as a cash management tool,The use of reimbursement resolutions shall be encouraged as a cash management tool,The use of reimbursement resolutions shall be encouraged as a cash management tool,The use of reimbursement resolutions shall be encouraged as a cash management tool,The use of reimbursement resolutions shall be encouraged as a cash management tool,The use of reimbursement resolutions shall be encouraged as a cash management tool,The use of reimbursement resolutions shall be encouraged as a cash management tool,The use of reimbursement resolutions shall be encouraged as a cash management tool,The use of reimbursement resolutions shall be encouraged as a cash management tool,The use of reimbursement resolutions shall be encouraged as a cash management tool
