,,,,FINANCIAL POLICIES,FINANCIAL POLICIES,FINANCIAL POLICIES,FINANCIAL POLICIES,,,
The City will prepare and annually update a long range (5 year) financial forecast of the,The City will prepare and annually update a long range (5 year) financial forecast of the,The City will prepare and annually update a long range (5 year) financial forecast of the,The City will prepare and annually update a long range (5 year) financial forecast of the,The City will prepare and annually update a long range (5 year) financial forecast of the,The City will prepare and annually update a long range (5 year) financial forecast of the,The City will prepare and annually update a long range (5 year) financial forecast of the,The City will prepare and annually update a long range (5 year) financial forecast of the,The City will prepare and annually update a long range (5 year) financial forecast of the,The City will prepare and annually update a long range (5 year) financial forecast of the,The City will prepare and annually update a long range (5 year) financial forecast of the,The City will prepare and annually update a long range (5 year) financial forecast of the,The City will prepare and annually update a long range (5 year) financial forecast of the
"operating budget utilizing trend indicators and projections of annual operating revenues,","operating budget utilizing trend indicators and projections of annual operating revenues,","operating budget utilizing trend indicators and projections of annual operating revenues,","operating budget utilizing trend indicators and projections of annual operating revenues,","operating budget utilizing trend indicators and projections of annual operating revenues,","operating budget utilizing trend indicators and projections of annual operating revenues,","operating budget utilizing trend indicators and projections of annual operating revenues,","operating budget utilizing trend indicators and projections of annual operating revenues,","operating budget utilizing trend indicators and projections of annual operating revenues,","operating budget utilizing trend indicators and projections of annual operating revenues,","operating budget utilizing trend indicators and projections of annual operating revenues,","operating budget utilizing trend indicators and projections of annual operating revenues,","operating budget utilizing trend indicators and projections of annual operating revenues,"
"expenditures, capital improvements, associated debt service and incremental operating","expenditures, capital improvements, associated debt service and incremental operating","expenditures, capital improvements, associated debt service and incremental operating","expenditures, capital improvements, associated debt service and incremental operating","expenditures, capital improvements, associated debt service and incremental operating","expenditures, capital improvements, associated debt service and incremental operating","expenditures, capital improvements, associated debt service and incremental operating","expenditures, capital improvements, associated debt service and incremental operating","expenditures, capital improvements, associated debt service and incremental operating","expenditures, capital improvements, associated debt service and incremental operating","expenditures, capital improvements, associated debt service and incremental operating","expenditures, capital improvements, associated debt service and incremental operating","expenditures, capital improvements, associated debt service and incremental operating"
"costs, and fund balance levels.","costs, and fund balance levels.","costs, and fund balance levels.","costs, and fund balance levels.",This forecast is intended to be an internal planning tool,This forecast is intended to be an internal planning tool,This forecast is intended to be an internal planning tool,This forecast is intended to be an internal planning tool,This forecast is intended to be an internal planning tool,This forecast is intended to be an internal planning tool,This forecast is intended to be an internal planning tool,This forecast is intended to be an internal planning tool,This forecast is intended to be an internal planning tool
"for Staff and the City Council, but will be shared with the rating agencies each year, as","for Staff and the City Council, but will be shared with the rating agencies each year, as","for Staff and the City Council, but will be shared with the rating agencies each year, as","for Staff and the City Council, but will be shared with the rating agencies each year, as","for Staff and the City Council, but will be shared with the rating agencies each year, as","for Staff and the City Council, but will be shared with the rating agencies each year, as","for Staff and the City Council, but will be shared with the rating agencies each year, as","for Staff and the City Council, but will be shared with the rating agencies each year, as","for Staff and the City Council, but will be shared with the rating agencies each year, as","for Staff and the City Council, but will be shared with the rating agencies each year, as","for Staff and the City Council, but will be shared with the rating agencies each year, as","for Staff and the City Council, but will be shared with the rating agencies each year, as","for Staff and the City Council, but will be shared with the rating agencies each year, as"
well as interested citizens upon request.,well as interested citizens upon request.,well as interested citizens upon request.,well as interested citizens upon request.,well as interested citizens upon request.,well as interested citizens upon request.,,The Forecast should be prepared with the,The Forecast should be prepared with the,The Forecast should be prepared with the,The Forecast should be prepared with the,The Forecast should be prepared with the,The Forecast should be prepared with the
"intention of showing projected results based on programs, trends, and policies then in","intention of showing projected results based on programs, trends, and policies then in","intention of showing projected results based on programs, trends, and policies then in","intention of showing projected results based on programs, trends, and policies then in","intention of showing projected results based on programs, trends, and policies then in","intention of showing projected results based on programs, trends, and policies then in","intention of showing projected results based on programs, trends, and policies then in","intention of showing projected results based on programs, trends, and policies then in","intention of showing projected results based on programs, trends, and policies then in","intention of showing projected results based on programs, trends, and policies then in","intention of showing projected results based on programs, trends, and policies then in","intention of showing projected results based on programs, trends, and policies then in","intention of showing projected results based on programs, trends, and policies then in"
effect and without undue influence on its outcome.,effect and without undue influence on its outcome.,effect and without undue influence on its outcome.,effect and without undue influence on its outcome.,effect and without undue influence on its outcome.,effect and without undue influence on its outcome.,effect and without undue influence on its outcome.,effect and without undue influence on its outcome.,,,,,
,,,,,,24,24,,,,,
FUND BALANCE,
Policy Minimum,
"The City will maintain an Unreserved, Undesignated General Fund Balance equal to 15%","The City will maintain an Unreserved, Undesignated General Fund Balance equal to 15%"
of General Fund revenues.,
"If the Unreserved, Undesignated General Fund Balance falls below the minimum level","If the Unreserved, Undesignated General Fund Balance falls below the minimum level"
"described above, Staff will submit a detailed plan (“Staff Plan”) to City Council that","described above, Staff will submit a detailed plan (“Staff Plan”) to City Council that"
proposes actions necessary to return the fund balance to the policy minimum over not,proposes actions necessary to return the fund balance to the policy minimum over not
more than two succeeding Fiscal Years.,City Council shall act upon the Staff Plan by
taking the actions necessary to implement same or substituting alternatives that achieve,taking the actions necessary to implement same or substituting alternatives that achieve
the same objective.,
"If, upon the effective date of these Financial Policies, the City is not in compliance with","If, upon the effective date of these Financial Policies, the City is not in compliance with"
"this Fund Balance Policy Minimum, the City Staff will prepare a Staff Plan to restore the","this Fund Balance Policy Minimum, the City Staff will prepare a Staff Plan to restore the"
fund balance to the policy level and such plan will be presented within not more than,fund balance to the policy level and such plan will be presented within not more than
three (3) months from the effective date.,
DEBT MANAGEMENT PRINCIPLES,
"All long-term financings shall comply with Federal, State, and City Charter requirements.","All long-term financings shall comply with Federal, State, and City Charter requirements."
"Accompanying each long-term financial obligation will be a cost benefit analysis, the","Accompanying each long-term financial obligation will be a cost benefit analysis, the"
"identification of the funding source, an assessment of the ability to repay the obligation,","identification of the funding source, an assessment of the ability to repay the obligation,"
"the impact on the current budget, commitments to the future budgets, maintenance and","the impact on the current budget, commitments to the future budgets, maintenance and"
operational impact of the facility or asset and the impact on the City’s credit rating.,operational impact of the facility or asset and the impact on the City’s credit rating.
The project should be incorporated into the City’s multi-year capital and equipment,The project should be incorporated into the City’s multi-year capital and equipment
improvement plan.,
"The term of the long-term obligation for the acquisition, replacement or expansion of","The term of the long-term obligation for the acquisition, replacement or expansion of"
"physical assets, will not exceed the useful life or the average life of the project or projects","physical assets, will not exceed the useful life or the average life of the project or projects"
being financed.,
"Long-term financial obligations will not be used to meet current operations, or for","Long-term financial obligations will not be used to meet current operations, or for"
recurring purposes.,
Variable rate obligations shall not exceed 15% of the City’s outstanding long-term,Variable rate obligations shall not exceed 15% of the City’s outstanding long-term
obligations and must be approved by the Chief Financial Officer.,obligations and must be approved by the Chief Financial Officer.
"The City Council may consider conduit financing on behalf of the EDA, PRHA, and","The City Council may consider conduit financing on behalf of the EDA, PRHA, and"
PPIC upon recommendation of the Debt Advisory Committee. Initial contact will be,PPIC upon recommendation of the Debt Advisory Committee. Initial contact will be
directed to the Chief Financial Officer. Council will consider whether the conduit is,directed to the Chief Financial Officer. Council will consider whether the conduit is
"feasible, financially and economically prudent, coincides with the City’s objectives, and","feasible, financially and economically prudent, coincides with the City’s objectives, and"
,25
does not impair the City’s creditworthiness (All expenses related to the conduit financing,does not impair the City’s creditworthiness (All expenses related to the conduit financing,does not impair the City’s creditworthiness (All expenses related to the conduit financing,does not impair the City’s creditworthiness (All expenses related to the conduit financing,does not impair the City’s creditworthiness (All expenses related to the conduit financing,does not impair the City’s creditworthiness (All expenses related to the conduit financing,does not impair the City’s creditworthiness (All expenses related to the conduit financing,does not impair the City’s creditworthiness (All expenses related to the conduit financing,does not impair the City’s creditworthiness (All expenses related to the conduit financing,does not impair the City’s creditworthiness (All expenses related to the conduit financing,does not impair the City’s creditworthiness (All expenses related to the conduit financing,does not impair the City’s creditworthiness (All expenses related to the conduit financing,does not impair the City’s creditworthiness (All expenses related to the conduit financing,does not impair the City’s creditworthiness (All expenses related to the conduit financing
will be borne by the applicants).,will be borne by the applicants).,will be borne by the applicants).,will be borne by the applicants).,will be borne by the applicants).,will be borne by the applicants).,,,,,,,,
"Except as noted below, long-term obligations issued through the City must qualify for an","Except as noted below, long-term obligations issued through the City must qualify for an","Except as noted below, long-term obligations issued through the City must qualify for an","Except as noted below, long-term obligations issued through the City must qualify for an","Except as noted below, long-term obligations issued through the City must qualify for an","Except as noted below, long-term obligations issued through the City must qualify for an","Except as noted below, long-term obligations issued through the City must qualify for an","Except as noted below, long-term obligations issued through the City must qualify for an","Except as noted below, long-term obligations issued through the City must qualify for an","Except as noted below, long-term obligations issued through the City must qualify for an","Except as noted below, long-term obligations issued through the City must qualify for an","Except as noted below, long-term obligations issued through the City must qualify for an","Except as noted below, long-term obligations issued through the City must qualify for an","Except as noted below, long-term obligations issued through the City must qualify for an"
underlying (i.e.; rated on the basis of the security for the loan) investment grade rating by,underlying (i.e.; rated on the basis of the security for the loan) investment grade rating by,underlying (i.e.; rated on the basis of the security for the loan) investment grade rating by,underlying (i.e.; rated on the basis of the security for the loan) investment grade rating by,underlying (i.e.; rated on the basis of the security for the loan) investment grade rating by,underlying (i.e.; rated on the basis of the security for the loan) investment grade rating by,underlying (i.e.; rated on the basis of the security for the loan) investment grade rating by,underlying (i.e.; rated on the basis of the security for the loan) investment grade rating by,underlying (i.e.; rated on the basis of the security for the loan) investment grade rating by,underlying (i.e.; rated on the basis of the security for the loan) investment grade rating by,underlying (i.e.; rated on the basis of the security for the loan) investment grade rating by,underlying (i.e.; rated on the basis of the security for the loan) investment grade rating by,underlying (i.e.; rated on the basis of the security for the loan) investment grade rating by,underlying (i.e.; rated on the basis of the security for the loan) investment grade rating by
one,of,the,nationally,recognized,recognized,rating,agencies,or,qualify,for,alternative,alternative,credit
enhancement. An exception to this requirement would be debt issued via the Virginia,enhancement. An exception to this requirement would be debt issued via the Virginia,enhancement. An exception to this requirement would be debt issued via the Virginia,enhancement. An exception to this requirement would be debt issued via the Virginia,enhancement. An exception to this requirement would be debt issued via the Virginia,enhancement. An exception to this requirement would be debt issued via the Virginia,enhancement. An exception to this requirement would be debt issued via the Virginia,enhancement. An exception to this requirement would be debt issued via the Virginia,enhancement. An exception to this requirement would be debt issued via the Virginia,enhancement. An exception to this requirement would be debt issued via the Virginia,enhancement. An exception to this requirement would be debt issued via the Virginia,enhancement. An exception to this requirement would be debt issued via the Virginia,enhancement. An exception to this requirement would be debt issued via the Virginia,enhancement. An exception to this requirement would be debt issued via the Virginia
"Resources Authority, a political subdivision of the Commonwealth of Virginia. In the","Resources Authority, a political subdivision of the Commonwealth of Virginia. In the","Resources Authority, a political subdivision of the Commonwealth of Virginia. In the","Resources Authority, a political subdivision of the Commonwealth of Virginia. In the","Resources Authority, a political subdivision of the Commonwealth of Virginia. In the","Resources Authority, a political subdivision of the Commonwealth of Virginia. In the","Resources Authority, a political subdivision of the Commonwealth of Virginia. In the","Resources Authority, a political subdivision of the Commonwealth of Virginia. In the","Resources Authority, a political subdivision of the Commonwealth of Virginia. In the","Resources Authority, a political subdivision of the Commonwealth of Virginia. In the","Resources Authority, a political subdivision of the Commonwealth of Virginia. In the","Resources Authority, a political subdivision of the Commonwealth of Virginia. In the","Resources Authority, a political subdivision of the Commonwealth of Virginia. In the","Resources Authority, a political subdivision of the Commonwealth of Virginia. In the"
case of long-term obligations that are privately placed as bank qualified investments by,case of long-term obligations that are privately placed as bank qualified investments by,case of long-term obligations that are privately placed as bank qualified investments by,case of long-term obligations that are privately placed as bank qualified investments by,case of long-term obligations that are privately placed as bank qualified investments by,case of long-term obligations that are privately placed as bank qualified investments by,case of long-term obligations that are privately placed as bank qualified investments by,case of long-term obligations that are privately placed as bank qualified investments by,case of long-term obligations that are privately placed as bank qualified investments by,case of long-term obligations that are privately placed as bank qualified investments by,case of long-term obligations that are privately placed as bank qualified investments by,case of long-term obligations that are privately placed as bank qualified investments by,case of long-term obligations that are privately placed as bank qualified investments by,case of long-term obligations that are privately placed as bank qualified investments by
"the City, such obligations would not be required to qualify for an investment grade rating.","the City, such obligations would not be required to qualify for an investment grade rating.","the City, such obligations would not be required to qualify for an investment grade rating.","the City, such obligations would not be required to qualify for an investment grade rating.","the City, such obligations would not be required to qualify for an investment grade rating.","the City, such obligations would not be required to qualify for an investment grade rating.","the City, such obligations would not be required to qualify for an investment grade rating.","the City, such obligations would not be required to qualify for an investment grade rating.","the City, such obligations would not be required to qualify for an investment grade rating.","the City, such obligations would not be required to qualify for an investment grade rating.","the City, such obligations would not be required to qualify for an investment grade rating.","the City, such obligations would not be required to qualify for an investment grade rating.","the City, such obligations would not be required to qualify for an investment grade rating.","the City, such obligations would not be required to qualify for an investment grade rating."
The,City,shall,,encourage,and,maintain,good,relations,with,credit,rating,rating,"agencies,"
investors,investors,in,the,City’s,long-term,financial,financial,"obligations,",and,those,in,the,financial
community who participate in the issuance and sale of our long-term obligations. A,community who participate in the issuance and sale of our long-term obligations. A,community who participate in the issuance and sale of our long-term obligations. A,community who participate in the issuance and sale of our long-term obligations. A,community who participate in the issuance and sale of our long-term obligations. A,community who participate in the issuance and sale of our long-term obligations. A,community who participate in the issuance and sale of our long-term obligations. A,community who participate in the issuance and sale of our long-term obligations. A,community who participate in the issuance and sale of our long-term obligations. A,community who participate in the issuance and sale of our long-term obligations. A,community who participate in the issuance and sale of our long-term obligations. A,community who participate in the issuance and sale of our long-term obligations. A,community who participate in the issuance and sale of our long-term obligations. A,community who participate in the issuance and sale of our long-term obligations. A
policy of full and open disclosure on every financial report and long-term obligation,policy of full and open disclosure on every financial report and long-term obligation,policy of full and open disclosure on every financial report and long-term obligation,policy of full and open disclosure on every financial report and long-term obligation,policy of full and open disclosure on every financial report and long-term obligation,policy of full and open disclosure on every financial report and long-term obligation,policy of full and open disclosure on every financial report and long-term obligation,policy of full and open disclosure on every financial report and long-term obligation,policy of full and open disclosure on every financial report and long-term obligation,policy of full and open disclosure on every financial report and long-term obligation,policy of full and open disclosure on every financial report and long-term obligation,policy of full and open disclosure on every financial report and long-term obligation,policy of full and open disclosure on every financial report and long-term obligation,policy of full and open disclosure on every financial report and long-term obligation
transaction will be enforced and credit rating agency presentations/updates shall be,transaction will be enforced and credit rating agency presentations/updates shall be,transaction will be enforced and credit rating agency presentations/updates shall be,transaction will be enforced and credit rating agency presentations/updates shall be,transaction will be enforced and credit rating agency presentations/updates shall be,transaction will be enforced and credit rating agency presentations/updates shall be,transaction will be enforced and credit rating agency presentations/updates shall be,transaction will be enforced and credit rating agency presentations/updates shall be,transaction will be enforced and credit rating agency presentations/updates shall be,transaction will be enforced and credit rating agency presentations/updates shall be,transaction will be enforced and credit rating agency presentations/updates shall be,transaction will be enforced and credit rating agency presentations/updates shall be,transaction will be enforced and credit rating agency presentations/updates shall be,transaction will be enforced and credit rating agency presentations/updates shall be
conducted at least annually.,conducted at least annually.,conducted at least annually.,conducted at least annually.,conducted at least annually.,,,,,,,,,
