,,,,FINANCIAL POLICIES,FINANCIAL POLICIES,FINANCIAL POLICIES,FINANCIAL POLICIES,,,
for debt funded projects. Reimbursement resolutions may be used for any project that,for debt funded projects. Reimbursement resolutions may be used for any project that,for debt funded projects. Reimbursement resolutions may be used for any project that,for debt funded projects. Reimbursement resolutions may be used for any project that,for debt funded projects. Reimbursement resolutions may be used for any project that,for debt funded projects. Reimbursement resolutions may be used for any project that,for debt funded projects. Reimbursement resolutions may be used for any project that,for debt funded projects. Reimbursement resolutions may be used for any project that,for debt funded projects. Reimbursement resolutions may be used for any project that,for debt funded projects. Reimbursement resolutions may be used for any project that,for debt funded projects. Reimbursement resolutions may be used for any project that,for debt funded projects. Reimbursement resolutions may be used for any project that
has been approved in the City’s Capital Budget. Reimbursement resolutions may be,has been approved in the City’s Capital Budget. Reimbursement resolutions may be,has been approved in the City’s Capital Budget. Reimbursement resolutions may be,has been approved in the City’s Capital Budget. Reimbursement resolutions may be,has been approved in the City’s Capital Budget. Reimbursement resolutions may be,has been approved in the City’s Capital Budget. Reimbursement resolutions may be,has been approved in the City’s Capital Budget. Reimbursement resolutions may be,has been approved in the City’s Capital Budget. Reimbursement resolutions may be,has been approved in the City’s Capital Budget. Reimbursement resolutions may be,has been approved in the City’s Capital Budget. Reimbursement resolutions may be,has been approved in the City’s Capital Budget. Reimbursement resolutions may be,has been approved in the City’s Capital Budget. Reimbursement resolutions may be
used for other projects if the projects are revenue supported or fund within departments’,used for other projects if the projects are revenue supported or fund within departments’,used for other projects if the projects are revenue supported or fund within departments’,used for other projects if the projects are revenue supported or fund within departments’,used for other projects if the projects are revenue supported or fund within departments’,used for other projects if the projects are revenue supported or fund within departments’,used for other projects if the projects are revenue supported or fund within departments’,used for other projects if the projects are revenue supported or fund within departments’,used for other projects if the projects are revenue supported or fund within departments’,used for other projects if the projects are revenue supported or fund within departments’,used for other projects if the projects are revenue supported or fund within departments’,used for other projects if the projects are revenue supported or fund within departments’
operating budget.,operating budget.,operating budget.,,,,,,,,,
The City shall obtain a clear opinion from qualified legal counsel that the City is not,The City shall obtain a clear opinion from qualified legal counsel that the City is not,The City shall obtain a clear opinion from qualified legal counsel that the City is not,The City shall obtain a clear opinion from qualified legal counsel that the City is not,The City shall obtain a clear opinion from qualified legal counsel that the City is not,The City shall obtain a clear opinion from qualified legal counsel that the City is not,The City shall obtain a clear opinion from qualified legal counsel that the City is not,The City shall obtain a clear opinion from qualified legal counsel that the City is not,The City shall obtain a clear opinion from qualified legal counsel that the City is not,The City shall obtain a clear opinion from qualified legal counsel that the City is not,The City shall obtain a clear opinion from qualified legal counsel that the City is not,The City shall obtain a clear opinion from qualified legal counsel that the City is not
liable for the payment of principal and/or interest in the event of default by a conduit,liable for the payment of principal and/or interest in the event of default by a conduit,liable for the payment of principal and/or interest in the event of default by a conduit,liable for the payment of principal and/or interest in the event of default by a conduit,liable for the payment of principal and/or interest in the event of default by a conduit,liable for the payment of principal and/or interest in the event of default by a conduit,liable for the payment of principal and/or interest in the event of default by a conduit,liable for the payment of principal and/or interest in the event of default by a conduit,liable for the payment of principal and/or interest in the event of default by a conduit,liable for the payment of principal and/or interest in the event of default by a conduit,liable for the payment of principal and/or interest in the event of default by a conduit,liable for the payment of principal and/or interest in the event of default by a conduit
"borrower. If no such opinion can be obtained, the conduit borrower will be required to","borrower. If no such opinion can be obtained, the conduit borrower will be required to","borrower. If no such opinion can be obtained, the conduit borrower will be required to","borrower. If no such opinion can be obtained, the conduit borrower will be required to","borrower. If no such opinion can be obtained, the conduit borrower will be required to","borrower. If no such opinion can be obtained, the conduit borrower will be required to","borrower. If no such opinion can be obtained, the conduit borrower will be required to","borrower. If no such opinion can be obtained, the conduit borrower will be required to","borrower. If no such opinion can be obtained, the conduit borrower will be required to","borrower. If no such opinion can be obtained, the conduit borrower will be required to","borrower. If no such opinion can be obtained, the conduit borrower will be required to","borrower. If no such opinion can be obtained, the conduit borrower will be required to"
purchase insurance or a letter of credit in the City’s name in the event of default.,purchase insurance or a letter of credit in the City’s name in the event of default.,purchase insurance or a letter of credit in the City’s name in the event of default.,purchase insurance or a letter of credit in the City’s name in the event of default.,purchase insurance or a letter of credit in the City’s name in the event of default.,purchase insurance or a letter of credit in the City’s name in the event of default.,purchase insurance or a letter of credit in the City’s name in the event of default.,purchase insurance or a letter of credit in the City’s name in the event of default.,purchase insurance or a letter of credit in the City’s name in the event of default.,purchase insurance or a letter of credit in the City’s name in the event of default.,purchase insurance or a letter of credit in the City’s name in the event of default.,purchase insurance or a letter of credit in the City’s name in the event of default.
"Examples of a conduit issuer are special authorities, tax-increment financing districts,","Examples of a conduit issuer are special authorities, tax-increment financing districts,","Examples of a conduit issuer are special authorities, tax-increment financing districts,","Examples of a conduit issuer are special authorities, tax-increment financing districts,","Examples of a conduit issuer are special authorities, tax-increment financing districts,","Examples of a conduit issuer are special authorities, tax-increment financing districts,","Examples of a conduit issuer are special authorities, tax-increment financing districts,","Examples of a conduit issuer are special authorities, tax-increment financing districts,","Examples of a conduit issuer are special authorities, tax-increment financing districts,","Examples of a conduit issuer are special authorities, tax-increment financing districts,","Examples of a conduit issuer are special authorities, tax-increment financing districts,","Examples of a conduit issuer are special authorities, tax-increment financing districts,"
"public improvement districts, or industrial development issuers.","public improvement districts, or industrial development issuers.","public improvement districts, or industrial development issuers.","public improvement districts, or industrial development issuers.","public improvement districts, or industrial development issuers.","public improvement districts, or industrial development issuers.","public improvement districts, or industrial development issuers.","public improvement districts, or industrial development issuers.","public improvement districts, or industrial development issuers.",,,
Debt Capacity and Affordability,Debt Capacity and Affordability,Debt Capacity and Affordability,Debt Capacity and Affordability,Debt Capacity and Affordability,Debt Capacity and Affordability,,,,,,
A long-term debt capacity and affordability analysis will be completed on an annual basis,A long-term debt capacity and affordability analysis will be completed on an annual basis,A long-term debt capacity and affordability analysis will be completed on an annual basis,A long-term debt capacity and affordability analysis will be completed on an annual basis,A long-term debt capacity and affordability analysis will be completed on an annual basis,A long-term debt capacity and affordability analysis will be completed on an annual basis,A long-term debt capacity and affordability analysis will be completed on an annual basis,A long-term debt capacity and affordability analysis will be completed on an annual basis,A long-term debt capacity and affordability analysis will be completed on an annual basis,A long-term debt capacity and affordability analysis will be completed on an annual basis,A long-term debt capacity and affordability analysis will be completed on an annual basis,A long-term debt capacity and affordability analysis will be completed on an annual basis
as a means of ensuring that the City does not exceed its ability to service current and,as a means of ensuring that the City does not exceed its ability to service current and,as a means of ensuring that the City does not exceed its ability to service current and,as a means of ensuring that the City does not exceed its ability to service current and,as a means of ensuring that the City does not exceed its ability to service current and,as a means of ensuring that the City does not exceed its ability to service current and,as a means of ensuring that the City does not exceed its ability to service current and,as a means of ensuring that the City does not exceed its ability to service current and,as a means of ensuring that the City does not exceed its ability to service current and,as a means of ensuring that the City does not exceed its ability to service current and,as a means of ensuring that the City does not exceed its ability to service current and,as a means of ensuring that the City does not exceed its ability to service current and
future debt requirements. This analysis will verify that the City is maintaining the,future debt requirements. This analysis will verify that the City is maintaining the,future debt requirements. This analysis will verify that the City is maintaining the,future debt requirements. This analysis will verify that the City is maintaining the,future debt requirements. This analysis will verify that the City is maintaining the,future debt requirements. This analysis will verify that the City is maintaining the,future debt requirements. This analysis will verify that the City is maintaining the,future debt requirements. This analysis will verify that the City is maintaining the,future debt requirements. This analysis will verify that the City is maintaining the,future debt requirements. This analysis will verify that the City is maintaining the,future debt requirements. This analysis will verify that the City is maintaining the,future debt requirements. This analysis will verify that the City is maintaining the
following,ratios,and,will,be,performed,in,conjunction,with,the,City’s,Capital
Improvement Program (CIP) process. The guidelines that are utilized for direct City debt,Improvement Program (CIP) process. The guidelines that are utilized for direct City debt,Improvement Program (CIP) process. The guidelines that are utilized for direct City debt,Improvement Program (CIP) process. The guidelines that are utilized for direct City debt,Improvement Program (CIP) process. The guidelines that are utilized for direct City debt,Improvement Program (CIP) process. The guidelines that are utilized for direct City debt,Improvement Program (CIP) process. The guidelines that are utilized for direct City debt,Improvement Program (CIP) process. The guidelines that are utilized for direct City debt,Improvement Program (CIP) process. The guidelines that are utilized for direct City debt,Improvement Program (CIP) process. The guidelines that are utilized for direct City debt,Improvement Program (CIP) process. The guidelines that are utilized for direct City debt,Improvement Program (CIP) process. The guidelines that are utilized for direct City debt
are as follows:,are as follows:,,,,,,,,,,
1. The ratio of Net Tax-Supported Debt Service to General Fund Revenues should,1. The ratio of Net Tax-Supported Debt Service to General Fund Revenues should,1. The ratio of Net Tax-Supported Debt Service to General Fund Revenues should,1. The ratio of Net Tax-Supported Debt Service to General Fund Revenues should,1. The ratio of Net Tax-Supported Debt Service to General Fund Revenues should,1. The ratio of Net Tax-Supported Debt Service to General Fund Revenues should,1. The ratio of Net Tax-Supported Debt Service to General Fund Revenues should,1. The ratio of Net Tax-Supported Debt Service to General Fund Revenues should,1. The ratio of Net Tax-Supported Debt Service to General Fund Revenues should,1. The ratio of Net Tax-Supported Debt Service to General Fund Revenues should,1. The ratio of Net Tax-Supported Debt Service to General Fund Revenues should,1. The ratio of Net Tax-Supported Debt Service to General Fund Revenues should
"not exceed 12%, within the six-year CIP projection;","not exceed 12%, within the six-year CIP projection;","not exceed 12%, within the six-year CIP projection;","not exceed 12%, within the six-year CIP projection;","not exceed 12%, within the six-year CIP projection;","not exceed 12%, within the six-year CIP projection;","not exceed 12%, within the six-year CIP projection;","not exceed 12%, within the six-year CIP projection;",,,,
,,,,,27,27,,,,,
,2. The ratio of Net Tax-Supported Debt Service to Market Value should not exceed,2. The ratio of Net Tax-Supported Debt Service to Market Value should not exceed,2. The ratio of Net Tax-Supported Debt Service to Market Value should not exceed,2. The ratio of Net Tax-Supported Debt Service to Market Value should not exceed,2. The ratio of Net Tax-Supported Debt Service to Market Value should not exceed,2. The ratio of Net Tax-Supported Debt Service to Market Value should not exceed,2. The ratio of Net Tax-Supported Debt Service to Market Value should not exceed,2. The ratio of Net Tax-Supported Debt Service to Market Value should not exceed,2. The ratio of Net Tax-Supported Debt Service to Market Value should not exceed,2. The ratio of Net Tax-Supported Debt Service to Market Value should not exceed,2. The ratio of Net Tax-Supported Debt Service to Market Value should not exceed,2. The ratio of Net Tax-Supported Debt Service to Market Value should not exceed
,,"four percent (4%), within the six-year CIP projection;","four percent (4%), within the six-year CIP projection;","four percent (4%), within the six-year CIP projection;","four percent (4%), within the six-year CIP projection;","four percent (4%), within the six-year CIP projection;","four percent (4%), within the six-year CIP projection;","four percent (4%), within the six-year CIP projection;","four percent (4%), within the six-year CIP projection;",,,
,3.,The 10 Year Debt Payout Ratio of Net Tax-Supported Debt Service Should Be,The 10 Year Debt Payout Ratio of Net Tax-Supported Debt Service Should Be,The 10 Year Debt Payout Ratio of Net Tax-Supported Debt Service Should Be,The 10 Year Debt Payout Ratio of Net Tax-Supported Debt Service Should Be,The 10 Year Debt Payout Ratio of Net Tax-Supported Debt Service Should Be,The 10 Year Debt Payout Ratio of Net Tax-Supported Debt Service Should Be,The 10 Year Debt Payout Ratio of Net Tax-Supported Debt Service Should Be,The 10 Year Debt Payout Ratio of Net Tax-Supported Debt Service Should Be,The 10 Year Debt Payout Ratio of Net Tax-Supported Debt Service Should Be,The 10 Year Debt Payout Ratio of Net Tax-Supported Debt Service Should Be,The 10 Year Debt Payout Ratio of Net Tax-Supported Debt Service Should Be
,,Greater Than or Equal To 50%.,Greater Than or Equal To 50%.,Greater Than or Equal To 50%.,Greater Than or Equal To 50%.,Greater Than or Equal To 50%.,,,,,,
Utility Fund Debt,Utility Fund Debt,Utility Fund Debt,Utility Fund Debt,Utility Fund Debt,,,,,,,,
The City will adopt annual water and sewer rates that will generate sufficient revenues to,The City will adopt annual water and sewer rates that will generate sufficient revenues to,The City will adopt annual water and sewer rates that will generate sufficient revenues to,The City will adopt annual water and sewer rates that will generate sufficient revenues to,The City will adopt annual water and sewer rates that will generate sufficient revenues to,The City will adopt annual water and sewer rates that will generate sufficient revenues to,The City will adopt annual water and sewer rates that will generate sufficient revenues to,The City will adopt annual water and sewer rates that will generate sufficient revenues to,The City will adopt annual water and sewer rates that will generate sufficient revenues to,The City will adopt annual water and sewer rates that will generate sufficient revenues to,The City will adopt annual water and sewer rates that will generate sufficient revenues to,The City will adopt annual water and sewer rates that will generate sufficient revenues to,The City will adopt annual water and sewer rates that will generate sufficient revenues to
meet the legal requirements of Enterprise Fund bond covenants. These rates will also,meet the legal requirements of Enterprise Fund bond covenants. These rates will also,meet the legal requirements of Enterprise Fund bond covenants. These rates will also,meet the legal requirements of Enterprise Fund bond covenants. These rates will also,meet the legal requirements of Enterprise Fund bond covenants. These rates will also,meet the legal requirements of Enterprise Fund bond covenants. These rates will also,meet the legal requirements of Enterprise Fund bond covenants. These rates will also,meet the legal requirements of Enterprise Fund bond covenants. These rates will also,meet the legal requirements of Enterprise Fund bond covenants. These rates will also,meet the legal requirements of Enterprise Fund bond covenants. These rates will also,meet the legal requirements of Enterprise Fund bond covenants. These rates will also,meet the legal requirements of Enterprise Fund bond covenants. These rates will also,meet the legal requirements of Enterprise Fund bond covenants. These rates will also
allow for adequate capital replacement in water and sewer systems.,allow for adequate capital replacement in water and sewer systems.,allow for adequate capital replacement in water and sewer systems.,allow for adequate capital replacement in water and sewer systems.,allow for adequate capital replacement in water and sewer systems.,allow for adequate capital replacement in water and sewer systems.,allow for adequate capital replacement in water and sewer systems.,allow for adequate capital replacement in water and sewer systems.,allow for adequate capital replacement in water and sewer systems.,allow for adequate capital replacement in water and sewer systems.,allow for adequate capital replacement in water and sewer systems.,,
Refunding Bonds,Refunding Bonds,Refunding Bonds,Refunding Bonds,Refunding Bonds,,,,,,,,
"The City, with the assistance of its Financial Advisor, shall monitor the City’s debt","The City, with the assistance of its Financial Advisor, shall monitor the City’s debt","The City, with the assistance of its Financial Advisor, shall monitor the City’s debt","The City, with the assistance of its Financial Advisor, shall monitor the City’s debt","The City, with the assistance of its Financial Advisor, shall monitor the City’s debt","The City, with the assistance of its Financial Advisor, shall monitor the City’s debt","The City, with the assistance of its Financial Advisor, shall monitor the City’s debt","The City, with the assistance of its Financial Advisor, shall monitor the City’s debt","The City, with the assistance of its Financial Advisor, shall monitor the City’s debt","The City, with the assistance of its Financial Advisor, shall monitor the City’s debt","The City, with the assistance of its Financial Advisor, shall monitor the City’s debt","The City, with the assistance of its Financial Advisor, shall monitor the City’s debt","The City, with the assistance of its Financial Advisor, shall monitor the City’s debt"
portfolio,portfolio,on,a,regular,basis,for,refunding,opportunities.,opportunities.,When,contemplating,a
"refunding, the City will have a minimum of 3.0% economic savings (as expressed on a","refunding, the City will have a minimum of 3.0% economic savings (as expressed on a","refunding, the City will have a minimum of 3.0% economic savings (as expressed on a","refunding, the City will have a minimum of 3.0% economic savings (as expressed on a","refunding, the City will have a minimum of 3.0% economic savings (as expressed on a","refunding, the City will have a minimum of 3.0% economic savings (as expressed on a","refunding, the City will have a minimum of 3.0% economic savings (as expressed on a","refunding, the City will have a minimum of 3.0% economic savings (as expressed on a","refunding, the City will have a minimum of 3.0% economic savings (as expressed on a","refunding, the City will have a minimum of 3.0% economic savings (as expressed on a","refunding, the City will have a minimum of 3.0% economic savings (as expressed on a","refunding, the City will have a minimum of 3.0% economic savings (as expressed on a","refunding, the City will have a minimum of 3.0% economic savings (as expressed on a"
net present value basis) as a benchmark to proceed with a refunding.,net present value basis) as a benchmark to proceed with a refunding.,net present value basis) as a benchmark to proceed with a refunding.,net present value basis) as a benchmark to proceed with a refunding.,net present value basis) as a benchmark to proceed with a refunding.,net present value basis) as a benchmark to proceed with a refunding.,net present value basis) as a benchmark to proceed with a refunding.,net present value basis) as a benchmark to proceed with a refunding.,net present value basis) as a benchmark to proceed with a refunding.,net present value basis) as a benchmark to proceed with a refunding.,net present value basis) as a benchmark to proceed with a refunding.,This policy is not,This policy is not
intended to preclude the possibility of refunding one or more maturities of existing debt,intended to preclude the possibility of refunding one or more maturities of existing debt,intended to preclude the possibility of refunding one or more maturities of existing debt,intended to preclude the possibility of refunding one or more maturities of existing debt,intended to preclude the possibility of refunding one or more maturities of existing debt,intended to preclude the possibility of refunding one or more maturities of existing debt,intended to preclude the possibility of refunding one or more maturities of existing debt,intended to preclude the possibility of refunding one or more maturities of existing debt,intended to preclude the possibility of refunding one or more maturities of existing debt,intended to preclude the possibility of refunding one or more maturities of existing debt,intended to preclude the possibility of refunding one or more maturities of existing debt,intended to preclude the possibility of refunding one or more maturities of existing debt,intended to preclude the possibility of refunding one or more maturities of existing debt
