Name: “Table 1 of 1 on page 5 of 9”,Name: “Table 1 of 1 on page 5 of 9”,Name: “Table 1 of 1 on page 5 of 9”,Name: “Table 1 of 1 on page 5 of 9”,Name: “Table 1 of 1 on page 5 of 9”,Name: “Table 1 of 1 on page 5 of 9”,Name: “Table 1 of 1 on page 5 of 9”,Name: “Table 1 of 1 on page 5 of 9”,Name: “Table 1 of 1 on page 5 of 9”,Name: “Table 1 of 1 on page 5 of 9”,Name: “Table 1 of 1 on page 5 of 9”,Name: “Table 1 of 1 on page 5 of 9”,Name: “Table 1 of 1 on page 5 of 9”,Name: “Table 1 of 1 on page 5 of 9”
Table: 5,Table: 5,Table: 5,Table: 5,Table: 5,Table: 5,Table: 5,Table: 5,Table: 5,Table: 5,Table: 5,Table: 5,Table: 5,Table: 5
,,,,,,,,,,,,,
does not impair the City’s creditworthiness (All expenses related to the conduit financing,does not impair the City’s creditworthiness (All expenses related to the conduit financing,does not impair the City’s creditworthiness (All expenses related to the conduit financing,does not impair the City’s creditworthiness (All expenses related to the conduit financing,does not impair the City’s creditworthiness (All expenses related to the conduit financing,does not impair the City’s creditworthiness (All expenses related to the conduit financing,does not impair the City’s creditworthiness (All expenses related to the conduit financing,does not impair the City’s creditworthiness (All expenses related to the conduit financing,does not impair the City’s creditworthiness (All expenses related to the conduit financing,does not impair the City’s creditworthiness (All expenses related to the conduit financing,does not impair the City’s creditworthiness (All expenses related to the conduit financing,does not impair the City’s creditworthiness (All expenses related to the conduit financing,does not impair the City’s creditworthiness (All expenses related to the conduit financing,does not impair the City’s creditworthiness (All expenses related to the conduit financing
will be borne by the applicants).,will be borne by the applicants).,will be borne by the applicants).,will be borne by the applicants).,will be borne by the applicants).,will be borne by the applicants).,,,,,,,,
"Except as noted below, long-term obligations issued through the City must qualify for an","Except as noted below, long-term obligations issued through the City must qualify for an","Except as noted below, long-term obligations issued through the City must qualify for an","Except as noted below, long-term obligations issued through the City must qualify for an","Except as noted below, long-term obligations issued through the City must qualify for an","Except as noted below, long-term obligations issued through the City must qualify for an","Except as noted below, long-term obligations issued through the City must qualify for an","Except as noted below, long-term obligations issued through the City must qualify for an","Except as noted below, long-term obligations issued through the City must qualify for an","Except as noted below, long-term obligations issued through the City must qualify for an","Except as noted below, long-term obligations issued through the City must qualify for an","Except as noted below, long-term obligations issued through the City must qualify for an","Except as noted below, long-term obligations issued through the City must qualify for an","Except as noted below, long-term obligations issued through the City must qualify for an"
underlying (i.e.; rated on the basis of the security for the loan) investment grade rating by,underlying (i.e.; rated on the basis of the security for the loan) investment grade rating by,underlying (i.e.; rated on the basis of the security for the loan) investment grade rating by,underlying (i.e.; rated on the basis of the security for the loan) investment grade rating by,underlying (i.e.; rated on the basis of the security for the loan) investment grade rating by,underlying (i.e.; rated on the basis of the security for the loan) investment grade rating by,underlying (i.e.; rated on the basis of the security for the loan) investment grade rating by,underlying (i.e.; rated on the basis of the security for the loan) investment grade rating by,underlying (i.e.; rated on the basis of the security for the loan) investment grade rating by,underlying (i.e.; rated on the basis of the security for the loan) investment grade rating by,underlying (i.e.; rated on the basis of the security for the loan) investment grade rating by,underlying (i.e.; rated on the basis of the security for the loan) investment grade rating by,underlying (i.e.; rated on the basis of the security for the loan) investment grade rating by,underlying (i.e.; rated on the basis of the security for the loan) investment grade rating by
one,of,the,nationally,recognized,recognized,rating,agencies,or,qualify,for,alternative,alternative,credit
enhancement. An exception to this requirement would be debt issued via the Virginia,enhancement. An exception to this requirement would be debt issued via the Virginia,enhancement. An exception to this requirement would be debt issued via the Virginia,enhancement. An exception to this requirement would be debt issued via the Virginia,enhancement. An exception to this requirement would be debt issued via the Virginia,enhancement. An exception to this requirement would be debt issued via the Virginia,enhancement. An exception to this requirement would be debt issued via the Virginia,enhancement. An exception to this requirement would be debt issued via the Virginia,enhancement. An exception to this requirement would be debt issued via the Virginia,enhancement. An exception to this requirement would be debt issued via the Virginia,enhancement. An exception to this requirement would be debt issued via the Virginia,enhancement. An exception to this requirement would be debt issued via the Virginia,enhancement. An exception to this requirement would be debt issued via the Virginia,enhancement. An exception to this requirement would be debt issued via the Virginia
"Resources Authority, a political subdivision of the Commonwealth of Virginia. In the","Resources Authority, a political subdivision of the Commonwealth of Virginia. In the","Resources Authority, a political subdivision of the Commonwealth of Virginia. In the","Resources Authority, a political subdivision of the Commonwealth of Virginia. In the","Resources Authority, a political subdivision of the Commonwealth of Virginia. In the","Resources Authority, a political subdivision of the Commonwealth of Virginia. In the","Resources Authority, a political subdivision of the Commonwealth of Virginia. In the","Resources Authority, a political subdivision of the Commonwealth of Virginia. In the","Resources Authority, a political subdivision of the Commonwealth of Virginia. In the","Resources Authority, a political subdivision of the Commonwealth of Virginia. In the","Resources Authority, a political subdivision of the Commonwealth of Virginia. In the","Resources Authority, a political subdivision of the Commonwealth of Virginia. In the","Resources Authority, a political subdivision of the Commonwealth of Virginia. In the","Resources Authority, a political subdivision of the Commonwealth of Virginia. In the"
case of long-term obligations that are privately placed as bank qualified investments by,case of long-term obligations that are privately placed as bank qualified investments by,case of long-term obligations that are privately placed as bank qualified investments by,case of long-term obligations that are privately placed as bank qualified investments by,case of long-term obligations that are privately placed as bank qualified investments by,case of long-term obligations that are privately placed as bank qualified investments by,case of long-term obligations that are privately placed as bank qualified investments by,case of long-term obligations that are privately placed as bank qualified investments by,case of long-term obligations that are privately placed as bank qualified investments by,case of long-term obligations that are privately placed as bank qualified investments by,case of long-term obligations that are privately placed as bank qualified investments by,case of long-term obligations that are privately placed as bank qualified investments by,case of long-term obligations that are privately placed as bank qualified investments by,case of long-term obligations that are privately placed as bank qualified investments by
"the City, such obligations would not be required to qualify for an investment grade rating.","the City, such obligations would not be required to qualify for an investment grade rating.","the City, such obligations would not be required to qualify for an investment grade rating.","the City, such obligations would not be required to qualify for an investment grade rating.","the City, such obligations would not be required to qualify for an investment grade rating.","the City, such obligations would not be required to qualify for an investment grade rating.","the City, such obligations would not be required to qualify for an investment grade rating.","the City, such obligations would not be required to qualify for an investment grade rating.","the City, such obligations would not be required to qualify for an investment grade rating.","the City, such obligations would not be required to qualify for an investment grade rating.","the City, such obligations would not be required to qualify for an investment grade rating.","the City, such obligations would not be required to qualify for an investment grade rating.","the City, such obligations would not be required to qualify for an investment grade rating.","the City, such obligations would not be required to qualify for an investment grade rating."
The,City,shall,,encourage,and,maintain,good,relations,with,credit,rating,rating,"agencies,"
investors,investors,in,the,City’s,long-term,financial,financial,"obligations,",and,those,in,the,financial
community who participate in the issuance and sale of our long-term obligations. A,community who participate in the issuance and sale of our long-term obligations. A,community who participate in the issuance and sale of our long-term obligations. A,community who participate in the issuance and sale of our long-term obligations. A,community who participate in the issuance and sale of our long-term obligations. A,community who participate in the issuance and sale of our long-term obligations. A,community who participate in the issuance and sale of our long-term obligations. A,community who participate in the issuance and sale of our long-term obligations. A,community who participate in the issuance and sale of our long-term obligations. A,community who participate in the issuance and sale of our long-term obligations. A,community who participate in the issuance and sale of our long-term obligations. A,community who participate in the issuance and sale of our long-term obligations. A,community who participate in the issuance and sale of our long-term obligations. A,community who participate in the issuance and sale of our long-term obligations. A
policy of full and open disclosure on every financial report and long-term obligation,policy of full and open disclosure on every financial report and long-term obligation,policy of full and open disclosure on every financial report and long-term obligation,policy of full and open disclosure on every financial report and long-term obligation,policy of full and open disclosure on every financial report and long-term obligation,policy of full and open disclosure on every financial report and long-term obligation,policy of full and open disclosure on every financial report and long-term obligation,policy of full and open disclosure on every financial report and long-term obligation,policy of full and open disclosure on every financial report and long-term obligation,policy of full and open disclosure on every financial report and long-term obligation,policy of full and open disclosure on every financial report and long-term obligation,policy of full and open disclosure on every financial report and long-term obligation,policy of full and open disclosure on every financial report and long-term obligation,policy of full and open disclosure on every financial report and long-term obligation
transaction will be enforced and credit rating agency presentations/updates shall be,transaction will be enforced and credit rating agency presentations/updates shall be,transaction will be enforced and credit rating agency presentations/updates shall be,transaction will be enforced and credit rating agency presentations/updates shall be,transaction will be enforced and credit rating agency presentations/updates shall be,transaction will be enforced and credit rating agency presentations/updates shall be,transaction will be enforced and credit rating agency presentations/updates shall be,transaction will be enforced and credit rating agency presentations/updates shall be,transaction will be enforced and credit rating agency presentations/updates shall be,transaction will be enforced and credit rating agency presentations/updates shall be,transaction will be enforced and credit rating agency presentations/updates shall be,transaction will be enforced and credit rating agency presentations/updates shall be,transaction will be enforced and credit rating agency presentations/updates shall be,transaction will be enforced and credit rating agency presentations/updates shall be
conducted at least annually.,conducted at least annually.,conducted at least annually.,conducted at least annually.,conducted at least annually.,,,,,,,,,
The City shall comply with all on-going disclosure requirements and shall file such,The City shall comply with all on-going disclosure requirements and shall file such,The City shall comply with all on-going disclosure requirements and shall file such,The City shall comply with all on-going disclosure requirements and shall file such,The City shall comply with all on-going disclosure requirements and shall file such,The City shall comply with all on-going disclosure requirements and shall file such,The City shall comply with all on-going disclosure requirements and shall file such,The City shall comply with all on-going disclosure requirements and shall file such,The City shall comply with all on-going disclosure requirements and shall file such,The City shall comply with all on-going disclosure requirements and shall file such,The City shall comply with all on-going disclosure requirements and shall file such,The City shall comply with all on-going disclosure requirements and shall file such,The City shall comply with all on-going disclosure requirements and shall file such,The City shall comply with all on-going disclosure requirements and shall file such
documents in a timely manner.,documents in a timely manner.,documents in a timely manner.,documents in a timely manner.,documents in a timely manner.,documents in a timely manner.,,,,,,,,
The City shall monitor earnings on bond proceeds and rebate excess earnings as required,The City shall monitor earnings on bond proceeds and rebate excess earnings as required,The City shall monitor earnings on bond proceeds and rebate excess earnings as required,The City shall monitor earnings on bond proceeds and rebate excess earnings as required,The City shall monitor earnings on bond proceeds and rebate excess earnings as required,The City shall monitor earnings on bond proceeds and rebate excess earnings as required,The City shall monitor earnings on bond proceeds and rebate excess earnings as required,The City shall monitor earnings on bond proceeds and rebate excess earnings as required,The City shall monitor earnings on bond proceeds and rebate excess earnings as required,The City shall monitor earnings on bond proceeds and rebate excess earnings as required,The City shall monitor earnings on bond proceeds and rebate excess earnings as required,The City shall monitor earnings on bond proceeds and rebate excess earnings as required,The City shall monitor earnings on bond proceeds and rebate excess earnings as required,The City shall monitor earnings on bond proceeds and rebate excess earnings as required
to the U.S. Treasury to avoid the loss of tax-exempt status.,to the U.S. Treasury to avoid the loss of tax-exempt status.,to the U.S. Treasury to avoid the loss of tax-exempt status.,to the U.S. Treasury to avoid the loss of tax-exempt status.,to the U.S. Treasury to avoid the loss of tax-exempt status.,to the U.S. Treasury to avoid the loss of tax-exempt status.,to the U.S. Treasury to avoid the loss of tax-exempt status.,to the U.S. Treasury to avoid the loss of tax-exempt status.,to the U.S. Treasury to avoid the loss of tax-exempt status.,,,,,
The City will enforce filing notices of completion on all projects within five years of their,The City will enforce filing notices of completion on all projects within five years of their,The City will enforce filing notices of completion on all projects within five years of their,The City will enforce filing notices of completion on all projects within five years of their,The City will enforce filing notices of completion on all projects within five years of their,The City will enforce filing notices of completion on all projects within five years of their,The City will enforce filing notices of completion on all projects within five years of their,The City will enforce filing notices of completion on all projects within five years of their,The City will enforce filing notices of completion on all projects within five years of their,The City will enforce filing notices of completion on all projects within five years of their,The City will enforce filing notices of completion on all projects within five years of their,The City will enforce filing notices of completion on all projects within five years of their,The City will enforce filing notices of completion on all projects within five years of their,The City will enforce filing notices of completion on all projects within five years of their
financing.,financing.,,,,,,,,,,,,
The,City,shall,,continually,review,outstanding,outstanding,obligations,and,aggressively,aggressively,aggressively,initiate
refinancings when economically feasible and advantageous.,refinancings when economically feasible and advantageous.,refinancings when economically feasible and advantageous.,refinancings when economically feasible and advantageous.,refinancings when economically feasible and advantageous.,refinancings when economically feasible and advantageous.,refinancings when economically feasible and advantageous.,refinancings when economically feasible and advantageous.,refinancings when economically feasible and advantageous.,,,,,
The Chief Financial Officer will periodically report unspent capital project funds to the,The Chief Financial Officer will periodically report unspent capital project funds to the,The Chief Financial Officer will periodically report unspent capital project funds to the,The Chief Financial Officer will periodically report unspent capital project funds to the,The Chief Financial Officer will periodically report unspent capital project funds to the,The Chief Financial Officer will periodically report unspent capital project funds to the,The Chief Financial Officer will periodically report unspent capital project funds to the,The Chief Financial Officer will periodically report unspent capital project funds to the,The Chief Financial Officer will periodically report unspent capital project funds to the,The Chief Financial Officer will periodically report unspent capital project funds to the,The Chief Financial Officer will periodically report unspent capital project funds to the,The Chief Financial Officer will periodically report unspent capital project funds to the,The Chief Financial Officer will periodically report unspent capital project funds to the,The Chief Financial Officer will periodically report unspent capital project funds to the
City Manager and City Council not less than annually.,City Manager and City Council not less than annually.,City Manager and City Council not less than annually.,City Manager and City Council not less than annually.,City Manager and City Council not less than annually.,City Manager and City Council not less than annually.,City Manager and City Council not less than annually.,City Manager and City Council not less than annually.,,,,,,
Debt Administration,Debt Administration,Debt Administration,Debt Administration,,,,,,,,,,
The City shall comply with the Internal Revenue Code Section 148 — Arbitrage,The City shall comply with the Internal Revenue Code Section 148 — Arbitrage,The City shall comply with the Internal Revenue Code Section 148 — Arbitrage,The City shall comply with the Internal Revenue Code Section 148 — Arbitrage,The City shall comply with the Internal Revenue Code Section 148 — Arbitrage,The City shall comply with the Internal Revenue Code Section 148 — Arbitrage,The City shall comply with the Internal Revenue Code Section 148 — Arbitrage,The City shall comply with the Internal Revenue Code Section 148 — Arbitrage,The City shall comply with the Internal Revenue Code Section 148 — Arbitrage,The City shall comply with the Internal Revenue Code Section 148 — Arbitrage,The City shall comply with the Internal Revenue Code Section 148 — Arbitrage,The City shall comply with the Internal Revenue Code Section 148 — Arbitrage,The City shall comply with the Internal Revenue Code Section 148 — Arbitrage,The City shall comply with the Internal Revenue Code Section 148 — Arbitrage
Regulations for all tax-exempt debt issued. An annual estimate of arbitrage liabilities,Regulations for all tax-exempt debt issued. An annual estimate of arbitrage liabilities,Regulations for all tax-exempt debt issued. An annual estimate of arbitrage liabilities,Regulations for all tax-exempt debt issued. An annual estimate of arbitrage liabilities,Regulations for all tax-exempt debt issued. An annual estimate of arbitrage liabilities,Regulations for all tax-exempt debt issued. An annual estimate of arbitrage liabilities,Regulations for all tax-exempt debt issued. An annual estimate of arbitrage liabilities,Regulations for all tax-exempt debt issued. An annual estimate of arbitrage liabilities,Regulations for all tax-exempt debt issued. An annual estimate of arbitrage liabilities,Regulations for all tax-exempt debt issued. An annual estimate of arbitrage liabilities,Regulations for all tax-exempt debt issued. An annual estimate of arbitrage liabilities,Regulations for all tax-exempt debt issued. An annual estimate of arbitrage liabilities,Regulations for all tax-exempt debt issued. An annual estimate of arbitrage liabilities,Regulations for all tax-exempt debt issued. An annual estimate of arbitrage liabilities
shall be obtained by the City and recorded on the financial statements.,shall be obtained by the City and recorded on the financial statements.,shall be obtained by the City and recorded on the financial statements.,shall be obtained by the City and recorded on the financial statements.,shall be obtained by the City and recorded on the financial statements.,shall be obtained by the City and recorded on the financial statements.,shall be obtained by the City and recorded on the financial statements.,shall be obtained by the City and recorded on the financial statements.,shall be obtained by the City and recorded on the financial statements.,shall be obtained by the City and recorded on the financial statements.,shall be obtained by the City and recorded on the financial statements.,,,
A good faith deposit of 2.0% of the par amount of the bond sale shall be presented by,A good faith deposit of 2.0% of the par amount of the bond sale shall be presented by,A good faith deposit of 2.0% of the par amount of the bond sale shall be presented by,A good faith deposit of 2.0% of the par amount of the bond sale shall be presented by,A good faith deposit of 2.0% of the par amount of the bond sale shall be presented by,A good faith deposit of 2.0% of the par amount of the bond sale shall be presented by,A good faith deposit of 2.0% of the par amount of the bond sale shall be presented by,A good faith deposit of 2.0% of the par amount of the bond sale shall be presented by,A good faith deposit of 2.0% of the par amount of the bond sale shall be presented by,A good faith deposit of 2.0% of the par amount of the bond sale shall be presented by,A good faith deposit of 2.0% of the par amount of the bond sale shall be presented by,A good faith deposit of 2.0% of the par amount of the bond sale shall be presented by,A good faith deposit of 2.0% of the par amount of the bond sale shall be presented by,A good faith deposit of 2.0% of the par amount of the bond sale shall be presented by
