Name: “Table 1 of 1 on page 21 of 166”,Name: “Table 1 of 1 on page 21 of 166”,Name: “Table 1 of 1 on page 21 of 166”,Name: “Table 1 of 1 on page 21 of 166”,Name: “Table 1 of 1 on page 21 of 166”,Name: “Table 1 of 1 on page 21 of 166”,Name: “Table 1 of 1 on page 21 of 166”,Name: “Table 1 of 1 on page 21 of 166”,Name: “Table 1 of 1 on page 21 of 166”,Name: “Table 1 of 1 on page 21 of 166”,Name: “Table 1 of 1 on page 21 of 166”,Name: “Table 1 of 1 on page 21 of 166”,Name: “Table 1 of 1 on page 21 of 166”,Name: “Table 1 of 1 on page 21 of 166”,Name: “Table 1 of 1 on page 21 of 166”,Name: “Table 1 of 1 on page 21 of 166”,Name: “Table 1 of 1 on page 21 of 166”,Name: “Table 1 of 1 on page 21 of 166”,Name: “Table 1 of 1 on page 21 of 166”,Name: “Table 1 of 1 on page 21 of 166”,Name: “Table 1 of 1 on page 21 of 166”
Table: 21,Table: 21,Table: 21,Table: 21,Table: 21,Table: 21,Table: 21,Table: 21,Table: 21,Table: 21,Table: 21,Table: 21,Table: 21,Table: 21,Table: 21,Table: 21,Table: 21,Table: 21,Table: 21,Table: 21,Table: 21
,,,,,,,,,,,,,,,,,,,,
,,,,,,,,,,,,,,,,,,,,
,,,,,County Administrator's Budget Message,County Administrator's Budget Message,County Administrator's Budget Message,County Administrator's Budget Message,County Administrator's Budget Message,County Administrator's Budget Message,County Administrator's Budget Message,County Administrator's Budget Message,County Administrator's Budget Message,County Administrator's Budget Message,County Administrator's Budget Message,County Administrator's Budget Message,,,,
To: The Members of the Board of Supervisors,To: The Members of the Board of Supervisors,To: The Members of the Board of Supervisors,To: The Members of the Board of Supervisors,To: The Members of the Board of Supervisors,To: The Members of the Board of Supervisors,To: The Members of the Board of Supervisors,To: The Members of the Board of Supervisors,To: The Members of the Board of Supervisors,To: The Members of the Board of Supervisors,To: The Members of the Board of Supervisors,To: The Members of the Board of Supervisors,To: The Members of the Board of Supervisors,To: The Members of the Board of Supervisors,To: The Members of the Board of Supervisors,,,,,,
In this document I present to you and the citizens of James City County the proposed budget for,In this document I present to you and the citizens of James City County the proposed budget for,In this document I present to you and the citizens of James City County the proposed budget for,In this document I present to you and the citizens of James City County the proposed budget for,In this document I present to you and the citizens of James City County the proposed budget for,In this document I present to you and the citizens of James City County the proposed budget for,In this document I present to you and the citizens of James City County the proposed budget for,In this document I present to you and the citizens of James City County the proposed budget for,In this document I present to you and the citizens of James City County the proposed budget for,In this document I present to you and the citizens of James City County the proposed budget for,In this document I present to you and the citizens of James City County the proposed budget for,In this document I present to you and the citizens of James City County the proposed budget for,In this document I present to you and the citizens of James City County the proposed budget for,In this document I present to you and the citizens of James City County the proposed budget for,In this document I present to you and the citizens of James City County the proposed budget for,In this document I present to you and the citizens of James City County the proposed budget for,In this document I present to you and the citizens of James City County the proposed budget for,In this document I present to you and the citizens of James City County the proposed budget for,In this document I present to you and the citizens of James City County the proposed budget for,In this document I present to you and the citizens of James City County the proposed budget for,In this document I present to you and the citizens of James City County the proposed budget for
"the Fiscal Year 2012 beginning July 1, 2011 (FY 2012). This is a restrained budget that attempts","the Fiscal Year 2012 beginning July 1, 2011 (FY 2012). This is a restrained budget that attempts","the Fiscal Year 2012 beginning July 1, 2011 (FY 2012). This is a restrained budget that attempts","the Fiscal Year 2012 beginning July 1, 2011 (FY 2012). This is a restrained budget that attempts","the Fiscal Year 2012 beginning July 1, 2011 (FY 2012). This is a restrained budget that attempts","the Fiscal Year 2012 beginning July 1, 2011 (FY 2012). This is a restrained budget that attempts","the Fiscal Year 2012 beginning July 1, 2011 (FY 2012). This is a restrained budget that attempts","the Fiscal Year 2012 beginning July 1, 2011 (FY 2012). This is a restrained budget that attempts","the Fiscal Year 2012 beginning July 1, 2011 (FY 2012). This is a restrained budget that attempts","the Fiscal Year 2012 beginning July 1, 2011 (FY 2012). This is a restrained budget that attempts","the Fiscal Year 2012 beginning July 1, 2011 (FY 2012). This is a restrained budget that attempts","the Fiscal Year 2012 beginning July 1, 2011 (FY 2012). This is a restrained budget that attempts","the Fiscal Year 2012 beginning July 1, 2011 (FY 2012). This is a restrained budget that attempts","the Fiscal Year 2012 beginning July 1, 2011 (FY 2012). This is a restrained budget that attempts","the Fiscal Year 2012 beginning July 1, 2011 (FY 2012). This is a restrained budget that attempts","the Fiscal Year 2012 beginning July 1, 2011 (FY 2012). This is a restrained budget that attempts","the Fiscal Year 2012 beginning July 1, 2011 (FY 2012). This is a restrained budget that attempts","the Fiscal Year 2012 beginning July 1, 2011 (FY 2012). This is a restrained budget that attempts","the Fiscal Year 2012 beginning July 1, 2011 (FY 2012). This is a restrained budget that attempts","the Fiscal Year 2012 beginning July 1, 2011 (FY 2012). This is a restrained budget that attempts","the Fiscal Year 2012 beginning July 1, 2011 (FY 2012). This is a restrained budget that attempts"
to,reallocate,reallocate,resources,resources,resources,to,meet,,community,community,community,needs,and,avoid,adding,adding,annual,recurring,recurring,recurring
"expenditures. Even though some revenues and economic indicators are beginning to increase,","expenditures. Even though some revenues and economic indicators are beginning to increase,","expenditures. Even though some revenues and economic indicators are beginning to increase,","expenditures. Even though some revenues and economic indicators are beginning to increase,","expenditures. Even though some revenues and economic indicators are beginning to increase,","expenditures. Even though some revenues and economic indicators are beginning to increase,","expenditures. Even though some revenues and economic indicators are beginning to increase,","expenditures. Even though some revenues and economic indicators are beginning to increase,","expenditures. Even though some revenues and economic indicators are beginning to increase,","expenditures. Even though some revenues and economic indicators are beginning to increase,","expenditures. Even though some revenues and economic indicators are beginning to increase,","expenditures. Even though some revenues and economic indicators are beginning to increase,","expenditures. Even though some revenues and economic indicators are beginning to increase,","expenditures. Even though some revenues and economic indicators are beginning to increase,","expenditures. Even though some revenues and economic indicators are beginning to increase,","expenditures. Even though some revenues and economic indicators are beginning to increase,","expenditures. Even though some revenues and economic indicators are beginning to increase,","expenditures. Even though some revenues and economic indicators are beginning to increase,","expenditures. Even though some revenues and economic indicators are beginning to increase,","expenditures. Even though some revenues and economic indicators are beginning to increase,","expenditures. Even though some revenues and economic indicators are beginning to increase,"
this budget is prepared with a view to the next biennium (FY 2013-2014) and challenges that are,this budget is prepared with a view to the next biennium (FY 2013-2014) and challenges that are,this budget is prepared with a view to the next biennium (FY 2013-2014) and challenges that are,this budget is prepared with a view to the next biennium (FY 2013-2014) and challenges that are,this budget is prepared with a view to the next biennium (FY 2013-2014) and challenges that are,this budget is prepared with a view to the next biennium (FY 2013-2014) and challenges that are,this budget is prepared with a view to the next biennium (FY 2013-2014) and challenges that are,this budget is prepared with a view to the next biennium (FY 2013-2014) and challenges that are,this budget is prepared with a view to the next biennium (FY 2013-2014) and challenges that are,this budget is prepared with a view to the next biennium (FY 2013-2014) and challenges that are,this budget is prepared with a view to the next biennium (FY 2013-2014) and challenges that are,this budget is prepared with a view to the next biennium (FY 2013-2014) and challenges that are,this budget is prepared with a view to the next biennium (FY 2013-2014) and challenges that are,this budget is prepared with a view to the next biennium (FY 2013-2014) and challenges that are,this budget is prepared with a view to the next biennium (FY 2013-2014) and challenges that are,this budget is prepared with a view to the next biennium (FY 2013-2014) and challenges that are,this budget is prepared with a view to the next biennium (FY 2013-2014) and challenges that are,this budget is prepared with a view to the next biennium (FY 2013-2014) and challenges that are,this budget is prepared with a view to the next biennium (FY 2013-2014) and challenges that are,this budget is prepared with a view to the next biennium (FY 2013-2014) and challenges that are,this budget is prepared with a view to the next biennium (FY 2013-2014) and challenges that are
anticipated.,anticipated.,anticipated.,,,,,,,,,,,,,,,,,,
This budget restraint could be described by what is not included for FY 2012.,This budget restraint could be described by what is not included for FY 2012.,This budget restraint could be described by what is not included for FY 2012.,This budget restraint could be described by what is not included for FY 2012.,This budget restraint could be described by what is not included for FY 2012.,This budget restraint could be described by what is not included for FY 2012.,This budget restraint could be described by what is not included for FY 2012.,This budget restraint could be described by what is not included for FY 2012.,This budget restraint could be described by what is not included for FY 2012.,This budget restraint could be described by what is not included for FY 2012.,This budget restraint could be described by what is not included for FY 2012.,This budget restraint could be described by what is not included for FY 2012.,This budget restraint could be described by what is not included for FY 2012.,This budget restraint could be described by what is not included for FY 2012.,This budget restraint could be described by what is not included for FY 2012.,This budget restraint could be described by what is not included for FY 2012.,This budget restraint could be described by what is not included for FY 2012.,,,,
,,There are no changes in tax rates and no changes in fees.,There are no changes in tax rates and no changes in fees.,There are no changes in tax rates and no changes in fees.,There are no changes in tax rates and no changes in fees.,There are no changes in tax rates and no changes in fees.,There are no changes in tax rates and no changes in fees.,There are no changes in tax rates and no changes in fees.,There are no changes in tax rates and no changes in fees.,There are no changes in tax rates and no changes in fees.,There are no changes in tax rates and no changes in fees.,There are no changes in tax rates and no changes in fees.,There are no changes in tax rates and no changes in fees.,There are no changes in tax rates and no changes in fees.,,,,,,
,,There is no overall pay increase for County employees.,There is no overall pay increase for County employees.,There is no overall pay increase for County employees.,There is no overall pay increase for County employees.,There is no overall pay increase for County employees.,There is no overall pay increase for County employees.,There is no overall pay increase for County employees.,There is no overall pay increase for County employees.,There is no overall pay increase for County employees.,There is no overall pay increase for County employees.,There is no overall pay increase for County employees.,There is no overall pay increase for County employees.,,,,,,,
,,There is no increase in the number of County employees.,There is no increase in the number of County employees.,There is no increase in the number of County employees.,There is no increase in the number of County employees.,There is no increase in the number of County employees.,There is no increase in the number of County employees.,There is no increase in the number of County employees.,There is no increase in the number of County employees.,There is no increase in the number of County employees.,There is no increase in the number of County employees.,There is no increase in the number of County employees.,There is no increase in the number of County employees.,There is no increase in the number of County employees.,,,,,,
,,There is no general reassessment of real property.,There is no general reassessment of real property.,There is no general reassessment of real property.,There is no general reassessment of real property.,There is no general reassessment of real property.,There is no general reassessment of real property.,There is no general reassessment of real property.,There is no general reassessment of real property.,There is no general reassessment of real property.,There is no general reassessment of real property.,There is no general reassessment of real property.,,,,,,,,
This budget proposal includes a reallocation of internal resources that I have implemented in FY,This budget proposal includes a reallocation of internal resources that I have implemented in FY,This budget proposal includes a reallocation of internal resources that I have implemented in FY,This budget proposal includes a reallocation of internal resources that I have implemented in FY,This budget proposal includes a reallocation of internal resources that I have implemented in FY,This budget proposal includes a reallocation of internal resources that I have implemented in FY,This budget proposal includes a reallocation of internal resources that I have implemented in FY,This budget proposal includes a reallocation of internal resources that I have implemented in FY,This budget proposal includes a reallocation of internal resources that I have implemented in FY,This budget proposal includes a reallocation of internal resources that I have implemented in FY,This budget proposal includes a reallocation of internal resources that I have implemented in FY,This budget proposal includes a reallocation of internal resources that I have implemented in FY,This budget proposal includes a reallocation of internal resources that I have implemented in FY,This budget proposal includes a reallocation of internal resources that I have implemented in FY,This budget proposal includes a reallocation of internal resources that I have implemented in FY,This budget proposal includes a reallocation of internal resources that I have implemented in FY,This budget proposal includes a reallocation of internal resources that I have implemented in FY,This budget proposal includes a reallocation of internal resources that I have implemented in FY,This budget proposal includes a reallocation of internal resources that I have implemented in FY,This budget proposal includes a reallocation of internal resources that I have implemented in FY,This budget proposal includes a reallocation of internal resources that I have implemented in FY
"2011 and includes moving positions to target areas in the County’s organization, like economic","2011 and includes moving positions to target areas in the County’s organization, like economic","2011 and includes moving positions to target areas in the County’s organization, like economic","2011 and includes moving positions to target areas in the County’s organization, like economic","2011 and includes moving positions to target areas in the County’s organization, like economic","2011 and includes moving positions to target areas in the County’s organization, like economic","2011 and includes moving positions to target areas in the County’s organization, like economic","2011 and includes moving positions to target areas in the County’s organization, like economic","2011 and includes moving positions to target areas in the County’s organization, like economic","2011 and includes moving positions to target areas in the County’s organization, like economic","2011 and includes moving positions to target areas in the County’s organization, like economic","2011 and includes moving positions to target areas in the County’s organization, like economic","2011 and includes moving positions to target areas in the County’s organization, like economic","2011 and includes moving positions to target areas in the County’s organization, like economic","2011 and includes moving positions to target areas in the County’s organization, like economic","2011 and includes moving positions to target areas in the County’s organization, like economic","2011 and includes moving positions to target areas in the County’s organization, like economic","2011 and includes moving positions to target areas in the County’s organization, like economic","2011 and includes moving positions to target areas in the County’s organization, like economic","2011 and includes moving positions to target areas in the County’s organization, like economic","2011 and includes moving positions to target areas in the County’s organization, like economic"
"development and zoning enforcement, where I believe they can be used to significantly enhance","development and zoning enforcement, where I believe they can be used to significantly enhance","development and zoning enforcement, where I believe they can be used to significantly enhance","development and zoning enforcement, where I believe they can be used to significantly enhance","development and zoning enforcement, where I believe they can be used to significantly enhance","development and zoning enforcement, where I believe they can be used to significantly enhance","development and zoning enforcement, where I believe they can be used to significantly enhance","development and zoning enforcement, where I believe they can be used to significantly enhance","development and zoning enforcement, where I believe they can be used to significantly enhance","development and zoning enforcement, where I believe they can be used to significantly enhance","development and zoning enforcement, where I believe they can be used to significantly enhance","development and zoning enforcement, where I believe they can be used to significantly enhance","development and zoning enforcement, where I believe they can be used to significantly enhance","development and zoning enforcement, where I believe they can be used to significantly enhance","development and zoning enforcement, where I believe they can be used to significantly enhance","development and zoning enforcement, where I believe they can be used to significantly enhance","development and zoning enforcement, where I believe they can be used to significantly enhance","development and zoning enforcement, where I believe they can be used to significantly enhance","development and zoning enforcement, where I believe they can be used to significantly enhance","development and zoning enforcement, where I believe they can be used to significantly enhance","development and zoning enforcement, where I believe they can be used to significantly enhance"
those programs.,those programs.,those programs.,those programs.,,,,,,,,,,,,,,,,,
"This year we revisited the County’s Strategic Plan, the common foundation that guides our work.","This year we revisited the County’s Strategic Plan, the common foundation that guides our work.","This year we revisited the County’s Strategic Plan, the common foundation that guides our work.","This year we revisited the County’s Strategic Plan, the common foundation that guides our work.","This year we revisited the County’s Strategic Plan, the common foundation that guides our work.","This year we revisited the County’s Strategic Plan, the common foundation that guides our work.","This year we revisited the County’s Strategic Plan, the common foundation that guides our work.","This year we revisited the County’s Strategic Plan, the common foundation that guides our work.","This year we revisited the County’s Strategic Plan, the common foundation that guides our work.","This year we revisited the County’s Strategic Plan, the common foundation that guides our work.","This year we revisited the County’s Strategic Plan, the common foundation that guides our work.","This year we revisited the County’s Strategic Plan, the common foundation that guides our work.","This year we revisited the County’s Strategic Plan, the common foundation that guides our work.","This year we revisited the County’s Strategic Plan, the common foundation that guides our work.","This year we revisited the County’s Strategic Plan, the common foundation that guides our work.","This year we revisited the County’s Strategic Plan, the common foundation that guides our work.","This year we revisited the County’s Strategic Plan, the common foundation that guides our work.","This year we revisited the County’s Strategic Plan, the common foundation that guides our work.","This year we revisited the County’s Strategic Plan, the common foundation that guides our work.","This year we revisited the County’s Strategic Plan, the common foundation that guides our work.","This year we revisited the County’s Strategic Plan, the common foundation that guides our work."
I have worked with staff and the Board on a revised vision and we reaffirmed the County’s,I have worked with staff and the Board on a revised vision and we reaffirmed the County’s,I have worked with staff and the Board on a revised vision and we reaffirmed the County’s,I have worked with staff and the Board on a revised vision and we reaffirmed the County’s,I have worked with staff and the Board on a revised vision and we reaffirmed the County’s,I have worked with staff and the Board on a revised vision and we reaffirmed the County’s,I have worked with staff and the Board on a revised vision and we reaffirmed the County’s,I have worked with staff and the Board on a revised vision and we reaffirmed the County’s,I have worked with staff and the Board on a revised vision and we reaffirmed the County’s,I have worked with staff and the Board on a revised vision and we reaffirmed the County’s,I have worked with staff and the Board on a revised vision and we reaffirmed the County’s,I have worked with staff and the Board on a revised vision and we reaffirmed the County’s,I have worked with staff and the Board on a revised vision and we reaffirmed the County’s,I have worked with staff and the Board on a revised vision and we reaffirmed the County’s,I have worked with staff and the Board on a revised vision and we reaffirmed the County’s,I have worked with staff and the Board on a revised vision and we reaffirmed the County’s,I have worked with staff and the Board on a revised vision and we reaffirmed the County’s,I have worked with staff and the Board on a revised vision and we reaffirmed the County’s,I have worked with staff and the Board on a revised vision and we reaffirmed the County’s,I have worked with staff and the Board on a revised vision and we reaffirmed the County’s,I have worked with staff and the Board on a revised vision and we reaffirmed the County’s
mission,mission,and,established,established,established,a,new,set,of,values.,values.,The,budget,document,document,is,slightly different,slightly different,slightly different,in
