appearance this year in anticipation of a revised strategic plan and as we transition to a budget,appearance this year in anticipation of a revised strategic plan and as we transition to a budget,appearance this year in anticipation of a revised strategic plan and as we transition to a budget,appearance this year in anticipation of a revised strategic plan and as we transition to a budget,appearance this year in anticipation of a revised strategic plan and as we transition to a budget,appearance this year in anticipation of a revised strategic plan and as we transition to a budget,appearance this year in anticipation of a revised strategic plan and as we transition to a budget,appearance this year in anticipation of a revised strategic plan and as we transition to a budget,appearance this year in anticipation of a revised strategic plan and as we transition to a budget,appearance this year in anticipation of a revised strategic plan and as we transition to a budget,appearance this year in anticipation of a revised strategic plan and as we transition to a budget,appearance this year in anticipation of a revised strategic plan and as we transition to a budget,appearance this year in anticipation of a revised strategic plan and as we transition to a budget,appearance this year in anticipation of a revised strategic plan and as we transition to a budget,appearance this year in anticipation of a revised strategic plan and as we transition to a budget,appearance this year in anticipation of a revised strategic plan and as we transition to a budget,appearance this year in anticipation of a revised strategic plan and as we transition to a budget,appearance this year in anticipation of a revised strategic plan and as we transition to a budget,appearance this year in anticipation of a revised strategic plan and as we transition to a budget,appearance this year in anticipation of a revised strategic plan and as we transition to a budget,appearance this year in anticipation of a revised strategic plan and as we transition to a budget
with a higher focus on outcomes.,with a higher focus on outcomes.,with a higher focus on outcomes.,with a higher focus on outcomes.,with a higher focus on outcomes.,with a higher focus on outcomes.,with a higher focus on outcomes.,with a higher focus on outcomes.,This budget presents for each operating department a more full,This budget presents for each operating department a more full,This budget presents for each operating department a more full,This budget presents for each operating department a more full,This budget presents for each operating department a more full,This budget presents for each operating department a more full,This budget presents for each operating department a more full,This budget presents for each operating department a more full,This budget presents for each operating department a more full,This budget presents for each operating department a more full,This budget presents for each operating department a more full,This budget presents for each operating department a more full,This budget presents for each operating department a more full
explanation,explanation,explanation,of,the,key,services,services,provided.,provided.,provided.,As,the,County’s,Strategic,Strategic,Plan,is,developed,the,the
department outcomes will align with the broader goals in the plan.,department outcomes will align with the broader goals in the plan.,department outcomes will align with the broader goals in the plan.,department outcomes will align with the broader goals in the plan.,department outcomes will align with the broader goals in the plan.,department outcomes will align with the broader goals in the plan.,department outcomes will align with the broader goals in the plan.,department outcomes will align with the broader goals in the plan.,department outcomes will align with the broader goals in the plan.,department outcomes will align with the broader goals in the plan.,department outcomes will align with the broader goals in the plan.,department outcomes will align with the broader goals in the plan.,department outcomes will align with the broader goals in the plan.,department outcomes will align with the broader goals in the plan.,department outcomes will align with the broader goals in the plan.,,,,,,
"The FY 2012 budget increases $3.1 million from the adopted fiscal plan, an increase of 1.9","The FY 2012 budget increases $3.1 million from the adopted fiscal plan, an increase of 1.9","The FY 2012 budget increases $3.1 million from the adopted fiscal plan, an increase of 1.9","The FY 2012 budget increases $3.1 million from the adopted fiscal plan, an increase of 1.9","The FY 2012 budget increases $3.1 million from the adopted fiscal plan, an increase of 1.9","The FY 2012 budget increases $3.1 million from the adopted fiscal plan, an increase of 1.9","The FY 2012 budget increases $3.1 million from the adopted fiscal plan, an increase of 1.9","The FY 2012 budget increases $3.1 million from the adopted fiscal plan, an increase of 1.9","The FY 2012 budget increases $3.1 million from the adopted fiscal plan, an increase of 1.9","The FY 2012 budget increases $3.1 million from the adopted fiscal plan, an increase of 1.9","The FY 2012 budget increases $3.1 million from the adopted fiscal plan, an increase of 1.9","The FY 2012 budget increases $3.1 million from the adopted fiscal plan, an increase of 1.9","The FY 2012 budget increases $3.1 million from the adopted fiscal plan, an increase of 1.9","The FY 2012 budget increases $3.1 million from the adopted fiscal plan, an increase of 1.9","The FY 2012 budget increases $3.1 million from the adopted fiscal plan, an increase of 1.9","The FY 2012 budget increases $3.1 million from the adopted fiscal plan, an increase of 1.9","The FY 2012 budget increases $3.1 million from the adopted fiscal plan, an increase of 1.9","The FY 2012 budget increases $3.1 million from the adopted fiscal plan, an increase of 1.9","The FY 2012 budget increases $3.1 million from the adopted fiscal plan, an increase of 1.9","The FY 2012 budget increases $3.1 million from the adopted fiscal plan, an increase of 1.9","The FY 2012 budget increases $3.1 million from the adopted fiscal plan, an increase of 1.9"
"percent, and $3.3 million or 2.0 percent from the FY 2011 adopted budget.","percent, and $3.3 million or 2.0 percent from the FY 2011 adopted budget.","percent, and $3.3 million or 2.0 percent from the FY 2011 adopted budget.","percent, and $3.3 million or 2.0 percent from the FY 2011 adopted budget.","percent, and $3.3 million or 2.0 percent from the FY 2011 adopted budget.","percent, and $3.3 million or 2.0 percent from the FY 2011 adopted budget.","percent, and $3.3 million or 2.0 percent from the FY 2011 adopted budget.","percent, and $3.3 million or 2.0 percent from the FY 2011 adopted budget.","percent, and $3.3 million or 2.0 percent from the FY 2011 adopted budget.","percent, and $3.3 million or 2.0 percent from the FY 2011 adopted budget.","percent, and $3.3 million or 2.0 percent from the FY 2011 adopted budget.","percent, and $3.3 million or 2.0 percent from the FY 2011 adopted budget.","percent, and $3.3 million or 2.0 percent from the FY 2011 adopted budget.","percent, and $3.3 million or 2.0 percent from the FY 2011 adopted budget.","percent, and $3.3 million or 2.0 percent from the FY 2011 adopted budget.","percent, and $3.3 million or 2.0 percent from the FY 2011 adopted budget.","percent, and $3.3 million or 2.0 percent from the FY 2011 adopted budget.",After three years of,After three years of,After three years of,After three years of
declining,declining,budgets,budgets,it,would,would,be,tempting,tempting,to,use,the,increase,in,projected,projected,revenues,to,add,to
recurring,recurring,spending.,spending.,spending.,Several,Several,priorities,priorities,priorities,such,as,compensation,compensation,increases,increases,or,additional,additional,staff,or
expanded contributions to the several regional agencies we participate in could be addressed.,expanded contributions to the several regional agencies we participate in could be addressed.,expanded contributions to the several regional agencies we participate in could be addressed.,expanded contributions to the several regional agencies we participate in could be addressed.,expanded contributions to the several regional agencies we participate in could be addressed.,expanded contributions to the several regional agencies we participate in could be addressed.,expanded contributions to the several regional agencies we participate in could be addressed.,expanded contributions to the several regional agencies we participate in could be addressed.,expanded contributions to the several regional agencies we participate in could be addressed.,expanded contributions to the several regional agencies we participate in could be addressed.,expanded contributions to the several regional agencies we participate in could be addressed.,expanded contributions to the several regional agencies we participate in could be addressed.,expanded contributions to the several regional agencies we participate in could be addressed.,expanded contributions to the several regional agencies we participate in could be addressed.,expanded contributions to the several regional agencies we participate in could be addressed.,expanded contributions to the several regional agencies we participate in could be addressed.,expanded contributions to the several regional agencies we participate in could be addressed.,expanded contributions to the several regional agencies we participate in could be addressed.,expanded contributions to the several regional agencies we participate in could be addressed.,expanded contributions to the several regional agencies we participate in could be addressed.,expanded contributions to the several regional agencies we participate in could be addressed.
"However, looking ahead to FY 2013 and FY 2014, this budget had to avoid the addition of","However, looking ahead to FY 2013 and FY 2014, this budget had to avoid the addition of","However, looking ahead to FY 2013 and FY 2014, this budget had to avoid the addition of","However, looking ahead to FY 2013 and FY 2014, this budget had to avoid the addition of","However, looking ahead to FY 2013 and FY 2014, this budget had to avoid the addition of","However, looking ahead to FY 2013 and FY 2014, this budget had to avoid the addition of","However, looking ahead to FY 2013 and FY 2014, this budget had to avoid the addition of","However, looking ahead to FY 2013 and FY 2014, this budget had to avoid the addition of","However, looking ahead to FY 2013 and FY 2014, this budget had to avoid the addition of","However, looking ahead to FY 2013 and FY 2014, this budget had to avoid the addition of","However, looking ahead to FY 2013 and FY 2014, this budget had to avoid the addition of","However, looking ahead to FY 2013 and FY 2014, this budget had to avoid the addition of","However, looking ahead to FY 2013 and FY 2014, this budget had to avoid the addition of","However, looking ahead to FY 2013 and FY 2014, this budget had to avoid the addition of","However, looking ahead to FY 2013 and FY 2014, this budget had to avoid the addition of","However, looking ahead to FY 2013 and FY 2014, this budget had to avoid the addition of","However, looking ahead to FY 2013 and FY 2014, this budget had to avoid the addition of","However, looking ahead to FY 2013 and FY 2014, this budget had to avoid the addition of","However, looking ahead to FY 2013 and FY 2014, this budget had to avoid the addition of","However, looking ahead to FY 2013 and FY 2014, this budget had to avoid the addition of","However, looking ahead to FY 2013 and FY 2014, this budget had to avoid the addition of"
"recurring costs, if at all possible.","recurring costs, if at all possible.","recurring costs, if at all possible.","recurring costs, if at all possible.","recurring costs, if at all possible.","recurring costs, if at all possible.","recurring costs, if at all possible.","recurring costs, if at all possible.",,,,,,,,,,,,,
A portion of the increase in funding in FY 2012 has been driven by the same kind of spending,A portion of the increase in funding in FY 2012 has been driven by the same kind of spending,A portion of the increase in funding in FY 2012 has been driven by the same kind of spending,A portion of the increase in funding in FY 2012 has been driven by the same kind of spending,A portion of the increase in funding in FY 2012 has been driven by the same kind of spending,A portion of the increase in funding in FY 2012 has been driven by the same kind of spending,A portion of the increase in funding in FY 2012 has been driven by the same kind of spending,A portion of the increase in funding in FY 2012 has been driven by the same kind of spending,A portion of the increase in funding in FY 2012 has been driven by the same kind of spending,A portion of the increase in funding in FY 2012 has been driven by the same kind of spending,A portion of the increase in funding in FY 2012 has been driven by the same kind of spending,A portion of the increase in funding in FY 2012 has been driven by the same kind of spending,A portion of the increase in funding in FY 2012 has been driven by the same kind of spending,A portion of the increase in funding in FY 2012 has been driven by the same kind of spending,A portion of the increase in funding in FY 2012 has been driven by the same kind of spending,A portion of the increase in funding in FY 2012 has been driven by the same kind of spending,A portion of the increase in funding in FY 2012 has been driven by the same kind of spending,A portion of the increase in funding in FY 2012 has been driven by the same kind of spending,A portion of the increase in funding in FY 2012 has been driven by the same kind of spending,A portion of the increase in funding in FY 2012 has been driven by the same kind of spending,A portion of the increase in funding in FY 2012 has been driven by the same kind of spending
"increases that affect the average citizen – increases in fuel costs, health insurance, equipment","increases that affect the average citizen – increases in fuel costs, health insurance, equipment","increases that affect the average citizen – increases in fuel costs, health insurance, equipment","increases that affect the average citizen – increases in fuel costs, health insurance, equipment","increases that affect the average citizen – increases in fuel costs, health insurance, equipment","increases that affect the average citizen – increases in fuel costs, health insurance, equipment","increases that affect the average citizen – increases in fuel costs, health insurance, equipment","increases that affect the average citizen – increases in fuel costs, health insurance, equipment","increases that affect the average citizen – increases in fuel costs, health insurance, equipment","increases that affect the average citizen – increases in fuel costs, health insurance, equipment","increases that affect the average citizen – increases in fuel costs, health insurance, equipment","increases that affect the average citizen – increases in fuel costs, health insurance, equipment","increases that affect the average citizen – increases in fuel costs, health insurance, equipment","increases that affect the average citizen – increases in fuel costs, health insurance, equipment","increases that affect the average citizen – increases in fuel costs, health insurance, equipment","increases that affect the average citizen – increases in fuel costs, health insurance, equipment","increases that affect the average citizen – increases in fuel costs, health insurance, equipment","increases that affect the average citizen – increases in fuel costs, health insurance, equipment","increases that affect the average citizen – increases in fuel costs, health insurance, equipment","increases that affect the average citizen – increases in fuel costs, health insurance, equipment","increases that affect the average citizen – increases in fuel costs, health insurance, equipment"
maintenance and impacts of increasing rates for electricity.,maintenance and impacts of increasing rates for electricity.,maintenance and impacts of increasing rates for electricity.,maintenance and impacts of increasing rates for electricity.,maintenance and impacts of increasing rates for electricity.,maintenance and impacts of increasing rates for electricity.,maintenance and impacts of increasing rates for electricity.,maintenance and impacts of increasing rates for electricity.,maintenance and impacts of increasing rates for electricity.,maintenance and impacts of increasing rates for electricity.,maintenance and impacts of increasing rates for electricity.,maintenance and impacts of increasing rates for electricity.,maintenance and impacts of increasing rates for electricity.,The rest of the revenue increase is,The rest of the revenue increase is,The rest of the revenue increase is,The rest of the revenue increase is,The rest of the revenue increase is,The rest of the revenue increase is,The rest of the revenue increase is,The rest of the revenue increase is
directed,directed,to,one-time,one-time,spending.,spending.,spending.,Examples,Examples,Examples,are,capital,"projects,","projects,",a,watershed,watershed,"study,",voter,voter
"redistricting, increasing the contribution to the debt service reserve fund and in creating zoning","redistricting, increasing the contribution to the debt service reserve fund and in creating zoning","redistricting, increasing the contribution to the debt service reserve fund and in creating zoning","redistricting, increasing the contribution to the debt service reserve fund and in creating zoning","redistricting, increasing the contribution to the debt service reserve fund and in creating zoning","redistricting, increasing the contribution to the debt service reserve fund and in creating zoning","redistricting, increasing the contribution to the debt service reserve fund and in creating zoning","redistricting, increasing the contribution to the debt service reserve fund and in creating zoning","redistricting, increasing the contribution to the debt service reserve fund and in creating zoning","redistricting, increasing the contribution to the debt service reserve fund and in creating zoning","redistricting, increasing the contribution to the debt service reserve fund and in creating zoning","redistricting, increasing the contribution to the debt service reserve fund and in creating zoning","redistricting, increasing the contribution to the debt service reserve fund and in creating zoning","redistricting, increasing the contribution to the debt service reserve fund and in creating zoning","redistricting, increasing the contribution to the debt service reserve fund and in creating zoning","redistricting, increasing the contribution to the debt service reserve fund and in creating zoning","redistricting, increasing the contribution to the debt service reserve fund and in creating zoning","redistricting, increasing the contribution to the debt service reserve fund and in creating zoning","redistricting, increasing the contribution to the debt service reserve fund and in creating zoning","redistricting, increasing the contribution to the debt service reserve fund and in creating zoning","redistricting, increasing the contribution to the debt service reserve fund and in creating zoning"
ordinance amendments to implement the recently amended 2010 Comprehensive Plan.,ordinance amendments to implement the recently amended 2010 Comprehensive Plan.,ordinance amendments to implement the recently amended 2010 Comprehensive Plan.,ordinance amendments to implement the recently amended 2010 Comprehensive Plan.,ordinance amendments to implement the recently amended 2010 Comprehensive Plan.,ordinance amendments to implement the recently amended 2010 Comprehensive Plan.,ordinance amendments to implement the recently amended 2010 Comprehensive Plan.,ordinance amendments to implement the recently amended 2010 Comprehensive Plan.,ordinance amendments to implement the recently amended 2010 Comprehensive Plan.,ordinance amendments to implement the recently amended 2010 Comprehensive Plan.,ordinance amendments to implement the recently amended 2010 Comprehensive Plan.,ordinance amendments to implement the recently amended 2010 Comprehensive Plan.,ordinance amendments to implement the recently amended 2010 Comprehensive Plan.,ordinance amendments to implement the recently amended 2010 Comprehensive Plan.,ordinance amendments to implement the recently amended 2010 Comprehensive Plan.,ordinance amendments to implement the recently amended 2010 Comprehensive Plan.,ordinance amendments to implement the recently amended 2010 Comprehensive Plan.,ordinance amendments to implement the recently amended 2010 Comprehensive Plan.,,,
,,,,,,,,,,Page A-1,Page A-1,Page A-1,,,,,,,,
