Name: “Table 1 of 1 on page 2 of 124”,Name: “Table 1 of 1 on page 2 of 124”,Name: “Table 1 of 1 on page 2 of 124”,Name: “Table 1 of 1 on page 2 of 124”,Name: “Table 1 of 1 on page 2 of 124”,Name: “Table 1 of 1 on page 2 of 124”,Name: “Table 1 of 1 on page 2 of 124”,Name: “Table 1 of 1 on page 2 of 124”,Name: “Table 1 of 1 on page 2 of 124”,Name: “Table 1 of 1 on page 2 of 124”,Name: “Table 1 of 1 on page 2 of 124”,Name: “Table 1 of 1 on page 2 of 124”,Name: “Table 1 of 1 on page 2 of 124”,Name: “Table 1 of 1 on page 2 of 124”,Name: “Table 1 of 1 on page 2 of 124”,Name: “Table 1 of 1 on page 2 of 124”
Table: 2,Table: 2,Table: 2,Table: 2,Table: 2,Table: 2,Table: 2,Table: 2,Table: 2,Table: 2,Table: 2,Table: 2,Table: 2,Table: 2,Table: 2,Table: 2
,,,,,,,,,,,,,,,
,,,,,,General Overview,General Overview,General Overview,General Overview,,,,,,
What is a Capital Improvement Plan?,What is a Capital Improvement Plan?,What is a Capital Improvement Plan?,What is a Capital Improvement Plan?,What is a Capital Improvement Plan?,What is a Capital Improvement Plan?,What is a Capital Improvement Plan?,,,,,,,,,
,,The Capital Improvement Plan (CIP) is a five-year expenditure plan to finance the acquisition,The Capital Improvement Plan (CIP) is a five-year expenditure plan to finance the acquisition,The Capital Improvement Plan (CIP) is a five-year expenditure plan to finance the acquisition,The Capital Improvement Plan (CIP) is a five-year expenditure plan to finance the acquisition,The Capital Improvement Plan (CIP) is a five-year expenditure plan to finance the acquisition,The Capital Improvement Plan (CIP) is a five-year expenditure plan to finance the acquisition,The Capital Improvement Plan (CIP) is a five-year expenditure plan to finance the acquisition,The Capital Improvement Plan (CIP) is a five-year expenditure plan to finance the acquisition,The Capital Improvement Plan (CIP) is a five-year expenditure plan to finance the acquisition,The Capital Improvement Plan (CIP) is a five-year expenditure plan to finance the acquisition,The Capital Improvement Plan (CIP) is a five-year expenditure plan to finance the acquisition,The Capital Improvement Plan (CIP) is a five-year expenditure plan to finance the acquisition,The Capital Improvement Plan (CIP) is a five-year expenditure plan to finance the acquisition,The Capital Improvement Plan (CIP) is a five-year expenditure plan to finance the acquisition
of property and equipment and to fund new construction and other major improvements to existing,of property and equipment and to fund new construction and other major improvements to existing,of property and equipment and to fund new construction and other major improvements to existing,of property and equipment and to fund new construction and other major improvements to existing,of property and equipment and to fund new construction and other major improvements to existing,of property and equipment and to fund new construction and other major improvements to existing,of property and equipment and to fund new construction and other major improvements to existing,of property and equipment and to fund new construction and other major improvements to existing,of property and equipment and to fund new construction and other major improvements to existing,of property and equipment and to fund new construction and other major improvements to existing,of property and equipment and to fund new construction and other major improvements to existing,of property and equipment and to fund new construction and other major improvements to existing,of property and equipment and to fund new construction and other major improvements to existing,of property and equipment and to fund new construction and other major improvements to existing,of property and equipment and to fund new construction and other major improvements to existing,of property and equipment and to fund new construction and other major improvements to existing
public facilities.,public facilities.,public facilities.,,,,,,,,,,,,,
,,Each locality establishes its own criteria for capital improvement projects. The criterion in,Each locality establishes its own criteria for capital improvement projects. The criterion in,Each locality establishes its own criteria for capital improvement projects. The criterion in,Each locality establishes its own criteria for capital improvement projects. The criterion in,Each locality establishes its own criteria for capital improvement projects. The criterion in,Each locality establishes its own criteria for capital improvement projects. The criterion in,Each locality establishes its own criteria for capital improvement projects. The criterion in,Each locality establishes its own criteria for capital improvement projects. The criterion in,Each locality establishes its own criteria for capital improvement projects. The criterion in,Each locality establishes its own criteria for capital improvement projects. The criterion in,Each locality establishes its own criteria for capital improvement projects. The criterion in,Each locality establishes its own criteria for capital improvement projects. The criterion in,Each locality establishes its own criteria for capital improvement projects. The criterion in,Each locality establishes its own criteria for capital improvement projects. The criterion in
"Hampton is that a project must have a cost in excess of $50,000 and a life expectancy of at least five","Hampton is that a project must have a cost in excess of $50,000 and a life expectancy of at least five","Hampton is that a project must have a cost in excess of $50,000 and a life expectancy of at least five","Hampton is that a project must have a cost in excess of $50,000 and a life expectancy of at least five","Hampton is that a project must have a cost in excess of $50,000 and a life expectancy of at least five","Hampton is that a project must have a cost in excess of $50,000 and a life expectancy of at least five","Hampton is that a project must have a cost in excess of $50,000 and a life expectancy of at least five","Hampton is that a project must have a cost in excess of $50,000 and a life expectancy of at least five","Hampton is that a project must have a cost in excess of $50,000 and a life expectancy of at least five","Hampton is that a project must have a cost in excess of $50,000 and a life expectancy of at least five","Hampton is that a project must have a cost in excess of $50,000 and a life expectancy of at least five","Hampton is that a project must have a cost in excess of $50,000 and a life expectancy of at least five","Hampton is that a project must have a cost in excess of $50,000 and a life expectancy of at least five","Hampton is that a project must have a cost in excess of $50,000 and a life expectancy of at least five","Hampton is that a project must have a cost in excess of $50,000 and a life expectancy of at least five","Hampton is that a project must have a cost in excess of $50,000 and a life expectancy of at least five"
years.,years.,"Although the nature and scope of capital improvement projects vary, each project usually falls","Although the nature and scope of capital improvement projects vary, each project usually falls","Although the nature and scope of capital improvement projects vary, each project usually falls","Although the nature and scope of capital improvement projects vary, each project usually falls","Although the nature and scope of capital improvement projects vary, each project usually falls","Although the nature and scope of capital improvement projects vary, each project usually falls","Although the nature and scope of capital improvement projects vary, each project usually falls","Although the nature and scope of capital improvement projects vary, each project usually falls","Although the nature and scope of capital improvement projects vary, each project usually falls","Although the nature and scope of capital improvement projects vary, each project usually falls","Although the nature and scope of capital improvement projects vary, each project usually falls","Although the nature and scope of capital improvement projects vary, each project usually falls","Although the nature and scope of capital improvement projects vary, each project usually falls","Although the nature and scope of capital improvement projects vary, each project usually falls"
into one of the following ten broad categories:,into one of the following ten broad categories:,into one of the following ten broad categories:,into one of the following ten broad categories:,into one of the following ten broad categories:,into one of the following ten broad categories:,into one of the following ten broad categories:,,,,,,,,,
•,Education,Education,,,,,,,•,Hampton’s Waterways,Hampton’s Waterways,Hampton’s Waterways,,,
•,Maintenance of Public Properties/Performance Support,Maintenance of Public Properties/Performance Support,Maintenance of Public Properties/Performance Support,Maintenance of Public Properties/Performance Support,Maintenance of Public Properties/Performance Support,Maintenance of Public Properties/Performance Support,Maintenance of Public Properties/Performance Support,Maintenance of Public Properties/Performance Support,•,Master Plans,,,,,
•,Neighborhood Support,Neighborhood Support,Neighborhood Support,,,,,,•,New Facilities,,,,,
•,Other CIP Projects,Other CIP Projects,Other CIP Projects,,,,,,•,Other Economic Development Support,Other Economic Development Support,Other Economic Development Support,Other Economic Development Support,Other Economic Development Support,Other Economic Development Support
•,Public Safety,Public Safety,Public Safety,,,,,,•,Streets and Infrastructure,Streets and Infrastructure,Streets and Infrastructure,Streets and Infrastructure,,
Objectives,Objectives,Objectives,,,,,,,,,,,,,
The objectives of the capital improvement program serve to:,The objectives of the capital improvement program serve to:,The objectives of the capital improvement program serve to:,The objectives of the capital improvement program serve to:,The objectives of the capital improvement program serve to:,The objectives of the capital improvement program serve to:,The objectives of the capital improvement program serve to:,The objectives of the capital improvement program serve to:,The objectives of the capital improvement program serve to:,,,,,,,
,,Execute,projects,which,which,support,the,Hampton,Community,Plan,and,its,eight,elements,elements
,,sustaining the vision of “Making Hampton the Most Livable City in Virginia.” The Hampton,sustaining the vision of “Making Hampton the Most Livable City in Virginia.” The Hampton,sustaining the vision of “Making Hampton the Most Livable City in Virginia.” The Hampton,sustaining the vision of “Making Hampton the Most Livable City in Virginia.” The Hampton,sustaining the vision of “Making Hampton the Most Livable City in Virginia.” The Hampton,sustaining the vision of “Making Hampton the Most Livable City in Virginia.” The Hampton,sustaining the vision of “Making Hampton the Most Livable City in Virginia.” The Hampton,sustaining the vision of “Making Hampton the Most Livable City in Virginia.” The Hampton,sustaining the vision of “Making Hampton the Most Livable City in Virginia.” The Hampton,sustaining the vision of “Making Hampton the Most Livable City in Virginia.” The Hampton,sustaining the vision of “Making Hampton the Most Livable City in Virginia.” The Hampton,sustaining the vision of “Making Hampton the Most Livable City in Virginia.” The Hampton,sustaining the vision of “Making Hampton the Most Livable City in Virginia.” The Hampton,sustaining the vision of “Making Hampton the Most Livable City in Virginia.” The Hampton
,,Community Plan can be accessed on the web at http://www.hampton.gov/community-plan/.,Community Plan can be accessed on the web at http://www.hampton.gov/community-plan/.,Community Plan can be accessed on the web at http://www.hampton.gov/community-plan/.,Community Plan can be accessed on the web at http://www.hampton.gov/community-plan/.,Community Plan can be accessed on the web at http://www.hampton.gov/community-plan/.,Community Plan can be accessed on the web at http://www.hampton.gov/community-plan/.,Community Plan can be accessed on the web at http://www.hampton.gov/community-plan/.,Community Plan can be accessed on the web at http://www.hampton.gov/community-plan/.,Community Plan can be accessed on the web at http://www.hampton.gov/community-plan/.,Community Plan can be accessed on the web at http://www.hampton.gov/community-plan/.,Community Plan can be accessed on the web at http://www.hampton.gov/community-plan/.,Community Plan can be accessed on the web at http://www.hampton.gov/community-plan/.,Community Plan can be accessed on the web at http://www.hampton.gov/community-plan/.,
,,Prepare the Capital Budget portion of the Manager’s Recommended Budget. The first year of,Prepare the Capital Budget portion of the Manager’s Recommended Budget. The first year of,Prepare the Capital Budget portion of the Manager’s Recommended Budget. The first year of,Prepare the Capital Budget portion of the Manager’s Recommended Budget. The first year of,Prepare the Capital Budget portion of the Manager’s Recommended Budget. The first year of,Prepare the Capital Budget portion of the Manager’s Recommended Budget. The first year of,Prepare the Capital Budget portion of the Manager’s Recommended Budget. The first year of,Prepare the Capital Budget portion of the Manager’s Recommended Budget. The first year of,Prepare the Capital Budget portion of the Manager’s Recommended Budget. The first year of,Prepare the Capital Budget portion of the Manager’s Recommended Budget. The first year of,Prepare the Capital Budget portion of the Manager’s Recommended Budget. The first year of,Prepare the Capital Budget portion of the Manager’s Recommended Budget. The first year of,Prepare the Capital Budget portion of the Manager’s Recommended Budget. The first year of,Prepare the Capital Budget portion of the Manager’s Recommended Budget. The first year of
,,the Council Approved five-year CIP is incorporated as the Capital Budget component for the,the Council Approved five-year CIP is incorporated as the Capital Budget component for the,the Council Approved five-year CIP is incorporated as the Capital Budget component for the,the Council Approved five-year CIP is incorporated as the Capital Budget component for the,the Council Approved five-year CIP is incorporated as the Capital Budget component for the,the Council Approved five-year CIP is incorporated as the Capital Budget component for the,the Council Approved five-year CIP is incorporated as the Capital Budget component for the,the Council Approved five-year CIP is incorporated as the Capital Budget component for the,the Council Approved five-year CIP is incorporated as the Capital Budget component for the,the Council Approved five-year CIP is incorporated as the Capital Budget component for the,the Council Approved five-year CIP is incorporated as the Capital Budget component for the,the Council Approved five-year CIP is incorporated as the Capital Budget component for the,the Council Approved five-year CIP is incorporated as the Capital Budget component for the,the Council Approved five-year CIP is incorporated as the Capital Budget component for the
,,upcoming fiscal year. The CIP serves as one of many planning tools used during the budget,upcoming fiscal year. The CIP serves as one of many planning tools used during the budget,upcoming fiscal year. The CIP serves as one of many planning tools used during the budget,upcoming fiscal year. The CIP serves as one of many planning tools used during the budget,upcoming fiscal year. The CIP serves as one of many planning tools used during the budget,upcoming fiscal year. The CIP serves as one of many planning tools used during the budget,upcoming fiscal year. The CIP serves as one of many planning tools used during the budget,upcoming fiscal year. The CIP serves as one of many planning tools used during the budget,upcoming fiscal year. The CIP serves as one of many planning tools used during the budget,upcoming fiscal year. The CIP serves as one of many planning tools used during the budget,upcoming fiscal year. The CIP serves as one of many planning tools used during the budget,upcoming fiscal year. The CIP serves as one of many planning tools used during the budget,upcoming fiscal year. The CIP serves as one of many planning tools used during the budget,upcoming fiscal year. The CIP serves as one of many planning tools used during the budget
,,development process.,development process.,development process.,,,,,,,,,,,
21,,,,,,,,,,,,,,,
,,Maintain the City’s current bond rating by ensuring that conservative fiscal parameters are in,Maintain the City’s current bond rating by ensuring that conservative fiscal parameters are in,Maintain the City’s current bond rating by ensuring that conservative fiscal parameters are in,Maintain the City’s current bond rating by ensuring that conservative fiscal parameters are in,Maintain the City’s current bond rating by ensuring that conservative fiscal parameters are in,Maintain the City’s current bond rating by ensuring that conservative fiscal parameters are in,Maintain the City’s current bond rating by ensuring that conservative fiscal parameters are in,Maintain the City’s current bond rating by ensuring that conservative fiscal parameters are in,Maintain the City’s current bond rating by ensuring that conservative fiscal parameters are in,Maintain the City’s current bond rating by ensuring that conservative fiscal parameters are in,Maintain the City’s current bond rating by ensuring that conservative fiscal parameters are in,Maintain the City’s current bond rating by ensuring that conservative fiscal parameters are in,Maintain the City’s current bond rating by ensuring that conservative fiscal parameters are in,Maintain the City’s current bond rating by ensuring that conservative fiscal parameters are in
,,place to protect the City’s bond rating.,place to protect the City’s bond rating.,place to protect the City’s bond rating.,place to protect the City’s bond rating.,place to protect the City’s bond rating.,,,,,,,,,
,,Balance the City’s need for new or enhanced economic development with existing development,Balance the City’s need for new or enhanced economic development with existing development,Balance the City’s need for new or enhanced economic development with existing development,Balance the City’s need for new or enhanced economic development with existing development,Balance the City’s need for new or enhanced economic development with existing development,Balance the City’s need for new or enhanced economic development with existing development,Balance the City’s need for new or enhanced economic development with existing development,Balance the City’s need for new or enhanced economic development with existing development,Balance the City’s need for new or enhanced economic development with existing development,Balance the City’s need for new or enhanced economic development with existing development,Balance the City’s need for new or enhanced economic development with existing development,Balance the City’s need for new or enhanced economic development with existing development,Balance the City’s need for new or enhanced economic development with existing development,Balance the City’s need for new or enhanced economic development with existing development
,,and capital renewal needs.,and capital renewal needs.,and capital renewal needs.,and capital renewal needs.,,,,,,,,,,
,,Address,and,implement,implement,short-term,critical,critical,initiatives,outlined,in,the,Council,Approved,Approved
,,Strategic Area Master Plans.,Strategic Area Master Plans.,Strategic Area Master Plans.,Strategic Area Master Plans.,Strategic Area Master Plans.,,,,,,,,,
,,Merge the Hampton City Schools’ capital improvement plans with the City’s process.,Merge the Hampton City Schools’ capital improvement plans with the City’s process.,Merge the Hampton City Schools’ capital improvement plans with the City’s process.,Merge the Hampton City Schools’ capital improvement plans with the City’s process.,Merge the Hampton City Schools’ capital improvement plans with the City’s process.,Merge the Hampton City Schools’ capital improvement plans with the City’s process.,Merge the Hampton City Schools’ capital improvement plans with the City’s process.,Merge the Hampton City Schools’ capital improvement plans with the City’s process.,Merge the Hampton City Schools’ capital improvement plans with the City’s process.,Merge the Hampton City Schools’ capital improvement plans with the City’s process.,Merge the Hampton City Schools’ capital improvement plans with the City’s process.,Merge the Hampton City Schools’ capital improvement plans with the City’s process.,,
Development Process,Development Process,Development Process,Development Process,Development Process,,,,,,,,,,,
,,The annual development process commences with the distribution of funding request packets.,The annual development process commences with the distribution of funding request packets.,The annual development process commences with the distribution of funding request packets.,The annual development process commences with the distribution of funding request packets.,The annual development process commences with the distribution of funding request packets.,The annual development process commences with the distribution of funding request packets.,The annual development process commences with the distribution of funding request packets.,The annual development process commences with the distribution of funding request packets.,The annual development process commences with the distribution of funding request packets.,The annual development process commences with the distribution of funding request packets.,The annual development process commences with the distribution of funding request packets.,The annual development process commences with the distribution of funding request packets.,The annual development process commences with the distribution of funding request packets.,The annual development process commences with the distribution of funding request packets.
"Suggested projects come from a variety of sources such as City departments, City Council, citizen","Suggested projects come from a variety of sources such as City departments, City Council, citizen","Suggested projects come from a variety of sources such as City departments, City Council, citizen","Suggested projects come from a variety of sources such as City departments, City Council, citizen","Suggested projects come from a variety of sources such as City departments, City Council, citizen","Suggested projects come from a variety of sources such as City departments, City Council, citizen","Suggested projects come from a variety of sources such as City departments, City Council, citizen","Suggested projects come from a variety of sources such as City departments, City Council, citizen","Suggested projects come from a variety of sources such as City departments, City Council, citizen","Suggested projects come from a variety of sources such as City departments, City Council, citizen","Suggested projects come from a variety of sources such as City departments, City Council, citizen","Suggested projects come from a variety of sources such as City departments, City Council, citizen","Suggested projects come from a variety of sources such as City departments, City Council, citizen","Suggested projects come from a variety of sources such as City departments, City Council, citizen","Suggested projects come from a variety of sources such as City departments, City Council, citizen","Suggested projects come from a variety of sources such as City departments, City Council, citizen"
groups and local business communities. It is recommended that project submissions from citizen,groups and local business communities. It is recommended that project submissions from citizen,groups and local business communities. It is recommended that project submissions from citizen,groups and local business communities. It is recommended that project submissions from citizen,groups and local business communities. It is recommended that project submissions from citizen,groups and local business communities. It is recommended that project submissions from citizen,groups and local business communities. It is recommended that project submissions from citizen,groups and local business communities. It is recommended that project submissions from citizen,groups and local business communities. It is recommended that project submissions from citizen,groups and local business communities. It is recommended that project submissions from citizen,groups and local business communities. It is recommended that project submissions from citizen,groups and local business communities. It is recommended that project submissions from citizen,groups and local business communities. It is recommended that project submissions from citizen,groups and local business communities. It is recommended that project submissions from citizen,groups and local business communities. It is recommended that project submissions from citizen,groups and local business communities. It is recommended that project submissions from citizen
