Annual maintenance to public recreational facilities such as parks; tennis and basketball courts;,Annual maintenance to public recreational facilities such as parks; tennis and basketball courts;,Annual maintenance to public recreational facilities such as parks; tennis and basketball courts;,Annual maintenance to public recreational facilities such as parks; tennis and basketball courts;,Annual maintenance to public recreational facilities such as parks; tennis and basketball courts;,Annual maintenance to public recreational facilities such as parks; tennis and basketball courts;,Annual maintenance to public recreational facilities such as parks; tennis and basketball courts;,Annual maintenance to public recreational facilities such as parks; tennis and basketball courts;,Annual maintenance to public recreational facilities such as parks; tennis and basketball courts;,Annual maintenance to public recreational facilities such as parks; tennis and basketball courts;,Annual maintenance to public recreational facilities such as parks; tennis and basketball courts;,Annual maintenance to public recreational facilities such as parks; tennis and basketball courts;,Annual maintenance to public recreational facilities such as parks; tennis and basketball courts;,Annual maintenance to public recreational facilities such as parks; tennis and basketball courts;,Annual maintenance to public recreational facilities such as parks; tennis and basketball courts;
"softball, football and soccer fields and school outdoor recreational facilities to reduce the rate of","softball, football and soccer fields and school outdoor recreational facilities to reduce the rate of","softball, football and soccer fields and school outdoor recreational facilities to reduce the rate of","softball, football and soccer fields and school outdoor recreational facilities to reduce the rate of","softball, football and soccer fields and school outdoor recreational facilities to reduce the rate of","softball, football and soccer fields and school outdoor recreational facilities to reduce the rate of","softball, football and soccer fields and school outdoor recreational facilities to reduce the rate of","softball, football and soccer fields and school outdoor recreational facilities to reduce the rate of","softball, football and soccer fields and school outdoor recreational facilities to reduce the rate of","softball, football and soccer fields and school outdoor recreational facilities to reduce the rate of","softball, football and soccer fields and school outdoor recreational facilities to reduce the rate of","softball, football and soccer fields and school outdoor recreational facilities to reduce the rate of","softball, football and soccer fields and school outdoor recreational facilities to reduce the rate of","softball, football and soccer fields and school outdoor recreational facilities to reduce the rate of","softball, football and soccer fields and school outdoor recreational facilities to reduce the rate of"
"deterioration,",ensure,ensure,compliance,with,safety,standards,standards,and,prevent,future,future,costly,repairs,and
upgrades.,,,,,,,,,,,,,,
NEIGHBORHOOD SUPPORT,NEIGHBORHOOD SUPPORT,NEIGHBORHOOD SUPPORT,NEIGHBORHOOD SUPPORT,,,,,,,,,,,
Blighted Property Acquisition and Demolition,Blighted Property Acquisition and Demolition,Blighted Property Acquisition and Demolition,Blighted Property Acquisition and Demolition,Blighted Property Acquisition and Demolition,Blighted Property Acquisition and Demolition,Blighted Property Acquisition and Demolition,Blighted Property Acquisition and Demolition,"......................................................... 200,000","......................................................... 200,000","......................................................... 200,000","......................................................... 200,000","......................................................... 200,000","......................................................... 200,000","......................................................... 200,000"
Acquire and demolish strategic (and generally blighted) properties to control redevelopment and halt,Acquire and demolish strategic (and generally blighted) properties to control redevelopment and halt,Acquire and demolish strategic (and generally blighted) properties to control redevelopment and halt,Acquire and demolish strategic (and generally blighted) properties to control redevelopment and halt,Acquire and demolish strategic (and generally blighted) properties to control redevelopment and halt,Acquire and demolish strategic (and generally blighted) properties to control redevelopment and halt,Acquire and demolish strategic (and generally blighted) properties to control redevelopment and halt,Acquire and demolish strategic (and generally blighted) properties to control redevelopment and halt,Acquire and demolish strategic (and generally blighted) properties to control redevelopment and halt,Acquire and demolish strategic (and generally blighted) properties to control redevelopment and halt,Acquire and demolish strategic (and generally blighted) properties to control redevelopment and halt,Acquire and demolish strategic (and generally blighted) properties to control redevelopment and halt,Acquire and demolish strategic (and generally blighted) properties to control redevelopment and halt,Acquire and demolish strategic (and generally blighted) properties to control redevelopment and halt,Acquire and demolish strategic (and generally blighted) properties to control redevelopment and halt
disinvestments in Hampton's neighborhoods.,disinvestments in Hampton's neighborhoods.,disinvestments in Hampton's neighborhoods.,disinvestments in Hampton's neighborhoods.,disinvestments in Hampton's neighborhoods.,disinvestments in Hampton's neighborhoods.,Funds supplement Community Development Block,Funds supplement Community Development Block,Funds supplement Community Development Block,Funds supplement Community Development Block,Funds supplement Community Development Block,Funds supplement Community Development Block,Funds supplement Community Development Block,Funds supplement Community Development Block,Funds supplement Community Development Block
Grants,(CDBG),which,permits,acquisitions,acquisitions,to,continue,at,acceptable,acceptable,level,and,make,possible
acquisitions which are not CDBG eligible.,acquisitions which are not CDBG eligible.,acquisitions which are not CDBG eligible.,acquisitions which are not CDBG eligible.,acquisitions which are not CDBG eligible.,acquisitions which are not CDBG eligible.,,,,,,,,,
"Housing Improvement Grants .................................................................................... 300,000","Housing Improvement Grants .................................................................................... 300,000","Housing Improvement Grants .................................................................................... 300,000","Housing Improvement Grants .................................................................................... 300,000","Housing Improvement Grants .................................................................................... 300,000","Housing Improvement Grants .................................................................................... 300,000","Housing Improvement Grants .................................................................................... 300,000","Housing Improvement Grants .................................................................................... 300,000","Housing Improvement Grants .................................................................................... 300,000","Housing Improvement Grants .................................................................................... 300,000","Housing Improvement Grants .................................................................................... 300,000","Housing Improvement Grants .................................................................................... 300,000","Housing Improvement Grants .................................................................................... 300,000","Housing Improvement Grants .................................................................................... 300,000","Housing Improvement Grants .................................................................................... 300,000"
Expand Curb Appeal Matching Grants program to older neighborhoods within Master Plan areas.,Expand Curb Appeal Matching Grants program to older neighborhoods within Master Plan areas.,Expand Curb Appeal Matching Grants program to older neighborhoods within Master Plan areas.,Expand Curb Appeal Matching Grants program to older neighborhoods within Master Plan areas.,Expand Curb Appeal Matching Grants program to older neighborhoods within Master Plan areas.,Expand Curb Appeal Matching Grants program to older neighborhoods within Master Plan areas.,Expand Curb Appeal Matching Grants program to older neighborhoods within Master Plan areas.,Expand Curb Appeal Matching Grants program to older neighborhoods within Master Plan areas.,Expand Curb Appeal Matching Grants program to older neighborhoods within Master Plan areas.,Expand Curb Appeal Matching Grants program to older neighborhoods within Master Plan areas.,Expand Curb Appeal Matching Grants program to older neighborhoods within Master Plan areas.,Expand Curb Appeal Matching Grants program to older neighborhoods within Master Plan areas.,Expand Curb Appeal Matching Grants program to older neighborhoods within Master Plan areas.,Expand Curb Appeal Matching Grants program to older neighborhoods within Master Plan areas.,Expand Curb Appeal Matching Grants program to older neighborhoods within Master Plan areas.
"Recipients are required to provide a minimum one-to-one match to funds invested by the City, which","Recipients are required to provide a minimum one-to-one match to funds invested by the City, which","Recipients are required to provide a minimum one-to-one match to funds invested by the City, which","Recipients are required to provide a minimum one-to-one match to funds invested by the City, which","Recipients are required to provide a minimum one-to-one match to funds invested by the City, which","Recipients are required to provide a minimum one-to-one match to funds invested by the City, which","Recipients are required to provide a minimum one-to-one match to funds invested by the City, which","Recipients are required to provide a minimum one-to-one match to funds invested by the City, which","Recipients are required to provide a minimum one-to-one match to funds invested by the City, which","Recipients are required to provide a minimum one-to-one match to funds invested by the City, which","Recipients are required to provide a minimum one-to-one match to funds invested by the City, which","Recipients are required to provide a minimum one-to-one match to funds invested by the City, which","Recipients are required to provide a minimum one-to-one match to funds invested by the City, which","Recipients are required to provide a minimum one-to-one match to funds invested by the City, which","Recipients are required to provide a minimum one-to-one match to funds invested by the City, which"
allows a better concentration of resources and greater impact over a shorter period of time.,allows a better concentration of resources and greater impact over a shorter period of time.,allows a better concentration of resources and greater impact over a shorter period of time.,allows a better concentration of resources and greater impact over a shorter period of time.,allows a better concentration of resources and greater impact over a shorter period of time.,allows a better concentration of resources and greater impact over a shorter period of time.,allows a better concentration of resources and greater impact over a shorter period of time.,allows a better concentration of resources and greater impact over a shorter period of time.,allows a better concentration of resources and greater impact over a shorter period of time.,allows a better concentration of resources and greater impact over a shorter period of time.,allows a better concentration of resources and greater impact over a shorter period of time.,allows a better concentration of resources and greater impact over a shorter period of time.,allows a better concentration of resources and greater impact over a shorter period of time.,,
Neighborhood Curb and Gutter Program,Neighborhood Curb and Gutter Program,Neighborhood Curb and Gutter Program,Neighborhood Curb and Gutter Program,Neighborhood Curb and Gutter Program,Neighborhood Curb and Gutter Program,".................................................................. 585,000",".................................................................. 585,000",".................................................................. 585,000",".................................................................. 585,000",".................................................................. 585,000",".................................................................. 585,000",".................................................................. 585,000",".................................................................. 585,000",".................................................................. 585,000"
,,,,,,,7,,,,,,,
