"Employer of Choice initiative, which was created to attract and retain an engaged and dynamic","Employer of Choice initiative, which was created to attract and retain an engaged and dynamic","Employer of Choice initiative, which was created to attract and retain an engaged and dynamic","Employer of Choice initiative, which was created to attract and retain an engaged and dynamic","Employer of Choice initiative, which was created to attract and retain an engaged and dynamic","Employer of Choice initiative, which was created to attract and retain an engaged and dynamic","Employer of Choice initiative, which was created to attract and retain an engaged and dynamic","Employer of Choice initiative, which was created to attract and retain an engaged and dynamic","Employer of Choice initiative, which was created to attract and retain an engaged and dynamic","Employer of Choice initiative, which was created to attract and retain an engaged and dynamic","Employer of Choice initiative, which was created to attract and retain an engaged and dynamic","Employer of Choice initiative, which was created to attract and retain an engaged and dynamic","Employer of Choice initiative, which was created to attract and retain an engaged and dynamic","Employer of Choice initiative, which was created to attract and retain an engaged and dynamic","Employer of Choice initiative, which was created to attract and retain an engaged and dynamic","Employer of Choice initiative, which was created to attract and retain an engaged and dynamic","Employer of Choice initiative, which was created to attract and retain an engaged and dynamic","Employer of Choice initiative, which was created to attract and retain an engaged and dynamic"
workforce.,workforce.,"The Employer of Choice initiative, announced in the Proposed FY 2013 Budget,","The Employer of Choice initiative, announced in the Proposed FY 2013 Budget,","The Employer of Choice initiative, announced in the Proposed FY 2013 Budget,","The Employer of Choice initiative, announced in the Proposed FY 2013 Budget,","The Employer of Choice initiative, announced in the Proposed FY 2013 Budget,","The Employer of Choice initiative, announced in the Proposed FY 2013 Budget,","The Employer of Choice initiative, announced in the Proposed FY 2013 Budget,","The Employer of Choice initiative, announced in the Proposed FY 2013 Budget,","The Employer of Choice initiative, announced in the Proposed FY 2013 Budget,","The Employer of Choice initiative, announced in the Proposed FY 2013 Budget,","The Employer of Choice initiative, announced in the Proposed FY 2013 Budget,","The Employer of Choice initiative, announced in the Proposed FY 2013 Budget,","The Employer of Choice initiative, announced in the Proposed FY 2013 Budget,","The Employer of Choice initiative, announced in the Proposed FY 2013 Budget,","The Employer of Choice initiative, announced in the Proposed FY 2013 Budget,","The Employer of Choice initiative, announced in the Proposed FY 2013 Budget,"
included more than just compensation and benefits.,included more than just compensation and benefits.,included more than just compensation and benefits.,included more than just compensation and benefits.,included more than just compensation and benefits.,included more than just compensation and benefits.,included more than just compensation and benefits.,included more than just compensation and benefits.,included more than just compensation and benefits.,included more than just compensation and benefits.,A major focus of the Employer of Choice,A major focus of the Employer of Choice,A major focus of the Employer of Choice,A major focus of the Employer of Choice,A major focus of the Employer of Choice,A major focus of the Employer of Choice,A major focus of the Employer of Choice,A major focus of the Employer of Choice
concept is providing opportunities for employees to strengthen their skills for professional,concept is providing opportunities for employees to strengthen their skills for professional,concept is providing opportunities for employees to strengthen their skills for professional,concept is providing opportunities for employees to strengthen their skills for professional,concept is providing opportunities for employees to strengthen their skills for professional,concept is providing opportunities for employees to strengthen their skills for professional,concept is providing opportunities for employees to strengthen their skills for professional,concept is providing opportunities for employees to strengthen their skills for professional,concept is providing opportunities for employees to strengthen their skills for professional,concept is providing opportunities for employees to strengthen their skills for professional,concept is providing opportunities for employees to strengthen their skills for professional,concept is providing opportunities for employees to strengthen their skills for professional,concept is providing opportunities for employees to strengthen their skills for professional,concept is providing opportunities for employees to strengthen their skills for professional,concept is providing opportunities for employees to strengthen their skills for professional,concept is providing opportunities for employees to strengthen their skills for professional,concept is providing opportunities for employees to strengthen their skills for professional,concept is providing opportunities for employees to strengthen their skills for professional
growth,and,"development,","development,","development,",as,well,as,offer,opportunities,opportunities,opportunities,for,cross,training,training,and,career
advancement. The Proposed FY 2014 Budget supports efforts begun in FY 2013 including:,advancement. The Proposed FY 2014 Budget supports efforts begun in FY 2013 including:,advancement. The Proposed FY 2014 Budget supports efforts begun in FY 2013 including:,advancement. The Proposed FY 2014 Budget supports efforts begun in FY 2013 including:,advancement. The Proposed FY 2014 Budget supports efforts begun in FY 2013 including:,advancement. The Proposed FY 2014 Budget supports efforts begun in FY 2013 including:,advancement. The Proposed FY 2014 Budget supports efforts begun in FY 2013 including:,advancement. The Proposed FY 2014 Budget supports efforts begun in FY 2013 including:,advancement. The Proposed FY 2014 Budget supports efforts begun in FY 2013 including:,advancement. The Proposed FY 2014 Budget supports efforts begun in FY 2013 including:,advancement. The Proposed FY 2014 Budget supports efforts begun in FY 2013 including:,advancement. The Proposed FY 2014 Budget supports efforts begun in FY 2013 including:,advancement. The Proposed FY 2014 Budget supports efforts begun in FY 2013 including:,advancement. The Proposed FY 2014 Budget supports efforts begun in FY 2013 including:,advancement. The Proposed FY 2014 Budget supports efforts begun in FY 2013 including:,advancement. The Proposed FY 2014 Budget supports efforts begun in FY 2013 including:,advancement. The Proposed FY 2014 Budget supports efforts begun in FY 2013 including:,
,Tuition reimbursement,Tuition reimbursement,Tuition reimbursement,Tuition reimbursement,Tuition reimbursement,,,,,,,,,,,,
,Employer and supervisor training opportunities,Employer and supervisor training opportunities,Employer and supervisor training opportunities,Employer and supervisor training opportunities,Employer and supervisor training opportunities,Employer and supervisor training opportunities,Employer and supervisor training opportunities,Employer and supervisor training opportunities,Employer and supervisor training opportunities,Employer and supervisor training opportunities,,,,,,,
,Four hours to volunteer at NPS,Four hours to volunteer at NPS,Four hours to volunteer at NPS,Four hours to volunteer at NPS,Four hours to volunteer at NPS,Four hours to volunteer at NPS,,,,,,,,,,,
,Master Police and Firefighter programs,Master Police and Firefighter programs,Master Police and Firefighter programs,Master Police and Firefighter programs,Master Police and Firefighter programs,Master Police and Firefighter programs,Master Police and Firefighter programs,Master Police and Firefighter programs,,,,,,,,,
"Additionally, new for FY 2014 is the creation of additional public safety internship opportunities","Additionally, new for FY 2014 is the creation of additional public safety internship opportunities","Additionally, new for FY 2014 is the creation of additional public safety internship opportunities","Additionally, new for FY 2014 is the creation of additional public safety internship opportunities","Additionally, new for FY 2014 is the creation of additional public safety internship opportunities","Additionally, new for FY 2014 is the creation of additional public safety internship opportunities","Additionally, new for FY 2014 is the creation of additional public safety internship opportunities","Additionally, new for FY 2014 is the creation of additional public safety internship opportunities","Additionally, new for FY 2014 is the creation of additional public safety internship opportunities","Additionally, new for FY 2014 is the creation of additional public safety internship opportunities","Additionally, new for FY 2014 is the creation of additional public safety internship opportunities","Additionally, new for FY 2014 is the creation of additional public safety internship opportunities","Additionally, new for FY 2014 is the creation of additional public safety internship opportunities","Additionally, new for FY 2014 is the creation of additional public safety internship opportunities","Additionally, new for FY 2014 is the creation of additional public safety internship opportunities","Additionally, new for FY 2014 is the creation of additional public safety internship opportunities","Additionally, new for FY 2014 is the creation of additional public safety internship opportunities","Additionally, new for FY 2014 is the creation of additional public safety internship opportunities"
for NPS students and a two percent General Wage Increase (GWI) for all employees beginning,for NPS students and a two percent General Wage Increase (GWI) for all employees beginning,for NPS students and a two percent General Wage Increase (GWI) for all employees beginning,for NPS students and a two percent General Wage Increase (GWI) for all employees beginning,for NPS students and a two percent General Wage Increase (GWI) for all employees beginning,for NPS students and a two percent General Wage Increase (GWI) for all employees beginning,for NPS students and a two percent General Wage Increase (GWI) for all employees beginning,for NPS students and a two percent General Wage Increase (GWI) for all employees beginning,for NPS students and a two percent General Wage Increase (GWI) for all employees beginning,for NPS students and a two percent General Wage Increase (GWI) for all employees beginning,for NPS students and a two percent General Wage Increase (GWI) for all employees beginning,for NPS students and a two percent General Wage Increase (GWI) for all employees beginning,for NPS students and a two percent General Wage Increase (GWI) for all employees beginning,for NPS students and a two percent General Wage Increase (GWI) for all employees beginning,for NPS students and a two percent General Wage Increase (GWI) for all employees beginning,for NPS students and a two percent General Wage Increase (GWI) for all employees beginning,for NPS students and a two percent General Wage Increase (GWI) for all employees beginning,for NPS students and a two percent General Wage Increase (GWI) for all employees beginning
,,,,,,,,,,,,,,,,22,
