"strategies for preserving property rights and developing land use policies, providing governmental services","strategies for preserving property rights and developing land use policies, providing governmental services","strategies for preserving property rights and developing land use policies, providing governmental services","strategies for preserving property rights and developing land use policies, providing governmental services","strategies for preserving property rights and developing land use policies, providing governmental services","strategies for preserving property rights and developing land use policies, providing governmental services","strategies for preserving property rights and developing land use policies, providing governmental services","strategies for preserving property rights and developing land use policies, providing governmental services","strategies for preserving property rights and developing land use policies, providing governmental services","strategies for preserving property rights and developing land use policies, providing governmental services","strategies for preserving property rights and developing land use policies, providing governmental services","strategies for preserving property rights and developing land use policies, providing governmental services","strategies for preserving property rights and developing land use policies, providing governmental services","strategies for preserving property rights and developing land use policies, providing governmental services","strategies for preserving property rights and developing land use policies, providing governmental services","strategies for preserving property rights and developing land use policies, providing governmental services","strategies for preserving property rights and developing land use policies, providing governmental services","strategies for preserving property rights and developing land use policies, providing governmental services","strategies for preserving property rights and developing land use policies, providing governmental services","strategies for preserving property rights and developing land use policies, providing governmental services","strategies for preserving property rights and developing land use policies, providing governmental services","strategies for preserving property rights and developing land use policies, providing governmental services","strategies for preserving property rights and developing land use policies, providing governmental services","strategies for preserving property rights and developing land use policies, providing governmental services"
"and facilities, encouraging economic development, and meeting transportation needs of the City. The CIP in","and facilities, encouraging economic development, and meeting transportation needs of the City. The CIP in","and facilities, encouraging economic development, and meeting transportation needs of the City. The CIP in","and facilities, encouraging economic development, and meeting transportation needs of the City. The CIP in","and facilities, encouraging economic development, and meeting transportation needs of the City. The CIP in","and facilities, encouraging economic development, and meeting transportation needs of the City. The CIP in","and facilities, encouraging economic development, and meeting transportation needs of the City. The CIP in","and facilities, encouraging economic development, and meeting transportation needs of the City. The CIP in","and facilities, encouraging economic development, and meeting transportation needs of the City. The CIP in","and facilities, encouraging economic development, and meeting transportation needs of the City. The CIP in","and facilities, encouraging economic development, and meeting transportation needs of the City. The CIP in","and facilities, encouraging economic development, and meeting transportation needs of the City. The CIP in","and facilities, encouraging economic development, and meeting transportation needs of the City. The CIP in","and facilities, encouraging economic development, and meeting transportation needs of the City. The CIP in","and facilities, encouraging economic development, and meeting transportation needs of the City. The CIP in","and facilities, encouraging economic development, and meeting transportation needs of the City. The CIP in","and facilities, encouraging economic development, and meeting transportation needs of the City. The CIP in","and facilities, encouraging economic development, and meeting transportation needs of the City. The CIP in","and facilities, encouraging economic development, and meeting transportation needs of the City. The CIP in","and facilities, encouraging economic development, and meeting transportation needs of the City. The CIP in","and facilities, encouraging economic development, and meeting transportation needs of the City. The CIP in","and facilities, encouraging economic development, and meeting transportation needs of the City. The CIP in","and facilities, encouraging economic development, and meeting transportation needs of the City. The CIP in","and facilities, encouraging economic development, and meeting transportation needs of the City. The CIP in"
"combination with the Comprehensive Plan should assist with determining and balancing long-term needs,","combination with the Comprehensive Plan should assist with determining and balancing long-term needs,","combination with the Comprehensive Plan should assist with determining and balancing long-term needs,","combination with the Comprehensive Plan should assist with determining and balancing long-term needs,","combination with the Comprehensive Plan should assist with determining and balancing long-term needs,","combination with the Comprehensive Plan should assist with determining and balancing long-term needs,","combination with the Comprehensive Plan should assist with determining and balancing long-term needs,","combination with the Comprehensive Plan should assist with determining and balancing long-term needs,","combination with the Comprehensive Plan should assist with determining and balancing long-term needs,","combination with the Comprehensive Plan should assist with determining and balancing long-term needs,","combination with the Comprehensive Plan should assist with determining and balancing long-term needs,","combination with the Comprehensive Plan should assist with determining and balancing long-term needs,","combination with the Comprehensive Plan should assist with determining and balancing long-term needs,","combination with the Comprehensive Plan should assist with determining and balancing long-term needs,","combination with the Comprehensive Plan should assist with determining and balancing long-term needs,","combination with the Comprehensive Plan should assist with determining and balancing long-term needs,","combination with the Comprehensive Plan should assist with determining and balancing long-term needs,","combination with the Comprehensive Plan should assist with determining and balancing long-term needs,","combination with the Comprehensive Plan should assist with determining and balancing long-term needs,","combination with the Comprehensive Plan should assist with determining and balancing long-term needs,","combination with the Comprehensive Plan should assist with determining and balancing long-term needs,","combination with the Comprehensive Plan should assist with determining and balancing long-term needs,","combination with the Comprehensive Plan should assist with determining and balancing long-term needs,","combination with the Comprehensive Plan should assist with determining and balancing long-term needs,"
"setting priorities, and addressing capital problems before they become critical.","setting priorities, and addressing capital problems before they become critical.","setting priorities, and addressing capital problems before they become critical.","setting priorities, and addressing capital problems before they become critical.","setting priorities, and addressing capital problems before they become critical.","setting priorities, and addressing capital problems before they become critical.","setting priorities, and addressing capital problems before they become critical.","setting priorities, and addressing capital problems before they become critical.","setting priorities, and addressing capital problems before they become critical.","setting priorities, and addressing capital problems before they become critical.","setting priorities, and addressing capital problems before they become critical.","setting priorities, and addressing capital problems before they become critical.","setting priorities, and addressing capital problems before they become critical.","setting priorities, and addressing capital problems before they become critical.","setting priorities, and addressing capital problems before they become critical.","setting priorities, and addressing capital problems before they become critical.","setting priorities, and addressing capital problems before they become critical.","setting priorities, and addressing capital problems before they become critical.",The Comprehensive Plan,The Comprehensive Plan,The Comprehensive Plan,The Comprehensive Plan,The Comprehensive Plan,The Comprehensive Plan
was,adopted,adopted,adopted,by,City,Council,Council,on,September,September,"28,","28,",2009,,and,staff,is,currently,currently,implementing,implementing,implementing,the
recommendations within the document as outlined in the work program.,recommendations within the document as outlined in the work program.,recommendations within the document as outlined in the work program.,recommendations within the document as outlined in the work program.,recommendations within the document as outlined in the work program.,recommendations within the document as outlined in the work program.,recommendations within the document as outlined in the work program.,recommendations within the document as outlined in the work program.,recommendations within the document as outlined in the work program.,recommendations within the document as outlined in the work program.,recommendations within the document as outlined in the work program.,recommendations within the document as outlined in the work program.,recommendations within the document as outlined in the work program.,recommendations within the document as outlined in the work program.,recommendations within the document as outlined in the work program.,recommendations within the document as outlined in the work program.,recommendations within the document as outlined in the work program.,,,,,,,
,,,,,,,,,,,xxvi,xxvi,,,,,,,,,,,
