Name: “Table 1 of 1 on page 42 of 239”,Name: “Table 1 of 1 on page 42 of 239”,Name: “Table 1 of 1 on page 42 of 239”,Name: “Table 1 of 1 on page 42 of 239”,Name: “Table 1 of 1 on page 42 of 239”,Name: “Table 1 of 1 on page 42 of 239”,Name: “Table 1 of 1 on page 42 of 239”,Name: “Table 1 of 1 on page 42 of 239”,Name: “Table 1 of 1 on page 42 of 239”,Name: “Table 1 of 1 on page 42 of 239”,Name: “Table 1 of 1 on page 42 of 239”,Name: “Table 1 of 1 on page 42 of 239”,Name: “Table 1 of 1 on page 42 of 239”,Name: “Table 1 of 1 on page 42 of 239”,Name: “Table 1 of 1 on page 42 of 239”,Name: “Table 1 of 1 on page 42 of 239”,Name: “Table 1 of 1 on page 42 of 239”,Name: “Table 1 of 1 on page 42 of 239”,Name: “Table 1 of 1 on page 42 of 239”,Name: “Table 1 of 1 on page 42 of 239”,Name: “Table 1 of 1 on page 42 of 239”,Name: “Table 1 of 1 on page 42 of 239”,Name: “Table 1 of 1 on page 42 of 239”,Name: “Table 1 of 1 on page 42 of 239”
Table: 31,Table: 31,Table: 31,Table: 31,Table: 31,Table: 31,Table: 31,Table: 31,Table: 31,Table: 31,Table: 31,Table: 31,Table: 31,Table: 31,Table: 31,Table: 31,Table: 31,Table: 31,Table: 31,Table: 31,Table: 31,Table: 31,Table: 31,Table: 31
,,,,,,,,,,,,,,,,,,,,,,,
,,,,,,THE BUDGET PROCESS IN POQUOSON,THE BUDGET PROCESS IN POQUOSON,THE BUDGET PROCESS IN POQUOSON,THE BUDGET PROCESS IN POQUOSON,THE BUDGET PROCESS IN POQUOSON,THE BUDGET PROCESS IN POQUOSON,THE BUDGET PROCESS IN POQUOSON,THE BUDGET PROCESS IN POQUOSON,THE BUDGET PROCESS IN POQUOSON,THE BUDGET PROCESS IN POQUOSON,THE BUDGET PROCESS IN POQUOSON,THE BUDGET PROCESS IN POQUOSON,THE BUDGET PROCESS IN POQUOSON,,,,,
through frequent meetings with the department head.,through frequent meetings with the department head.,through frequent meetings with the department head.,through frequent meetings with the department head.,through frequent meetings with the department head.,through frequent meetings with the department head.,through frequent meetings with the department head.,through frequent meetings with the department head.,through frequent meetings with the department head.,through frequent meetings with the department head.,through frequent meetings with the department head.,through frequent meetings with the department head.,"In addition, each department establishes efficiency","In addition, each department establishes efficiency","In addition, each department establishes efficiency","In addition, each department establishes efficiency","In addition, each department establishes efficiency","In addition, each department establishes efficiency","In addition, each department establishes efficiency","In addition, each department establishes efficiency","In addition, each department establishes efficiency","In addition, each department establishes efficiency","In addition, each department establishes efficiency","In addition, each department establishes efficiency"
and effectiveness measures in regards to their operations.,and effectiveness measures in regards to their operations.,and effectiveness measures in regards to their operations.,and effectiveness measures in regards to their operations.,and effectiveness measures in regards to their operations.,and effectiveness measures in regards to their operations.,and effectiveness measures in regards to their operations.,and effectiveness measures in regards to their operations.,and effectiveness measures in regards to their operations.,and effectiveness measures in regards to their operations.,and effectiveness measures in regards to their operations.,and effectiveness measures in regards to their operations.,and effectiveness measures in regards to their operations.,,,,,,,,,,,
Budgetary control is maintained on a line-item basis.,Budgetary control is maintained on a line-item basis.,Budgetary control is maintained on a line-item basis.,Budgetary control is maintained on a line-item basis.,Budgetary control is maintained on a line-item basis.,Budgetary control is maintained on a line-item basis.,Budgetary control is maintained on a line-item basis.,Budgetary control is maintained on a line-item basis.,Budgetary control is maintained on a line-item basis.,Budgetary control is maintained on a line-item basis.,Budgetary control is maintained on a line-item basis.,Budgetary control is maintained on a line-item basis.,The Budget is monitored by the issuance of Monthly,The Budget is monitored by the issuance of Monthly,The Budget is monitored by the issuance of Monthly,The Budget is monitored by the issuance of Monthly,The Budget is monitored by the issuance of Monthly,The Budget is monitored by the issuance of Monthly,The Budget is monitored by the issuance of Monthly,The Budget is monitored by the issuance of Monthly,The Budget is monitored by the issuance of Monthly,The Budget is monitored by the issuance of Monthly,The Budget is monitored by the issuance of Monthly,The Budget is monitored by the issuance of Monthly
Management Reports.,Management Reports.,Management Reports.,Management Reports.,Management Reports.,Management Reports.,These reports indicate actual financial results compared to Budget and are reviewed,These reports indicate actual financial results compared to Budget and are reviewed,These reports indicate actual financial results compared to Budget and are reviewed,These reports indicate actual financial results compared to Budget and are reviewed,These reports indicate actual financial results compared to Budget and are reviewed,These reports indicate actual financial results compared to Budget and are reviewed,These reports indicate actual financial results compared to Budget and are reviewed,These reports indicate actual financial results compared to Budget and are reviewed,These reports indicate actual financial results compared to Budget and are reviewed,These reports indicate actual financial results compared to Budget and are reviewed,These reports indicate actual financial results compared to Budget and are reviewed,These reports indicate actual financial results compared to Budget and are reviewed,These reports indicate actual financial results compared to Budget and are reviewed,These reports indicate actual financial results compared to Budget and are reviewed,These reports indicate actual financial results compared to Budget and are reviewed,These reports indicate actual financial results compared to Budget and are reviewed,These reports indicate actual financial results compared to Budget and are reviewed,These reports indicate actual financial results compared to Budget and are reviewed
thoroughly by the Finance Department.,thoroughly by the Finance Department.,thoroughly by the Finance Department.,thoroughly by the Finance Department.,thoroughly by the Finance Department.,thoroughly by the Finance Department.,thoroughly by the Finance Department.,thoroughly by the Finance Department.,thoroughly by the Finance Department.,These reports are forwarded to City Departments and the City,These reports are forwarded to City Departments and the City,These reports are forwarded to City Departments and the City,These reports are forwarded to City Departments and the City,These reports are forwarded to City Departments and the City,These reports are forwarded to City Departments and the City,These reports are forwarded to City Departments and the City,These reports are forwarded to City Departments and the City,These reports are forwarded to City Departments and the City,These reports are forwarded to City Departments and the City,These reports are forwarded to City Departments and the City,These reports are forwarded to City Departments and the City,These reports are forwarded to City Departments and the City,These reports are forwarded to City Departments and the City,These reports are forwarded to City Departments and the City
Manager for their analysis and management.,Manager for their analysis and management.,Manager for their analysis and management.,Manager for their analysis and management.,Manager for their analysis and management.,Manager for their analysis and management.,Manager for their analysis and management.,Manager for their analysis and management.,Manager for their analysis and management.,Manager for their analysis and management.,,,,,,,,,,,,,,
Purchases of goods and services must be accomplished by the use of a formal purchase order.,Purchases of goods and services must be accomplished by the use of a formal purchase order.,Purchases of goods and services must be accomplished by the use of a formal purchase order.,Purchases of goods and services must be accomplished by the use of a formal purchase order.,Purchases of goods and services must be accomplished by the use of a formal purchase order.,Purchases of goods and services must be accomplished by the use of a formal purchase order.,Purchases of goods and services must be accomplished by the use of a formal purchase order.,Purchases of goods and services must be accomplished by the use of a formal purchase order.,Purchases of goods and services must be accomplished by the use of a formal purchase order.,Purchases of goods and services must be accomplished by the use of a formal purchase order.,Purchases of goods and services must be accomplished by the use of a formal purchase order.,Purchases of goods and services must be accomplished by the use of a formal purchase order.,Purchases of goods and services must be accomplished by the use of a formal purchase order.,Purchases of goods and services must be accomplished by the use of a formal purchase order.,Purchases of goods and services must be accomplished by the use of a formal purchase order.,Purchases of goods and services must be accomplished by the use of a formal purchase order.,Purchases of goods and services must be accomplished by the use of a formal purchase order.,Purchases of goods and services must be accomplished by the use of a formal purchase order.,Purchases of goods and services must be accomplished by the use of a formal purchase order.,Purchases of goods and services must be accomplished by the use of a formal purchase order.,Purchases of goods and services must be accomplished by the use of a formal purchase order.,Funds are,Funds are,Funds are
encumbered based on purchase orders to ensure that an over-spent condition does not exist per Budget,encumbered based on purchase orders to ensure that an over-spent condition does not exist per Budget,encumbered based on purchase orders to ensure that an over-spent condition does not exist per Budget,encumbered based on purchase orders to ensure that an over-spent condition does not exist per Budget,encumbered based on purchase orders to ensure that an over-spent condition does not exist per Budget,encumbered based on purchase orders to ensure that an over-spent condition does not exist per Budget,encumbered based on purchase orders to ensure that an over-spent condition does not exist per Budget,encumbered based on purchase orders to ensure that an over-spent condition does not exist per Budget,encumbered based on purchase orders to ensure that an over-spent condition does not exist per Budget,encumbered based on purchase orders to ensure that an over-spent condition does not exist per Budget,encumbered based on purchase orders to ensure that an over-spent condition does not exist per Budget,encumbered based on purchase orders to ensure that an over-spent condition does not exist per Budget,encumbered based on purchase orders to ensure that an over-spent condition does not exist per Budget,encumbered based on purchase orders to ensure that an over-spent condition does not exist per Budget,encumbered based on purchase orders to ensure that an over-spent condition does not exist per Budget,encumbered based on purchase orders to ensure that an over-spent condition does not exist per Budget,encumbered based on purchase orders to ensure that an over-spent condition does not exist per Budget,encumbered based on purchase orders to ensure that an over-spent condition does not exist per Budget,encumbered based on purchase orders to ensure that an over-spent condition does not exist per Budget,encumbered based on purchase orders to ensure that an over-spent condition does not exist per Budget,encumbered based on purchase orders to ensure that an over-spent condition does not exist per Budget,encumbered based on purchase orders to ensure that an over-spent condition does not exist per Budget,encumbered based on purchase orders to ensure that an over-spent condition does not exist per Budget,encumbered based on purchase orders to ensure that an over-spent condition does not exist per Budget
line item.,line item.,,,,,,,,,,,,,,,,,,,,,,
,,,,,,CAPITAL IMPROVEMENTS PROGRAM,CAPITAL IMPROVEMENTS PROGRAM,CAPITAL IMPROVEMENTS PROGRAM,CAPITAL IMPROVEMENTS PROGRAM,CAPITAL IMPROVEMENTS PROGRAM,CAPITAL IMPROVEMENTS PROGRAM,CAPITAL IMPROVEMENTS PROGRAM,CAPITAL IMPROVEMENTS PROGRAM,CAPITAL IMPROVEMENTS PROGRAM,CAPITAL IMPROVEMENTS PROGRAM,CAPITAL IMPROVEMENTS PROGRAM,,,,,,,
The,CIP,is,a,planning,planning,and,budgeting,budgeting,tool,that,identifies,identifies,identifies,the,necessary,necessary,capital,capital,projects,for,the,City,of
Poquoson over the five-year period.,Poquoson over the five-year period.,Poquoson over the five-year period.,Poquoson over the five-year period.,Poquoson over the five-year period.,Poquoson over the five-year period.,Poquoson over the five-year period.,Poquoson over the five-year period.,Poquoson over the five-year period.,The plan is reviewed and updated annually.,The plan is reviewed and updated annually.,The plan is reviewed and updated annually.,The plan is reviewed and updated annually.,The plan is reviewed and updated annually.,The plan is reviewed and updated annually.,The plan is reviewed and updated annually.,The plan is reviewed and updated annually.,The plan is reviewed and updated annually.,The plan is reviewed and updated annually.,,Early in the budget,Early in the budget,Early in the budget,Early in the budget
"process, the plan is reviewed by the Poquoson Planning Commission.","process, the plan is reviewed by the Poquoson Planning Commission.","process, the plan is reviewed by the Poquoson Planning Commission.","process, the plan is reviewed by the Poquoson Planning Commission.","process, the plan is reviewed by the Poquoson Planning Commission.","process, the plan is reviewed by the Poquoson Planning Commission.","process, the plan is reviewed by the Poquoson Planning Commission.","process, the plan is reviewed by the Poquoson Planning Commission.","process, the plan is reviewed by the Poquoson Planning Commission.","process, the plan is reviewed by the Poquoson Planning Commission.","process, the plan is reviewed by the Poquoson Planning Commission.","process, the plan is reviewed by the Poquoson Planning Commission.","process, the plan is reviewed by the Poquoson Planning Commission.","process, the plan is reviewed by the Poquoson Planning Commission.","process, the plan is reviewed by the Poquoson Planning Commission.","process, the plan is reviewed by the Poquoson Planning Commission.","process, the plan is reviewed by the Poquoson Planning Commission.",Once the CIP is adopted by the,Once the CIP is adopted by the,Once the CIP is adopted by the,Once the CIP is adopted by the,Once the CIP is adopted by the,Once the CIP is adopted by the,Once the CIP is adopted by the
Planning,Planning,"Commission,","Commission,","Commission,","Commission,",the,document,document,then,goes,to,City,,Council,Council,for,approval.,approval.,Projects,in,the,CIP,are
incorporated in the Annual Financial Plan to the extent funds are available.,incorporated in the Annual Financial Plan to the extent funds are available.,incorporated in the Annual Financial Plan to the extent funds are available.,incorporated in the Annual Financial Plan to the extent funds are available.,incorporated in the Annual Financial Plan to the extent funds are available.,incorporated in the Annual Financial Plan to the extent funds are available.,incorporated in the Annual Financial Plan to the extent funds are available.,incorporated in the Annual Financial Plan to the extent funds are available.,incorporated in the Annual Financial Plan to the extent funds are available.,incorporated in the Annual Financial Plan to the extent funds are available.,incorporated in the Annual Financial Plan to the extent funds are available.,incorporated in the Annual Financial Plan to the extent funds are available.,incorporated in the Annual Financial Plan to the extent funds are available.,incorporated in the Annual Financial Plan to the extent funds are available.,incorporated in the Annual Financial Plan to the extent funds are available.,incorporated in the Annual Financial Plan to the extent funds are available.,incorporated in the Annual Financial Plan to the extent funds are available.,,,,,,,
The FY 2011 – Beyond FY 2015 CIP prepared by staff was presented to Poquoson Planning Commission,The FY 2011 – Beyond FY 2015 CIP prepared by staff was presented to Poquoson Planning Commission,The FY 2011 – Beyond FY 2015 CIP prepared by staff was presented to Poquoson Planning Commission,The FY 2011 – Beyond FY 2015 CIP prepared by staff was presented to Poquoson Planning Commission,The FY 2011 – Beyond FY 2015 CIP prepared by staff was presented to Poquoson Planning Commission,The FY 2011 – Beyond FY 2015 CIP prepared by staff was presented to Poquoson Planning Commission,The FY 2011 – Beyond FY 2015 CIP prepared by staff was presented to Poquoson Planning Commission,The FY 2011 – Beyond FY 2015 CIP prepared by staff was presented to Poquoson Planning Commission,The FY 2011 – Beyond FY 2015 CIP prepared by staff was presented to Poquoson Planning Commission,The FY 2011 – Beyond FY 2015 CIP prepared by staff was presented to Poquoson Planning Commission,The FY 2011 – Beyond FY 2015 CIP prepared by staff was presented to Poquoson Planning Commission,The FY 2011 – Beyond FY 2015 CIP prepared by staff was presented to Poquoson Planning Commission,The FY 2011 – Beyond FY 2015 CIP prepared by staff was presented to Poquoson Planning Commission,The FY 2011 – Beyond FY 2015 CIP prepared by staff was presented to Poquoson Planning Commission,The FY 2011 – Beyond FY 2015 CIP prepared by staff was presented to Poquoson Planning Commission,The FY 2011 – Beyond FY 2015 CIP prepared by staff was presented to Poquoson Planning Commission,The FY 2011 – Beyond FY 2015 CIP prepared by staff was presented to Poquoson Planning Commission,The FY 2011 – Beyond FY 2015 CIP prepared by staff was presented to Poquoson Planning Commission,The FY 2011 – Beyond FY 2015 CIP prepared by staff was presented to Poquoson Planning Commission,The FY 2011 – Beyond FY 2015 CIP prepared by staff was presented to Poquoson Planning Commission,The FY 2011 – Beyond FY 2015 CIP prepared by staff was presented to Poquoson Planning Commission,The FY 2011 – Beyond FY 2015 CIP prepared by staff was presented to Poquoson Planning Commission,The FY 2011 – Beyond FY 2015 CIP prepared by staff was presented to Poquoson Planning Commission,The FY 2011 – Beyond FY 2015 CIP prepared by staff was presented to Poquoson Planning Commission
"on November 25, 2009.","on November 25, 2009.","on November 25, 2009.","on November 25, 2009.","on November 25, 2009.","on November 25, 2009.",The Planning Commission held a work session and Public Hearing on December,The Planning Commission held a work session and Public Hearing on December,The Planning Commission held a work session and Public Hearing on December,The Planning Commission held a work session and Public Hearing on December,The Planning Commission held a work session and Public Hearing on December,The Planning Commission held a work session and Public Hearing on December,The Planning Commission held a work session and Public Hearing on December,The Planning Commission held a work session and Public Hearing on December,The Planning Commission held a work session and Public Hearing on December,The Planning Commission held a work session and Public Hearing on December,The Planning Commission held a work session and Public Hearing on December,The Planning Commission held a work session and Public Hearing on December,The Planning Commission held a work session and Public Hearing on December,The Planning Commission held a work session and Public Hearing on December,The Planning Commission held a work session and Public Hearing on December,The Planning Commission held a work session and Public Hearing on December,The Planning Commission held a work session and Public Hearing on December,The Planning Commission held a work session and Public Hearing on December
"21, 2009 for document review.","21, 2009 for document review.","21, 2009 for document review.","21, 2009 for document review.","21, 2009 for document review.","21, 2009 for document review.","21, 2009 for document review.","The Planning Commission adopted the CIP Plan on December 21, 2009 and","The Planning Commission adopted the CIP Plan on December 21, 2009 and","The Planning Commission adopted the CIP Plan on December 21, 2009 and","The Planning Commission adopted the CIP Plan on December 21, 2009 and","The Planning Commission adopted the CIP Plan on December 21, 2009 and","The Planning Commission adopted the CIP Plan on December 21, 2009 and","The Planning Commission adopted the CIP Plan on December 21, 2009 and","The Planning Commission adopted the CIP Plan on December 21, 2009 and","The Planning Commission adopted the CIP Plan on December 21, 2009 and","The Planning Commission adopted the CIP Plan on December 21, 2009 and","The Planning Commission adopted the CIP Plan on December 21, 2009 and","The Planning Commission adopted the CIP Plan on December 21, 2009 and","The Planning Commission adopted the CIP Plan on December 21, 2009 and","The Planning Commission adopted the CIP Plan on December 21, 2009 and","The Planning Commission adopted the CIP Plan on December 21, 2009 and","The Planning Commission adopted the CIP Plan on December 21, 2009 and","The Planning Commission adopted the CIP Plan on December 21, 2009 and"
was,submitted,submitted,submitted,to,City,Council,on,January,January,"25,",2010,for,,their,consideration.,consideration.,consideration.,The,CIP,was,adopted,adopted,by
"Poquoson City Council on March 22, 2010 with several amendments incorporated into the plan.","Poquoson City Council on March 22, 2010 with several amendments incorporated into the plan.","Poquoson City Council on March 22, 2010 with several amendments incorporated into the plan.","Poquoson City Council on March 22, 2010 with several amendments incorporated into the plan.","Poquoson City Council on March 22, 2010 with several amendments incorporated into the plan.","Poquoson City Council on March 22, 2010 with several amendments incorporated into the plan.","Poquoson City Council on March 22, 2010 with several amendments incorporated into the plan.","Poquoson City Council on March 22, 2010 with several amendments incorporated into the plan.","Poquoson City Council on March 22, 2010 with several amendments incorporated into the plan.","Poquoson City Council on March 22, 2010 with several amendments incorporated into the plan.","Poquoson City Council on March 22, 2010 with several amendments incorporated into the plan.","Poquoson City Council on March 22, 2010 with several amendments incorporated into the plan.","Poquoson City Council on March 22, 2010 with several amendments incorporated into the plan.","Poquoson City Council on March 22, 2010 with several amendments incorporated into the plan.","Poquoson City Council on March 22, 2010 with several amendments incorporated into the plan.","Poquoson City Council on March 22, 2010 with several amendments incorporated into the plan.","Poquoson City Council on March 22, 2010 with several amendments incorporated into the plan.","Poquoson City Council on March 22, 2010 with several amendments incorporated into the plan.","Poquoson City Council on March 22, 2010 with several amendments incorporated into the plan.","Poquoson City Council on March 22, 2010 with several amendments incorporated into the plan.","Poquoson City Council on March 22, 2010 with several amendments incorporated into the plan.",,,
"Generally,","Generally,",the,the,basis,for,the,CIP,can,be,found,in,the,Comprehensive,Comprehensive,Comprehensive,Comprehensive,Plan.,The,Comprehensive,Comprehensive,Comprehensive,Plan,Plan
attempts,attempts,to,address,address,how,Poquoson,Poquoson,Poquoson,will,sustain,itself,itself,at,the,beginning,beginning,of,the,21st,century.,It,provides,provides
