Name: “Table 1 of 1 on page 55 of 157”,Name: “Table 1 of 1 on page 55 of 157”,Name: “Table 1 of 1 on page 55 of 157”,Name: “Table 1 of 1 on page 55 of 157”,Name: “Table 1 of 1 on page 55 of 157”,Name: “Table 1 of 1 on page 55 of 157”,Name: “Table 1 of 1 on page 55 of 157”,Name: “Table 1 of 1 on page 55 of 157”,Name: “Table 1 of 1 on page 55 of 157”,Name: “Table 1 of 1 on page 55 of 157”,Name: “Table 1 of 1 on page 55 of 157”,Name: “Table 1 of 1 on page 55 of 157”,Name: “Table 1 of 1 on page 55 of 157”,Name: “Table 1 of 1 on page 55 of 157”,Name: “Table 1 of 1 on page 55 of 157”,Name: “Table 1 of 1 on page 55 of 157”,Name: “Table 1 of 1 on page 55 of 157”,Name: “Table 1 of 1 on page 55 of 157”,Name: “Table 1 of 1 on page 55 of 157”,Name: “Table 1 of 1 on page 55 of 157”,Name: “Table 1 of 1 on page 55 of 157”,Name: “Table 1 of 1 on page 55 of 157”
Table: 53,Table: 53,Table: 53,Table: 53,Table: 53,Table: 53,Table: 53,Table: 53,Table: 53,Table: 53,Table: 53,Table: 53,Table: 53,Table: 53,Table: 53,Table: 53,Table: 53,Table: 53,Table: 53,Table: 53,Table: 53,Table: 53
,,,,,,,,,,,,,,,,,,,,,
,,,,,,,,,ISLE OF WIGHT COUNTY,ISLE OF WIGHT COUNTY,ISLE OF WIGHT COUNTY,ISLE OF WIGHT COUNTY,ISLE OF WIGHT COUNTY,,,,,,,,
,,,,,,,FY 2008-09 GENERAL OPERATING BUDGET,FY 2008-09 GENERAL OPERATING BUDGET,FY 2008-09 GENERAL OPERATING BUDGET,FY 2008-09 GENERAL OPERATING BUDGET,FY 2008-09 GENERAL OPERATING BUDGET,FY 2008-09 GENERAL OPERATING BUDGET,FY 2008-09 GENERAL OPERATING BUDGET,FY 2008-09 GENERAL OPERATING BUDGET,FY 2008-09 GENERAL OPERATING BUDGET,,,,,,
,,,,,,,,CLERK OF THE CIRCUIT COURT,CLERK OF THE CIRCUIT COURT,CLERK OF THE CIRCUIT COURT,CLERK OF THE CIRCUIT COURT,CLERK OF THE CIRCUIT COURT,CLERK OF THE CIRCUIT COURT,,,,,,,,
PROGRAM DESCRIPTION,PROGRAM DESCRIPTION,PROGRAM DESCRIPTION,PROGRAM DESCRIPTION,PROGRAM DESCRIPTION,PROGRAM DESCRIPTION,,,,,,,,,,,,,,,,
The,Clerk,of,the,Circuit,Court,is,an,elected,official,responsible,for,maintenance,maintenance,of,all,real,estate,title,and,land,parcel
documents.,documents.,documents.,The,Circuit,Court,Clerk's,Clerk's,Office,records,"deeds,","wills,",civil,"suits,",financing,financing,statements,statements,and,other,documents,
relating to real estate and civil cases.,relating to real estate and civil cases.,relating to real estate and civil cases.,relating to real estate and civil cases.,relating to real estate and civil cases.,relating to real estate and civil cases.,relating to real estate and civil cases.,relating to real estate and civil cases.,"The Clerk's Office is also the administrative office for the Circuit Court, and in that","The Clerk's Office is also the administrative office for the Circuit Court, and in that","The Clerk's Office is also the administrative office for the Circuit Court, and in that","The Clerk's Office is also the administrative office for the Circuit Court, and in that","The Clerk's Office is also the administrative office for the Circuit Court, and in that","The Clerk's Office is also the administrative office for the Circuit Court, and in that","The Clerk's Office is also the administrative office for the Circuit Court, and in that","The Clerk's Office is also the administrative office for the Circuit Court, and in that","The Clerk's Office is also the administrative office for the Circuit Court, and in that","The Clerk's Office is also the administrative office for the Circuit Court, and in that","The Clerk's Office is also the administrative office for the Circuit Court, and in that","The Clerk's Office is also the administrative office for the Circuit Court, and in that","The Clerk's Office is also the administrative office for the Circuit Court, and in that",
"capacity, keeps both","capacity, keeps both","capacity, keeps both","capacity, keeps both",the active and concluded court dockets and makes the arrangements necessary for the trial of both civil,the active and concluded court dockets and makes the arrangements necessary for the trial of both civil,the active and concluded court dockets and makes the arrangements necessary for the trial of both civil,the active and concluded court dockets and makes the arrangements necessary for the trial of both civil,the active and concluded court dockets and makes the arrangements necessary for the trial of both civil,the active and concluded court dockets and makes the arrangements necessary for the trial of both civil,the active and concluded court dockets and makes the arrangements necessary for the trial of both civil,the active and concluded court dockets and makes the arrangements necessary for the trial of both civil,the active and concluded court dockets and makes the arrangements necessary for the trial of both civil,the active and concluded court dockets and makes the arrangements necessary for the trial of both civil,the active and concluded court dockets and makes the arrangements necessary for the trial of both civil,the active and concluded court dockets and makes the arrangements necessary for the trial of both civil,the active and concluded court dockets and makes the arrangements necessary for the trial of both civil,the active and concluded court dockets and makes the arrangements necessary for the trial of both civil,the active and concluded court dockets and makes the arrangements necessary for the trial of both civil,the active and concluded court dockets and makes the arrangements necessary for the trial of both civil,the active and concluded court dockets and makes the arrangements necessary for the trial of both civil,
and criminal cases.,and criminal cases.,and criminal cases.,and criminal cases.,"The office issues subpoenas for witnesses, draws jurors, sets trial dates and attends trials.","The office issues subpoenas for witnesses, draws jurors, sets trial dates and attends trials.","The office issues subpoenas for witnesses, draws jurors, sets trial dates and attends trials.","The office issues subpoenas for witnesses, draws jurors, sets trial dates and attends trials.","The office issues subpoenas for witnesses, draws jurors, sets trial dates and attends trials.","The office issues subpoenas for witnesses, draws jurors, sets trial dates and attends trials.","The office issues subpoenas for witnesses, draws jurors, sets trial dates and attends trials.","The office issues subpoenas for witnesses, draws jurors, sets trial dates and attends trials.","The office issues subpoenas for witnesses, draws jurors, sets trial dates and attends trials.","The office issues subpoenas for witnesses, draws jurors, sets trial dates and attends trials.","The office issues subpoenas for witnesses, draws jurors, sets trial dates and attends trials.","The office issues subpoenas for witnesses, draws jurors, sets trial dates and attends trials.","The office issues subpoenas for witnesses, draws jurors, sets trial dates and attends trials.","The office issues subpoenas for witnesses, draws jurors, sets trial dates and attends trials.","The office issues subpoenas for witnesses, draws jurors, sets trial dates and attends trials.","After the trial,","After the trial,",
the Clerks Office writes orders carrying out the rulings of the court. Judgments are docketed and fines and costs are collected.,the Clerks Office writes orders carrying out the rulings of the court. Judgments are docketed and fines and costs are collected.,the Clerks Office writes orders carrying out the rulings of the court. Judgments are docketed and fines and costs are collected.,the Clerks Office writes orders carrying out the rulings of the court. Judgments are docketed and fines and costs are collected.,the Clerks Office writes orders carrying out the rulings of the court. Judgments are docketed and fines and costs are collected.,the Clerks Office writes orders carrying out the rulings of the court. Judgments are docketed and fines and costs are collected.,the Clerks Office writes orders carrying out the rulings of the court. Judgments are docketed and fines and costs are collected.,the Clerks Office writes orders carrying out the rulings of the court. Judgments are docketed and fines and costs are collected.,the Clerks Office writes orders carrying out the rulings of the court. Judgments are docketed and fines and costs are collected.,the Clerks Office writes orders carrying out the rulings of the court. Judgments are docketed and fines and costs are collected.,the Clerks Office writes orders carrying out the rulings of the court. Judgments are docketed and fines and costs are collected.,the Clerks Office writes orders carrying out the rulings of the court. Judgments are docketed and fines and costs are collected.,the Clerks Office writes orders carrying out the rulings of the court. Judgments are docketed and fines and costs are collected.,the Clerks Office writes orders carrying out the rulings of the court. Judgments are docketed and fines and costs are collected.,the Clerks Office writes orders carrying out the rulings of the court. Judgments are docketed and fines and costs are collected.,the Clerks Office writes orders carrying out the rulings of the court. Judgments are docketed and fines and costs are collected.,the Clerks Office writes orders carrying out the rulings of the court. Judgments are docketed and fines and costs are collected.,the Clerks Office writes orders carrying out the rulings of the court. Judgments are docketed and fines and costs are collected.,the Clerks Office writes orders carrying out the rulings of the court. Judgments are docketed and fines and costs are collected.,the Clerks Office writes orders carrying out the rulings of the court. Judgments are docketed and fines and costs are collected.,the Clerks Office writes orders carrying out the rulings of the court. Judgments are docketed and fines and costs are collected.,
"Other duties include the issuance of marriage licenses, hunting and fishing licenses, and passports; administering notary","Other duties include the issuance of marriage licenses, hunting and fishing licenses, and passports; administering notary","Other duties include the issuance of marriage licenses, hunting and fishing licenses, and passports; administering notary","Other duties include the issuance of marriage licenses, hunting and fishing licenses, and passports; administering notary","Other duties include the issuance of marriage licenses, hunting and fishing licenses, and passports; administering notary","Other duties include the issuance of marriage licenses, hunting and fishing licenses, and passports; administering notary","Other duties include the issuance of marriage licenses, hunting and fishing licenses, and passports; administering notary","Other duties include the issuance of marriage licenses, hunting and fishing licenses, and passports; administering notary","Other duties include the issuance of marriage licenses, hunting and fishing licenses, and passports; administering notary","Other duties include the issuance of marriage licenses, hunting and fishing licenses, and passports; administering notary","Other duties include the issuance of marriage licenses, hunting and fishing licenses, and passports; administering notary","Other duties include the issuance of marriage licenses, hunting and fishing licenses, and passports; administering notary","Other duties include the issuance of marriage licenses, hunting and fishing licenses, and passports; administering notary","Other duties include the issuance of marriage licenses, hunting and fishing licenses, and passports; administering notary","Other duties include the issuance of marriage licenses, hunting and fishing licenses, and passports; administering notary","Other duties include the issuance of marriage licenses, hunting and fishing licenses, and passports; administering notary","Other duties include the issuance of marriage licenses, hunting and fishing licenses, and passports; administering notary","Other duties include the issuance of marriage licenses, hunting and fishing licenses, and passports; administering notary","Other duties include the issuance of marriage licenses, hunting and fishing licenses, and passports; administering notary","Other duties include the issuance of marriage licenses, hunting and fishing licenses, and passports; administering notary","Other duties include the issuance of marriage licenses, hunting and fishing licenses, and passports; administering notary",
"oaths, recording judgements, liens and releases. The Clerk's Office also serves as the Probate Court appointing persons to","oaths, recording judgements, liens and releases. The Clerk's Office also serves as the Probate Court appointing persons to","oaths, recording judgements, liens and releases. The Clerk's Office also serves as the Probate Court appointing persons to","oaths, recording judgements, liens and releases. The Clerk's Office also serves as the Probate Court appointing persons to","oaths, recording judgements, liens and releases. The Clerk's Office also serves as the Probate Court appointing persons to","oaths, recording judgements, liens and releases. The Clerk's Office also serves as the Probate Court appointing persons to","oaths, recording judgements, liens and releases. The Clerk's Office also serves as the Probate Court appointing persons to","oaths, recording judgements, liens and releases. The Clerk's Office also serves as the Probate Court appointing persons to","oaths, recording judgements, liens and releases. The Clerk's Office also serves as the Probate Court appointing persons to","oaths, recording judgements, liens and releases. The Clerk's Office also serves as the Probate Court appointing persons to","oaths, recording judgements, liens and releases. The Clerk's Office also serves as the Probate Court appointing persons to","oaths, recording judgements, liens and releases. The Clerk's Office also serves as the Probate Court appointing persons to","oaths, recording judgements, liens and releases. The Clerk's Office also serves as the Probate Court appointing persons to","oaths, recording judgements, liens and releases. The Clerk's Office also serves as the Probate Court appointing persons to","oaths, recording judgements, liens and releases. The Clerk's Office also serves as the Probate Court appointing persons to","oaths, recording judgements, liens and releases. The Clerk's Office also serves as the Probate Court appointing persons to","oaths, recording judgements, liens and releases. The Clerk's Office also serves as the Probate Court appointing persons to","oaths, recording judgements, liens and releases. The Clerk's Office also serves as the Probate Court appointing persons to","oaths, recording judgements, liens and releases. The Clerk's Office also serves as the Probate Court appointing persons to","oaths, recording judgements, liens and releases. The Clerk's Office also serves as the Probate Court appointing persons to","oaths, recording judgements, liens and releases. The Clerk's Office also serves as the Probate Court appointing persons to",
administer estates and recording estate documents.,administer estates and recording estate documents.,administer estates and recording estate documents.,administer estates and recording estate documents.,administer estates and recording estate documents.,administer estates and recording estate documents.,administer estates and recording estate documents.,administer estates and recording estate documents.,administer estates and recording estate documents.,administer estates and recording estate documents.,,,,,,,,,,,,
GOALS AND OBJECTIVES,GOALS AND OBJECTIVES,GOALS AND OBJECTIVES,GOALS AND OBJECTIVES,GOALS AND OBJECTIVES,GOALS AND OBJECTIVES,,,,,,,,,,,,,,,,
*,Continue to provide the services necessary for the storage and retrieval of County records.,Continue to provide the services necessary for the storage and retrieval of County records.,Continue to provide the services necessary for the storage and retrieval of County records.,Continue to provide the services necessary for the storage and retrieval of County records.,Continue to provide the services necessary for the storage and retrieval of County records.,Continue to provide the services necessary for the storage and retrieval of County records.,Continue to provide the services necessary for the storage and retrieval of County records.,Continue to provide the services necessary for the storage and retrieval of County records.,Continue to provide the services necessary for the storage and retrieval of County records.,Continue to provide the services necessary for the storage and retrieval of County records.,Continue to provide the services necessary for the storage and retrieval of County records.,Continue to provide the services necessary for the storage and retrieval of County records.,Continue to provide the services necessary for the storage and retrieval of County records.,Continue to provide the services necessary for the storage and retrieval of County records.,Continue to provide the services necessary for the storage and retrieval of County records.,Continue to provide the services necessary for the storage and retrieval of County records.,,,,,
*,Continue to support the Circuit Court Judges.,Continue to support the Circuit Court Judges.,Continue to support the Circuit Court Judges.,Continue to support the Circuit Court Judges.,Continue to support the Circuit Court Judges.,Continue to support the Circuit Court Judges.,Continue to support the Circuit Court Judges.,Continue to support the Circuit Court Judges.,Continue to support the Circuit Court Judges.,,,,,,,,,,,,
*,Continue to provide such services as the public using the office might require.,Continue to provide such services as the public using the office might require.,Continue to provide such services as the public using the office might require.,Continue to provide such services as the public using the office might require.,Continue to provide such services as the public using the office might require.,Continue to provide such services as the public using the office might require.,Continue to provide such services as the public using the office might require.,Continue to provide such services as the public using the office might require.,Continue to provide such services as the public using the office might require.,Continue to provide such services as the public using the office might require.,Continue to provide such services as the public using the office might require.,Continue to provide such services as the public using the office might require.,Continue to provide such services as the public using the office might require.,,,,,,,,
*,Continue to improve and add new technology and computer programs to enhance the record keeping for the general,Continue to improve and add new technology and computer programs to enhance the record keeping for the general,Continue to improve and add new technology and computer programs to enhance the record keeping for the general,Continue to improve and add new technology and computer programs to enhance the record keeping for the general,Continue to improve and add new technology and computer programs to enhance the record keeping for the general,Continue to improve and add new technology and computer programs to enhance the record keeping for the general,Continue to improve and add new technology and computer programs to enhance the record keeping for the general,Continue to improve and add new technology and computer programs to enhance the record keeping for the general,Continue to improve and add new technology and computer programs to enhance the record keeping for the general,Continue to improve and add new technology and computer programs to enhance the record keeping for the general,Continue to improve and add new technology and computer programs to enhance the record keeping for the general,Continue to improve and add new technology and computer programs to enhance the record keeping for the general,Continue to improve and add new technology and computer programs to enhance the record keeping for the general,Continue to improve and add new technology and computer programs to enhance the record keeping for the general,Continue to improve and add new technology and computer programs to enhance the record keeping for the general,Continue to improve and add new technology and computer programs to enhance the record keeping for the general,Continue to improve and add new technology and computer programs to enhance the record keeping for the general,Continue to improve and add new technology and computer programs to enhance the record keeping for the general,Continue to improve and add new technology and computer programs to enhance the record keeping for the general,Continue to improve and add new technology and computer programs to enhance the record keeping for the general,
,publlic and uses of the systems.,publlic and uses of the systems.,publlic and uses of the systems.,publlic and uses of the systems.,publlic and uses of the systems.,publlic and uses of the systems.,publlic and uses of the systems.,,,,,,,,,,,,,,
,Workload Information Summary,Workload Information Summary,Workload Information Summary,Workload Information Summary,Workload Information Summary,Workload Information Summary,Workload Information Summary,,FY 2003,FY 2003,FY 2004,FY 2005,FY 2005,FY 2006,FY 2006,FY 2006,FY 2007,,,,
,Criminal Cases Commenced,Criminal Cases Commenced,Criminal Cases Commenced,Criminal Cases Commenced,Criminal Cases Commenced,,,,784,784,676,,634,739,739,739,743,,,,
,Law Cases Commenced,Law Cases Commenced,Law Cases Commenced,Law Cases Commenced,Law Cases Commenced,,,,120,120,209,,114,371,371,371,384,,,,
,Chancery Cases Commenced,Chancery Cases Commenced,Chancery Cases Commenced,Chancery Cases Commenced,Chancery Cases Commenced,Chancery Cases Commenced,,,209,209,147,,216,,,-,-,,,,
,Wills/Estates Initiated,Wills/Estates Initiated,Wills/Estates Initiated,Wills/Estates Initiated,,,,,127,127,160,,168,193,193,193,162,,,,
,Judgments/Admin Liens/Notices,Judgments/Admin Liens/Notices,Judgments/Admin Liens/Notices,Judgments/Admin Liens/Notices,Judgments/Admin Liens/Notices,Judgments/Admin Liens/Notices,Judgments/Admin Liens/Notices,,789,789,921,,736,868,868,868,"1,003",,,,
,Deeds Recorded,Deeds Recorded,Deeds Recorded,,,,,,"10,366","10,366","9,240",,"9,844","10,147","10,147","10,147","9,317",,,,
,Financing Statements,Financing Statements,Financing Statements,Financing Statements,,,,,,54,48,,61,,53,53,54,,,,
,Fictitious Names,Fictitious Names,Fictitious Names,,,,,,224,224,238,,312,304,304,304,258,,,,
,Marriage Licenses,Marriage Licenses,Marriage Licenses,Marriage Licenses,,,,,200,200,216,,238,208,208,208,234,,,,
,Notary Qualifed,Notary Qualifed,Notary Qualifed,,,,,,,94,109,,100,,98,98,94,,,,
,Game Licenses,Game Licenses,Game Licenses,,,,,,166,166,132,,150,,93,93,43,,,,
,Concealed Hand Gun Permits Issued,Concealed Hand Gun Permits Issued,Concealed Hand Gun Permits Issued,Concealed Hand Gun Permits Issued,Concealed Hand Gun Permits Issued,Concealed Hand Gun Permits Issued,Concealed Hand Gun Permits Issued,,220,220,150,,220,178,178,178,298,,,,
,Passports Issued,Passports Issued,Passports Issued,,,,,,,-,240,,282,482,482,482,700,,,,
,TOTAL,TOTAL,TOTAL,,,,,,"13,353","13,353","12,486","13,075","13,075","13,734","13,734","13,734","13,290",,,,
,,,,,,,,,,,,,,,,,,,,,Page 49
