Name: “Table 1 of 1 on page 183 of 214”,Name: “Table 1 of 1 on page 183 of 214”,Name: “Table 1 of 1 on page 183 of 214”,Name: “Table 1 of 1 on page 183 of 214”,Name: “Table 1 of 1 on page 183 of 214”,Name: “Table 1 of 1 on page 183 of 214”
Table: 183,Table: 183,Table: 183,Table: 183,Table: 183,Table: 183
,,,,,
A PPROVED FY 2013 B UDGET A CTIONS,A PPROVED FY 2013 B UDGET A CTIONS,,,,
•,Update personnel expenditures,FY 2013:,"($890,348)",,
,Technical adjustment to update the department’s cost for personnel services. The position count shown in the,Technical adjustment to update the department’s cost for personnel services. The position count shown in the,Technical adjustment to update the department’s cost for personnel services. The position count shown in the,Technical adjustment to update the department’s cost for personnel services. The position count shown in the,
,"position summary table reflects updates in staffing due to administrative actions, creation, consolidations, and","position summary table reflects updates in staffing due to administrative actions, creation, consolidations, and","position summary table reflects updates in staffing due to administrative actions, creation, consolidations, and","position summary table reflects updates in staffing due to administrative actions, creation, consolidations, and",
,reorganization efforts. This adjustment reflects the corresponding funding needed in FY 2013 for these actions.,reorganization efforts. This adjustment reflects the corresponding funding needed in FY 2013 for these actions.,reorganization efforts. This adjustment reflects the corresponding funding needed in FY 2013 for these actions.,reorganization efforts. This adjustment reflects the corresponding funding needed in FY 2013 for these actions.,reorganization efforts. This adjustment reflects the corresponding funding needed in FY 2013 for these actions.
,"The adjustment also reflects rate revisions for contributions related to the Norfolk Employee Retirement System,","The adjustment also reflects rate revisions for contributions related to the Norfolk Employee Retirement System,","The adjustment also reflects rate revisions for contributions related to the Norfolk Employee Retirement System,","The adjustment also reflects rate revisions for contributions related to the Norfolk Employee Retirement System,","The adjustment also reflects rate revisions for contributions related to the Norfolk Employee Retirement System,"
,"Virginia Retirement System (VRS) as appropriate, group life insurance and health care premiums. For FY 2013,","Virginia Retirement System (VRS) as appropriate, group life insurance and health care premiums. For FY 2013,","Virginia Retirement System (VRS) as appropriate, group life insurance and health care premiums. For FY 2013,","Virginia Retirement System (VRS) as appropriate, group life insurance and health care premiums. For FY 2013,",
,"the approved budget assumes a VRS rate increase from 8.95 percent to 11.74 percent, a group life insurance rate","the approved budget assumes a VRS rate increase from 8.95 percent to 11.74 percent, a group life insurance rate","the approved budget assumes a VRS rate increase from 8.95 percent to 11.74 percent, a group life insurance rate","the approved budget assumes a VRS rate increase from 8.95 percent to 11.74 percent, a group life insurance rate","the approved budget assumes a VRS rate increase from 8.95 percent to 11.74 percent, a group life insurance rate"
,increase from 0.34 percent to 1.19 percent and an increase in health care of 7.7 percent. These are routine,increase from 0.34 percent to 1.19 percent and an increase in health care of 7.7 percent. These are routine,increase from 0.34 percent to 1.19 percent and an increase in health care of 7.7 percent. These are routine,increase from 0.34 percent to 1.19 percent and an increase in health care of 7.7 percent. These are routine,
,actions which occur at the beginning of each budget cycle.,,,,
•,Remove excess VJCCCA local match funds,FY 2013:,"($419,199)",Positions:,0
,This is a technical adjustment to remove funds in excess of the grant match requirements for the Virginia,This is a technical adjustment to remove funds in excess of the grant match requirements for the Virginia,This is a technical adjustment to remove funds in excess of the grant match requirements for the Virginia,This is a technical adjustment to remove funds in excess of the grant match requirements for the Virginia,
,"Juvenile Community Crime Control Act (VJCCCA). During FY 2012, the required local match for the program was","Juvenile Community Crime Control Act (VJCCCA). During FY 2012, the required local match for the program was","Juvenile Community Crime Control Act (VJCCCA). During FY 2012, the required local match for the program was","Juvenile Community Crime Control Act (VJCCCA). During FY 2012, the required local match for the program was","Juvenile Community Crime Control Act (VJCCCA). During FY 2012, the required local match for the program was"
,reduced from a historically set number to a percent of total expenditures.,reduced from a historically set number to a percent of total expenditures.,,,
•,Transfer facilities management of group homes to,FY 2013:,"($7,845)",Positions:,0
,DGS,,,,
,"Transfer funding, and responsibility of the maintenance of three facilities from Human Services to the","Transfer funding, and responsibility of the maintenance of three facilities from Human Services to the","Transfer funding, and responsibility of the maintenance of three facilities from Human Services to the","Transfer funding, and responsibility of the maintenance of three facilities from Human Services to the",
,Department of General Services (DGS). The facilities are no longer used by the Department of Human Services,Department of General Services (DGS). The facilities are no longer used by the Department of Human Services,Department of General Services (DGS). The facilities are no longer used by the Department of Human Services,Department of General Services (DGS). The facilities are no longer used by the Department of Human Services,
,and will be better managed by the Facilities Division of General Services. A corresponding adjustment can be,and will be better managed by the Facilities Division of General Services. A corresponding adjustment can be,and will be better managed by the Facilities Division of General Services. A corresponding adjustment can be,and will be better managed by the Facilities Division of General Services. A corresponding adjustment can be,
,found in DGS.,,,,
•,Provide funds for Homeless Action Response Team,FY 2013:,"$130,000",Positions:,0
,(HART),,,,
,Provide local funds for the Homeless Action and Response Team whose mission is to help end homelessness in,Provide local funds for the Homeless Action and Response Team whose mission is to help end homelessness in,Provide local funds for the Homeless Action and Response Team whose mission is to help end homelessness in,Provide local funds for the Homeless Action and Response Team whose mission is to help end homelessness in,Provide local funds for the Homeless Action and Response Team whose mission is to help end homelessness in
,the City of Norfolk.,,,,
•,Support change of Senior/Disabled Tax Relief program,FY 2013:,"$100,000",Positions:,0
,Provide funds for the Senior/Disabled Tax Relief program to address changes in the eligibility qualifications.,Provide funds for the Senior/Disabled Tax Relief program to address changes in the eligibility qualifications.,Provide funds for the Senior/Disabled Tax Relief program to address changes in the eligibility qualifications.,Provide funds for the Senior/Disabled Tax Relief program to address changes in the eligibility qualifications.,
•,Provide funds for permanent part-time staff,FY 2013:,"$18,870",Positions:,14
,Provide funds to continue hiring permanent part-time city employees instead of using a private staffing,Provide funds to continue hiring permanent part-time city employees instead of using a private staffing,Provide funds to continue hiring permanent part-time city employees instead of using a private staffing,Provide funds to continue hiring permanent part-time city employees instead of using a private staffing,
,company. This is the second step of a two-year efficiency improving conversion process which has reduced the,company. This is the second step of a two-year efficiency improving conversion process which has reduced the,company. This is the second step of a two-year efficiency improving conversion process which has reduced the,company. This is the second step of a two-year efficiency improving conversion process which has reduced the,
,Human Services budget overall while maintaining temporary employee staffing levels.,Human Services budget overall while maintaining temporary employee staffing levels.,Human Services budget overall while maintaining temporary employee staffing levels.,,
•,Transfer NIC/CSA administration funds from Special,FY 2013:,"$39,142",Positions:,3
,Revenue,,,,
,Transfer funding for Norfolk Interagency Consortium/Comprehensive Services Act administration from a special,Transfer funding for Norfolk Interagency Consortium/Comprehensive Services Act administration from a special,Transfer funding for Norfolk Interagency Consortium/Comprehensive Services Act administration from a special,Transfer funding for Norfolk Interagency Consortium/Comprehensive Services Act administration from a special,Transfer funding for Norfolk Interagency Consortium/Comprehensive Services Act administration from a special
,revenue fund to the General Fund to maximize reimbursement from the state and federal governments. Grant,revenue fund to the General Fund to maximize reimbursement from the state and federal governments. Grant,revenue fund to the General Fund to maximize reimbursement from the state and federal governments. Grant,revenue fund to the General Fund to maximize reimbursement from the state and federal governments. Grant,
,matching funds were moved from Outside Agencies to the Department of Human Services in FY 2012. This,matching funds were moved from Outside Agencies to the Department of Human Services in FY 2012. This,matching funds were moved from Outside Agencies to the Department of Human Services in FY 2012. This,matching funds were moved from Outside Agencies to the Department of Human Services in FY 2012. This,
,transfer of administrative funds will complete the actions necessary to appropriately execute the grant.,transfer of administrative funds will complete the actions necessary to appropriately execute the grant.,transfer of administrative funds will complete the actions necessary to appropriately execute the grant.,transfer of administrative funds will complete the actions necessary to appropriately execute the grant.,
•,Purchase Child Log Automation software,FY 2013:,"$70,000",Positions:,0
,Provide funds for Child Log Automation software which will allow for more efficient case management at the,Provide funds for Child Log Automation software which will allow for more efficient case management at the,Provide funds for Child Log Automation software which will allow for more efficient case management at the,Provide funds for Child Log Automation software which will allow for more efficient case management at the,
,Juvenile Detention Center.,,,,
•,Fund Smart Beginnings grant local match,FY 2013:,"$80,000",Positions:,0
,Provide an increase in funds for the local match portion of the Smart Beginnings grant. This increase is required,Provide an increase in funds for the local match portion of the Smart Beginnings grant. This increase is required,Provide an increase in funds for the local match portion of the Smart Beginnings grant. This increase is required,Provide an increase in funds for the local match portion of the Smart Beginnings grant. This increase is required,Provide an increase in funds for the local match portion of the Smart Beginnings grant. This increase is required
,by the terms of the grant.,,,,
,,,Human Services,Human Services,285
