•,Increase the resources and training available to the Norfolk Magistrates in order to maintain the high level of,Increase the resources and training available to the Norfolk Magistrates in order to maintain the high level of,Increase the resources and training available to the Norfolk Magistrates in order to maintain the high level of,Increase the resources and training available to the Norfolk Magistrates in order to maintain the high level of,Increase the resources and training available to the Norfolk Magistrates in order to maintain the high level of,Increase the resources and training available to the Norfolk Magistrates in order to maintain the high level of,Increase the resources and training available to the Norfolk Magistrates in order to maintain the high level of,Increase the resources and training available to the Norfolk Magistrates in order to maintain the high level of,Increase the resources and training available to the Norfolk Magistrates in order to maintain the high level of,Increase the resources and training available to the Norfolk Magistrates in order to maintain the high level of,Increase the resources and training available to the Norfolk Magistrates in order to maintain the high level of,Increase the resources and training available to the Norfolk Magistrates in order to maintain the high level of,Increase the resources and training available to the Norfolk Magistrates in order to maintain the high level of,Increase the resources and training available to the Norfolk Magistrates in order to maintain the high level of,Increase the resources and training available to the Norfolk Magistrates in order to maintain the high level of,Increase the resources and training available to the Norfolk Magistrates in order to maintain the high level of,Increase the resources and training available to the Norfolk Magistrates in order to maintain the high level of,Increase the resources and training available to the Norfolk Magistrates in order to maintain the high level of
,service provided to the city,service provided to the city,service provided to the city,service provided to the city,,,,,,,,,,,,,,
•,"Inform citizens, law enforcement and members of the Bar of the accomplishments of the Office of the Norfolk","Inform citizens, law enforcement and members of the Bar of the accomplishments of the Office of the Norfolk","Inform citizens, law enforcement and members of the Bar of the accomplishments of the Office of the Norfolk","Inform citizens, law enforcement and members of the Bar of the accomplishments of the Office of the Norfolk","Inform citizens, law enforcement and members of the Bar of the accomplishments of the Office of the Norfolk","Inform citizens, law enforcement and members of the Bar of the accomplishments of the Office of the Norfolk","Inform citizens, law enforcement and members of the Bar of the accomplishments of the Office of the Norfolk","Inform citizens, law enforcement and members of the Bar of the accomplishments of the Office of the Norfolk","Inform citizens, law enforcement and members of the Bar of the accomplishments of the Office of the Norfolk","Inform citizens, law enforcement and members of the Bar of the accomplishments of the Office of the Norfolk","Inform citizens, law enforcement and members of the Bar of the accomplishments of the Office of the Norfolk","Inform citizens, law enforcement and members of the Bar of the accomplishments of the Office of the Norfolk","Inform citizens, law enforcement and members of the Bar of the accomplishments of the Office of the Norfolk","Inform citizens, law enforcement and members of the Bar of the accomplishments of the Office of the Norfolk","Inform citizens, law enforcement and members of the Bar of the accomplishments of the Office of the Norfolk","Inform citizens, law enforcement and members of the Bar of the accomplishments of the Office of the Norfolk","Inform citizens, law enforcement and members of the Bar of the accomplishments of the Office of the Norfolk","Inform citizens, law enforcement and members of the Bar of the accomplishments of the Office of the Norfolk"
,Magistrates' Office,Magistrates' Office,Magistrates' Office,,,,,,,,,,,,,,,
•,Maintain the efficiency in conducting hearings and the issuing of process (when warranted) in order to provide,Maintain the efficiency in conducting hearings and the issuing of process (when warranted) in order to provide,Maintain the efficiency in conducting hearings and the issuing of process (when warranted) in order to provide,Maintain the efficiency in conducting hearings and the issuing of process (when warranted) in order to provide,Maintain the efficiency in conducting hearings and the issuing of process (when warranted) in order to provide,Maintain the efficiency in conducting hearings and the issuing of process (when warranted) in order to provide,Maintain the efficiency in conducting hearings and the issuing of process (when warranted) in order to provide,Maintain the efficiency in conducting hearings and the issuing of process (when warranted) in order to provide,Maintain the efficiency in conducting hearings and the issuing of process (when warranted) in order to provide,Maintain the efficiency in conducting hearings and the issuing of process (when warranted) in order to provide,Maintain the efficiency in conducting hearings and the issuing of process (when warranted) in order to provide,Maintain the efficiency in conducting hearings and the issuing of process (when warranted) in order to provide,Maintain the efficiency in conducting hearings and the issuing of process (when warranted) in order to provide,Maintain the efficiency in conducting hearings and the issuing of process (when warranted) in order to provide,Maintain the efficiency in conducting hearings and the issuing of process (when warranted) in order to provide,Maintain the efficiency in conducting hearings and the issuing of process (when warranted) in order to provide,Maintain the efficiency in conducting hearings and the issuing of process (when warranted) in order to provide,Maintain the efficiency in conducting hearings and the issuing of process (when warranted) in order to provide
,"better, timely, access for everyone","better, timely, access for everyone","better, timely, access for everyone","better, timely, access for everyone","better, timely, access for everyone",,,,,,,,,,,,,
,,,,,,,,,,,,,,,,Magistrate,Magistrate,167
