Name: “Table 1 of 1 on page 157 of 214”,Name: “Table 1 of 1 on page 157 of 214”,Name: “Table 1 of 1 on page 157 of 214”,Name: “Table 1 of 1 on page 157 of 214”,Name: “Table 1 of 1 on page 157 of 214”,Name: “Table 1 of 1 on page 157 of 214”,Name: “Table 1 of 1 on page 157 of 214”,Name: “Table 1 of 1 on page 157 of 214”,Name: “Table 1 of 1 on page 157 of 214”,Name: “Table 1 of 1 on page 157 of 214”,Name: “Table 1 of 1 on page 157 of 214”,Name: “Table 1 of 1 on page 157 of 214”,Name: “Table 1 of 1 on page 157 of 214”,Name: “Table 1 of 1 on page 157 of 214”,Name: “Table 1 of 1 on page 157 of 214”,Name: “Table 1 of 1 on page 157 of 214”,Name: “Table 1 of 1 on page 157 of 214”,Name: “Table 1 of 1 on page 157 of 214”,Name: “Table 1 of 1 on page 157 of 214”
Table: 157,Table: 157,Table: 157,Table: 157,Table: 157,Table: 157,Table: 157,Table: 157,Table: 157,Table: 157,Table: 157,Table: 157,Table: 157,Table: 157,Table: 157,Table: 157,Table: 157,Table: 157,Table: 157
,,,,,,,,,,,,,,,,,,
THE N ATIONAL M ARITIME C ENTER,THE N ATIONAL M ARITIME C ENTER,THE N ATIONAL M ARITIME C ENTER,THE N ATIONAL M ARITIME C ENTER,THE N ATIONAL M ARITIME C ENTER,THE N ATIONAL M ARITIME C ENTER,THE N ATIONAL M ARITIME C ENTER,THE N ATIONAL M ARITIME C ENTER,THE N ATIONAL M ARITIME C ENTER,THE N ATIONAL M ARITIME C ENTER,THE N ATIONAL M ARITIME C ENTER,THE N ATIONAL M ARITIME C ENTER,THE N ATIONAL M ARITIME C ENTER,,,,,,
MISSION S TATEMENT,MISSION S TATEMENT,MISSION S TATEMENT,MISSION S TATEMENT,MISSION S TATEMENT,MISSION S TATEMENT,MISSION S TATEMENT,,,,,,,,,,,,
"The National Maritime Center, also known as Nauticus, inspires and educates people with engaging and interactive","The National Maritime Center, also known as Nauticus, inspires and educates people with engaging and interactive","The National Maritime Center, also known as Nauticus, inspires and educates people with engaging and interactive","The National Maritime Center, also known as Nauticus, inspires and educates people with engaging and interactive","The National Maritime Center, also known as Nauticus, inspires and educates people with engaging and interactive","The National Maritime Center, also known as Nauticus, inspires and educates people with engaging and interactive","The National Maritime Center, also known as Nauticus, inspires and educates people with engaging and interactive","The National Maritime Center, also known as Nauticus, inspires and educates people with engaging and interactive","The National Maritime Center, also known as Nauticus, inspires and educates people with engaging and interactive","The National Maritime Center, also known as Nauticus, inspires and educates people with engaging and interactive","The National Maritime Center, also known as Nauticus, inspires and educates people with engaging and interactive","The National Maritime Center, also known as Nauticus, inspires and educates people with engaging and interactive","The National Maritime Center, also known as Nauticus, inspires and educates people with engaging and interactive","The National Maritime Center, also known as Nauticus, inspires and educates people with engaging and interactive","The National Maritime Center, also known as Nauticus, inspires and educates people with engaging and interactive","The National Maritime Center, also known as Nauticus, inspires and educates people with engaging and interactive","The National Maritime Center, also known as Nauticus, inspires and educates people with engaging and interactive","The National Maritime Center, also known as Nauticus, inspires and educates people with engaging and interactive","The National Maritime Center, also known as Nauticus, inspires and educates people with engaging and interactive"
experiences that celebrate connections with today's maritime world. Nauticus is a contemporary museum that,experiences that celebrate connections with today's maritime world. Nauticus is a contemporary museum that,experiences that celebrate connections with today's maritime world. Nauticus is a contemporary museum that,experiences that celebrate connections with today's maritime world. Nauticus is a contemporary museum that,experiences that celebrate connections with today's maritime world. Nauticus is a contemporary museum that,experiences that celebrate connections with today's maritime world. Nauticus is a contemporary museum that,experiences that celebrate connections with today's maritime world. Nauticus is a contemporary museum that,experiences that celebrate connections with today's maritime world. Nauticus is a contemporary museum that,experiences that celebrate connections with today's maritime world. Nauticus is a contemporary museum that,experiences that celebrate connections with today's maritime world. Nauticus is a contemporary museum that,experiences that celebrate connections with today's maritime world. Nauticus is a contemporary museum that,experiences that celebrate connections with today's maritime world. Nauticus is a contemporary museum that,experiences that celebrate connections with today's maritime world. Nauticus is a contemporary museum that,experiences that celebrate connections with today's maritime world. Nauticus is a contemporary museum that,experiences that celebrate connections with today's maritime world. Nauticus is a contemporary museum that,experiences that celebrate connections with today's maritime world. Nauticus is a contemporary museum that,experiences that celebrate connections with today's maritime world. Nauticus is a contemporary museum that,experiences that celebrate connections with today's maritime world. Nauticus is a contemporary museum that,experiences that celebrate connections with today's maritime world. Nauticus is a contemporary museum that
uses the natural setting of Norfolk's harbor to showcase global maritime commerce and the world's largest Navy.,uses the natural setting of Norfolk's harbor to showcase global maritime commerce and the world's largest Navy.,uses the natural setting of Norfolk's harbor to showcase global maritime commerce and the world's largest Navy.,uses the natural setting of Norfolk's harbor to showcase global maritime commerce and the world's largest Navy.,uses the natural setting of Norfolk's harbor to showcase global maritime commerce and the world's largest Navy.,uses the natural setting of Norfolk's harbor to showcase global maritime commerce and the world's largest Navy.,uses the natural setting of Norfolk's harbor to showcase global maritime commerce and the world's largest Navy.,uses the natural setting of Norfolk's harbor to showcase global maritime commerce and the world's largest Navy.,uses the natural setting of Norfolk's harbor to showcase global maritime commerce and the world's largest Navy.,uses the natural setting of Norfolk's harbor to showcase global maritime commerce and the world's largest Navy.,uses the natural setting of Norfolk's harbor to showcase global maritime commerce and the world's largest Navy.,uses the natural setting of Norfolk's harbor to showcase global maritime commerce and the world's largest Navy.,uses the natural setting of Norfolk's harbor to showcase global maritime commerce and the world's largest Navy.,uses the natural setting of Norfolk's harbor to showcase global maritime commerce and the world's largest Navy.,uses the natural setting of Norfolk's harbor to showcase global maritime commerce and the world's largest Navy.,uses the natural setting of Norfolk's harbor to showcase global maritime commerce and the world's largest Navy.,uses the natural setting of Norfolk's harbor to showcase global maritime commerce and the world's largest Navy.,uses the natural setting of Norfolk's harbor to showcase global maritime commerce and the world's largest Navy.,uses the natural setting of Norfolk's harbor to showcase global maritime commerce and the world's largest Navy.
D EPARTMENT O VERVIEW,D EPARTMENT O VERVIEW,D EPARTMENT O VERVIEW,D EPARTMENT O VERVIEW,D EPARTMENT O VERVIEW,D EPARTMENT O VERVIEW,D EPARTMENT O VERVIEW,,,,,,,,,,,,
"Nauticus is a major tourist destination, attracting over 285,000 visitors annually.","Nauticus is a major tourist destination, attracting over 285,000 visitors annually.","Nauticus is a major tourist destination, attracting over 285,000 visitors annually.","Nauticus is a major tourist destination, attracting over 285,000 visitors annually.","Nauticus is a major tourist destination, attracting over 285,000 visitors annually.","Nauticus is a major tourist destination, attracting over 285,000 visitors annually.","Nauticus is a major tourist destination, attracting over 285,000 visitors annually.","Nauticus is a major tourist destination, attracting over 285,000 visitors annually.","Nauticus is a major tourist destination, attracting over 285,000 visitors annually.","Nauticus is a major tourist destination, attracting over 285,000 visitors annually.","Nauticus is a major tourist destination, attracting over 285,000 visitors annually.","Nauticus is a major tourist destination, attracting over 285,000 visitors annually.","Nauticus is a major tourist destination, attracting over 285,000 visitors annually.","Nauticus is a major tourist destination, attracting over 285,000 visitors annually.","Nauticus is a major tourist destination, attracting over 285,000 visitors annually.",It is an educational resource,It is an educational resource,It is an educational resource,It is an educational resource
offering structured Virginia Standards of Learning (SOL) based programs to school age children locally and,offering structured Virginia Standards of Learning (SOL) based programs to school age children locally and,offering structured Virginia Standards of Learning (SOL) based programs to school age children locally and,offering structured Virginia Standards of Learning (SOL) based programs to school age children locally and,offering structured Virginia Standards of Learning (SOL) based programs to school age children locally and,offering structured Virginia Standards of Learning (SOL) based programs to school age children locally and,offering structured Virginia Standards of Learning (SOL) based programs to school age children locally and,offering structured Virginia Standards of Learning (SOL) based programs to school age children locally and,offering structured Virginia Standards of Learning (SOL) based programs to school age children locally and,offering structured Virginia Standards of Learning (SOL) based programs to school age children locally and,offering structured Virginia Standards of Learning (SOL) based programs to school age children locally and,offering structured Virginia Standards of Learning (SOL) based programs to school age children locally and,offering structured Virginia Standards of Learning (SOL) based programs to school age children locally and,offering structured Virginia Standards of Learning (SOL) based programs to school age children locally and,offering structured Virginia Standards of Learning (SOL) based programs to school age children locally and,offering structured Virginia Standards of Learning (SOL) based programs to school age children locally and,offering structured Virginia Standards of Learning (SOL) based programs to school age children locally and,offering structured Virginia Standards of Learning (SOL) based programs to school age children locally and,offering structured Virginia Standards of Learning (SOL) based programs to school age children locally and
regionally.,regionally.,,"It serves as a community resource for a variety of programs and workshops, memberships, and","It serves as a community resource for a variety of programs and workshops, memberships, and","It serves as a community resource for a variety of programs and workshops, memberships, and","It serves as a community resource for a variety of programs and workshops, memberships, and","It serves as a community resource for a variety of programs and workshops, memberships, and","It serves as a community resource for a variety of programs and workshops, memberships, and","It serves as a community resource for a variety of programs and workshops, memberships, and","It serves as a community resource for a variety of programs and workshops, memberships, and","It serves as a community resource for a variety of programs and workshops, memberships, and","It serves as a community resource for a variety of programs and workshops, memberships, and","It serves as a community resource for a variety of programs and workshops, memberships, and","It serves as a community resource for a variety of programs and workshops, memberships, and","It serves as a community resource for a variety of programs and workshops, memberships, and","It serves as a community resource for a variety of programs and workshops, memberships, and","It serves as a community resource for a variety of programs and workshops, memberships, and","It serves as a community resource for a variety of programs and workshops, memberships, and"
volunteer opportunities appealing to diverse audiences.,volunteer opportunities appealing to diverse audiences.,volunteer opportunities appealing to diverse audiences.,volunteer opportunities appealing to diverse audiences.,volunteer opportunities appealing to diverse audiences.,volunteer opportunities appealing to diverse audiences.,volunteer opportunities appealing to diverse audiences.,volunteer opportunities appealing to diverse audiences.,volunteer opportunities appealing to diverse audiences.,volunteer opportunities appealing to diverse audiences.,,,,,,,,,
Nauticus,Nauticus,is,the,home,of,the,Battleship,Wisconsin,,and,also,houses,the,Hampton,Roads,Naval,"Museum,",a
"contemporary seaport museum, and the Victory Rover tour boat. Nauticus also operates the Banana Pier Gift Shop","contemporary seaport museum, and the Victory Rover tour boat. Nauticus also operates the Banana Pier Gift Shop","contemporary seaport museum, and the Victory Rover tour boat. Nauticus also operates the Banana Pier Gift Shop","contemporary seaport museum, and the Victory Rover tour boat. Nauticus also operates the Banana Pier Gift Shop","contemporary seaport museum, and the Victory Rover tour boat. Nauticus also operates the Banana Pier Gift Shop","contemporary seaport museum, and the Victory Rover tour boat. Nauticus also operates the Banana Pier Gift Shop","contemporary seaport museum, and the Victory Rover tour boat. Nauticus also operates the Banana Pier Gift Shop","contemporary seaport museum, and the Victory Rover tour boat. Nauticus also operates the Banana Pier Gift Shop","contemporary seaport museum, and the Victory Rover tour boat. Nauticus also operates the Banana Pier Gift Shop","contemporary seaport museum, and the Victory Rover tour boat. Nauticus also operates the Banana Pier Gift Shop","contemporary seaport museum, and the Victory Rover tour boat. Nauticus also operates the Banana Pier Gift Shop","contemporary seaport museum, and the Victory Rover tour boat. Nauticus also operates the Banana Pier Gift Shop","contemporary seaport museum, and the Victory Rover tour boat. Nauticus also operates the Banana Pier Gift Shop","contemporary seaport museum, and the Victory Rover tour boat. Nauticus also operates the Banana Pier Gift Shop","contemporary seaport museum, and the Victory Rover tour boat. Nauticus also operates the Banana Pier Gift Shop","contemporary seaport museum, and the Victory Rover tour boat. Nauticus also operates the Banana Pier Gift Shop","contemporary seaport museum, and the Victory Rover tour boat. Nauticus also operates the Banana Pier Gift Shop","contemporary seaport museum, and the Victory Rover tour boat. Nauticus also operates the Banana Pier Gift Shop","contemporary seaport museum, and the Victory Rover tour boat. Nauticus also operates the Banana Pier Gift Shop"
"and, through contract, the Outtakes Café.","and, through contract, the Outtakes Café.","and, through contract, the Outtakes Café.","and, through contract, the Outtakes Café.","and, through contract, the Outtakes Café.","and, through contract, the Outtakes Café.","and, through contract, the Outtakes Café.","and, through contract, the Outtakes Café.",,,,,,,,,,,
"Beginning in FY 2013, the Half Moone Cruise and Celebration Center is operated as one component of the Nauticus","Beginning in FY 2013, the Half Moone Cruise and Celebration Center is operated as one component of the Nauticus","Beginning in FY 2013, the Half Moone Cruise and Celebration Center is operated as one component of the Nauticus","Beginning in FY 2013, the Half Moone Cruise and Celebration Center is operated as one component of the Nauticus","Beginning in FY 2013, the Half Moone Cruise and Celebration Center is operated as one component of the Nauticus","Beginning in FY 2013, the Half Moone Cruise and Celebration Center is operated as one component of the Nauticus","Beginning in FY 2013, the Half Moone Cruise and Celebration Center is operated as one component of the Nauticus","Beginning in FY 2013, the Half Moone Cruise and Celebration Center is operated as one component of the Nauticus","Beginning in FY 2013, the Half Moone Cruise and Celebration Center is operated as one component of the Nauticus","Beginning in FY 2013, the Half Moone Cruise and Celebration Center is operated as one component of the Nauticus","Beginning in FY 2013, the Half Moone Cruise and Celebration Center is operated as one component of the Nauticus","Beginning in FY 2013, the Half Moone Cruise and Celebration Center is operated as one component of the Nauticus","Beginning in FY 2013, the Half Moone Cruise and Celebration Center is operated as one component of the Nauticus","Beginning in FY 2013, the Half Moone Cruise and Celebration Center is operated as one component of the Nauticus","Beginning in FY 2013, the Half Moone Cruise and Celebration Center is operated as one component of the Nauticus","Beginning in FY 2013, the Half Moone Cruise and Celebration Center is operated as one component of the Nauticus","Beginning in FY 2013, the Half Moone Cruise and Celebration Center is operated as one component of the Nauticus","Beginning in FY 2013, the Half Moone Cruise and Celebration Center is operated as one component of the Nauticus","Beginning in FY 2013, the Half Moone Cruise and Celebration Center is operated as one component of the Nauticus"
"Campus which includes the museum, Battleship Wisconsin, and other waterborne programming.","Campus which includes the museum, Battleship Wisconsin, and other waterborne programming.","Campus which includes the museum, Battleship Wisconsin, and other waterborne programming.","Campus which includes the museum, Battleship Wisconsin, and other waterborne programming.","Campus which includes the museum, Battleship Wisconsin, and other waterborne programming.","Campus which includes the museum, Battleship Wisconsin, and other waterborne programming.","Campus which includes the museum, Battleship Wisconsin, and other waterborne programming.","Campus which includes the museum, Battleship Wisconsin, and other waterborne programming.","Campus which includes the museum, Battleship Wisconsin, and other waterborne programming.","Campus which includes the museum, Battleship Wisconsin, and other waterborne programming.","Campus which includes the museum, Battleship Wisconsin, and other waterborne programming.","Campus which includes the museum, Battleship Wisconsin, and other waterborne programming.","Campus which includes the museum, Battleship Wisconsin, and other waterborne programming.","Campus which includes the museum, Battleship Wisconsin, and other waterborne programming.","Campus which includes the museum, Battleship Wisconsin, and other waterborne programming.","Campus which includes the museum, Battleship Wisconsin, and other waterborne programming.","Campus which includes the museum, Battleship Wisconsin, and other waterborne programming.",With this,With this
"premise of integrating the entire operations as one compound, the Cruise Ship Terminal functions have been","premise of integrating the entire operations as one compound, the Cruise Ship Terminal functions have been","premise of integrating the entire operations as one compound, the Cruise Ship Terminal functions have been","premise of integrating the entire operations as one compound, the Cruise Ship Terminal functions have been","premise of integrating the entire operations as one compound, the Cruise Ship Terminal functions have been","premise of integrating the entire operations as one compound, the Cruise Ship Terminal functions have been","premise of integrating the entire operations as one compound, the Cruise Ship Terminal functions have been","premise of integrating the entire operations as one compound, the Cruise Ship Terminal functions have been","premise of integrating the entire operations as one compound, the Cruise Ship Terminal functions have been","premise of integrating the entire operations as one compound, the Cruise Ship Terminal functions have been","premise of integrating the entire operations as one compound, the Cruise Ship Terminal functions have been","premise of integrating the entire operations as one compound, the Cruise Ship Terminal functions have been","premise of integrating the entire operations as one compound, the Cruise Ship Terminal functions have been","premise of integrating the entire operations as one compound, the Cruise Ship Terminal functions have been","premise of integrating the entire operations as one compound, the Cruise Ship Terminal functions have been","premise of integrating the entire operations as one compound, the Cruise Ship Terminal functions have been","premise of integrating the entire operations as one compound, the Cruise Ship Terminal functions have been","premise of integrating the entire operations as one compound, the Cruise Ship Terminal functions have been","premise of integrating the entire operations as one compound, the Cruise Ship Terminal functions have been"
transferred to the National Maritime Center (Nauticus).,transferred to the National Maritime Center (Nauticus).,transferred to the National Maritime Center (Nauticus).,transferred to the National Maritime Center (Nauticus).,transferred to the National Maritime Center (Nauticus).,transferred to the National Maritime Center (Nauticus).,transferred to the National Maritime Center (Nauticus).,transferred to the National Maritime Center (Nauticus).,transferred to the National Maritime Center (Nauticus).,transferred to the National Maritime Center (Nauticus).,All appropriate information including adding the Cruise,All appropriate information including adding the Cruise,All appropriate information including adding the Cruise,All appropriate information including adding the Cruise,All appropriate information including adding the Cruise,All appropriate information including adding the Cruise,All appropriate information including adding the Cruise,All appropriate information including adding the Cruise,All appropriate information including adding the Cruise
Ship,function,function,to,the,organizational,organizational,chart,and,performance,performance,performance,measures,are,incorporated,within,the,National,National
Maritime Center (Nauticus) department.,Maritime Center (Nauticus) department.,Maritime Center (Nauticus) department.,Maritime Center (Nauticus) department.,Maritime Center (Nauticus) department.,Maritime Center (Nauticus) department.,Maritime Center (Nauticus) department.,Maritime Center (Nauticus) department.,,,,,,,,,,,
,,,,,,,,,dŚĞ EĂƚŝŽŶĂů,dŚĞ EĂƚŝŽŶĂů,dŚĞ EĂƚŝŽŶĂů,,,,,,,
,,,,,,,,,DĂƌŝƚŝŵĞ ĞŶƚĞƌ,DĂƌŝƚŝŵĞ ĞŶƚĞƌ,DĂƌŝƚŝŵĞ ĞŶƚĞƌ,,,,,,,
,,,,,,,KƉĞƌĂƚŝŽŶƐ͕,,,sŝƐŝƚŽƌ,sŝƐŝƚŽƌ,,,,,,,
,,,ƌƵŝƐĞ ^ŚŝƉ,ƌƵŝƐĞ ^ŚŝƉ,,,ĚŵŝŶŝƐƚƌĂƚŝŽŶ,ĚŵŝŶŝƐƚƌĂƚŝŽŶ,^ĞƌǀŝĐĞƐ ĂŶĚ,^ĞƌǀŝĐĞƐ ĂŶĚ,^ĞƌǀŝĐĞƐ ĂŶĚ,,ĞǀĞůŽƉŵĞŶƚ,ĞǀĞůŽƉŵĞŶƚ,ĚƵĐĂƚŝŽŶĂůWƌŽŐƌĂŵŵŝŶŐ,,,
,,,,,,,ĂŶĚ ^ƵƉƉŽƌƚ,,,ĚŵŝƐƐŝŽŶƐ,ĚŵŝƐƐŝŽŶƐ,,,,,,,
Short-Term Objectives,Short-Term Objectives,Short-Term Objectives,Short-Term Objectives,Short-Term Objectives,,,,,,,,,,,,,,
•,Increase,,the,number,of,patrons,to,Nauticus,by,expanding,expanding,the,variety,of,"programs,",targeting,various,various
,demographic groups including the creative class,demographic groups including the creative class,demographic groups including the creative class,demographic groups including the creative class,demographic groups including the creative class,demographic groups including the creative class,demographic groups including the creative class,demographic groups including the creative class,,,,,,,,,,
