•,Increase the number of,Increase the number of,Increase the number of,Increase the number of,Increase the number of,"grant requests submitted and those awarded by philanthropists, private corporations,","grant requests submitted and those awarded by philanthropists, private corporations,","grant requests submitted and those awarded by philanthropists, private corporations,","grant requests submitted and those awarded by philanthropists, private corporations,","grant requests submitted and those awarded by philanthropists, private corporations,","grant requests submitted and those awarded by philanthropists, private corporations,","grant requests submitted and those awarded by philanthropists, private corporations,","grant requests submitted and those awarded by philanthropists, private corporations,","grant requests submitted and those awarded by philanthropists, private corporations,","grant requests submitted and those awarded by philanthropists, private corporations,","grant requests submitted and those awarded by philanthropists, private corporations,","grant requests submitted and those awarded by philanthropists, private corporations,","grant requests submitted and those awarded by philanthropists, private corporations,"
,"and non-profit entities in support of the Nauticus mission to provide quality exhibitry, programming, and","and non-profit entities in support of the Nauticus mission to provide quality exhibitry, programming, and","and non-profit entities in support of the Nauticus mission to provide quality exhibitry, programming, and","and non-profit entities in support of the Nauticus mission to provide quality exhibitry, programming, and","and non-profit entities in support of the Nauticus mission to provide quality exhibitry, programming, and","and non-profit entities in support of the Nauticus mission to provide quality exhibitry, programming, and","and non-profit entities in support of the Nauticus mission to provide quality exhibitry, programming, and","and non-profit entities in support of the Nauticus mission to provide quality exhibitry, programming, and","and non-profit entities in support of the Nauticus mission to provide quality exhibitry, programming, and","and non-profit entities in support of the Nauticus mission to provide quality exhibitry, programming, and","and non-profit entities in support of the Nauticus mission to provide quality exhibitry, programming, and","and non-profit entities in support of the Nauticus mission to provide quality exhibitry, programming, and","and non-profit entities in support of the Nauticus mission to provide quality exhibitry, programming, and","and non-profit entities in support of the Nauticus mission to provide quality exhibitry, programming, and","and non-profit entities in support of the Nauticus mission to provide quality exhibitry, programming, and","and non-profit entities in support of the Nauticus mission to provide quality exhibitry, programming, and","and non-profit entities in support of the Nauticus mission to provide quality exhibitry, programming, and","and non-profit entities in support of the Nauticus mission to provide quality exhibitry, programming, and"
,Battleship Wisconsin interpretation,Battleship Wisconsin interpretation,Battleship Wisconsin interpretation,Battleship Wisconsin interpretation,Battleship Wisconsin interpretation,Battleship Wisconsin interpretation,,,,,,,,,,,,
•,Establish Nauticus as a premium community resource for,Establish Nauticus as a premium community resource for,Establish Nauticus as a premium community resource for,Establish Nauticus as a premium community resource for,Establish Nauticus as a premium community resource for,Establish Nauticus as a premium community resource for,Establish Nauticus as a premium community resource for,Establish Nauticus as a premium community resource for,Establish Nauticus as a premium community resource for,Establish Nauticus as a premium community resource for,informal education by developing fun and engaging,informal education by developing fun and engaging,informal education by developing fun and engaging,informal education by developing fun and engaging,informal education by developing fun and engaging,informal education by developing fun and engaging,informal education by developing fun and engaging,informal education by developing fun and engaging
,educational programs that leverage the unique environment of the Battleship Wisconsin and other campus,educational programs that leverage the unique environment of the Battleship Wisconsin and other campus,educational programs that leverage the unique environment of the Battleship Wisconsin and other campus,educational programs that leverage the unique environment of the Battleship Wisconsin and other campus,educational programs that leverage the unique environment of the Battleship Wisconsin and other campus,educational programs that leverage the unique environment of the Battleship Wisconsin and other campus,educational programs that leverage the unique environment of the Battleship Wisconsin and other campus,educational programs that leverage the unique environment of the Battleship Wisconsin and other campus,educational programs that leverage the unique environment of the Battleship Wisconsin and other campus,educational programs that leverage the unique environment of the Battleship Wisconsin and other campus,educational programs that leverage the unique environment of the Battleship Wisconsin and other campus,educational programs that leverage the unique environment of the Battleship Wisconsin and other campus,educational programs that leverage the unique environment of the Battleship Wisconsin and other campus,educational programs that leverage the unique environment of the Battleship Wisconsin and other campus,educational programs that leverage the unique environment of the Battleship Wisconsin and other campus,educational programs that leverage the unique environment of the Battleship Wisconsin and other campus,educational programs that leverage the unique environment of the Battleship Wisconsin and other campus,educational programs that leverage the unique environment of the Battleship Wisconsin and other campus
,assets,,,,,,,,,,,,,,,,,
,,,,,,,,,,,,,,The National Maritime Center,The National Maritime Center,The National Maritime Center,259,259
