"purposes designated by object group, i.e., categories including: personnel services; materials, supplies and repairs;","purposes designated by object group, i.e., categories including: personnel services; materials, supplies and repairs;","purposes designated by object group, i.e., categories including: personnel services; materials, supplies and repairs;","purposes designated by object group, i.e., categories including: personnel services; materials, supplies and repairs;","purposes designated by object group, i.e., categories including: personnel services; materials, supplies and repairs;","purposes designated by object group, i.e., categories including: personnel services; materials, supplies and repairs;","purposes designated by object group, i.e., categories including: personnel services; materials, supplies and repairs;","purposes designated by object group, i.e., categories including: personnel services; materials, supplies and repairs;","purposes designated by object group, i.e., categories including: personnel services; materials, supplies and repairs;","purposes designated by object group, i.e., categories including: personnel services; materials, supplies and repairs;","purposes designated by object group, i.e., categories including: personnel services; materials, supplies and repairs;","purposes designated by object group, i.e., categories including: personnel services; materials, supplies and repairs;","purposes designated by object group, i.e., categories including: personnel services; materials, supplies and repairs;"
general operations and fixed charges; equipment; public assistance; all purpose appropriations and debt service.,general operations and fixed charges; equipment; public assistance; all purpose appropriations and debt service.,general operations and fixed charges; equipment; public assistance; all purpose appropriations and debt service.,general operations and fixed charges; equipment; public assistance; all purpose appropriations and debt service.,general operations and fixed charges; equipment; public assistance; all purpose appropriations and debt service.,general operations and fixed charges; equipment; public assistance; all purpose appropriations and debt service.,general operations and fixed charges; equipment; public assistance; all purpose appropriations and debt service.,general operations and fixed charges; equipment; public assistance; all purpose appropriations and debt service.,general operations and fixed charges; equipment; public assistance; all purpose appropriations and debt service.,general operations and fixed charges; equipment; public assistance; all purpose appropriations and debt service.,general operations and fixed charges; equipment; public assistance; all purpose appropriations and debt service.,general operations and fixed charges; equipment; public assistance; all purpose appropriations and debt service.,general operations and fixed charges; equipment; public assistance; all purpose appropriations and debt service.
C ITY M ANAGER’S AUTHORIZATION,C ITY M ANAGER’S AUTHORIZATION,C ITY M ANAGER’S AUTHORIZATION,C ITY M ANAGER’S AUTHORIZATION,C ITY M ANAGER’S AUTHORIZATION,,,,,,,,
"In accordance with the City Charter, at least sixty days before the end of each fiscal year, the City Manager shall","In accordance with the City Charter, at least sixty days before the end of each fiscal year, the City Manager shall","In accordance with the City Charter, at least sixty days before the end of each fiscal year, the City Manager shall","In accordance with the City Charter, at least sixty days before the end of each fiscal year, the City Manager shall","In accordance with the City Charter, at least sixty days before the end of each fiscal year, the City Manager shall","In accordance with the City Charter, at least sixty days before the end of each fiscal year, the City Manager shall","In accordance with the City Charter, at least sixty days before the end of each fiscal year, the City Manager shall","In accordance with the City Charter, at least sixty days before the end of each fiscal year, the City Manager shall","In accordance with the City Charter, at least sixty days before the end of each fiscal year, the City Manager shall","In accordance with the City Charter, at least sixty days before the end of each fiscal year, the City Manager shall","In accordance with the City Charter, at least sixty days before the end of each fiscal year, the City Manager shall","In accordance with the City Charter, at least sixty days before the end of each fiscal year, the City Manager shall","In accordance with the City Charter, at least sixty days before the end of each fiscal year, the City Manager shall"
prepare and submit to the City Council an annual budget for the ensuing fiscal year. The budget shall be balanced,prepare and submit to the City Council an annual budget for the ensuing fiscal year. The budget shall be balanced,prepare and submit to the City Council an annual budget for the ensuing fiscal year. The budget shall be balanced,prepare and submit to the City Council an annual budget for the ensuing fiscal year. The budget shall be balanced,prepare and submit to the City Council an annual budget for the ensuing fiscal year. The budget shall be balanced,prepare and submit to the City Council an annual budget for the ensuing fiscal year. The budget shall be balanced,prepare and submit to the City Council an annual budget for the ensuing fiscal year. The budget shall be balanced,prepare and submit to the City Council an annual budget for the ensuing fiscal year. The budget shall be balanced,prepare and submit to the City Council an annual budget for the ensuing fiscal year. The budget shall be balanced,prepare and submit to the City Council an annual budget for the ensuing fiscal year. The budget shall be balanced,prepare and submit to the City Council an annual budget for the ensuing fiscal year. The budget shall be balanced,prepare and submit to the City Council an annual budget for the ensuing fiscal year. The budget shall be balanced,prepare and submit to the City Council an annual budget for the ensuing fiscal year. The budget shall be balanced
at all times. The total amount of appropriations shall not exceed the estimated revenues of the city.,at all times. The total amount of appropriations shall not exceed the estimated revenues of the city.,at all times. The total amount of appropriations shall not exceed the estimated revenues of the city.,at all times. The total amount of appropriations shall not exceed the estimated revenues of the city.,at all times. The total amount of appropriations shall not exceed the estimated revenues of the city.,at all times. The total amount of appropriations shall not exceed the estimated revenues of the city.,at all times. The total amount of appropriations shall not exceed the estimated revenues of the city.,at all times. The total amount of appropriations shall not exceed the estimated revenues of the city.,at all times. The total amount of appropriations shall not exceed the estimated revenues of the city.,at all times. The total amount of appropriations shall not exceed the estimated revenues of the city.,at all times. The total amount of appropriations shall not exceed the estimated revenues of the city.,,
"In a given year, the City Manager is authorized to transfer from any department, fund or activity which has a","In a given year, the City Manager is authorized to transfer from any department, fund or activity which has a","In a given year, the City Manager is authorized to transfer from any department, fund or activity which has a","In a given year, the City Manager is authorized to transfer from any department, fund or activity which has a","In a given year, the City Manager is authorized to transfer from any department, fund or activity which has a","In a given year, the City Manager is authorized to transfer from any department, fund or activity which has a","In a given year, the City Manager is authorized to transfer from any department, fund or activity which has a","In a given year, the City Manager is authorized to transfer from any department, fund or activity which has a","In a given year, the City Manager is authorized to transfer from any department, fund or activity which has a","In a given year, the City Manager is authorized to transfer from any department, fund or activity which has a","In a given year, the City Manager is authorized to transfer from any department, fund or activity which has a","In a given year, the City Manager is authorized to transfer from any department, fund or activity which has a","In a given year, the City Manager is authorized to transfer from any department, fund or activity which has a"
"budgetary excess of funds appropriated to any department, fund or activity as necessary.","budgetary excess of funds appropriated to any department, fund or activity as necessary.","budgetary excess of funds appropriated to any department, fund or activity as necessary.","budgetary excess of funds appropriated to any department, fund or activity as necessary.","budgetary excess of funds appropriated to any department, fund or activity as necessary.","budgetary excess of funds appropriated to any department, fund or activity as necessary.","budgetary excess of funds appropriated to any department, fund or activity as necessary.","budgetary excess of funds appropriated to any department, fund or activity as necessary.","budgetary excess of funds appropriated to any department, fund or activity as necessary.",,,,
20,Budget Process,,,,,,,,,,,
