Name: “Table 1 of 1 on page 6 of 18”,Name: “Table 1 of 1 on page 6 of 18”,Name: “Table 1 of 1 on page 6 of 18”,Name: “Table 1 of 1 on page 6 of 18”,Name: “Table 1 of 1 on page 6 of 18”,Name: “Table 1 of 1 on page 6 of 18”,Name: “Table 1 of 1 on page 6 of 18”,Name: “Table 1 of 1 on page 6 of 18”,Name: “Table 1 of 1 on page 6 of 18”,Name: “Table 1 of 1 on page 6 of 18”,Name: “Table 1 of 1 on page 6 of 18”,Name: “Table 1 of 1 on page 6 of 18”,Name: “Table 1 of 1 on page 6 of 18”,Name: “Table 1 of 1 on page 6 of 18”,Name: “Table 1 of 1 on page 6 of 18”,Name: “Table 1 of 1 on page 6 of 18”,Name: “Table 1 of 1 on page 6 of 18”,Name: “Table 1 of 1 on page 6 of 18”
Table: 6,Table: 6,Table: 6,Table: 6,Table: 6,Table: 6,Table: 6,Table: 6,Table: 6,Table: 6,Table: 6,Table: 6,Table: 6,Table: 6,Table: 6,Table: 6,Table: 6,Table: 6
,,,,,,,,,,,,,,,,,
•,"Replaced all of the Moores Bridges Water Treatment Plant's hypochlorite and ammonia pumps, piping","Replaced all of the Moores Bridges Water Treatment Plant's hypochlorite and ammonia pumps, piping","Replaced all of the Moores Bridges Water Treatment Plant's hypochlorite and ammonia pumps, piping","Replaced all of the Moores Bridges Water Treatment Plant's hypochlorite and ammonia pumps, piping","Replaced all of the Moores Bridges Water Treatment Plant's hypochlorite and ammonia pumps, piping","Replaced all of the Moores Bridges Water Treatment Plant's hypochlorite and ammonia pumps, piping","Replaced all of the Moores Bridges Water Treatment Plant's hypochlorite and ammonia pumps, piping","Replaced all of the Moores Bridges Water Treatment Plant's hypochlorite and ammonia pumps, piping","Replaced all of the Moores Bridges Water Treatment Plant's hypochlorite and ammonia pumps, piping","Replaced all of the Moores Bridges Water Treatment Plant's hypochlorite and ammonia pumps, piping","Replaced all of the Moores Bridges Water Treatment Plant's hypochlorite and ammonia pumps, piping","Replaced all of the Moores Bridges Water Treatment Plant's hypochlorite and ammonia pumps, piping","Replaced all of the Moores Bridges Water Treatment Plant's hypochlorite and ammonia pumps, piping","Replaced all of the Moores Bridges Water Treatment Plant's hypochlorite and ammonia pumps, piping","Replaced all of the Moores Bridges Water Treatment Plant's hypochlorite and ammonia pumps, piping","Replaced all of the Moores Bridges Water Treatment Plant's hypochlorite and ammonia pumps, piping","Replaced all of the Moores Bridges Water Treatment Plant's hypochlorite and ammonia pumps, piping"
,"and controls greatly improving system performance, reliability and reducing operating costs.","and controls greatly improving system performance, reliability and reducing operating costs.","and controls greatly improving system performance, reliability and reducing operating costs.","and controls greatly improving system performance, reliability and reducing operating costs.","and controls greatly improving system performance, reliability and reducing operating costs.","and controls greatly improving system performance, reliability and reducing operating costs.","and controls greatly improving system performance, reliability and reducing operating costs.","and controls greatly improving system performance, reliability and reducing operating costs.","and controls greatly improving system performance, reliability and reducing operating costs.","and controls greatly improving system performance, reliability and reducing operating costs.","and controls greatly improving system performance, reliability and reducing operating costs.","and controls greatly improving system performance, reliability and reducing operating costs.","and controls greatly improving system performance, reliability and reducing operating costs.","and controls greatly improving system performance, reliability and reducing operating costs.","and controls greatly improving system performance, reliability and reducing operating costs.",,
•,Increased the efficiency of chemical usage by installing new lime slakers at the Moores Bridges Water,Increased the efficiency of chemical usage by installing new lime slakers at the Moores Bridges Water,Increased the efficiency of chemical usage by installing new lime slakers at the Moores Bridges Water,Increased the efficiency of chemical usage by installing new lime slakers at the Moores Bridges Water,Increased the efficiency of chemical usage by installing new lime slakers at the Moores Bridges Water,Increased the efficiency of chemical usage by installing new lime slakers at the Moores Bridges Water,Increased the efficiency of chemical usage by installing new lime slakers at the Moores Bridges Water,Increased the efficiency of chemical usage by installing new lime slakers at the Moores Bridges Water,Increased the efficiency of chemical usage by installing new lime slakers at the Moores Bridges Water,Increased the efficiency of chemical usage by installing new lime slakers at the Moores Bridges Water,Increased the efficiency of chemical usage by installing new lime slakers at the Moores Bridges Water,Increased the efficiency of chemical usage by installing new lime slakers at the Moores Bridges Water,Increased the efficiency of chemical usage by installing new lime slakers at the Moores Bridges Water,Increased the efficiency of chemical usage by installing new lime slakers at the Moores Bridges Water,Increased the efficiency of chemical usage by installing new lime slakers at the Moores Bridges Water,Increased the efficiency of chemical usage by installing new lime slakers at the Moores Bridges Water,Increased the efficiency of chemical usage by installing new lime slakers at the Moores Bridges Water
,Treatment Plant which reduces waste byproducts and helps limit lime deposits that can block water lines,Treatment Plant which reduces waste byproducts and helps limit lime deposits that can block water lines,Treatment Plant which reduces waste byproducts and helps limit lime deposits that can block water lines,Treatment Plant which reduces waste byproducts and helps limit lime deposits that can block water lines,Treatment Plant which reduces waste byproducts and helps limit lime deposits that can block water lines,Treatment Plant which reduces waste byproducts and helps limit lime deposits that can block water lines,Treatment Plant which reduces waste byproducts and helps limit lime deposits that can block water lines,Treatment Plant which reduces waste byproducts and helps limit lime deposits that can block water lines,Treatment Plant which reduces waste byproducts and helps limit lime deposits that can block water lines,Treatment Plant which reduces waste byproducts and helps limit lime deposits that can block water lines,Treatment Plant which reduces waste byproducts and helps limit lime deposits that can block water lines,Treatment Plant which reduces waste byproducts and helps limit lime deposits that can block water lines,Treatment Plant which reduces waste byproducts and helps limit lime deposits that can block water lines,Treatment Plant which reduces waste byproducts and helps limit lime deposits that can block water lines,Treatment Plant which reduces waste byproducts and helps limit lime deposits that can block water lines,Treatment Plant which reduces waste byproducts and helps limit lime deposits that can block water lines,Treatment Plant which reduces waste byproducts and helps limit lime deposits that can block water lines
,and equipment at the treatment plants.,and equipment at the treatment plants.,and equipment at the treatment plants.,and equipment at the treatment plants.,and equipment at the treatment plants.,and equipment at the treatment plants.,,,,,,,,,,,
•,Completed the conversion to the new Supervisory Control And Data Acquisition (SCADA) system at the,Completed the conversion to the new Supervisory Control And Data Acquisition (SCADA) system at the,Completed the conversion to the new Supervisory Control And Data Acquisition (SCADA) system at the,Completed the conversion to the new Supervisory Control And Data Acquisition (SCADA) system at the,Completed the conversion to the new Supervisory Control And Data Acquisition (SCADA) system at the,Completed the conversion to the new Supervisory Control And Data Acquisition (SCADA) system at the,Completed the conversion to the new Supervisory Control And Data Acquisition (SCADA) system at the,Completed the conversion to the new Supervisory Control And Data Acquisition (SCADA) system at the,Completed the conversion to the new Supervisory Control And Data Acquisition (SCADA) system at the,Completed the conversion to the new Supervisory Control And Data Acquisition (SCADA) system at the,Completed the conversion to the new Supervisory Control And Data Acquisition (SCADA) system at the,Completed the conversion to the new Supervisory Control And Data Acquisition (SCADA) system at the,Completed the conversion to the new Supervisory Control And Data Acquisition (SCADA) system at the,Completed the conversion to the new Supervisory Control And Data Acquisition (SCADA) system at the,Completed the conversion to the new Supervisory Control And Data Acquisition (SCADA) system at the,Completed the conversion to the new Supervisory Control And Data Acquisition (SCADA) system at the,Completed the conversion to the new Supervisory Control And Data Acquisition (SCADA) system at the
,"Moores Bridges Water Treatment Plant which increases our expandability, reliability and flexibility with","Moores Bridges Water Treatment Plant which increases our expandability, reliability and flexibility with","Moores Bridges Water Treatment Plant which increases our expandability, reliability and flexibility with","Moores Bridges Water Treatment Plant which increases our expandability, reliability and flexibility with","Moores Bridges Water Treatment Plant which increases our expandability, reliability and flexibility with","Moores Bridges Water Treatment Plant which increases our expandability, reliability and flexibility with","Moores Bridges Water Treatment Plant which increases our expandability, reliability and flexibility with","Moores Bridges Water Treatment Plant which increases our expandability, reliability and flexibility with","Moores Bridges Water Treatment Plant which increases our expandability, reliability and flexibility with","Moores Bridges Water Treatment Plant which increases our expandability, reliability and flexibility with","Moores Bridges Water Treatment Plant which increases our expandability, reliability and flexibility with","Moores Bridges Water Treatment Plant which increases our expandability, reliability and flexibility with","Moores Bridges Water Treatment Plant which increases our expandability, reliability and flexibility with","Moores Bridges Water Treatment Plant which increases our expandability, reliability and flexibility with","Moores Bridges Water Treatment Plant which increases our expandability, reliability and flexibility with","Moores Bridges Water Treatment Plant which increases our expandability, reliability and flexibility with","Moores Bridges Water Treatment Plant which increases our expandability, reliability and flexibility with"
,plant monitoring and controls.,plant monitoring and controls.,plant monitoring and controls.,plant monitoring and controls.,,,,,,,,,,,,,
•,Completed construction and placed into operation new Ocean View and Berkley tank booster pump,Completed construction and placed into operation new Ocean View and Berkley tank booster pump,Completed construction and placed into operation new Ocean View and Berkley tank booster pump,Completed construction and placed into operation new Ocean View and Berkley tank booster pump,Completed construction and placed into operation new Ocean View and Berkley tank booster pump,Completed construction and placed into operation new Ocean View and Berkley tank booster pump,Completed construction and placed into operation new Ocean View and Berkley tank booster pump,Completed construction and placed into operation new Ocean View and Berkley tank booster pump,Completed construction and placed into operation new Ocean View and Berkley tank booster pump,Completed construction and placed into operation new Ocean View and Berkley tank booster pump,Completed construction and placed into operation new Ocean View and Berkley tank booster pump,Completed construction and placed into operation new Ocean View and Berkley tank booster pump,Completed construction and placed into operation new Ocean View and Berkley tank booster pump,Completed construction and placed into operation new Ocean View and Berkley tank booster pump,Completed construction and placed into operation new Ocean View and Berkley tank booster pump,Completed construction and placed into operation new Ocean View and Berkley tank booster pump,Completed construction and placed into operation new Ocean View and Berkley tank booster pump
,stations.,,,,,,,,,,,,,,,,
•,"Enhanced security at the Blackwater, Nottoway, Lake Prince and Simonsdale I and II Pump Stations with","Enhanced security at the Blackwater, Nottoway, Lake Prince and Simonsdale I and II Pump Stations with","Enhanced security at the Blackwater, Nottoway, Lake Prince and Simonsdale I and II Pump Stations with","Enhanced security at the Blackwater, Nottoway, Lake Prince and Simonsdale I and II Pump Stations with","Enhanced security at the Blackwater, Nottoway, Lake Prince and Simonsdale I and II Pump Stations with","Enhanced security at the Blackwater, Nottoway, Lake Prince and Simonsdale I and II Pump Stations with","Enhanced security at the Blackwater, Nottoway, Lake Prince and Simonsdale I and II Pump Stations with","Enhanced security at the Blackwater, Nottoway, Lake Prince and Simonsdale I and II Pump Stations with","Enhanced security at the Blackwater, Nottoway, Lake Prince and Simonsdale I and II Pump Stations with","Enhanced security at the Blackwater, Nottoway, Lake Prince and Simonsdale I and II Pump Stations with","Enhanced security at the Blackwater, Nottoway, Lake Prince and Simonsdale I and II Pump Stations with","Enhanced security at the Blackwater, Nottoway, Lake Prince and Simonsdale I and II Pump Stations with","Enhanced security at the Blackwater, Nottoway, Lake Prince and Simonsdale I and II Pump Stations with","Enhanced security at the Blackwater, Nottoway, Lake Prince and Simonsdale I and II Pump Stations with","Enhanced security at the Blackwater, Nottoway, Lake Prince and Simonsdale I and II Pump Stations with","Enhanced security at the Blackwater, Nottoway, Lake Prince and Simonsdale I and II Pump Stations with","Enhanced security at the Blackwater, Nottoway, Lake Prince and Simonsdale I and II Pump Stations with"
,the installation of new digital video recorders.,the installation of new digital video recorders.,the installation of new digital video recorders.,the installation of new digital video recorders.,the installation of new digital video recorders.,the installation of new digital video recorders.,,,,,,,,,,,
•,Cleaned 17 percent of the 820 miles of wastewater gravity mains to help minimize blockages and make,Cleaned 17 percent of the 820 miles of wastewater gravity mains to help minimize blockages and make,Cleaned 17 percent of the 820 miles of wastewater gravity mains to help minimize blockages and make,Cleaned 17 percent of the 820 miles of wastewater gravity mains to help minimize blockages and make,Cleaned 17 percent of the 820 miles of wastewater gravity mains to help minimize blockages and make,Cleaned 17 percent of the 820 miles of wastewater gravity mains to help minimize blockages and make,Cleaned 17 percent of the 820 miles of wastewater gravity mains to help minimize blockages and make,Cleaned 17 percent of the 820 miles of wastewater gravity mains to help minimize blockages and make,Cleaned 17 percent of the 820 miles of wastewater gravity mains to help minimize blockages and make,Cleaned 17 percent of the 820 miles of wastewater gravity mains to help minimize blockages and make,Cleaned 17 percent of the 820 miles of wastewater gravity mains to help minimize blockages and make,Cleaned 17 percent of the 820 miles of wastewater gravity mains to help minimize blockages and make,Cleaned 17 percent of the 820 miles of wastewater gravity mains to help minimize blockages and make,Cleaned 17 percent of the 820 miles of wastewater gravity mains to help minimize blockages and make,Cleaned 17 percent of the 820 miles of wastewater gravity mains to help minimize blockages and make,Cleaned 17 percent of the 820 miles of wastewater gravity mains to help minimize blockages and make,Cleaned 17 percent of the 820 miles of wastewater gravity mains to help minimize blockages and make
,the wastewater system more reliable.,the wastewater system more reliable.,the wastewater system more reliable.,the wastewater system more reliable.,the wastewater system more reliable.,the wastewater system more reliable.,,,,,,,,,,,
•,Received the Hampton Roads Sanitation District's Pre-treatment Silver Award for exemplary permit,Received the Hampton Roads Sanitation District's Pre-treatment Silver Award for exemplary permit,Received the Hampton Roads Sanitation District's Pre-treatment Silver Award for exemplary permit,Received the Hampton Roads Sanitation District's Pre-treatment Silver Award for exemplary permit,Received the Hampton Roads Sanitation District's Pre-treatment Silver Award for exemplary permit,Received the Hampton Roads Sanitation District's Pre-treatment Silver Award for exemplary permit,Received the Hampton Roads Sanitation District's Pre-treatment Silver Award for exemplary permit,Received the Hampton Roads Sanitation District's Pre-treatment Silver Award for exemplary permit,Received the Hampton Roads Sanitation District's Pre-treatment Silver Award for exemplary permit,Received the Hampton Roads Sanitation District's Pre-treatment Silver Award for exemplary permit,Received the Hampton Roads Sanitation District's Pre-treatment Silver Award for exemplary permit,Received the Hampton Roads Sanitation District's Pre-treatment Silver Award for exemplary permit,Received the Hampton Roads Sanitation District's Pre-treatment Silver Award for exemplary permit,Received the Hampton Roads Sanitation District's Pre-treatment Silver Award for exemplary permit,Received the Hampton Roads Sanitation District's Pre-treatment Silver Award for exemplary permit,Received the Hampton Roads Sanitation District's Pre-treatment Silver Award for exemplary permit,Received the Hampton Roads Sanitation District's Pre-treatment Silver Award for exemplary permit
,compliance at both the Moores Bridges and 37th Street Water Treatment Plants.,compliance at both the Moores Bridges and 37th Street Water Treatment Plants.,compliance at both the Moores Bridges and 37th Street Water Treatment Plants.,compliance at both the Moores Bridges and 37th Street Water Treatment Plants.,compliance at both the Moores Bridges and 37th Street Water Treatment Plants.,compliance at both the Moores Bridges and 37th Street Water Treatment Plants.,compliance at both the Moores Bridges and 37th Street Water Treatment Plants.,compliance at both the Moores Bridges and 37th Street Water Treatment Plants.,compliance at both the Moores Bridges and 37th Street Water Treatment Plants.,compliance at both the Moores Bridges and 37th Street Water Treatment Plants.,compliance at both the Moores Bridges and 37th Street Water Treatment Plants.,compliance at both the Moores Bridges and 37th Street Water Treatment Plants.,compliance at both the Moores Bridges and 37th Street Water Treatment Plants.,,,,
BUDGET H IGHLIGHTS,BUDGET H IGHLIGHTS,BUDGET H IGHLIGHTS,BUDGET H IGHLIGHTS,BUDGET H IGHLIGHTS,,,,,,,,,,,,,
"The total FY 2012 budget for the Water Fund is $79,305,000.","The total FY 2012 budget for the Water Fund is $79,305,000.","The total FY 2012 budget for the Water Fund is $79,305,000.","The total FY 2012 budget for the Water Fund is $79,305,000.","The total FY 2012 budget for the Water Fund is $79,305,000.","The total FY 2012 budget for the Water Fund is $79,305,000.","The total FY 2012 budget for the Water Fund is $79,305,000.","The total FY 2012 budget for the Water Fund is $79,305,000.","The total FY 2012 budget for the Water Fund is $79,305,000.","The total FY 2012 budget for the Water Fund is $79,305,000.","This is an increase of $203,000 from the FY","This is an increase of $203,000 from the FY","This is an increase of $203,000 from the FY","This is an increase of $203,000 from the FY","This is an increase of $203,000 from the FY","This is an increase of $203,000 from the FY","This is an increase of $203,000 from the FY","This is an increase of $203,000 from the FY"
2011 budget.,2011 budget.,2011 budget.,Facing challenges of a drop in projected wholesale customer water consumption and flat,Facing challenges of a drop in projected wholesale customer water consumption and flat,Facing challenges of a drop in projected wholesale customer water consumption and flat,Facing challenges of a drop in projected wholesale customer water consumption and flat,Facing challenges of a drop in projected wholesale customer water consumption and flat,Facing challenges of a drop in projected wholesale customer water consumption and flat,Facing challenges of a drop in projected wholesale customer water consumption and flat,Facing challenges of a drop in projected wholesale customer water consumption and flat,Facing challenges of a drop in projected wholesale customer water consumption and flat,Facing challenges of a drop in projected wholesale customer water consumption and flat,Facing challenges of a drop in projected wholesale customer water consumption and flat,Facing challenges of a drop in projected wholesale customer water consumption and flat,Facing challenges of a drop in projected wholesale customer water consumption and flat,Facing challenges of a drop in projected wholesale customer water consumption and flat,Facing challenges of a drop in projected wholesale customer water consumption and flat
"Norfolk consumption, the Water Fund is able to balance the FY 2012 revenue and expenditure budgets by","Norfolk consumption, the Water Fund is able to balance the FY 2012 revenue and expenditure budgets by","Norfolk consumption, the Water Fund is able to balance the FY 2012 revenue and expenditure budgets by","Norfolk consumption, the Water Fund is able to balance the FY 2012 revenue and expenditure budgets by","Norfolk consumption, the Water Fund is able to balance the FY 2012 revenue and expenditure budgets by","Norfolk consumption, the Water Fund is able to balance the FY 2012 revenue and expenditure budgets by","Norfolk consumption, the Water Fund is able to balance the FY 2012 revenue and expenditure budgets by","Norfolk consumption, the Water Fund is able to balance the FY 2012 revenue and expenditure budgets by","Norfolk consumption, the Water Fund is able to balance the FY 2012 revenue and expenditure budgets by","Norfolk consumption, the Water Fund is able to balance the FY 2012 revenue and expenditure budgets by","Norfolk consumption, the Water Fund is able to balance the FY 2012 revenue and expenditure budgets by","Norfolk consumption, the Water Fund is able to balance the FY 2012 revenue and expenditure budgets by","Norfolk consumption, the Water Fund is able to balance the FY 2012 revenue and expenditure budgets by","Norfolk consumption, the Water Fund is able to balance the FY 2012 revenue and expenditure budgets by","Norfolk consumption, the Water Fund is able to balance the FY 2012 revenue and expenditure budgets by","Norfolk consumption, the Water Fund is able to balance the FY 2012 revenue and expenditure budgets by","Norfolk consumption, the Water Fund is able to balance the FY 2012 revenue and expenditure budgets by","Norfolk consumption, the Water Fund is able to balance the FY 2012 revenue and expenditure budgets by"
significantly,significantly,reducing,reducing,operating,"expenditures,","expenditures,",increasing,increasing,increasing,raw,water,revenue,revenue,from,a,new,wholesale
