customer and incorporating the gradual and predictable multi-year rate structure adopted by City Council,customer and incorporating the gradual and predictable multi-year rate structure adopted by City Council,customer and incorporating the gradual and predictable multi-year rate structure adopted by City Council,customer and incorporating the gradual and predictable multi-year rate structure adopted by City Council,customer and incorporating the gradual and predictable multi-year rate structure adopted by City Council,customer and incorporating the gradual and predictable multi-year rate structure adopted by City Council,customer and incorporating the gradual and predictable multi-year rate structure adopted by City Council,customer and incorporating the gradual and predictable multi-year rate structure adopted by City Council,customer and incorporating the gradual and predictable multi-year rate structure adopted by City Council,customer and incorporating the gradual and predictable multi-year rate structure adopted by City Council,customer and incorporating the gradual and predictable multi-year rate structure adopted by City Council,customer and incorporating the gradual and predictable multi-year rate structure adopted by City Council,customer and incorporating the gradual and predictable multi-year rate structure adopted by City Council,customer and incorporating the gradual and predictable multi-year rate structure adopted by City Council,customer and incorporating the gradual and predictable multi-year rate structure adopted by City Council,customer and incorporating the gradual and predictable multi-year rate structure adopted by City Council,customer and incorporating the gradual and predictable multi-year rate structure adopted by City Council,customer and incorporating the gradual and predictable multi-year rate structure adopted by City Council
in 2003 aimed at maintaining the physical infrastructure and financial viability of the system.,in 2003 aimed at maintaining the physical infrastructure and financial viability of the system.,in 2003 aimed at maintaining the physical infrastructure and financial viability of the system.,in 2003 aimed at maintaining the physical infrastructure and financial viability of the system.,in 2003 aimed at maintaining the physical infrastructure and financial viability of the system.,in 2003 aimed at maintaining the physical infrastructure and financial viability of the system.,in 2003 aimed at maintaining the physical infrastructure and financial viability of the system.,in 2003 aimed at maintaining the physical infrastructure and financial viability of the system.,in 2003 aimed at maintaining the physical infrastructure and financial viability of the system.,in 2003 aimed at maintaining the physical infrastructure and financial viability of the system.,in 2003 aimed at maintaining the physical infrastructure and financial viability of the system.,in 2003 aimed at maintaining the physical infrastructure and financial viability of the system.,in 2003 aimed at maintaining the physical infrastructure and financial viability of the system.,in 2003 aimed at maintaining the physical infrastructure and financial viability of the system.,in 2003 aimed at maintaining the physical infrastructure and financial viability of the system.,in 2003 aimed at maintaining the physical infrastructure and financial viability of the system.,,
"The total FY 2012 budget for the Wastewater Fund is $25,710,000.","The total FY 2012 budget for the Wastewater Fund is $25,710,000.","The total FY 2012 budget for the Wastewater Fund is $25,710,000.","The total FY 2012 budget for the Wastewater Fund is $25,710,000.","The total FY 2012 budget for the Wastewater Fund is $25,710,000.","The total FY 2012 budget for the Wastewater Fund is $25,710,000.","The total FY 2012 budget for the Wastewater Fund is $25,710,000.","The total FY 2012 budget for the Wastewater Fund is $25,710,000.","The total FY 2012 budget for the Wastewater Fund is $25,710,000.","The total FY 2012 budget for the Wastewater Fund is $25,710,000.","The total FY 2012 budget for the Wastewater Fund is $25,710,000.","This is a $7,000 increase from the","This is a $7,000 increase from the","This is a $7,000 increase from the","This is a $7,000 increase from the","This is a $7,000 increase from the","This is a $7,000 increase from the","This is a $7,000 increase from the"
"approved FY 2011 budget. With a projected decline in wastewater billed flow, the Wastewater Fund is able","approved FY 2011 budget. With a projected decline in wastewater billed flow, the Wastewater Fund is able","approved FY 2011 budget. With a projected decline in wastewater billed flow, the Wastewater Fund is able","approved FY 2011 budget. With a projected decline in wastewater billed flow, the Wastewater Fund is able","approved FY 2011 budget. With a projected decline in wastewater billed flow, the Wastewater Fund is able","approved FY 2011 budget. With a projected decline in wastewater billed flow, the Wastewater Fund is able","approved FY 2011 budget. With a projected decline in wastewater billed flow, the Wastewater Fund is able","approved FY 2011 budget. With a projected decline in wastewater billed flow, the Wastewater Fund is able","approved FY 2011 budget. With a projected decline in wastewater billed flow, the Wastewater Fund is able","approved FY 2011 budget. With a projected decline in wastewater billed flow, the Wastewater Fund is able","approved FY 2011 budget. With a projected decline in wastewater billed flow, the Wastewater Fund is able","approved FY 2011 budget. With a projected decline in wastewater billed flow, the Wastewater Fund is able","approved FY 2011 budget. With a projected decline in wastewater billed flow, the Wastewater Fund is able","approved FY 2011 budget. With a projected decline in wastewater billed flow, the Wastewater Fund is able","approved FY 2011 budget. With a projected decline in wastewater billed flow, the Wastewater Fund is able","approved FY 2011 budget. With a projected decline in wastewater billed flow, the Wastewater Fund is able","approved FY 2011 budget. With a projected decline in wastewater billed flow, the Wastewater Fund is able","approved FY 2011 budget. With a projected decline in wastewater billed flow, the Wastewater Fund is able"
to balance the FY 2012 revenue and expenditure budgets by incorporating the gradual and predictable,to balance the FY 2012 revenue and expenditure budgets by incorporating the gradual and predictable,to balance the FY 2012 revenue and expenditure budgets by incorporating the gradual and predictable,to balance the FY 2012 revenue and expenditure budgets by incorporating the gradual and predictable,to balance the FY 2012 revenue and expenditure budgets by incorporating the gradual and predictable,to balance the FY 2012 revenue and expenditure budgets by incorporating the gradual and predictable,to balance the FY 2012 revenue and expenditure budgets by incorporating the gradual and predictable,to balance the FY 2012 revenue and expenditure budgets by incorporating the gradual and predictable,to balance the FY 2012 revenue and expenditure budgets by incorporating the gradual and predictable,to balance the FY 2012 revenue and expenditure budgets by incorporating the gradual and predictable,to balance the FY 2012 revenue and expenditure budgets by incorporating the gradual and predictable,to balance the FY 2012 revenue and expenditure budgets by incorporating the gradual and predictable,to balance the FY 2012 revenue and expenditure budgets by incorporating the gradual and predictable,to balance the FY 2012 revenue and expenditure budgets by incorporating the gradual and predictable,to balance the FY 2012 revenue and expenditure budgets by incorporating the gradual and predictable,to balance the FY 2012 revenue and expenditure budgets by incorporating the gradual and predictable,to balance the FY 2012 revenue and expenditure budgets by incorporating the gradual and predictable,to balance the FY 2012 revenue and expenditure budgets by incorporating the gradual and predictable
multi-year rate structure adopted by City Council in 2003 to support a multi-year wastewater system,multi-year rate structure adopted by City Council in 2003 to support a multi-year wastewater system,multi-year rate structure adopted by City Council in 2003 to support a multi-year wastewater system,multi-year rate structure adopted by City Council in 2003 to support a multi-year wastewater system,multi-year rate structure adopted by City Council in 2003 to support a multi-year wastewater system,multi-year rate structure adopted by City Council in 2003 to support a multi-year wastewater system,multi-year rate structure adopted by City Council in 2003 to support a multi-year wastewater system,multi-year rate structure adopted by City Council in 2003 to support a multi-year wastewater system,multi-year rate structure adopted by City Council in 2003 to support a multi-year wastewater system,multi-year rate structure adopted by City Council in 2003 to support a multi-year wastewater system,multi-year rate structure adopted by City Council in 2003 to support a multi-year wastewater system,multi-year rate structure adopted by City Council in 2003 to support a multi-year wastewater system,multi-year rate structure adopted by City Council in 2003 to support a multi-year wastewater system,multi-year rate structure adopted by City Council in 2003 to support a multi-year wastewater system,multi-year rate structure adopted by City Council in 2003 to support a multi-year wastewater system,multi-year rate structure adopted by City Council in 2003 to support a multi-year wastewater system,multi-year rate structure adopted by City Council in 2003 to support a multi-year wastewater system,multi-year rate structure adopted by City Council in 2003 to support a multi-year wastewater system
"improvement plan intended to reduce failing pipes and system overflows. Additionally, the Department's","improvement plan intended to reduce failing pipes and system overflows. Additionally, the Department's","improvement plan intended to reduce failing pipes and system overflows. Additionally, the Department's","improvement plan intended to reduce failing pipes and system overflows. Additionally, the Department's","improvement plan intended to reduce failing pipes and system overflows. Additionally, the Department's","improvement plan intended to reduce failing pipes and system overflows. Additionally, the Department's","improvement plan intended to reduce failing pipes and system overflows. Additionally, the Department's","improvement plan intended to reduce failing pipes and system overflows. Additionally, the Department's","improvement plan intended to reduce failing pipes and system overflows. Additionally, the Department's","improvement plan intended to reduce failing pipes and system overflows. Additionally, the Department's","improvement plan intended to reduce failing pipes and system overflows. Additionally, the Department's","improvement plan intended to reduce failing pipes and system overflows. Additionally, the Department's","improvement plan intended to reduce failing pipes and system overflows. Additionally, the Department's","improvement plan intended to reduce failing pipes and system overflows. Additionally, the Department's","improvement plan intended to reduce failing pipes and system overflows. Additionally, the Department's","improvement plan intended to reduce failing pipes and system overflows. Additionally, the Department's","improvement plan intended to reduce failing pipes and system overflows. Additionally, the Department's","improvement plan intended to reduce failing pipes and system overflows. Additionally, the Department's"
streamlining efforts achieve efficiency savings by reducing various non-personnel expenditures including,streamlining efforts achieve efficiency savings by reducing various non-personnel expenditures including,streamlining efforts achieve efficiency savings by reducing various non-personnel expenditures including,streamlining efforts achieve efficiency savings by reducing various non-personnel expenditures including,streamlining efforts achieve efficiency savings by reducing various non-personnel expenditures including,streamlining efforts achieve efficiency savings by reducing various non-personnel expenditures including,streamlining efforts achieve efficiency savings by reducing various non-personnel expenditures including,streamlining efforts achieve efficiency savings by reducing various non-personnel expenditures including,streamlining efforts achieve efficiency savings by reducing various non-personnel expenditures including,streamlining efforts achieve efficiency savings by reducing various non-personnel expenditures including,streamlining efforts achieve efficiency savings by reducing various non-personnel expenditures including,streamlining efforts achieve efficiency savings by reducing various non-personnel expenditures including,streamlining efforts achieve efficiency savings by reducing various non-personnel expenditures including,streamlining efforts achieve efficiency savings by reducing various non-personnel expenditures including,streamlining efforts achieve efficiency savings by reducing various non-personnel expenditures including,streamlining efforts achieve efficiency savings by reducing various non-personnel expenditures including,streamlining efforts achieve efficiency savings by reducing various non-personnel expenditures including,streamlining efforts achieve efficiency savings by reducing various non-personnel expenditures including
"chemicals, temporary services, and contractual obligations.","chemicals, temporary services, and contractual obligations.","chemicals, temporary services, and contractual obligations.","chemicals, temporary services, and contractual obligations.","chemicals, temporary services, and contractual obligations.","chemicals, temporary services, and contractual obligations.","chemicals, temporary services, and contractual obligations.","chemicals, temporary services, and contractual obligations.","chemicals, temporary services, and contractual obligations.","chemicals, temporary services, and contractual obligations.",,,,,,,,
KEY GOALS AND O BJECTIVES,KEY GOALS AND O BJECTIVES,KEY GOALS AND O BJECTIVES,KEY GOALS AND O BJECTIVES,KEY GOALS AND O BJECTIVES,KEY GOALS AND O BJECTIVES,KEY GOALS AND O BJECTIVES,,,,,,,,,,,
•,To,provide,"clean,","safe,",reliable,drinking,water,to,the,customers,customers,of,the,Norfolk,water,system,by
,"performing monitoring, analyses, and reporting as required by the Safe Drinking Water Act.","performing monitoring, analyses, and reporting as required by the Safe Drinking Water Act.","performing monitoring, analyses, and reporting as required by the Safe Drinking Water Act.","performing monitoring, analyses, and reporting as required by the Safe Drinking Water Act.","performing monitoring, analyses, and reporting as required by the Safe Drinking Water Act.","performing monitoring, analyses, and reporting as required by the Safe Drinking Water Act.","performing monitoring, analyses, and reporting as required by the Safe Drinking Water Act.","performing monitoring, analyses, and reporting as required by the Safe Drinking Water Act.","performing monitoring, analyses, and reporting as required by the Safe Drinking Water Act.","performing monitoring, analyses, and reporting as required by the Safe Drinking Water Act.","performing monitoring, analyses, and reporting as required by the Safe Drinking Water Act.","performing monitoring, analyses, and reporting as required by the Safe Drinking Water Act.","performing monitoring, analyses, and reporting as required by the Safe Drinking Water Act.","performing monitoring, analyses, and reporting as required by the Safe Drinking Water Act.","performing monitoring, analyses, and reporting as required by the Safe Drinking Water Act.",,
•,To,provide,reliable,and,efficient,collection,of,wastewater,wastewater,from,Norfolk,Norfolk,homes,and,and,businesses,by
,complying with all Federal and State environmental regulations.,complying with all Federal and State environmental regulations.,complying with all Federal and State environmental regulations.,complying with all Federal and State environmental regulations.,complying with all Federal and State environmental regulations.,complying with all Federal and State environmental regulations.,complying with all Federal and State environmental regulations.,complying with all Federal and State environmental regulations.,complying with all Federal and State environmental regulations.,complying with all Federal and State environmental regulations.,,,,,,,
•,To continue implementation of long-term infrastructure improvement plan.,To continue implementation of long-term infrastructure improvement plan.,To continue implementation of long-term infrastructure improvement plan.,To continue implementation of long-term infrastructure improvement plan.,To continue implementation of long-term infrastructure improvement plan.,To continue implementation of long-term infrastructure improvement plan.,To continue implementation of long-term infrastructure improvement plan.,To continue implementation of long-term infrastructure improvement plan.,To continue implementation of long-term infrastructure improvement plan.,To continue implementation of long-term infrastructure improvement plan.,To continue implementation of long-term infrastructure improvement plan.,To continue implementation of long-term infrastructure improvement plan.,,,,,
322,Water,,,,,,,,,,,,,,,,
