"the requirements to advance along a career ladder, such as Police Officer I to Police Officer II,","the requirements to advance along a career ladder, such as Police Officer I to Police Officer II,","the requirements to advance along a career ladder, such as Police Officer I to Police Officer II,","the requirements to advance along a career ladder, such as Police Officer I to Police Officer II,","the requirements to advance along a career ladder, such as Police Officer I to Police Officer II,","the requirements to advance along a career ladder, such as Police Officer I to Police Officer II,","the requirements to advance along a career ladder, such as Police Officer I to Police Officer II,","the requirements to advance along a career ladder, such as Police Officer I to Police Officer II,","the requirements to advance along a career ladder, such as Police Officer I to Police Officer II,","the requirements to advance along a career ladder, such as Police Officer I to Police Officer II,","the requirements to advance along a career ladder, such as Police Officer I to Police Officer II,","the requirements to advance along a career ladder, such as Police Officer I to Police Officer II,","the requirements to advance along a career ladder, such as Police Officer I to Police Officer II,","the requirements to advance along a career ladder, such as Police Officer I to Police Officer II,","the requirements to advance along a career ladder, such as Police Officer I to Police Officer II,","the requirements to advance along a career ladder, such as Police Officer I to Police Officer II,","the requirements to advance along a career ladder, such as Police Officer I to Police Officer II,","the requirements to advance along a career ladder, such as Police Officer I to Police Officer II,","the requirements to advance along a career ladder, such as Police Officer I to Police Officer II,"
and,equity,equity,adjustments,to,fewer,than,15,positions,positions,which,which,have,changed,significantly,significantly,significantly,or,are
significantly behind the market.,significantly behind the market.,significantly behind the market.,significantly behind the market.,significantly behind the market.,,,,,,,,,,,,,,
"Overall, the County General Fund does not increase positions even though several new positions","Overall, the County General Fund does not increase positions even though several new positions","Overall, the County General Fund does not increase positions even though several new positions","Overall, the County General Fund does not increase positions even though several new positions","Overall, the County General Fund does not increase positions even though several new positions","Overall, the County General Fund does not increase positions even though several new positions","Overall, the County General Fund does not increase positions even though several new positions","Overall, the County General Fund does not increase positions even though several new positions","Overall, the County General Fund does not increase positions even though several new positions","Overall, the County General Fund does not increase positions even though several new positions","Overall, the County General Fund does not increase positions even though several new positions","Overall, the County General Fund does not increase positions even though several new positions","Overall, the County General Fund does not increase positions even though several new positions","Overall, the County General Fund does not increase positions even though several new positions","Overall, the County General Fund does not increase positions even though several new positions","Overall, the County General Fund does not increase positions even though several new positions","Overall, the County General Fund does not increase positions even though several new positions","Overall, the County General Fund does not increase positions even though several new positions","Overall, the County General Fund does not increase positions even though several new positions"
are included.,are included.,are included.,"Three full-time positions have been eliminated; a Planner, an Engineer, and a","Three full-time positions have been eliminated; a Planner, an Engineer, and a","Three full-time positions have been eliminated; a Planner, an Engineer, and a","Three full-time positions have been eliminated; a Planner, an Engineer, and a","Three full-time positions have been eliminated; a Planner, an Engineer, and a","Three full-time positions have been eliminated; a Planner, an Engineer, and a","Three full-time positions have been eliminated; a Planner, an Engineer, and a","Three full-time positions have been eliminated; a Planner, an Engineer, and a","Three full-time positions have been eliminated; a Planner, an Engineer, and a","Three full-time positions have been eliminated; a Planner, an Engineer, and a","Three full-time positions have been eliminated; a Planner, an Engineer, and a","Three full-time positions have been eliminated; a Planner, an Engineer, and a","Three full-time positions have been eliminated; a Planner, an Engineer, and a","Three full-time positions have been eliminated; a Planner, an Engineer, and a","Three full-time positions have been eliminated; a Planner, an Engineer, and a","Three full-time positions have been eliminated; a Planner, an Engineer, and a"
Recreation,Recreation,Recreation,Operations,Coordinator.,Coordinator.,Coordinator.,In,"addition,","addition,",two,"positions,","positions,",previously,previously,counted,counted,in,the
Cooperative Extension Service have now begun to be paid directly by Virginia Tech and have,Cooperative Extension Service have now begun to be paid directly by Virginia Tech and have,Cooperative Extension Service have now begun to be paid directly by Virginia Tech and have,Cooperative Extension Service have now begun to be paid directly by Virginia Tech and have,Cooperative Extension Service have now begun to be paid directly by Virginia Tech and have,Cooperative Extension Service have now begun to be paid directly by Virginia Tech and have,Cooperative Extension Service have now begun to be paid directly by Virginia Tech and have,Cooperative Extension Service have now begun to be paid directly by Virginia Tech and have,Cooperative Extension Service have now begun to be paid directly by Virginia Tech and have,Cooperative Extension Service have now begun to be paid directly by Virginia Tech and have,Cooperative Extension Service have now begun to be paid directly by Virginia Tech and have,Cooperative Extension Service have now begun to be paid directly by Virginia Tech and have,Cooperative Extension Service have now begun to be paid directly by Virginia Tech and have,Cooperative Extension Service have now begun to be paid directly by Virginia Tech and have,Cooperative Extension Service have now begun to be paid directly by Virginia Tech and have,Cooperative Extension Service have now begun to be paid directly by Virginia Tech and have,Cooperative Extension Service have now begun to be paid directly by Virginia Tech and have,Cooperative Extension Service have now begun to be paid directly by Virginia Tech and have,Cooperative Extension Service have now begun to be paid directly by Virginia Tech and have
been eliminated from the County’s position count. A part-time Custodian is eliminated as the,been eliminated from the County’s position count. A part-time Custodian is eliminated as the,been eliminated from the County’s position count. A part-time Custodian is eliminated as the,been eliminated from the County’s position count. A part-time Custodian is eliminated as the,been eliminated from the County’s position count. A part-time Custodian is eliminated as the,been eliminated from the County’s position count. A part-time Custodian is eliminated as the,been eliminated from the County’s position count. A part-time Custodian is eliminated as the,been eliminated from the County’s position count. A part-time Custodian is eliminated as the,been eliminated from the County’s position count. A part-time Custodian is eliminated as the,been eliminated from the County’s position count. A part-time Custodian is eliminated as the,been eliminated from the County’s position count. A part-time Custodian is eliminated as the,been eliminated from the County’s position count. A part-time Custodian is eliminated as the,been eliminated from the County’s position count. A part-time Custodian is eliminated as the,been eliminated from the County’s position count. A part-time Custodian is eliminated as the,been eliminated from the County’s position count. A part-time Custodian is eliminated as the,been eliminated from the County’s position count. A part-time Custodian is eliminated as the,been eliminated from the County’s position count. A part-time Custodian is eliminated as the,been eliminated from the County’s position count. A part-time Custodian is eliminated as the,been eliminated from the County’s position count. A part-time Custodian is eliminated as the
function has been added to the County’s contract with the School division under shared services.,function has been added to the County’s contract with the School division under shared services.,function has been added to the County’s contract with the School division under shared services.,function has been added to the County’s contract with the School division under shared services.,function has been added to the County’s contract with the School division under shared services.,function has been added to the County’s contract with the School division under shared services.,function has been added to the County’s contract with the School division under shared services.,function has been added to the County’s contract with the School division under shared services.,function has been added to the County’s contract with the School division under shared services.,function has been added to the County’s contract with the School division under shared services.,function has been added to the County’s contract with the School division under shared services.,function has been added to the County’s contract with the School division under shared services.,function has been added to the County’s contract with the School division under shared services.,function has been added to the County’s contract with the School division under shared services.,function has been added to the County’s contract with the School division under shared services.,function has been added to the County’s contract with the School division under shared services.,function has been added to the County’s contract with the School division under shared services.,function has been added to the County’s contract with the School division under shared services.,function has been added to the County’s contract with the School division under shared services.
A new Senior Facilities Specialist position with its associated equipment is proposed to help,A new Senior Facilities Specialist position with its associated equipment is proposed to help,A new Senior Facilities Specialist position with its associated equipment is proposed to help,A new Senior Facilities Specialist position with its associated equipment is proposed to help,A new Senior Facilities Specialist position with its associated equipment is proposed to help,A new Senior Facilities Specialist position with its associated equipment is proposed to help,A new Senior Facilities Specialist position with its associated equipment is proposed to help,A new Senior Facilities Specialist position with its associated equipment is proposed to help,A new Senior Facilities Specialist position with its associated equipment is proposed to help,A new Senior Facilities Specialist position with its associated equipment is proposed to help,A new Senior Facilities Specialist position with its associated equipment is proposed to help,A new Senior Facilities Specialist position with its associated equipment is proposed to help,A new Senior Facilities Specialist position with its associated equipment is proposed to help,A new Senior Facilities Specialist position with its associated equipment is proposed to help,A new Senior Facilities Specialist position with its associated equipment is proposed to help,A new Senior Facilities Specialist position with its associated equipment is proposed to help,A new Senior Facilities Specialist position with its associated equipment is proposed to help,A new Senior Facilities Specialist position with its associated equipment is proposed to help,A new Senior Facilities Specialist position with its associated equipment is proposed to help
maintain County facilities.,maintain County facilities.,maintain County facilities.,maintain County facilities.,maintain County facilities.,"In FY2012, facility space has increased 13.6 percent to 530,643","In FY2012, facility space has increased 13.6 percent to 530,643","In FY2012, facility space has increased 13.6 percent to 530,643","In FY2012, facility space has increased 13.6 percent to 530,643","In FY2012, facility space has increased 13.6 percent to 530,643","In FY2012, facility space has increased 13.6 percent to 530,643","In FY2012, facility space has increased 13.6 percent to 530,643","In FY2012, facility space has increased 13.6 percent to 530,643","In FY2012, facility space has increased 13.6 percent to 530,643","In FY2012, facility space has increased 13.6 percent to 530,643","In FY2012, facility space has increased 13.6 percent to 530,643","In FY2012, facility space has increased 13.6 percent to 530,643","In FY2012, facility space has increased 13.6 percent to 530,643","In FY2012, facility space has increased 13.6 percent to 530,643"
square,feet.,feet.,Some,contracting,services,services,services,have,been,eliminated,eliminated,to,help,offset,the,cost,of,the
position. Temporary hours in the Fire Department are also proposed to change to a part-time,position. Temporary hours in the Fire Department are also proposed to change to a part-time,position. Temporary hours in the Fire Department are also proposed to change to a part-time,position. Temporary hours in the Fire Department are also proposed to change to a part-time,position. Temporary hours in the Fire Department are also proposed to change to a part-time,position. Temporary hours in the Fire Department are also proposed to change to a part-time,position. Temporary hours in the Fire Department are also proposed to change to a part-time,position. Temporary hours in the Fire Department are also proposed to change to a part-time,position. Temporary hours in the Fire Department are also proposed to change to a part-time,position. Temporary hours in the Fire Department are also proposed to change to a part-time,position. Temporary hours in the Fire Department are also proposed to change to a part-time,position. Temporary hours in the Fire Department are also proposed to change to a part-time,position. Temporary hours in the Fire Department are also proposed to change to a part-time,position. Temporary hours in the Fire Department are also proposed to change to a part-time,position. Temporary hours in the Fire Department are also proposed to change to a part-time,position. Temporary hours in the Fire Department are also proposed to change to a part-time,position. Temporary hours in the Fire Department are also proposed to change to a part-time,position. Temporary hours in the Fire Department are also proposed to change to a part-time,position. Temporary hours in the Fire Department are also proposed to change to a part-time
position to help with recruitment and retention.,position to help with recruitment and retention.,position to help with recruitment and retention.,position to help with recruitment and retention.,position to help with recruitment and retention.,position to help with recruitment and retention.,position to help with recruitment and retention.,position to help with recruitment and retention.,position to help with recruitment and retention.,,,,,,,,,,
Four full-time positions are proposed to be added to enhance services as a result of the proposal,Four full-time positions are proposed to be added to enhance services as a result of the proposal,Four full-time positions are proposed to be added to enhance services as a result of the proposal,Four full-time positions are proposed to be added to enhance services as a result of the proposal,Four full-time positions are proposed to be added to enhance services as a result of the proposal,Four full-time positions are proposed to be added to enhance services as a result of the proposal,Four full-time positions are proposed to be added to enhance services as a result of the proposal,Four full-time positions are proposed to be added to enhance services as a result of the proposal,Four full-time positions are proposed to be added to enhance services as a result of the proposal,Four full-time positions are proposed to be added to enhance services as a result of the proposal,Four full-time positions are proposed to be added to enhance services as a result of the proposal,Four full-time positions are proposed to be added to enhance services as a result of the proposal,Four full-time positions are proposed to be added to enhance services as a result of the proposal,Four full-time positions are proposed to be added to enhance services as a result of the proposal,Four full-time positions are proposed to be added to enhance services as a result of the proposal,Four full-time positions are proposed to be added to enhance services as a result of the proposal,Four full-time positions are proposed to be added to enhance services as a result of the proposal,Four full-time positions are proposed to be added to enhance services as a result of the proposal,Four full-time positions are proposed to be added to enhance services as a result of the proposal
to increase delinquent revenues in the Treasurer’s office:,to increase delinquent revenues in the Treasurer’s office:,to increase delinquent revenues in the Treasurer’s office:,to increase delinquent revenues in the Treasurer’s office:,to increase delinquent revenues in the Treasurer’s office:,to increase delinquent revenues in the Treasurer’s office:,to increase delinquent revenues in the Treasurer’s office:,to increase delinquent revenues in the Treasurer’s office:,to increase delinquent revenues in the Treasurer’s office:,to increase delinquent revenues in the Treasurer’s office:,to increase delinquent revenues in the Treasurer’s office:,,,,,,,,
,A,position,in,the,Treasurer’s,Treasurer’s,office,office,that,will,be,responsible,responsible,for,generating,generating,extra,extra
,delinquent collections;,delinquent collections;,delinquent collections;,delinquent collections;,,,,,,,,,,,,,,
,,,,,,,,Page A-6,Page A-6,,,,,,,,,
