"State Corporation Commission and the Virginia Department of Taxation); and residential, commercial, apartments and","State Corporation Commission and the Virginia Department of Taxation); and residential, commercial, apartments and","State Corporation Commission and the Virginia Department of Taxation); and residential, commercial, apartments and","State Corporation Commission and the Virginia Department of Taxation); and residential, commercial, apartments and","State Corporation Commission and the Virginia Department of Taxation); and residential, commercial, apartments and","State Corporation Commission and the Virginia Department of Taxation); and residential, commercial, apartments and","State Corporation Commission and the Virginia Department of Taxation); and residential, commercial, apartments and","State Corporation Commission and the Virginia Department of Taxation); and residential, commercial, apartments and","State Corporation Commission and the Virginia Department of Taxation); and residential, commercial, apartments and","State Corporation Commission and the Virginia Department of Taxation); and residential, commercial, apartments and","State Corporation Commission and the Virginia Department of Taxation); and residential, commercial, apartments and","State Corporation Commission and the Virginia Department of Taxation); and residential, commercial, apartments and","State Corporation Commission and the Virginia Department of Taxation); and residential, commercial, apartments and","State Corporation Commission and the Virginia Department of Taxation); and residential, commercial, apartments and","State Corporation Commission and the Virginia Department of Taxation); and residential, commercial, apartments and","State Corporation Commission and the Virginia Department of Taxation); and residential, commercial, apartments and"
"vacant land (as assessed by the City Assessor). Taxable real property estimates are as of March 31, 2011.","vacant land (as assessed by the City Assessor). Taxable real property estimates are as of March 31, 2011.","vacant land (as assessed by the City Assessor). Taxable real property estimates are as of March 31, 2011.","vacant land (as assessed by the City Assessor). Taxable real property estimates are as of March 31, 2011.","vacant land (as assessed by the City Assessor). Taxable real property estimates are as of March 31, 2011.","vacant land (as assessed by the City Assessor). Taxable real property estimates are as of March 31, 2011.","vacant land (as assessed by the City Assessor). Taxable real property estimates are as of March 31, 2011.","vacant land (as assessed by the City Assessor). Taxable real property estimates are as of March 31, 2011.","vacant land (as assessed by the City Assessor). Taxable real property estimates are as of March 31, 2011.","vacant land (as assessed by the City Assessor). Taxable real property estimates are as of March 31, 2011.","vacant land (as assessed by the City Assessor). Taxable real property estimates are as of March 31, 2011.","vacant land (as assessed by the City Assessor). Taxable real property estimates are as of March 31, 2011.","vacant land (as assessed by the City Assessor). Taxable real property estimates are as of March 31, 2011.",,,
2,Estimated – assumes issuance of all previously authorized General Obligation bonds.,Estimated – assumes issuance of all previously authorized General Obligation bonds.,Estimated – assumes issuance of all previously authorized General Obligation bonds.,Estimated – assumes issuance of all previously authorized General Obligation bonds.,Estimated – assumes issuance of all previously authorized General Obligation bonds.,Estimated – assumes issuance of all previously authorized General Obligation bonds.,Estimated – assumes issuance of all previously authorized General Obligation bonds.,Estimated – assumes issuance of all previously authorized General Obligation bonds.,,,,,,,
O VERLAPPING D EBT,O VERLAPPING D EBT,O VERLAPPING D EBT,O VERLAPPING D EBT,O VERLAPPING D EBT,,,,,,,,,,,
The City of Norfolk is autonomous and independent of any county or other political subdivision and is not,The City of Norfolk is autonomous and independent of any county or other political subdivision and is not,The City of Norfolk is autonomous and independent of any county or other political subdivision and is not,The City of Norfolk is autonomous and independent of any county or other political subdivision and is not,The City of Norfolk is autonomous and independent of any county or other political subdivision and is not,The City of Norfolk is autonomous and independent of any county or other political subdivision and is not,The City of Norfolk is autonomous and independent of any county or other political subdivision and is not,The City of Norfolk is autonomous and independent of any county or other political subdivision and is not,The City of Norfolk is autonomous and independent of any county or other political subdivision and is not,The City of Norfolk is autonomous and independent of any county or other political subdivision and is not,The City of Norfolk is autonomous and independent of any county or other political subdivision and is not,The City of Norfolk is autonomous and independent of any county or other political subdivision and is not,The City of Norfolk is autonomous and independent of any county or other political subdivision and is not,The City of Norfolk is autonomous and independent of any county or other political subdivision and is not,The City of Norfolk is autonomous and independent of any county or other political subdivision and is not,The City of Norfolk is autonomous and independent of any county or other political subdivision and is not
"subject to taxation by any county or school district, nor is it liable for any county or school district","subject to taxation by any county or school district, nor is it liable for any county or school district","subject to taxation by any county or school district, nor is it liable for any county or school district","subject to taxation by any county or school district, nor is it liable for any county or school district","subject to taxation by any county or school district, nor is it liable for any county or school district","subject to taxation by any county or school district, nor is it liable for any county or school district","subject to taxation by any county or school district, nor is it liable for any county or school district","subject to taxation by any county or school district, nor is it liable for any county or school district","subject to taxation by any county or school district, nor is it liable for any county or school district","subject to taxation by any county or school district, nor is it liable for any county or school district","subject to taxation by any county or school district, nor is it liable for any county or school district","subject to taxation by any county or school district, nor is it liable for any county or school district","subject to taxation by any county or school district, nor is it liable for any county or school district","subject to taxation by any county or school district, nor is it liable for any county or school district","subject to taxation by any county or school district, nor is it liable for any county or school district","subject to taxation by any county or school district, nor is it liable for any county or school district"
indebtedness. There is no overlapping debt.,indebtedness. There is no overlapping debt.,indebtedness. There is no overlapping debt.,indebtedness. There is no overlapping debt.,indebtedness. There is no overlapping debt.,indebtedness. There is no overlapping debt.,indebtedness. There is no overlapping debt.,,,,,,,,,
STATEMENT OF NO PAST D EFAULT,STATEMENT OF NO PAST D EFAULT,STATEMENT OF NO PAST D EFAULT,STATEMENT OF NO PAST D EFAULT,STATEMENT OF NO PAST D EFAULT,STATEMENT OF NO PAST D EFAULT,STATEMENT OF NO PAST D EFAULT,STATEMENT OF NO PAST D EFAULT,,,,,,,,
The City has never defaulted on the payment of either principal or interest on any debt.,The City has never defaulted on the payment of either principal or interest on any debt.,The City has never defaulted on the payment of either principal or interest on any debt.,The City has never defaulted on the payment of either principal or interest on any debt.,The City has never defaulted on the payment of either principal or interest on any debt.,The City has never defaulted on the payment of either principal or interest on any debt.,The City has never defaulted on the payment of either principal or interest on any debt.,The City has never defaulted on the payment of either principal or interest on any debt.,The City has never defaulted on the payment of either principal or interest on any debt.,The City has never defaulted on the payment of either principal or interest on any debt.,The City has never defaulted on the payment of either principal or interest on any debt.,The City has never defaulted on the payment of either principal or interest on any debt.,The City has never defaulted on the payment of either principal or interest on any debt.,,,
,,,,,,,,,,,,,City Indebtedness,City Indebtedness,53
