•,Net debt as a percent of taxable real estate should not exceed 3.5 percent.,Net debt as a percent of taxable real estate should not exceed 3.5 percent.,Net debt as a percent of taxable real estate should not exceed 3.5 percent.,Net debt as a percent of taxable real estate should not exceed 3.5 percent.,Net debt as a percent of taxable real estate should not exceed 3.5 percent.,Net debt as a percent of taxable real estate should not exceed 3.5 percent.,Net debt as a percent of taxable real estate should not exceed 3.5 percent.,Net debt as a percent of taxable real estate should not exceed 3.5 percent.,Net debt as a percent of taxable real estate should not exceed 3.5 percent.,Net debt as a percent of taxable real estate should not exceed 3.5 percent.,Net debt as a percent of taxable real estate should not exceed 3.5 percent.,Net debt as a percent of taxable real estate should not exceed 3.5 percent.,,,
"In determining general obligation debt limitations, certain classes of indebtedness may be excluded, such","In determining general obligation debt limitations, certain classes of indebtedness may be excluded, such","In determining general obligation debt limitations, certain classes of indebtedness may be excluded, such","In determining general obligation debt limitations, certain classes of indebtedness may be excluded, such","In determining general obligation debt limitations, certain classes of indebtedness may be excluded, such","In determining general obligation debt limitations, certain classes of indebtedness may be excluded, such","In determining general obligation debt limitations, certain classes of indebtedness may be excluded, such","In determining general obligation debt limitations, certain classes of indebtedness may be excluded, such","In determining general obligation debt limitations, certain classes of indebtedness may be excluded, such","In determining general obligation debt limitations, certain classes of indebtedness may be excluded, such","In determining general obligation debt limitations, certain classes of indebtedness may be excluded, such","In determining general obligation debt limitations, certain classes of indebtedness may be excluded, such","In determining general obligation debt limitations, certain classes of indebtedness may be excluded, such","In determining general obligation debt limitations, certain classes of indebtedness may be excluded, such","In determining general obligation debt limitations, certain classes of indebtedness may be excluded, such","In determining general obligation debt limitations, certain classes of indebtedness may be excluded, such"
"as revenue anticipation notes maturing in one year or less, general obligation bonds payable from a","as revenue anticipation notes maturing in one year or less, general obligation bonds payable from a","as revenue anticipation notes maturing in one year or less, general obligation bonds payable from a","as revenue anticipation notes maturing in one year or less, general obligation bonds payable from a","as revenue anticipation notes maturing in one year or less, general obligation bonds payable from a","as revenue anticipation notes maturing in one year or less, general obligation bonds payable from a","as revenue anticipation notes maturing in one year or less, general obligation bonds payable from a","as revenue anticipation notes maturing in one year or less, general obligation bonds payable from a","as revenue anticipation notes maturing in one year or less, general obligation bonds payable from a","as revenue anticipation notes maturing in one year or less, general obligation bonds payable from a","as revenue anticipation notes maturing in one year or less, general obligation bonds payable from a","as revenue anticipation notes maturing in one year or less, general obligation bonds payable from a","as revenue anticipation notes maturing in one year or less, general obligation bonds payable from a","as revenue anticipation notes maturing in one year or less, general obligation bonds payable from a","as revenue anticipation notes maturing in one year or less, general obligation bonds payable from a","as revenue anticipation notes maturing in one year or less, general obligation bonds payable from a"
"specified revenue producing undertaking, so long as the undertaking is self-supporting, capital leases and","specified revenue producing undertaking, so long as the undertaking is self-supporting, capital leases and","specified revenue producing undertaking, so long as the undertaking is self-supporting, capital leases and","specified revenue producing undertaking, so long as the undertaking is self-supporting, capital leases and","specified revenue producing undertaking, so long as the undertaking is self-supporting, capital leases and","specified revenue producing undertaking, so long as the undertaking is self-supporting, capital leases and","specified revenue producing undertaking, so long as the undertaking is self-supporting, capital leases and","specified revenue producing undertaking, so long as the undertaking is self-supporting, capital leases and","specified revenue producing undertaking, so long as the undertaking is self-supporting, capital leases and","specified revenue producing undertaking, so long as the undertaking is self-supporting, capital leases and","specified revenue producing undertaking, so long as the undertaking is self-supporting, capital leases and","specified revenue producing undertaking, so long as the undertaking is self-supporting, capital leases and","specified revenue producing undertaking, so long as the undertaking is self-supporting, capital leases and","specified revenue producing undertaking, so long as the undertaking is self-supporting, capital leases and","specified revenue producing undertaking, so long as the undertaking is self-supporting, capital leases and","specified revenue producing undertaking, so long as the undertaking is self-supporting, capital leases and"
revenue bonds.,revenue bonds.,"The City’s enterprise operations for Water, Wastewater and Parking bonded debt are a","The City’s enterprise operations for Water, Wastewater and Parking bonded debt are a","The City’s enterprise operations for Water, Wastewater and Parking bonded debt are a","The City’s enterprise operations for Water, Wastewater and Parking bonded debt are a","The City’s enterprise operations for Water, Wastewater and Parking bonded debt are a","The City’s enterprise operations for Water, Wastewater and Parking bonded debt are a","The City’s enterprise operations for Water, Wastewater and Parking bonded debt are a","The City’s enterprise operations for Water, Wastewater and Parking bonded debt are a","The City’s enterprise operations for Water, Wastewater and Parking bonded debt are a","The City’s enterprise operations for Water, Wastewater and Parking bonded debt are a","The City’s enterprise operations for Water, Wastewater and Parking bonded debt are a","The City’s enterprise operations for Water, Wastewater and Parking bonded debt are a","The City’s enterprise operations for Water, Wastewater and Parking bonded debt are a","The City’s enterprise operations for Water, Wastewater and Parking bonded debt are a"
"combination of self-supporting, general obligation and revenue bonds. The City’s operation for Storm","combination of self-supporting, general obligation and revenue bonds. The City’s operation for Storm","combination of self-supporting, general obligation and revenue bonds. The City’s operation for Storm","combination of self-supporting, general obligation and revenue bonds. The City’s operation for Storm","combination of self-supporting, general obligation and revenue bonds. The City’s operation for Storm","combination of self-supporting, general obligation and revenue bonds. The City’s operation for Storm","combination of self-supporting, general obligation and revenue bonds. The City’s operation for Storm","combination of self-supporting, general obligation and revenue bonds. The City’s operation for Storm","combination of self-supporting, general obligation and revenue bonds. The City’s operation for Storm","combination of self-supporting, general obligation and revenue bonds. The City’s operation for Storm","combination of self-supporting, general obligation and revenue bonds. The City’s operation for Storm","combination of self-supporting, general obligation and revenue bonds. The City’s operation for Storm","combination of self-supporting, general obligation and revenue bonds. The City’s operation for Storm","combination of self-supporting, general obligation and revenue bonds. The City’s operation for Storm","combination of self-supporting, general obligation and revenue bonds. The City’s operation for Storm","combination of self-supporting, general obligation and revenue bonds. The City’s operation for Storm"
Water bonded debt is self-supporting utilizing general obligation bonds.,Water bonded debt is self-supporting utilizing general obligation bonds.,Water bonded debt is self-supporting utilizing general obligation bonds.,Water bonded debt is self-supporting utilizing general obligation bonds.,Water bonded debt is self-supporting utilizing general obligation bonds.,Water bonded debt is self-supporting utilizing general obligation bonds.,Water bonded debt is self-supporting utilizing general obligation bonds.,Water bonded debt is self-supporting utilizing general obligation bonds.,Water bonded debt is self-supporting utilizing general obligation bonds.,Water bonded debt is self-supporting utilizing general obligation bonds.,Water bonded debt is self-supporting utilizing general obligation bonds.,Water bonded debt is self-supporting utilizing general obligation bonds.,,,,
The City has never defaulted on the payment of either principal or interest on any debt.,The City has never defaulted on the payment of either principal or interest on any debt.,The City has never defaulted on the payment of either principal or interest on any debt.,The City has never defaulted on the payment of either principal or interest on any debt.,The City has never defaulted on the payment of either principal or interest on any debt.,The City has never defaulted on the payment of either principal or interest on any debt.,The City has never defaulted on the payment of either principal or interest on any debt.,The City has never defaulted on the payment of either principal or interest on any debt.,The City has never defaulted on the payment of either principal or interest on any debt.,The City has never defaulted on the payment of either principal or interest on any debt.,The City has never defaulted on the payment of either principal or interest on any debt.,The City has never defaulted on the payment of either principal or interest on any debt.,The City has never defaulted on the payment of either principal or interest on any debt.,,,
10,Financial Policies and Practices,Financial Policies and Practices,Financial Policies and Practices,Financial Policies and Practices,Financial Policies and Practices,,,,,,,,,,
