Name: “Table 1 of 1 on page 6 of 54”,Name: “Table 1 of 1 on page 6 of 54”,Name: “Table 1 of 1 on page 6 of 54”,Name: “Table 1 of 1 on page 6 of 54”,Name: “Table 1 of 1 on page 6 of 54”,Name: “Table 1 of 1 on page 6 of 54”,Name: “Table 1 of 1 on page 6 of 54”,Name: “Table 1 of 1 on page 6 of 54”,Name: “Table 1 of 1 on page 6 of 54”,Name: “Table 1 of 1 on page 6 of 54”,Name: “Table 1 of 1 on page 6 of 54”,Name: “Table 1 of 1 on page 6 of 54”,Name: “Table 1 of 1 on page 6 of 54”,Name: “Table 1 of 1 on page 6 of 54”,Name: “Table 1 of 1 on page 6 of 54”,Name: “Table 1 of 1 on page 6 of 54”
Table: 6,Table: 6,Table: 6,Table: 6,Table: 6,Table: 6,Table: 6,Table: 6,Table: 6,Table: 6,Table: 6,Table: 6,Table: 6,Table: 6,Table: 6,Table: 6
,,,,,,,,,,,,,,,
D EFINITION AND USE OF SURPLUSES,D EFINITION AND USE OF SURPLUSES,D EFINITION AND USE OF SURPLUSES,D EFINITION AND USE OF SURPLUSES,D EFINITION AND USE OF SURPLUSES,D EFINITION AND USE OF SURPLUSES,D EFINITION AND USE OF SURPLUSES,,,,,,,,,
The budget is a plan based on the best data available at the time the budget is approved.,The budget is a plan based on the best data available at the time the budget is approved.,The budget is a plan based on the best data available at the time the budget is approved.,The budget is a plan based on the best data available at the time the budget is approved.,The budget is a plan based on the best data available at the time the budget is approved.,The budget is a plan based on the best data available at the time the budget is approved.,The budget is a plan based on the best data available at the time the budget is approved.,The budget is a plan based on the best data available at the time the budget is approved.,The budget is a plan based on the best data available at the time the budget is approved.,The budget is a plan based on the best data available at the time the budget is approved.,The budget is a plan based on the best data available at the time the budget is approved.,The budget is a plan based on the best data available at the time the budget is approved.,The budget is a plan based on the best data available at the time the budget is approved.,The budget is a plan based on the best data available at the time the budget is approved.,Budgeted,Budgeted
"revenues and expenditures are projections and are not exact. Through strict monitoring, funds in excess of","revenues and expenditures are projections and are not exact. Through strict monitoring, funds in excess of","revenues and expenditures are projections and are not exact. Through strict monitoring, funds in excess of","revenues and expenditures are projections and are not exact. Through strict monitoring, funds in excess of","revenues and expenditures are projections and are not exact. Through strict monitoring, funds in excess of","revenues and expenditures are projections and are not exact. Through strict monitoring, funds in excess of","revenues and expenditures are projections and are not exact. Through strict monitoring, funds in excess of","revenues and expenditures are projections and are not exact. Through strict monitoring, funds in excess of","revenues and expenditures are projections and are not exact. Through strict monitoring, funds in excess of","revenues and expenditures are projections and are not exact. Through strict monitoring, funds in excess of","revenues and expenditures are projections and are not exact. Through strict monitoring, funds in excess of","revenues and expenditures are projections and are not exact. Through strict monitoring, funds in excess of","revenues and expenditures are projections and are not exact. Through strict monitoring, funds in excess of","revenues and expenditures are projections and are not exact. Through strict monitoring, funds in excess of","revenues and expenditures are projections and are not exact. Through strict monitoring, funds in excess of","revenues and expenditures are projections and are not exact. Through strict monitoring, funds in excess of"
the budget projections may occur and are referred to as surpluses.,the budget projections may occur and are referred to as surpluses.,the budget projections may occur and are referred to as surpluses.,the budget projections may occur and are referred to as surpluses.,the budget projections may occur and are referred to as surpluses.,the budget projections may occur and are referred to as surpluses.,the budget projections may occur and are referred to as surpluses.,the budget projections may occur and are referred to as surpluses.,the budget projections may occur and are referred to as surpluses.,the budget projections may occur and are referred to as surpluses.,the budget projections may occur and are referred to as surpluses.,"In terms of budget forecasts, the","In terms of budget forecasts, the","In terms of budget forecasts, the","In terms of budget forecasts, the","In terms of budget forecasts, the"
Commonwealth of Virginia has a goal or benchmark to be within two percent of the projected budget.,Commonwealth of Virginia has a goal or benchmark to be within two percent of the projected budget.,Commonwealth of Virginia has a goal or benchmark to be within two percent of the projected budget.,Commonwealth of Virginia has a goal or benchmark to be within two percent of the projected budget.,Commonwealth of Virginia has a goal or benchmark to be within two percent of the projected budget.,Commonwealth of Virginia has a goal or benchmark to be within two percent of the projected budget.,Commonwealth of Virginia has a goal or benchmark to be within two percent of the projected budget.,Commonwealth of Virginia has a goal or benchmark to be within two percent of the projected budget.,Commonwealth of Virginia has a goal or benchmark to be within two percent of the projected budget.,Commonwealth of Virginia has a goal or benchmark to be within two percent of the projected budget.,Commonwealth of Virginia has a goal or benchmark to be within two percent of the projected budget.,Commonwealth of Virginia has a goal or benchmark to be within two percent of the projected budget.,Commonwealth of Virginia has a goal or benchmark to be within two percent of the projected budget.,Commonwealth of Virginia has a goal or benchmark to be within two percent of the projected budget.,Commonwealth of Virginia has a goal or benchmark to be within two percent of the projected budget.,Commonwealth of Virginia has a goal or benchmark to be within two percent of the projected budget.
"The City uses surpluses to meet the aforementioned reserve goals, reduce outstanding debt and avoid","The City uses surpluses to meet the aforementioned reserve goals, reduce outstanding debt and avoid","The City uses surpluses to meet the aforementioned reserve goals, reduce outstanding debt and avoid","The City uses surpluses to meet the aforementioned reserve goals, reduce outstanding debt and avoid","The City uses surpluses to meet the aforementioned reserve goals, reduce outstanding debt and avoid","The City uses surpluses to meet the aforementioned reserve goals, reduce outstanding debt and avoid","The City uses surpluses to meet the aforementioned reserve goals, reduce outstanding debt and avoid","The City uses surpluses to meet the aforementioned reserve goals, reduce outstanding debt and avoid","The City uses surpluses to meet the aforementioned reserve goals, reduce outstanding debt and avoid","The City uses surpluses to meet the aforementioned reserve goals, reduce outstanding debt and avoid","The City uses surpluses to meet the aforementioned reserve goals, reduce outstanding debt and avoid","The City uses surpluses to meet the aforementioned reserve goals, reduce outstanding debt and avoid","The City uses surpluses to meet the aforementioned reserve goals, reduce outstanding debt and avoid","The City uses surpluses to meet the aforementioned reserve goals, reduce outstanding debt and avoid","The City uses surpluses to meet the aforementioned reserve goals, reduce outstanding debt and avoid","The City uses surpluses to meet the aforementioned reserve goals, reduce outstanding debt and avoid"
future debt.,future debt.,"After meeting the City’s reserve requirements, excess surplus amounts may be used for the","After meeting the City’s reserve requirements, excess surplus amounts may be used for the","After meeting the City’s reserve requirements, excess surplus amounts may be used for the","After meeting the City’s reserve requirements, excess surplus amounts may be used for the","After meeting the City’s reserve requirements, excess surplus amounts may be used for the","After meeting the City’s reserve requirements, excess surplus amounts may be used for the","After meeting the City’s reserve requirements, excess surplus amounts may be used for the","After meeting the City’s reserve requirements, excess surplus amounts may be used for the","After meeting the City’s reserve requirements, excess surplus amounts may be used for the","After meeting the City’s reserve requirements, excess surplus amounts may be used for the","After meeting the City’s reserve requirements, excess surplus amounts may be used for the","After meeting the City’s reserve requirements, excess surplus amounts may be used for the","After meeting the City’s reserve requirements, excess surplus amounts may be used for the","After meeting the City’s reserve requirements, excess surplus amounts may be used for the"
following purposes:,following purposes:,following purposes:,following purposes:,,,,,,,,,,,,
•,Retirement of Existing Debt: Surplus funds may be used to pay principal on existing revenue bonds or,Retirement of Existing Debt: Surplus funds may be used to pay principal on existing revenue bonds or,Retirement of Existing Debt: Surplus funds may be used to pay principal on existing revenue bonds or,Retirement of Existing Debt: Surplus funds may be used to pay principal on existing revenue bonds or,Retirement of Existing Debt: Surplus funds may be used to pay principal on existing revenue bonds or,Retirement of Existing Debt: Surplus funds may be used to pay principal on existing revenue bonds or,Retirement of Existing Debt: Surplus funds may be used to pay principal on existing revenue bonds or,Retirement of Existing Debt: Surplus funds may be used to pay principal on existing revenue bonds or,Retirement of Existing Debt: Surplus funds may be used to pay principal on existing revenue bonds or,Retirement of Existing Debt: Surplus funds may be used to pay principal on existing revenue bonds or,Retirement of Existing Debt: Surplus funds may be used to pay principal on existing revenue bonds or,Retirement of Existing Debt: Surplus funds may be used to pay principal on existing revenue bonds or,Retirement of Existing Debt: Surplus funds may be used to pay principal on existing revenue bonds or,Retirement of Existing Debt: Surplus funds may be used to pay principal on existing revenue bonds or,Retirement of Existing Debt: Surplus funds may be used to pay principal on existing revenue bonds or
,any other existing debt;,any other existing debt;,any other existing debt;,any other existing debt;,,,,,,,,,,,
•,Capital Replacement Programs: Excess reserves may be directed to provide cash funding for certain,Capital Replacement Programs: Excess reserves may be directed to provide cash funding for certain,Capital Replacement Programs: Excess reserves may be directed to provide cash funding for certain,Capital Replacement Programs: Excess reserves may be directed to provide cash funding for certain,Capital Replacement Programs: Excess reserves may be directed to provide cash funding for certain,Capital Replacement Programs: Excess reserves may be directed to provide cash funding for certain,Capital Replacement Programs: Excess reserves may be directed to provide cash funding for certain,Capital Replacement Programs: Excess reserves may be directed to provide cash funding for certain,Capital Replacement Programs: Excess reserves may be directed to provide cash funding for certain,Capital Replacement Programs: Excess reserves may be directed to provide cash funding for certain,Capital Replacement Programs: Excess reserves may be directed to provide cash funding for certain,Capital Replacement Programs: Excess reserves may be directed to provide cash funding for certain,Capital Replacement Programs: Excess reserves may be directed to provide cash funding for certain,Capital Replacement Programs: Excess reserves may be directed to provide cash funding for certain,Capital Replacement Programs: Excess reserves may be directed to provide cash funding for certain
,"capital equipment replacement programs; or,","capital equipment replacement programs; or,","capital equipment replacement programs; or,","capital equipment replacement programs; or,","capital equipment replacement programs; or,","capital equipment replacement programs; or,","capital equipment replacement programs; or,",,,,,,,,
•,Cash Payments for Capital Improvement Projects: Excess funds may be used to provide cash funding for,Cash Payments for Capital Improvement Projects: Excess funds may be used to provide cash funding for,Cash Payments for Capital Improvement Projects: Excess funds may be used to provide cash funding for,Cash Payments for Capital Improvement Projects: Excess funds may be used to provide cash funding for,Cash Payments for Capital Improvement Projects: Excess funds may be used to provide cash funding for,Cash Payments for Capital Improvement Projects: Excess funds may be used to provide cash funding for,Cash Payments for Capital Improvement Projects: Excess funds may be used to provide cash funding for,Cash Payments for Capital Improvement Projects: Excess funds may be used to provide cash funding for,Cash Payments for Capital Improvement Projects: Excess funds may be used to provide cash funding for,Cash Payments for Capital Improvement Projects: Excess funds may be used to provide cash funding for,Cash Payments for Capital Improvement Projects: Excess funds may be used to provide cash funding for,Cash Payments for Capital Improvement Projects: Excess funds may be used to provide cash funding for,Cash Payments for Capital Improvement Projects: Excess funds may be used to provide cash funding for,Cash Payments for Capital Improvement Projects: Excess funds may be used to provide cash funding for,Cash Payments for Capital Improvement Projects: Excess funds may be used to provide cash funding for
,"Capital Improvement projects, thereby reducing the future debt burden upon the City.","Capital Improvement projects, thereby reducing the future debt burden upon the City.","Capital Improvement projects, thereby reducing the future debt burden upon the City.","Capital Improvement projects, thereby reducing the future debt burden upon the City.","Capital Improvement projects, thereby reducing the future debt burden upon the City.","Capital Improvement projects, thereby reducing the future debt burden upon the City.","Capital Improvement projects, thereby reducing the future debt burden upon the City.","Capital Improvement projects, thereby reducing the future debt burden upon the City.","Capital Improvement projects, thereby reducing the future debt burden upon the City.","Capital Improvement projects, thereby reducing the future debt burden upon the City.","Capital Improvement projects, thereby reducing the future debt burden upon the City.","Capital Improvement projects, thereby reducing the future debt burden upon the City.",,,
To the same extent that the City Administration attempts to match one-time revenues with one-time,To the same extent that the City Administration attempts to match one-time revenues with one-time,To the same extent that the City Administration attempts to match one-time revenues with one-time,To the same extent that the City Administration attempts to match one-time revenues with one-time,To the same extent that the City Administration attempts to match one-time revenues with one-time,To the same extent that the City Administration attempts to match one-time revenues with one-time,To the same extent that the City Administration attempts to match one-time revenues with one-time,To the same extent that the City Administration attempts to match one-time revenues with one-time,To the same extent that the City Administration attempts to match one-time revenues with one-time,To the same extent that the City Administration attempts to match one-time revenues with one-time,To the same extent that the City Administration attempts to match one-time revenues with one-time,To the same extent that the City Administration attempts to match one-time revenues with one-time,To the same extent that the City Administration attempts to match one-time revenues with one-time,To the same extent that the City Administration attempts to match one-time revenues with one-time,To the same extent that the City Administration attempts to match one-time revenues with one-time,To the same extent that the City Administration attempts to match one-time revenues with one-time
"expenses, a one-time surplus is also matched with one-time expenditures.","expenses, a one-time surplus is also matched with one-time expenditures.","expenses, a one-time surplus is also matched with one-time expenditures.","expenses, a one-time surplus is also matched with one-time expenditures.","expenses, a one-time surplus is also matched with one-time expenditures.","expenses, a one-time surplus is also matched with one-time expenditures.","expenses, a one-time surplus is also matched with one-time expenditures.","expenses, a one-time surplus is also matched with one-time expenditures.","expenses, a one-time surplus is also matched with one-time expenditures.","expenses, a one-time surplus is also matched with one-time expenditures.","expenses, a one-time surplus is also matched with one-time expenditures.","expenses, a one-time surplus is also matched with one-time expenditures.",,,,
D EBT M ANAGEMENT,D EBT M ANAGEMENT,D EBT M ANAGEMENT,D EBT M ANAGEMENT,D EBT M ANAGEMENT,,,,,,,,,,,
The Commonwealth of Virginia imposes a legal limit of 10 percent of the assessed valuation of taxed real,The Commonwealth of Virginia imposes a legal limit of 10 percent of the assessed valuation of taxed real,The Commonwealth of Virginia imposes a legal limit of 10 percent of the assessed valuation of taxed real,The Commonwealth of Virginia imposes a legal limit of 10 percent of the assessed valuation of taxed real,The Commonwealth of Virginia imposes a legal limit of 10 percent of the assessed valuation of taxed real,The Commonwealth of Virginia imposes a legal limit of 10 percent of the assessed valuation of taxed real,The Commonwealth of Virginia imposes a legal limit of 10 percent of the assessed valuation of taxed real,The Commonwealth of Virginia imposes a legal limit of 10 percent of the assessed valuation of taxed real,The Commonwealth of Virginia imposes a legal limit of 10 percent of the assessed valuation of taxed real,The Commonwealth of Virginia imposes a legal limit of 10 percent of the assessed valuation of taxed real,The Commonwealth of Virginia imposes a legal limit of 10 percent of the assessed valuation of taxed real,The Commonwealth of Virginia imposes a legal limit of 10 percent of the assessed valuation of taxed real,The Commonwealth of Virginia imposes a legal limit of 10 percent of the assessed valuation of taxed real,The Commonwealth of Virginia imposes a legal limit of 10 percent of the assessed valuation of taxed real,The Commonwealth of Virginia imposes a legal limit of 10 percent of the assessed valuation of taxed real,The Commonwealth of Virginia imposes a legal limit of 10 percent of the assessed valuation of taxed real
"property as a ceiling in the amount of general obligation borrowings. Based on this legal limit, the City can","property as a ceiling in the amount of general obligation borrowings. Based on this legal limit, the City can","property as a ceiling in the amount of general obligation borrowings. Based on this legal limit, the City can","property as a ceiling in the amount of general obligation borrowings. Based on this legal limit, the City can","property as a ceiling in the amount of general obligation borrowings. Based on this legal limit, the City can","property as a ceiling in the amount of general obligation borrowings. Based on this legal limit, the City can","property as a ceiling in the amount of general obligation borrowings. Based on this legal limit, the City can","property as a ceiling in the amount of general obligation borrowings. Based on this legal limit, the City can","property as a ceiling in the amount of general obligation borrowings. Based on this legal limit, the City can","property as a ceiling in the amount of general obligation borrowings. Based on this legal limit, the City can","property as a ceiling in the amount of general obligation borrowings. Based on this legal limit, the City can","property as a ceiling in the amount of general obligation borrowings. Based on this legal limit, the City can","property as a ceiling in the amount of general obligation borrowings. Based on this legal limit, the City can","property as a ceiling in the amount of general obligation borrowings. Based on this legal limit, the City can","property as a ceiling in the amount of general obligation borrowings. Based on this legal limit, the City can","property as a ceiling in the amount of general obligation borrowings. Based on this legal limit, the City can"
issue debt in excess of $875 million (see City Indebtedness section).,issue debt in excess of $875 million (see City Indebtedness section).,issue debt in excess of $875 million (see City Indebtedness section).,issue debt in excess of $875 million (see City Indebtedness section).,issue debt in excess of $875 million (see City Indebtedness section).,issue debt in excess of $875 million (see City Indebtedness section).,issue debt in excess of $875 million (see City Indebtedness section).,issue debt in excess of $875 million (see City Indebtedness section).,issue debt in excess of $875 million (see City Indebtedness section).,issue debt in excess of $875 million (see City Indebtedness section).,"While this is the legal limitation, the","While this is the legal limitation, the","While this is the legal limitation, the","While this is the legal limitation, the","While this is the legal limitation, the","While this is the legal limitation, the"
"City is well aware it cannot take on expenditures beyond its fiscal means of affordability. Therefore, the City","City is well aware it cannot take on expenditures beyond its fiscal means of affordability. Therefore, the City","City is well aware it cannot take on expenditures beyond its fiscal means of affordability. Therefore, the City","City is well aware it cannot take on expenditures beyond its fiscal means of affordability. Therefore, the City","City is well aware it cannot take on expenditures beyond its fiscal means of affordability. Therefore, the City","City is well aware it cannot take on expenditures beyond its fiscal means of affordability. Therefore, the City","City is well aware it cannot take on expenditures beyond its fiscal means of affordability. Therefore, the City","City is well aware it cannot take on expenditures beyond its fiscal means of affordability. Therefore, the City","City is well aware it cannot take on expenditures beyond its fiscal means of affordability. Therefore, the City","City is well aware it cannot take on expenditures beyond its fiscal means of affordability. Therefore, the City","City is well aware it cannot take on expenditures beyond its fiscal means of affordability. Therefore, the City","City is well aware it cannot take on expenditures beyond its fiscal means of affordability. Therefore, the City","City is well aware it cannot take on expenditures beyond its fiscal means of affordability. Therefore, the City","City is well aware it cannot take on expenditures beyond its fiscal means of affordability. Therefore, the City","City is well aware it cannot take on expenditures beyond its fiscal means of affordability. Therefore, the City","City is well aware it cannot take on expenditures beyond its fiscal means of affordability. Therefore, the City"
strives,to,adhere,to,the,following,internal,debt,ratios,to,guide,the,development,of,the,Capital
Improvement Plan (CIP):,Improvement Plan (CIP):,Improvement Plan (CIP):,Improvement Plan (CIP):,Improvement Plan (CIP):,,,,,,,,,,,
•,"Debt Service as a percent of the general fund budget should not exceed 10 percent; and,","Debt Service as a percent of the general fund budget should not exceed 10 percent; and,","Debt Service as a percent of the general fund budget should not exceed 10 percent; and,","Debt Service as a percent of the general fund budget should not exceed 10 percent; and,","Debt Service as a percent of the general fund budget should not exceed 10 percent; and,","Debt Service as a percent of the general fund budget should not exceed 10 percent; and,","Debt Service as a percent of the general fund budget should not exceed 10 percent; and,","Debt Service as a percent of the general fund budget should not exceed 10 percent; and,","Debt Service as a percent of the general fund budget should not exceed 10 percent; and,","Debt Service as a percent of the general fund budget should not exceed 10 percent; and,","Debt Service as a percent of the general fund budget should not exceed 10 percent; and,","Debt Service as a percent of the general fund budget should not exceed 10 percent; and,",,,
