property where nuisance abatement liens and/or delinquent taxes were not paid by their owners. The GEM,property where nuisance abatement liens and/or delinquent taxes were not paid by their owners. The GEM,property where nuisance abatement liens and/or delinquent taxes were not paid by their owners. The GEM,property where nuisance abatement liens and/or delinquent taxes were not paid by their owners. The GEM,property where nuisance abatement liens and/or delinquent taxes were not paid by their owners. The GEM,property where nuisance abatement liens and/or delinquent taxes were not paid by their owners. The GEM,property where nuisance abatement liens and/or delinquent taxes were not paid by their owners. The GEM,property where nuisance abatement liens and/or delinquent taxes were not paid by their owners. The GEM,property where nuisance abatement liens and/or delinquent taxes were not paid by their owners. The GEM,property where nuisance abatement liens and/or delinquent taxes were not paid by their owners. The GEM,property where nuisance abatement liens and/or delinquent taxes were not paid by their owners. The GEM,property where nuisance abatement liens and/or delinquent taxes were not paid by their owners. The GEM,property where nuisance abatement liens and/or delinquent taxes were not paid by their owners. The GEM,property where nuisance abatement liens and/or delinquent taxes were not paid by their owners. The GEM,property where nuisance abatement liens and/or delinquent taxes were not paid by their owners. The GEM
Program,acquires,slum,and,blighting,blighting,properties,in,the,community,to,provide,opportunities,opportunities,for
redevelopment and revitalization of Norfolk’s neighborhoods.,redevelopment and revitalization of Norfolk’s neighborhoods.,redevelopment and revitalization of Norfolk’s neighborhoods.,redevelopment and revitalization of Norfolk’s neighborhoods.,redevelopment and revitalization of Norfolk’s neighborhoods.,redevelopment and revitalization of Norfolk’s neighborhoods.,redevelopment and revitalization of Norfolk’s neighborhoods.,redevelopment and revitalization of Norfolk’s neighborhoods.,redevelopment and revitalization of Norfolk’s neighborhoods.,,,,,,
General Fund: The primary operating fund that accounts for all revenues and expenditures that are not,General Fund: The primary operating fund that accounts for all revenues and expenditures that are not,General Fund: The primary operating fund that accounts for all revenues and expenditures that are not,General Fund: The primary operating fund that accounts for all revenues and expenditures that are not,General Fund: The primary operating fund that accounts for all revenues and expenditures that are not,General Fund: The primary operating fund that accounts for all revenues and expenditures that are not,General Fund: The primary operating fund that accounts for all revenues and expenditures that are not,General Fund: The primary operating fund that accounts for all revenues and expenditures that are not,General Fund: The primary operating fund that accounts for all revenues and expenditures that are not,General Fund: The primary operating fund that accounts for all revenues and expenditures that are not,General Fund: The primary operating fund that accounts for all revenues and expenditures that are not,General Fund: The primary operating fund that accounts for all revenues and expenditures that are not,General Fund: The primary operating fund that accounts for all revenues and expenditures that are not,General Fund: The primary operating fund that accounts for all revenues and expenditures that are not,General Fund: The primary operating fund that accounts for all revenues and expenditures that are not
accounted for in specific purpose funds.,accounted for in specific purpose funds.,accounted for in specific purpose funds.,accounted for in specific purpose funds.,accounted for in specific purpose funds.,accounted for in specific purpose funds.,It finances the regular day-to-day operations of the City with,It finances the regular day-to-day operations of the City with,It finances the regular day-to-day operations of the City with,It finances the regular day-to-day operations of the City with,It finances the regular day-to-day operations of the City with,It finances the regular day-to-day operations of the City with,It finances the regular day-to-day operations of the City with,It finances the regular day-to-day operations of the City with,It finances the regular day-to-day operations of the City with
"taxes, fees and other revenue sources.","taxes, fees and other revenue sources.","taxes, fees and other revenue sources.","taxes, fees and other revenue sources.","taxes, fees and other revenue sources.","taxes, fees and other revenue sources.",,,,,,,,,
"General Obligation Bonds: General obligation bonds are direct obligations, and they pledge with the full","General Obligation Bonds: General obligation bonds are direct obligations, and they pledge with the full","General Obligation Bonds: General obligation bonds are direct obligations, and they pledge with the full","General Obligation Bonds: General obligation bonds are direct obligations, and they pledge with the full","General Obligation Bonds: General obligation bonds are direct obligations, and they pledge with the full","General Obligation Bonds: General obligation bonds are direct obligations, and they pledge with the full","General Obligation Bonds: General obligation bonds are direct obligations, and they pledge with the full","General Obligation Bonds: General obligation bonds are direct obligations, and they pledge with the full","General Obligation Bonds: General obligation bonds are direct obligations, and they pledge with the full","General Obligation Bonds: General obligation bonds are direct obligations, and they pledge with the full","General Obligation Bonds: General obligation bonds are direct obligations, and they pledge with the full","General Obligation Bonds: General obligation bonds are direct obligations, and they pledge with the full","General Obligation Bonds: General obligation bonds are direct obligations, and they pledge with the full","General Obligation Bonds: General obligation bonds are direct obligations, and they pledge with the full","General Obligation Bonds: General obligation bonds are direct obligations, and they pledge with the full"
faith and credit of the City.,faith and credit of the City.,faith and credit of the City.,faith and credit of the City.,,,,,,,,,,,
"GIS (Geographic Information System): A system used to capture, manage, analyze and display all forms","GIS (Geographic Information System): A system used to capture, manage, analyze and display all forms","GIS (Geographic Information System): A system used to capture, manage, analyze and display all forms","GIS (Geographic Information System): A system used to capture, manage, analyze and display all forms","GIS (Geographic Information System): A system used to capture, manage, analyze and display all forms","GIS (Geographic Information System): A system used to capture, manage, analyze and display all forms","GIS (Geographic Information System): A system used to capture, manage, analyze and display all forms","GIS (Geographic Information System): A system used to capture, manage, analyze and display all forms","GIS (Geographic Information System): A system used to capture, manage, analyze and display all forms","GIS (Geographic Information System): A system used to capture, manage, analyze and display all forms","GIS (Geographic Information System): A system used to capture, manage, analyze and display all forms","GIS (Geographic Information System): A system used to capture, manage, analyze and display all forms","GIS (Geographic Information System): A system used to capture, manage, analyze and display all forms","GIS (Geographic Information System): A system used to capture, manage, analyze and display all forms","GIS (Geographic Information System): A system used to capture, manage, analyze and display all forms"
of geographically,of geographically,referenced,referenced,information.,information.,A team of,A team of,employees is,employees is,responsible,for the,for the,design and,design and
"deployment of this web-based application that displays information at the street, neighborhood, and","deployment of this web-based application that displays information at the street, neighborhood, and","deployment of this web-based application that displays information at the street, neighborhood, and","deployment of this web-based application that displays information at the street, neighborhood, and","deployment of this web-based application that displays information at the street, neighborhood, and","deployment of this web-based application that displays information at the street, neighborhood, and","deployment of this web-based application that displays information at the street, neighborhood, and","deployment of this web-based application that displays information at the street, neighborhood, and","deployment of this web-based application that displays information at the street, neighborhood, and","deployment of this web-based application that displays information at the street, neighborhood, and","deployment of this web-based application that displays information at the street, neighborhood, and","deployment of this web-based application that displays information at the street, neighborhood, and","deployment of this web-based application that displays information at the street, neighborhood, and","deployment of this web-based application that displays information at the street, neighborhood, and","deployment of this web-based application that displays information at the street, neighborhood, and"
planning district levels.,planning district levels.,planning district levels.,,,,,,,,,,,,
446,Glossary,,,,,,,,,,,,,
