Name: “Table 1 of 1 on page 1 of 39”,Name: “Table 1 of 1 on page 1 of 39”,Name: “Table 1 of 1 on page 1 of 39”,Name: “Table 1 of 1 on page 1 of 39”,Name: “Table 1 of 1 on page 1 of 39”,Name: “Table 1 of 1 on page 1 of 39”,Name: “Table 1 of 1 on page 1 of 39”,Name: “Table 1 of 1 on page 1 of 39”,Name: “Table 1 of 1 on page 1 of 39”,Name: “Table 1 of 1 on page 1 of 39”,Name: “Table 1 of 1 on page 1 of 39”,Name: “Table 1 of 1 on page 1 of 39”,Name: “Table 1 of 1 on page 1 of 39”,Name: “Table 1 of 1 on page 1 of 39”,Name: “Table 1 of 1 on page 1 of 39”,Name: “Table 1 of 1 on page 1 of 39”,Name: “Table 1 of 1 on page 1 of 39”,Name: “Table 1 of 1 on page 1 of 39”,Name: “Table 1 of 1 on page 1 of 39”,Name: “Table 1 of 1 on page 1 of 39”,Name: “Table 1 of 1 on page 1 of 39”,Name: “Table 1 of 1 on page 1 of 39”,Name: “Table 1 of 1 on page 1 of 39”,Name: “Table 1 of 1 on page 1 of 39”,Name: “Table 1 of 1 on page 1 of 39”
Table: 1,Table: 1,Table: 1,Table: 1,Table: 1,Table: 1,Table: 1,Table: 1,Table: 1,Table: 1,Table: 1,Table: 1,Table: 1,Table: 1,Table: 1,Table: 1,Table: 1,Table: 1,Table: 1,Table: 1,Table: 1,Table: 1,Table: 1,Table: 1,Table: 1
,,,,,,,,,,,,,,,,,,,,,,,,
"CITY OF PORTSMOUTH, VIRGINIA","CITY OF PORTSMOUTH, VIRGINIA","CITY OF PORTSMOUTH, VIRGINIA","CITY OF PORTSMOUTH, VIRGINIA","CITY OF PORTSMOUTH, VIRGINIA","CITY OF PORTSMOUTH, VIRGINIA","CITY OF PORTSMOUTH, VIRGINIA","CITY OF PORTSMOUTH, VIRGINIA","CITY OF PORTSMOUTH, VIRGINIA","CITY OF PORTSMOUTH, VIRGINIA",,,,,,,,,,,,Exhibit H,Exhibit H,Exhibit H,
Notes to Basic Financial Statements,Notes to Basic Financial Statements,Notes to Basic Financial Statements,Notes to Basic Financial Statements,Notes to Basic Financial Statements,Notes to Basic Financial Statements,Notes to Basic Financial Statements,Notes to Basic Financial Statements,Notes to Basic Financial Statements,,,,,,,,,,,,,,,,
"June 30, 2010","June 30, 2010","June 30, 2010",,,,,,,,,,,,,,,,,,,,,,
(1),SUMMARY OF SIGNIFICANT ACCOUNTING POLICIES,SUMMARY OF SIGNIFICANT ACCOUNTING POLICIES,SUMMARY OF SIGNIFICANT ACCOUNTING POLICIES,SUMMARY OF SIGNIFICANT ACCOUNTING POLICIES,SUMMARY OF SIGNIFICANT ACCOUNTING POLICIES,SUMMARY OF SIGNIFICANT ACCOUNTING POLICIES,SUMMARY OF SIGNIFICANT ACCOUNTING POLICIES,SUMMARY OF SIGNIFICANT ACCOUNTING POLICIES,SUMMARY OF SIGNIFICANT ACCOUNTING POLICIES,SUMMARY OF SIGNIFICANT ACCOUNTING POLICIES,SUMMARY OF SIGNIFICANT ACCOUNTING POLICIES,SUMMARY OF SIGNIFICANT ACCOUNTING POLICIES,SUMMARY OF SIGNIFICANT ACCOUNTING POLICIES,,,,,,,,,,,
,"The City of Portsmouth, Virginia (the City) was established by act of the Virginia General Assembly in 1858.","The City of Portsmouth, Virginia (the City) was established by act of the Virginia General Assembly in 1858.","The City of Portsmouth, Virginia (the City) was established by act of the Virginia General Assembly in 1858.","The City of Portsmouth, Virginia (the City) was established by act of the Virginia General Assembly in 1858.","The City of Portsmouth, Virginia (the City) was established by act of the Virginia General Assembly in 1858.","The City of Portsmouth, Virginia (the City) was established by act of the Virginia General Assembly in 1858.","The City of Portsmouth, Virginia (the City) was established by act of the Virginia General Assembly in 1858.","The City of Portsmouth, Virginia (the City) was established by act of the Virginia General Assembly in 1858.","The City of Portsmouth, Virginia (the City) was established by act of the Virginia General Assembly in 1858.","The City of Portsmouth, Virginia (the City) was established by act of the Virginia General Assembly in 1858.","The City of Portsmouth, Virginia (the City) was established by act of the Virginia General Assembly in 1858.","The City of Portsmouth, Virginia (the City) was established by act of the Virginia General Assembly in 1858.","The City of Portsmouth, Virginia (the City) was established by act of the Virginia General Assembly in 1858.","The City of Portsmouth, Virginia (the City) was established by act of the Virginia General Assembly in 1858.","The City of Portsmouth, Virginia (the City) was established by act of the Virginia General Assembly in 1858.","The City of Portsmouth, Virginia (the City) was established by act of the Virginia General Assembly in 1858.","The City of Portsmouth, Virginia (the City) was established by act of the Virginia General Assembly in 1858.","The City of Portsmouth, Virginia (the City) was established by act of the Virginia General Assembly in 1858.","The City of Portsmouth, Virginia (the City) was established by act of the Virginia General Assembly in 1858.","The City of Portsmouth, Virginia (the City) was established by act of the Virginia General Assembly in 1858.","The City of Portsmouth, Virginia (the City) was established by act of the Virginia General Assembly in 1858.","The City of Portsmouth, Virginia (the City) was established by act of the Virginia General Assembly in 1858.",It is a,It is a
,political subdivision of the Commonwealth of Virginia operating under the council-manager form of government.,political subdivision of the Commonwealth of Virginia operating under the council-manager form of government.,political subdivision of the Commonwealth of Virginia operating under the council-manager form of government.,political subdivision of the Commonwealth of Virginia operating under the council-manager form of government.,political subdivision of the Commonwealth of Virginia operating under the council-manager form of government.,political subdivision of the Commonwealth of Virginia operating under the council-manager form of government.,political subdivision of the Commonwealth of Virginia operating under the council-manager form of government.,political subdivision of the Commonwealth of Virginia operating under the council-manager form of government.,political subdivision of the Commonwealth of Virginia operating under the council-manager form of government.,political subdivision of the Commonwealth of Virginia operating under the council-manager form of government.,political subdivision of the Commonwealth of Virginia operating under the council-manager form of government.,political subdivision of the Commonwealth of Virginia operating under the council-manager form of government.,political subdivision of the Commonwealth of Virginia operating under the council-manager form of government.,political subdivision of the Commonwealth of Virginia operating under the council-manager form of government.,political subdivision of the Commonwealth of Virginia operating under the council-manager form of government.,political subdivision of the Commonwealth of Virginia operating under the council-manager form of government.,political subdivision of the Commonwealth of Virginia operating under the council-manager form of government.,political subdivision of the Commonwealth of Virginia operating under the council-manager form of government.,political subdivision of the Commonwealth of Virginia operating under the council-manager form of government.,political subdivision of the Commonwealth of Virginia operating under the council-manager form of government.,political subdivision of the Commonwealth of Virginia operating under the council-manager form of government.,political subdivision of the Commonwealth of Virginia operating under the council-manager form of government.,City,City
,Council consists of a mayor and six other council members.,Council consists of a mayor and six other council members.,Council consists of a mayor and six other council members.,Council consists of a mayor and six other council members.,Council consists of a mayor and six other council members.,Council consists of a mayor and six other council members.,Council consists of a mayor and six other council members.,Council consists of a mayor and six other council members.,Council consists of a mayor and six other council members.,Council consists of a mayor and six other council members.,Council consists of a mayor and six other council members.,Council consists of a mayor and six other council members.,Council consists of a mayor and six other council members.,The City is not part of a county and has taxing powers,The City is not part of a county and has taxing powers,The City is not part of a county and has taxing powers,The City is not part of a county and has taxing powers,The City is not part of a county and has taxing powers,The City is not part of a county and has taxing powers,The City is not part of a county and has taxing powers,The City is not part of a county and has taxing powers,The City is not part of a county and has taxing powers,The City is not part of a county and has taxing powers,The City is not part of a county and has taxing powers
,subject to statewide restrictions and tax limits.,subject to statewide restrictions and tax limits.,subject to statewide restrictions and tax limits.,subject to statewide restrictions and tax limits.,subject to statewide restrictions and tax limits.,subject to statewide restrictions and tax limits.,subject to statewide restrictions and tax limits.,subject to statewide restrictions and tax limits.,subject to statewide restrictions and tax limits.,subject to statewide restrictions and tax limits.,,,,,,,,,,,,,,
,"The City provides a full range of municipal services including police and fire, sanitation, health and social services,","The City provides a full range of municipal services including police and fire, sanitation, health and social services,","The City provides a full range of municipal services including police and fire, sanitation, health and social services,","The City provides a full range of municipal services including police and fire, sanitation, health and social services,","The City provides a full range of municipal services including police and fire, sanitation, health and social services,","The City provides a full range of municipal services including police and fire, sanitation, health and social services,","The City provides a full range of municipal services including police and fire, sanitation, health and social services,","The City provides a full range of municipal services including police and fire, sanitation, health and social services,","The City provides a full range of municipal services including police and fire, sanitation, health and social services,","The City provides a full range of municipal services including police and fire, sanitation, health and social services,","The City provides a full range of municipal services including police and fire, sanitation, health and social services,","The City provides a full range of municipal services including police and fire, sanitation, health and social services,","The City provides a full range of municipal services including police and fire, sanitation, health and social services,","The City provides a full range of municipal services including police and fire, sanitation, health and social services,","The City provides a full range of municipal services including police and fire, sanitation, health and social services,","The City provides a full range of municipal services including police and fire, sanitation, health and social services,","The City provides a full range of municipal services including police and fire, sanitation, health and social services,","The City provides a full range of municipal services including police and fire, sanitation, health and social services,","The City provides a full range of municipal services including police and fire, sanitation, health and social services,","The City provides a full range of municipal services including police and fire, sanitation, health and social services,","The City provides a full range of municipal services including police and fire, sanitation, health and social services,","The City provides a full range of municipal services including police and fire, sanitation, health and social services,","The City provides a full range of municipal services including police and fire, sanitation, health and social services,","The City provides a full range of municipal services including police and fire, sanitation, health and social services,"
,"public improvements, planning and zoning, general administrative services, education, and water and sewer systems.","public improvements, planning and zoning, general administrative services, education, and water and sewer systems.","public improvements, planning and zoning, general administrative services, education, and water and sewer systems.","public improvements, planning and zoning, general administrative services, education, and water and sewer systems.","public improvements, planning and zoning, general administrative services, education, and water and sewer systems.","public improvements, planning and zoning, general administrative services, education, and water and sewer systems.","public improvements, planning and zoning, general administrative services, education, and water and sewer systems.","public improvements, planning and zoning, general administrative services, education, and water and sewer systems.","public improvements, planning and zoning, general administrative services, education, and water and sewer systems.","public improvements, planning and zoning, general administrative services, education, and water and sewer systems.","public improvements, planning and zoning, general administrative services, education, and water and sewer systems.","public improvements, planning and zoning, general administrative services, education, and water and sewer systems.","public improvements, planning and zoning, general administrative services, education, and water and sewer systems.","public improvements, planning and zoning, general administrative services, education, and water and sewer systems.","public improvements, planning and zoning, general administrative services, education, and water and sewer systems.","public improvements, planning and zoning, general administrative services, education, and water and sewer systems.","public improvements, planning and zoning, general administrative services, education, and water and sewer systems.","public improvements, planning and zoning, general administrative services, education, and water and sewer systems.","public improvements, planning and zoning, general administrative services, education, and water and sewer systems.","public improvements, planning and zoning, general administrative services, education, and water and sewer systems.","public improvements, planning and zoning, general administrative services, education, and water and sewer systems.","public improvements, planning and zoning, general administrative services, education, and water and sewer systems.","public improvements, planning and zoning, general administrative services, education, and water and sewer systems.",
,The following is a summary of the more significant policies:,The following is a summary of the more significant policies:,The following is a summary of the more significant policies:,The following is a summary of the more significant policies:,The following is a summary of the more significant policies:,The following is a summary of the more significant policies:,The following is a summary of the more significant policies:,The following is a summary of the more significant policies:,The following is a summary of the more significant policies:,The following is a summary of the more significant policies:,The following is a summary of the more significant policies:,The following is a summary of the more significant policies:,,,,,,,,,,,,
,A.,Financial Reporting Entity,Financial Reporting Entity,Financial Reporting Entity,Financial Reporting Entity,Financial Reporting Entity,Financial Reporting Entity,Financial Reporting Entity,,,,,,,,,,,,,,,,
,,The City’s financial reporting entity is defined and its financial statements are presented in accordance with GASB,The City’s financial reporting entity is defined and its financial statements are presented in accordance with GASB,The City’s financial reporting entity is defined and its financial statements are presented in accordance with GASB,The City’s financial reporting entity is defined and its financial statements are presented in accordance with GASB,The City’s financial reporting entity is defined and its financial statements are presented in accordance with GASB,The City’s financial reporting entity is defined and its financial statements are presented in accordance with GASB,The City’s financial reporting entity is defined and its financial statements are presented in accordance with GASB,The City’s financial reporting entity is defined and its financial statements are presented in accordance with GASB,The City’s financial reporting entity is defined and its financial statements are presented in accordance with GASB,The City’s financial reporting entity is defined and its financial statements are presented in accordance with GASB,The City’s financial reporting entity is defined and its financial statements are presented in accordance with GASB,The City’s financial reporting entity is defined and its financial statements are presented in accordance with GASB,The City’s financial reporting entity is defined and its financial statements are presented in accordance with GASB,The City’s financial reporting entity is defined and its financial statements are presented in accordance with GASB,The City’s financial reporting entity is defined and its financial statements are presented in accordance with GASB,The City’s financial reporting entity is defined and its financial statements are presented in accordance with GASB,The City’s financial reporting entity is defined and its financial statements are presented in accordance with GASB,The City’s financial reporting entity is defined and its financial statements are presented in accordance with GASB,The City’s financial reporting entity is defined and its financial statements are presented in accordance with GASB,The City’s financial reporting entity is defined and its financial statements are presented in accordance with GASB,The City’s financial reporting entity is defined and its financial statements are presented in accordance with GASB,The City’s financial reporting entity is defined and its financial statements are presented in accordance with GASB,The City’s financial reporting entity is defined and its financial statements are presented in accordance with GASB
,,"Statement No. 14, The Financial Reporting Entity, as amended.","Statement No. 14, The Financial Reporting Entity, as amended.","Statement No. 14, The Financial Reporting Entity, as amended.","Statement No. 14, The Financial Reporting Entity, as amended.","Statement No. 14, The Financial Reporting Entity, as amended.","Statement No. 14, The Financial Reporting Entity, as amended.","Statement No. 14, The Financial Reporting Entity, as amended.","Statement No. 14, The Financial Reporting Entity, as amended.","Statement No. 14, The Financial Reporting Entity, as amended.","Statement No. 14, The Financial Reporting Entity, as amended.","Statement No. 14, The Financial Reporting Entity, as amended.","Statement No. 14, The Financial Reporting Entity, as amended.","Statement No. 14, The Financial Reporting Entity, as amended.",This Statement defines the distinction between the,This Statement defines the distinction between the,This Statement defines the distinction between the,This Statement defines the distinction between the,This Statement defines the distinction between the,This Statement defines the distinction between the,This Statement defines the distinction between the,This Statement defines the distinction between the,This Statement defines the distinction between the,This Statement defines the distinction between the
,,City,as,a,primary,primary,government,government,and,its,related,entities.,entities.,The,financial,reporting,reporting,entity,consists,consists,of,the,primary,primary
,,"government and its component units, which are legally separate organizations for which the elected officials of the","government and its component units, which are legally separate organizations for which the elected officials of the","government and its component units, which are legally separate organizations for which the elected officials of the","government and its component units, which are legally separate organizations for which the elected officials of the","government and its component units, which are legally separate organizations for which the elected officials of the","government and its component units, which are legally separate organizations for which the elected officials of the","government and its component units, which are legally separate organizations for which the elected officials of the","government and its component units, which are legally separate organizations for which the elected officials of the","government and its component units, which are legally separate organizations for which the elected officials of the","government and its component units, which are legally separate organizations for which the elected officials of the","government and its component units, which are legally separate organizations for which the elected officials of the","government and its component units, which are legally separate organizations for which the elected officials of the","government and its component units, which are legally separate organizations for which the elected officials of the","government and its component units, which are legally separate organizations for which the elected officials of the","government and its component units, which are legally separate organizations for which the elected officials of the","government and its component units, which are legally separate organizations for which the elected officials of the","government and its component units, which are legally separate organizations for which the elected officials of the","government and its component units, which are legally separate organizations for which the elected officials of the","government and its component units, which are legally separate organizations for which the elected officials of the","government and its component units, which are legally separate organizations for which the elected officials of the","government and its component units, which are legally separate organizations for which the elected officials of the","government and its component units, which are legally separate organizations for which the elected officials of the","government and its component units, which are legally separate organizations for which the elected officials of the"
,,primary government are financially accountable.,primary government are financially accountable.,primary government are financially accountable.,primary government are financially accountable.,primary government are financially accountable.,primary government are financially accountable.,primary government are financially accountable.,primary government are financially accountable.,primary government are financially accountable.,primary government are financially accountable.,primary government are financially accountable.,Financial accountability is defined as appointment of a voting,Financial accountability is defined as appointment of a voting,Financial accountability is defined as appointment of a voting,Financial accountability is defined as appointment of a voting,Financial accountability is defined as appointment of a voting,Financial accountability is defined as appointment of a voting,Financial accountability is defined as appointment of a voting,Financial accountability is defined as appointment of a voting,Financial accountability is defined as appointment of a voting,Financial accountability is defined as appointment of a voting,Financial accountability is defined as appointment of a voting,Financial accountability is defined as appointment of a voting
