,premiums) through required monthly contributions that vary from $201.35 to $821.35 depending on the retiree’s choice,premiums) through required monthly contributions that vary from $201.35 to $821.35 depending on the retiree’s choice,premiums) through required monthly contributions that vary from $201.35 to $821.35 depending on the retiree’s choice,premiums) through required monthly contributions that vary from $201.35 to $821.35 depending on the retiree’s choice,premiums) through required monthly contributions that vary from $201.35 to $821.35 depending on the retiree’s choice,premiums) through required monthly contributions that vary from $201.35 to $821.35 depending on the retiree’s choice,premiums) through required monthly contributions that vary from $201.35 to $821.35 depending on the retiree’s choice,premiums) through required monthly contributions that vary from $201.35 to $821.35 depending on the retiree’s choice,premiums) through required monthly contributions that vary from $201.35 to $821.35 depending on the retiree’s choice,premiums) through required monthly contributions that vary from $201.35 to $821.35 depending on the retiree’s choice,premiums) through required monthly contributions that vary from $201.35 to $821.35 depending on the retiree’s choice,premiums) through required monthly contributions that vary from $201.35 to $821.35 depending on the retiree’s choice,premiums) through required monthly contributions that vary from $201.35 to $821.35 depending on the retiree’s choice,premiums) through required monthly contributions that vary from $201.35 to $821.35 depending on the retiree’s choice,premiums) through required monthly contributions that vary from $201.35 to $821.35 depending on the retiree’s choice,premiums) through required monthly contributions that vary from $201.35 to $821.35 depending on the retiree’s choice,premiums) through required monthly contributions that vary from $201.35 to $821.35 depending on the retiree’s choice
,"of Health Maintenance Organization or Preferred Provider coverage, the retiree’s age, and whether the coverage is for","of Health Maintenance Organization or Preferred Provider coverage, the retiree’s age, and whether the coverage is for","of Health Maintenance Organization or Preferred Provider coverage, the retiree’s age, and whether the coverage is for","of Health Maintenance Organization or Preferred Provider coverage, the retiree’s age, and whether the coverage is for","of Health Maintenance Organization or Preferred Provider coverage, the retiree’s age, and whether the coverage is for","of Health Maintenance Organization or Preferred Provider coverage, the retiree’s age, and whether the coverage is for","of Health Maintenance Organization or Preferred Provider coverage, the retiree’s age, and whether the coverage is for","of Health Maintenance Organization or Preferred Provider coverage, the retiree’s age, and whether the coverage is for","of Health Maintenance Organization or Preferred Provider coverage, the retiree’s age, and whether the coverage is for","of Health Maintenance Organization or Preferred Provider coverage, the retiree’s age, and whether the coverage is for","of Health Maintenance Organization or Preferred Provider coverage, the retiree’s age, and whether the coverage is for","of Health Maintenance Organization or Preferred Provider coverage, the retiree’s age, and whether the coverage is for","of Health Maintenance Organization or Preferred Provider coverage, the retiree’s age, and whether the coverage is for","of Health Maintenance Organization or Preferred Provider coverage, the retiree’s age, and whether the coverage is for","of Health Maintenance Organization or Preferred Provider coverage, the retiree’s age, and whether the coverage is for","of Health Maintenance Organization or Preferred Provider coverage, the retiree’s age, and whether the coverage is for","of Health Maintenance Organization or Preferred Provider coverage, the retiree’s age, and whether the coverage is for"
,the retiree only or includes family members .,the retiree only or includes family members .,the retiree only or includes family members .,the retiree only or includes family members .,the retiree only or includes family members .,the retiree only or includes family members .,the retiree only or includes family members .,,,,,,,,,,
,,Annual OPEB Cost and net OPEB Obligation.,Annual OPEB Cost and net OPEB Obligation.,Annual OPEB Cost and net OPEB Obligation.,Annual OPEB Cost and net OPEB Obligation.,Annual OPEB Cost and net OPEB Obligation.,Annual OPEB Cost and net OPEB Obligation.,Annual OPEB Cost and net OPEB Obligation.,The City’s and School’s annual other post employment benefit (OPEB),The City’s and School’s annual other post employment benefit (OPEB),The City’s and School’s annual other post employment benefit (OPEB),The City’s and School’s annual other post employment benefit (OPEB),The City’s and School’s annual other post employment benefit (OPEB),The City’s and School’s annual other post employment benefit (OPEB),The City’s and School’s annual other post employment benefit (OPEB),The City’s and School’s annual other post employment benefit (OPEB),The City’s and School’s annual other post employment benefit (OPEB)
,"cost (expense) is calculated based on the annual required contribution of the employer (ARC), an amount actuarially","cost (expense) is calculated based on the annual required contribution of the employer (ARC), an amount actuarially","cost (expense) is calculated based on the annual required contribution of the employer (ARC), an amount actuarially","cost (expense) is calculated based on the annual required contribution of the employer (ARC), an amount actuarially","cost (expense) is calculated based on the annual required contribution of the employer (ARC), an amount actuarially","cost (expense) is calculated based on the annual required contribution of the employer (ARC), an amount actuarially","cost (expense) is calculated based on the annual required contribution of the employer (ARC), an amount actuarially","cost (expense) is calculated based on the annual required contribution of the employer (ARC), an amount actuarially","cost (expense) is calculated based on the annual required contribution of the employer (ARC), an amount actuarially","cost (expense) is calculated based on the annual required contribution of the employer (ARC), an amount actuarially","cost (expense) is calculated based on the annual required contribution of the employer (ARC), an amount actuarially","cost (expense) is calculated based on the annual required contribution of the employer (ARC), an amount actuarially","cost (expense) is calculated based on the annual required contribution of the employer (ARC), an amount actuarially","cost (expense) is calculated based on the annual required contribution of the employer (ARC), an amount actuarially","cost (expense) is calculated based on the annual required contribution of the employer (ARC), an amount actuarially","cost (expense) is calculated based on the annual required contribution of the employer (ARC), an amount actuarially","cost (expense) is calculated based on the annual required contribution of the employer (ARC), an amount actuarially"
,determined in accordance with the parameters of GASB Statement 45.,determined in accordance with the parameters of GASB Statement 45.,determined in accordance with the parameters of GASB Statement 45.,determined in accordance with the parameters of GASB Statement 45.,determined in accordance with the parameters of GASB Statement 45.,determined in accordance with the parameters of GASB Statement 45.,determined in accordance with the parameters of GASB Statement 45.,determined in accordance with the parameters of GASB Statement 45.,determined in accordance with the parameters of GASB Statement 45.,determined in accordance with the parameters of GASB Statement 45.,"The ARC represents a level of funding that, if","The ARC represents a level of funding that, if","The ARC represents a level of funding that, if","The ARC represents a level of funding that, if","The ARC represents a level of funding that, if","The ARC represents a level of funding that, if","The ARC represents a level of funding that, if"
,"paid on an ongoing basis, is projected to cover normal cost each year and amortize any unfunded actuarial liabilities (or","paid on an ongoing basis, is projected to cover normal cost each year and amortize any unfunded actuarial liabilities (or","paid on an ongoing basis, is projected to cover normal cost each year and amortize any unfunded actuarial liabilities (or","paid on an ongoing basis, is projected to cover normal cost each year and amortize any unfunded actuarial liabilities (or","paid on an ongoing basis, is projected to cover normal cost each year and amortize any unfunded actuarial liabilities (or","paid on an ongoing basis, is projected to cover normal cost each year and amortize any unfunded actuarial liabilities (or","paid on an ongoing basis, is projected to cover normal cost each year and amortize any unfunded actuarial liabilities (or","paid on an ongoing basis, is projected to cover normal cost each year and amortize any unfunded actuarial liabilities (or","paid on an ongoing basis, is projected to cover normal cost each year and amortize any unfunded actuarial liabilities (or","paid on an ongoing basis, is projected to cover normal cost each year and amortize any unfunded actuarial liabilities (or","paid on an ongoing basis, is projected to cover normal cost each year and amortize any unfunded actuarial liabilities (or","paid on an ongoing basis, is projected to cover normal cost each year and amortize any unfunded actuarial liabilities (or","paid on an ongoing basis, is projected to cover normal cost each year and amortize any unfunded actuarial liabilities (or","paid on an ongoing basis, is projected to cover normal cost each year and amortize any unfunded actuarial liabilities (or","paid on an ongoing basis, is projected to cover normal cost each year and amortize any unfunded actuarial liabilities (or","paid on an ongoing basis, is projected to cover normal cost each year and amortize any unfunded actuarial liabilities (or","paid on an ongoing basis, is projected to cover normal cost each year and amortize any unfunded actuarial liabilities (or"
,,,,,,,,,58,,,,,,,,
